"modified","institutionCode","collectionCode","catalogNumber","scientificName","identificationQualifier","family","genus","specificEpithet","infraspecificEpithet","scientificNameAuthorship","identifiedBy","dateIdentified","typeStatus","recordNumber","fieldNumber","recordedBy","year","month","day","country","stateProvince","municipality","locality","decimalLatitude","decimalLongitude","occurrenceRemarks","acceptedNameUsage","occurrenceID","comments","bibliographicCitation"
"","MBML","MBML-HERBARIO","50349","Ocotea tenuiflora","","Lauraceae","Ocotea","tenuiflora","","(Nees) Mez",,,"","195","","A.D. Ferreira; P.J. Coelho",2014,9,12,"Brazil","Espírito Santo","Santa Teresa","RPPN Vale do Sol, Floresta Ombrófila Densa, trilha do lado esquerdo do cafezal, próximo ao córrego",,,"Árvore 3m. Frutos verdes e maduros","Ocotea tenuiflora (Nees) Mez","",,"GBIF"
"","JBRJ","RB","RB00952100","Ocotea tenuiflora","","Lauraceae","Ocotea","tenuiflora","","(Nees) Mez","A. Quinet",2013,"","1627","","G.R. Souza",2013,6,14,"Brazil","Rio de Janeiro","Resende","Parque penedo.",-22.416667,-44.35,"Arbusto 3 m de alt.; flor branca esverdeada, cheiro caracteristico, folha glabra","Ocotea tenuiflora (Nees) Mez","",,"GBIF"
"","JBRJ","RB","RB00594280","Ocotea tenuiflora","","Lauraceae","Ocotea","tenuiflora","","(Nees) Mez",,,"",,"","Rosangela A. Tristão",2008,8,,"Brazil","Rio de Janeiro","Silva Jardim","Faz. Biovert.",,,"Com flor.","Ocotea tenuiflora (Nees) Mez","",,"GBIF"
"","JBRJ","RB","RB00492546","Ocotea tenuiflora","","Lauraceae","Ocotea","tenuiflora","","(Nees) Mez","A. Quinet",,"","1895","","M. Nafruz; T. Cabral, P. Godinho & C. Parvo",2007,6,27,"Brazil","Rio de Janeiro","Teresópolis","Parque Nacional Serra dos Orgãos, vale do Soberbo, Rio Soberbo, subindo o rio. .",-22.489167,-43.013333,"Árvore; pecíolo esverdeado, lâmina membranácea esverdeada, levemente discolor, frutos sésseis, jovens esverdeados.","Ocotea tenuiflora (Nees) Mez","",,"GBIF"
"","JBRJ","RB","RB00531174","Ocotea tenuiflora","","Lauraceae","Ocotea","tenuiflora","","(Nees) Mez","A.Quinet",,"","42","","A.C.Giannerini; D.Monteiro",2006,12,2,"Brazil","Rio de Janeiro","Itatiaia","Trilha dos Três Picos.",,,"Árvore ca. 7m, ciófila. Folhas discolores verdes com nervuras principal amareladas na face abaxial; catáceas. Fruto seco enegrecido.","Ocotea tenuiflora (Nees) Mez","",,"GBIF"
"","Universidade Federal de Minas Gerais","BHCB","94312","Ocotea tenuiflora","","Lauraceae","Ocotea","tenuiflora","","(Nees) Mez",,,"","105","","Ferreira, RM; França, GS",2005,4,16,"Brazil","Minas Gerais","São Gonçalo do Rio Abaixo","Estação Ambiental de Peti.",,,"Arbórea, área do Bom Será","Ocotea tenuiflora (Nees) Mez","",,"GBIF"
"","UEFS","HUEFS","173622","Ocotea tenuiflora","","Lauraceae","Ocotea","tenuiflora","","(Nees) Mez",,,"","471","","Lima, M.P.M.",2005,9,10,"Brazil","Rio de Janeiro","Itatiaia","Parque Nacional de Itatiaia. Trilha para o Lago Azul. Próximo ao rio.",,,,"Ocotea tenuiflora (Nees) Mez","",,"GBIF"
"","JBRJ","RB","RB00475848","Ocotea tenuiflora","","Lauraceae","Ocotea","tenuiflora","","(Nees) Mez",,,"","471","","M.P.M. de Lima; M. Barros",2005,9,10,"Brazil","Rio de Janeiro","Itatiaia","Parque Nacional de Itatiaia. Trilha para o Lago Azul. Próximo ao rio.",,,"Árvore, ca. 7 m de altura; inflorescência jovem.","Ocotea tenuiflora (Nees) Mez","",,"GBIF"
"","JBRJ","RB","RB00585147","Ocotea tenuiflora","","Lauraceae","Ocotea","tenuiflora","","(Nees) Mez","A. Quinet",,"","5455","","Amorim, A.M; et.al",2005,10,30,"Brazil","Bahia","Camacan","RPPN  Serra  Bonita,  9,7  Km  W  de  Camacan  na  estrada  para  Jacareci,  daí  8  Km  SW  na  estrada  para  a  RPPN  e  a  Torre  da  Embratel,  Trilha  nova  que  vai  da  base  da  torre  ao  alojamento.",-15.383333,-39.565278,"Árvore ca. 15 m alt. Raque verde, corola alva. Flores em álcool 70%","Ocotea tenuiflora (Nees) Mez","",,"GBIF"
"","JBRJ","RB","RB00131217","Ocotea tenuiflora","","Lauraceae","Ocotea","tenuiflora","","(Nees) Mez","A. Quinet",,"","2959","","R.C. Forzza; L. C. S. Assis, J. G. Jardim, E. Lucas, B. R. Silva, M. Sobral, S. Edwards e D. Zappi",2004,3,7,"Brazil","Minas Gerais","Descoberto","Subida para a rampa da Pedra do Relogio, a 9,3km da entrada da Reserva Biológica da Represa.",,,"Arvoreta 4m alt, frutos verdes, 5ex.","Ocotea tenuiflora (Nees) Mez","",,"GBIF"
"","Comissão Executiva do Plano da Lavoura Cacaueira","CEPEC","132419","Ocotea tenuiflora","","Lauraceae","Ocotea","tenuiflora","","(Nees) Mez","A. C. Giannerini & A.Quinet",,"","6","","A. C. Giannerini",2004,8,10,"Brazil","Rio de Janeiro","ITATIAIA","Trilha dos Tres Picos.",-22.438056,-44.610278,,"Ocotea tenuiflora (Nees) Mez","",,"GBIF"
"","JBRJ","RB","RB00475809","Ocotea tenuiflora","","Lauraceae","Ocotea","tenuiflora","","(Nees) Mez","A.C.Giannerini & A.Quinet",2006,"","6","","A.C.Giannerini; A.Quinet, M.C.Silva, D.M.Ferreira",2004,8,10,"Brazil","Rio de Janeiro","Itatiaia","Trilha dos Tres Picos.",-22.438055,-44.610278,"Árvore de 6m de altura, semi-ciófila, folhas discolores verdes, cartaceas, botões florais verdes","Ocotea tenuiflora (Nees) Mez","",,"GBIF"
"","NY","NY","02703808","Ocotea tenuiflora","","Lauraceae","Ocotea","tenuiflora","","(Nees) Mez",,,"","6","","A. C. Giannerini",2004,8,10,"Brazil","Rio de Janeiro",,"Trilha dos Tres Picos.",-22.438055,-44.610278,,"Ocotea tenuiflora (Nees) Mez","",,"GBIF"
"","Universidade Federal de Minas Gerais","BHCB","94273","Ocotea tenuiflora","","Lauraceae","Ocotea","tenuiflora","","(Nees) Mez",,,"","66","","Ferreira, RM; França, GS; Stehmann, JR",2004,12,8,"Brazil","Minas Gerais","São Gonçalo do Rio Abaixo","Estação Ambiental de Peti.",,,"Arbóreo, 4m, frutos imaturos verdes, Vertedouro","Ocotea tenuiflora (Nees) Mez","",,"GBIF"
"","JBRJ","RB","RB00484506","Ocotea tenuiflora","","Lauraceae","Ocotea","tenuiflora","","(Nees) Mez","A. Quinet",,"","2425","","R.R.Vervloet; W.Pizziolo",2003,5,14,"Brazil","Espírito Santo","Santa Teresa","Nova Lombardia. Estada para João Neiva, parte inicial.",,,"Arvoreto de 5m , frutos imaturos de cor verde, passando a amarelado. Ramos com galhos, baixada, dossel 14m.","Ocotea tenuiflora (Nees) Mez","",,"GBIF"
"","JBRJ","RB","RB00131302","Ocotea tenuiflora","","Lauraceae","Ocotea","tenuiflora","","(Nees) Mez","A. Quinet",,"","2106","","R.C. Forzza; V.R. Almeida & B.K.S. Franco",2002,3,23,"Brazil","Minas Gerais","Minas Gerais","Descoberto, Reserva Biológica da Represa do Grama. Reserva Biológica da Represa do Grama",,,"Arbusto 2m. alt. Frutos verdes com hipanto vináceo.","Ocotea tenuiflora (Nees) Mez","",,"GBIF"
"","Universidade Federal de Juiz de Fora","CESJ","36935","Ocotea tenuiflora","","Lauraceae","Ocotea","tenuiflora","","(Nees) Mez","A. Quinet",2006,"","2106","","R.C. Forzza; V.R. Almeida; B.K.S. Franco",2002,3,23,"Brazil","Minas Gerais","Descoberto","Reserva Biológica da Represa do Grama",,,"Arbusto 2m alt. Frutos verdes com hipanto vináceo.","Ocotea tenuiflora (Nees) Mez","",,"GBIF"
"","Universidade Federal de Juiz de Fora","CESJ","38743","Ocotea tenuiflora","","Lauraceae","Ocotea","tenuiflora","","(Nees) Mez","A. Quinet",2006,"","568","","L.C.S. Assis; R.C. Forzza; L.D. Meireles; V.R. Scalon; L. Menini Neto; V.R. Almeida",2002,9,21,"Brazil","Minas Gerais","Descoberto","Reserva Biológica da Represa do Grama",,,"Arvoreta ca 4m no interior da mata, folhas discolores com domácias, perianto verde e estames amarelos. Frequente.","Ocotea tenuiflora (Nees) Mez","",,"GBIF"
"","Universidade Federal de Juiz de Fora","CESJ","38744","Ocotea tenuiflora","","Lauraceae","Ocotea","tenuiflora","","(Nees) Mez","A. Quinet",2006,"","570","","L.C.S. Assis; R.C. Forzza; L.D. Meireles; V.R. Scalon; L. Menini Neto; V.R. Almeida",2002,9,21,"Brazil","Minas Gerais","Descoberto","Reserva Biológica da Represa do Grama",,,"Arvoreta ca 3m no interior da mata, folhas discolores com domácias, perianto verde, verticilos masculinos amarelos. Frequente.","Ocotea tenuiflora (Nees) Mez","",,"GBIF"
"","JBRJ","RB","RB00131225","Ocotea tenuiflora","","Lauraceae","Ocotea","tenuiflora","","(Nees) Mez","A. Quinet",,"","568","","L. C. S. Assis; R. C. Forzza, L. D. Meireles, V. R. Scalon, L. M. Neto e V. R. Almeida",2002,9,21,"Brazil","Minas Gerais","Descoberto","Reserva Biológica da Represa do Grama. Reserva Biológica da Represa do Grama",,,"Arvoreta ca. 4m. Folhas discolores com domácias, perianto verde e estames amarelos. Frequente.","Ocotea tenuiflora (Nees) Mez","",,"GBIF"
"","JBRJ","RB","RB00131312","Ocotea tenuiflora","","Lauraceae","Ocotea","tenuiflora","","(Nees) Mez","A. Quinet",,"","570","","L.C.S. Assi; R.C. Forzza, L.D. Meirelles, V.R. Scalon, L.M. Neto e V.R. Almeida",2002,9,21,"Brazil","Minas Gerais","Descoberto","Reserva Biológica da Represa do Grama. Reserva Biológica da Represa do Grama",,,"Arvoreta ca. 3m. no interior da mata , fls. discolores com domácias, perianto verde, verticilos masculinos.  Frequente.","Ocotea tenuiflora (Nees) Mez","",,"GBIF"
"","Universidade Federal de Juiz de Fora","CESJ","33596","Ocotea tenuiflora","","Lauraceae","Ocotea","tenuiflora","","(Nees) Mez","A. Quinet",2006,"","426","","R.M. Castro; L.F.A. Fazza; V.R. Almeida; L.S. Fernandes; R.C. Forzza",2001,5,27,"Brazil","Minas Gerais","Descoberto","Reserva Biológica da Represa do Grama",,,"Arvoreta no interior da mata, com ca 4m de alt. Frutos pendentes. Receptáculo floral vermelho ou verde.","Ocotea tenuiflora (Nees) Mez","",,"GBIF"
"","MO","MO","3136938","Ocotea tenuiflora","","Lauraceae","Ocotea","tenuiflora","","(Nees) Mez","H. v. d. Werff",2001,"","Castro 426","","Castro",2001,5,27,"Brazil",,,"MG. Descoberto. Reserva Biologica da Represa do Grama.",,,,"Ocotea tenuiflora (Nees) Mez","",,"GBIF"
"","JBRJ","RB","RB00131241","Ocotea tenuiflora","","Lauraceae","Ocotea","tenuiflora","","(Nees) Mez","A. Quinet",,"","438","","A. Quinet",2000,7,30,"Brazil","Rio de Janeiro","Nova Friburgo","Lumiar, localidade de Santa Luzia.",-22.368611,-42.290833,"Árvore de 7m de altura, 20cm de CAP, folha discolor verde, cartácea, fruto bacáceo imaturo verde, maduro negro, cúpula verde. Semi-ciófila.","Ocotea tenuiflora (Nees) Mez","",,"GBIF"
"","JBRJ","RB","RB00585180","Ocotea tenuiflora","","Lauraceae","Ocotea","tenuiflora","","(Nees) Mez","A. Quinet",2000,"","23/26","","A. Quinet",2000,7,31,"Brazil","Rio de Janeiro","Nova Friburgo","5º Distrito, Santa Lúcia.",-22.384722,-42.290833,"Árvore 7 m de altura, 20 cm de DAP, folha discolor verde, fruto imaturo verde e maduro negro, rara no local, sobre solo argiloso e arenoso. Luminosidade média.","Ocotea tenuiflora (Nees) Mez","",,"GBIF"
"","MBML","MBML-HERBARIO","13434","Ocotea tenuiflora","","Lauraceae","Ocotea","tenuiflora","","(Nees) Mez","A. Quinet/01-08-2006",,"","1375","","V. Demuner; et al",2000,8,30,"Brazil","Espírito Santo","Santa Teresa","São Sebastião, Propr. Djalma Novelli",-19.848333,-40.722222,"Arvoreta 7m, botões florais e flores brancas. Ambiente aberto e ensolarado, margem do riacho.","Ocotea tenuiflora (Nees) Mez","",,"GBIF"
"","JBRJ","RB","RB00484300","Ocotea tenuiflora","","Lauraceae","Ocotea","tenuiflora","","(Nees) Mez","A. Quinet",2006,"","1375","","V. Demuner; E. Bausen & T.A. da Cruz",2000,8,30,"Brazil","Espírito Santo","Santa Teresa","São Sebastião, propriedade de Djalma Novelli.",,,"Arvoreto 7 m, botões florais e flores brancas.","Ocotea tenuiflora (Nees) Mez","",,"GBIF"
"","JBRJ","RB","RB00475818","Ocotea tenuiflora","","Lauraceae","Ocotea","tenuiflora","","(Nees) Mez","A.Quinet",2001,"","171","","A. Quinet; et al.",1999,5,17,"Brazil","Rio de Janeiro","Itatiaia","Parque Nacional de Itatiaia. Trilha do Abrigo IV para o rio Taquaral (Rio Simon) .",-22.25,-44.566667,"Arvoreta ca de 3m alt, ciófila, ripária, tronco de casca lisa, aromático, folhas cartáceas, discolores verdes, frutos maduros, baga verde com cúpula coroada pelos lobos do perianto rubros.","Ocotea tenuiflora (Nees) Mez","",,"GBIF"
"","JBRJ","RB","RB00475813","Ocotea tenuiflora","","Lauraceae","Ocotea","tenuiflora","","(Nees) Mez",,,"","421","","M.P.M.de Lima; et al.",1999,8,24,"Brazil","Rio de Janeiro","Itatiaia","Parque Nacional de Itatiaia. Subida para sede, próxima a entrada do Parque.",-22.25,-44.566667,"Árvore com ca 12m, folhas verdes discolores, levemente, inflorescências muito jovens verdes","Ocotea tenuiflora (Nees) Mez","",,"GBIF"
"","Universidade Federal de Minas Gerais","BHCB","46020","Ocotea tenuiflora","","Lauraceae","Ocotea","tenuiflora","","(Nees) Mez",,,"","s.n.","","Toledo, FRN; Teeira, EM",1998,4,10,"Brazil","Minas Gerais","Marliéria","Parque Estadual do Rio Doce.",,,"Árvore, 8m.","Ocotea tenuiflora (Nees) Mez","",,"GBIF"
"","Universidade Federal de Minas Gerais","BHCB","42981","Ocotea tenuiflora","","Lauraceae","Ocotea","tenuiflora","","(Nees) Mez",,,"","s.n.","","Lombardi, JA; et al.",1998,9,5,"Brazil","Minas Gerais","Caratinga","Estação Biológica de Caratinga",,,"Folhas cartáceas, botões verdes.","Ocotea tenuiflora (Nees) Mez","",,"GBIF"
"","Universidade Federal de Minas Gerais","BHCB","43114","Ocotea tenuiflora","","Lauraceae","Ocotea","tenuiflora","","(Nees) Mez",,,"","s.n.","","Lombardi, JA",1998,9,19,"Brazil","Minas Gerais","Marliéria","Parque Estadual do Rio Doce",,,"Folhas cartáceas, botões de base verde e ápice creme.","Ocotea tenuiflora (Nees) Mez","",,"GBIF"
"","Universidade Federal de Minas Gerais","BHCB","44140","Ocotea tenuiflora","","Lauraceae","Ocotea","tenuiflora","","(Nees) Mez",,,"","s.n.","","Oliveira, PP",1997,8,11,"Brazil","Rio de Janeiro","Rio das Ostras","Res. Biol. União",,,"trilha 4.","Ocotea tenuiflora (Nees) Mez","",,"GBIF"
"","Universidade Federal de Minas Gerais","BHCB","38524","Ocotea tenuiflora","","Lauraceae","Ocotea","tenuiflora","","(Nees) Mez",,,"","2000","","Lombardi, JA",1997,9,14,"Brazil","Minas Gerais","Marliéria","Parque Estadual do Rio Doce",,,"Folhas cartáceas, flores creme.","Ocotea tenuiflora (Nees) Mez","",,"GBIF"
"","Universidade Federal de Minas Gerais","BHCB","33186","Ocotea tenuiflora","","Lauraceae","Ocotea","tenuiflora","","(Nees) Mez",,2008,"","1490","","Lombardi, JA",1996,12,5,"Brazil","Minas Gerais","Marliéria","Parque Estadual do Rio Doce",-19.704444,-42.516389,"Ramos pendentes, folhas coriáceas, flores externamente verde amareladas, internamente brancas.","Ocotea tenuiflora (Nees) Mez","",,"GBIF"
"","JBRJ","RB","RB00488656","Ocotea tenuiflora","","Lauraceae","Ocotea","tenuiflora","","(Nees) Mez","A. Quinet",,"","2471","","R. Guedes; et al",1994,9,15,"Brazil","Rio de Janeiro","Itatiaia","Estrada que liga o Maromba a Macieiras, logo após o 1º portão.",-22.25,-44.566667,"Árvore de ca. 9m de altura; ramos acinzentados; folhas verdes concolores; inflorescência jovem verde; fruto imaturo verde com pedunculo expandido vermelho","Ocotea tenuiflora (Nees) Mez","",,"GBIF"
"","UFES","VIES","14284","Ocotea tenuiflora","","Lauraceae","Ocotea","tenuiflora","","(Nees) Mez","Thomaz, L.D.",1993,"","1248","","Thomaz, L.D.",1993,9,22,"Brazil","Espírito Santo","Santa Teresa","Estação Biológica de Santa Lúcia.",,,,"Ocotea tenuiflora (Nees) Mez","",,"GBIF"
"","Universidade Federal de Minas Gerais","BHCB","22352","Ocotea tenuiflora","","Lauraceae","Ocotea","tenuiflora","","(Nees) Mez",,,"","s.n.","","Costa, LS",1992,4,13,"Brazil","Minas Gerais","Caratinga","Estação Biológica de Caratinga",,,"Arbóreo, 6m.","Ocotea tenuiflora (Nees) Mez","",,"GBIF"
"","Universidade Federal de Minas Gerais","BHCB","19381","Ocotea tenuiflora","","Lauraceae","Ocotea","tenuiflora","","(Nees) Mez",,,"","s.n.","","Braga, PIS; et al.",1991,11,1,"Brazil","Minas Gerais","Caratinga","Fazenda Macedônia - CENIBRA.",,,"Arvoreta.","Ocotea tenuiflora (Nees) Mez","",,"GBIF"
"","Universidade Federal de Minas Gerais","BHCB","19377","Ocotea tenuiflora","","Lauraceae","Ocotea","tenuiflora","","(Nees) Mez",,,"","s.n.","","Tolêdo, F; et al.",1991,11,22,"Brazil","Minas Gerais","Caratinga","Fazenda Macedônia - CENIBRA.",,,"Arbóreo.","Ocotea tenuiflora (Nees) Mez","",,"GBIF"
"","JBRJ","RB","RB00559663","Ocotea tenuiflora","","Lauraceae","Ocotea","tenuiflora","","(Nees) Mez","Ida de V. Gil",,"","9990","","G.Martinelli; E.Dalcin & J.Hatton",1984,10,10,"Brazil","Rio de Janeiro","Guapimirim","Estação Ecológica Estadual de Paraíso. Centro de Primatológia do RJ-FEEMA.",-22.433333,-42.833333,"Árvore, tronco com 5cm de diâmetro; folhas levemente discolores; flores em botões verdes.","Ocotea tenuiflora (Nees) Mez","",,"GBIF"
"","JBRJ","RB","RB00133106","Ocotea tenuiflora","","Lauraceae","Ocotea","tenuiflora","","(Nees) Mez","A. Quinet",,"","18544","","E.P.Heringer",1982,10,22,"Brazil","Minas Gerais","Timóteo","Parque Estadual do Rio Doce. Parque Estadual do Rio Doce",,,"Árvore de grande porte","Ocotea tenuiflora (Nees) Mez","",,"GBIF"
"","JBRJ","RB","RB00134469","Ocotea tenuiflora","","Lauraceae","Ocotea","tenuiflora","","(Nees) Mez",,,"","10215","","D .Sucre; et al",1973,9,2,"Brazil","Minas Gerais","Rio Doce","Res. Flor. do Rio Doce.",,,"Pequena àrv. com 5m. de alt. umbrofila, crescendo na mata,","Ocotea tenuiflora (Nees) Mez","",,"GBIF"
"","MBM","MBM","265972","Ocotea tenuiflora","","Lauraceae","Ocotea","tenuiflora","","(Nees) Mez",,,"","9848","","Krieger, L",1971,1,23,"Brazil","Minas Gerais","Santa Rita de Jacutinga","Santa Rita de Jacutinga",,,,"Ocotea tenuiflora (Nees) Mez","",,"GBIF"
"","IPA","IPA","15225","Ocotea tenuiflora","","Lauraceae","Ocotea","tenuiflora","","(Nees) Mez","Roxana Barreto",1980,"","145","","Lira, C.C.",1967,12,21,"Brazil","Pernambuco",,"margem da estrada Tejucupapo-Ponta de Pedra.",,,"Arbusto 5-6m; só fruto.","Ocotea tenuiflora (Nees) Mez","",,"GBIF"
"","JBRJ","RB","RB00487617","Ocotea tenuiflora","","Lauraceae","Ocotea","tenuiflora","","(Nees) Mez","A. Quinet",,"",,"","S.V. de Andrade",1965,8,20,"Brazil","Rio de Janeiro","Itatiaia","Estrada do Lago Azul.",,,"Flor amarela","Ocotea tenuiflora (Nees) Mez","",,"GBIF"
"","JBRJ","RB","RB00488332","Ocotea tenuiflora","","Lauraceae","Ocotea","tenuiflora","","(Nees) Mez","A.C.Giannerini",2007,"","805","","W.D.Barros",1942,4,23,"Brazil","Rio de Janeiro","Itatiaia","Taquaral.",,,"Árvore pequena com frutos verdes.","Ocotea tenuiflora (Nees) Mez","",,"GBIF"
"","JBRJ","RB","RB00132903","Ocotea tenuiflora","","Lauraceae","Ocotea","tenuiflora","","(Nees) Mez","Ida de Vattimo",1955,"","936","","W.Duarte",1942,6,3,"Brazil","Rio de Janeiro","Itatiaia","Lote 17.",,,"arv. pequena, fruto imaturo a semente quando cortada é roxa","Ocotea tenuiflora (Nees) Mez","",,"GBIF"
"","JBRJ","RB","RB00488149","Ocotea tenuiflora","","Lauraceae","Ocotea","tenuiflora","","(Nees) Mez","A.C.Giannerini e A.Quinet",2007,"","936","","W.D.Barros",1942,6,3,"Brazil","Rio de Janeiro","Itatiaia","Lote 17.",,,"Arvore de pequeno porte, frutos verdes a semente quando cortada é roxa","Ocotea tenuiflora (Nees) Mez","",,"GBIF"
"","JBRJ","RB","RB00132936","Ocotea tenuiflora","","Lauraceae","Ocotea","tenuiflora","","(Nees) Mez","Ida de Vattimo",1978,"","357","","W. Duarte de Barros",1941,8,27,"Brazil","Rio de Janeiro","Itatiaia","Vale do Taquaral.",,,"arvore muito pequena","Ocotea tenuiflora (Nees) Mez","",,"GBIF"
"","JBRJ","RB","RB00488305","Ocotea tenuiflora","","Lauraceae","Ocotea","tenuiflora","","(Nees) Mez","A.Quinet",,"","357","","W.Duarte Barros",1941,8,27,"Brazil","Rio de Janeiro","Itatiaia","Mata do Taquaral.",,,"Arvore muito pequena. Pre florido","Ocotea tenuiflora (Nees) Mez","",,"GBIF"
"","JBRJ","RB","RB00132927","Ocotea tenuiflora","","Lauraceae","Ocotea","tenuiflora","","(Nees) Mez","Ida de Vattimo",1955,"","33","","W.Duarte de Barros",1940,9,26,"Brazil","Rio de Janeiro","Itatiaia","Monte Serrat.",,,"Arvore","Ocotea tenuiflora (Nees) Mez","",,"GBIF"
"","JBRJ","RB","RB00132921","Ocotea tenuiflora","","Lauraceae","Ocotea","tenuiflora","","(Nees) Mez","Ida de Vattimo",1955,"","33","","W.Duarte de Barros",1940,9,26,"Brazil","Rio de Janeiro","Itatiaia","Monte Serrat.",,,"Arv. proxima a rodovia","Ocotea tenuiflora (Nees) Mez","",,"GBIF"
"","JBRJ","RB","RB00488151","Ocotea tenuiflora","","Lauraceae","Ocotea","tenuiflora","","(Nees) Mez","A.C.Giannerini",2007,"","33","","W.D.Barros",1940,9,26,"Brazil","Rio de Janeiro","Itatiaia","Monte Serrat.",,,"Arvore proxima a rodovia","Ocotea tenuiflora (Nees) Mez","",,"GBIF"
"","Universidade Estadual de Londrina, UEL","FUEL","33916","Ocotea tenuiflora","","Lauraceae","Ocotea","tenuiflora","","(Nees) Mez","Steyermark; Standley",,"","1571","","Barreto, M",1935,7,12,"Brazil","Minas Gerais","Tombos","Fazenda da Cachoeira",,,"Árvore 10m.; Mata","Ocotea tenuiflora (Nees) Mez","",,"GBIF"
"","UEFS","HUEFS","60279","Ocotea tenuiflora","","Lauraceae","Ocotea","tenuiflora","","(Nees) Mez",,,"","1571","","Mello Barreto",1935,7,12,"Brazil","Minas Gerais","Tombos","Fazenda da Cachoeira.",,,"Mata.","Ocotea tenuiflora (Nees) Mez","",,"GBIF"
"","MBM","MBM","260234","Ocotea tenuiflora","","Lauraceae","Ocotea","tenuiflora","","(Nees) Mez","Standley; Steyermark",,"","1571","","Barreto, M",1935,7,12,"Brazil","Minas Gerais","Tombos","Fazenda da Cachoeira",,,,"Ocotea tenuiflora (Nees) Mez","",,"GBIF"
"","UnB","UB","150270","Ocotea tenuiflora","","Lauraceae","Ocotea","tenuiflora","","(Nees) Mez","Standley, P",,"","1571","","Barreto, M",1935,7,12,"Brazil","Minas Gerais","Tombos","Fazenda da Cachoeira",,,"Árvore de 10m; Mata","Ocotea tenuiflora (Nees) Mez","",,"GBIF"
"","Escola Superior de Agricultura Luiz de Queiroz, ESALQ","ESA","78956","Ocotea tenuiflora","","Lauraceae","Ocotea","tenuiflora","","(Nees) Mez","Standley & Steyermark",,"","1571","","Mello-Barreto",1935,7,12,"Brazil","Minas Gerais","Tombos",,,,,"Ocotea tenuiflora (Nees) Mez","",,"GBIF"
"","MO","MO","1542237","Ocotea tenuiflora","","Lauraceae","Ocotea","tenuiflora","","(Nees) Mez","A.C. Smith",,"","Mexia 4707","","Ynés Mexia",1930,5,16,"Brazil","Minas Gerais",,"Agricultural College lands. Cha-Cha valley.",,,,"Ocotea tenuiflora (Nees) Mez","",,"GBIF"
"","NY","NY","00918193","Ocotea tenuiflora","","Lauraceae","Ocotea","tenuiflora","","(Nees) Mez","A. C. Smith",,"","4707","","Y. E. J. Mexia",1930,5,16,"Brazil","Minas Gerais",,"Viçosa. Agricultural College lands. Cha-Cha Valley",-20.766686,-42.860644,,"Ocotea tenuiflora (Nees) Mez","",,"GBIF"
"","MNHN","P","P01959052","Ocotea tenuiflora","","Lauraceae","Ocotea","tenuiflora","","(Nees) Mez",,,"",,"","Mexia, Y.",1930,5,16,"Brazil","Minas Gerais",,,,,"Nome vulgar: Canella Babona","Ocotea tenuiflora (Nees) Mez","",,"GBIF"
"","JBRJ","RB","RB00132947","Ocotea tenuiflora","","Lauraceae","Ocotea","tenuiflora","","(Nees) Mez","J.G.Khulmann",,"",,"","pessoal do Horto Florestal",1927,10,14,"Brazil","Rio de Janeiro","Rio de Janeiro","Matas do Pai Ricardo, encosta do Sumaré.",,,"arvore","Ocotea tenuiflora (Nees) Mez","",,"GBIF"
"","JBRJ","RB","RB00132911","Ocotea tenuiflora","","Lauraceae","Ocotea","tenuiflora","","(Nees) Mez","Ida de Vattimo",1955,"",,"","Campos Porto",1918,,,"Brazil","Rio de Janeiro","Itatiaia","Mont Serrat.",,,,"Ocotea tenuiflora (Nees) Mez","",,"GBIF"
"","MNHN","P","P01959053","Ocotea tenuiflora","","Lauraceae","Ocotea","tenuiflora","","(Nees) Mez",,,"",,"","Galvão, R.|Saldanha",1879,10,5,"Brazil","Rio de Janeiro",,,,,"Nome vulgar: Canella","Ocotea tenuiflora (Nees) Mez","",,"GBIF"
"","MNHN","P","P01959049","Ocotea tenuiflora","","Lauraceae","Ocotea","tenuiflora","","(Nees) Mez",,,"",,"","Glaziou, A.",1872,9,12,"Brazil","Rio de Janeiro",,,,,,"Ocotea tenuiflora (Nees) Mez","",,"GBIF"
"","MNHN","P","P01959050","Ocotea tenuiflora","","Lauraceae","Ocotea","tenuiflora","","(Nees) Mez",,,"",,"","Glaziou, A.",1872,9,12,"Brazil","Rio de Janeiro",,,,,,"Ocotea tenuiflora (Nees) Mez","",,"GBIF"
"","MNHN","P","P01959051","Ocotea tenuiflora","","Lauraceae","Ocotea","tenuiflora","","(Nees) Mez",,,"",,"","Glaziou, A.",1872,9,12,"Brazil","Rio de Janeiro",,,,,"Herbier de A. Glaziou donné par Mme SIMARD, sa fille, en 1907","Ocotea tenuiflora (Nees) Mez","",,"GBIF"
"","MO","MO","1542239","Ocotea tenuiflora","","Lauraceae","Ocotea","tenuiflora","","(Nees) Mez",,,"","Glaziou 6017","","Auguste F.M. Glaziou",1861,,,,,,,,,,"Ocotea tenuiflora (Nees) Mez","",,"GBIF"
"","MNHN","P","P01959040","Ocotea tenuiflora","","Lauraceae","Ocotea","tenuiflora","","(Nees) Mez",,,"",,"","Saint-Hilaire, A.",1816,1,1,"Brazil","Minas Gerais",,,,,,"Ocotea tenuiflora (Nees) Mez","",,"GBIF"
"","MNHN","P","P01959044","Ocotea tenuiflora","","Lauraceae","Ocotea","tenuiflora","","(Nees) Mez",,,"",,"","Saint-Hilaire, A.",1816,1,1,"Brazil","Minas Gerais",,,,,,"Ocotea tenuiflora (Nees) Mez","",,"GBIF"
"","MNHN","P","P01959041","Ocotea tenuiflora","","Lauraceae","Ocotea","tenuiflora","","(Nees) Mez",,,"",,"","Saint-Hilaire, A.",1816,1,1,"Brazil","Minas Gerais",,,,,"No.389","Ocotea tenuiflora (Nees) Mez","",,"GBIF"
"","Universidade Federal de Minas Gerais","BHCB","67621","Ocotea tenuiflora","","Lauraceae","Ocotea","tenuiflora","","(Nees) Mez",,,"","1571","","Barreto, HLM",,,,"Brazil","Minas Gerais","Tombos",,,,,"Ocotea tenuiflora (Nees) Mez","",,"GBIF"
"","USP","SPFW","1932","Ocotea tenuiflora","","Lauraceae","Ocotea","tenuiflora","","(Nees) Mez",,,"",,"",,,,,"Brazil","Minas Gerais","Tombos",,,,,"Ocotea tenuiflora (Nees) Mez","",,"GBIF"
"","USP","SPFW","4306","Ocotea tenuiflora","","Lauraceae","Ocotea","tenuiflora","","(Nees) Mez",,,"",,"",,,,,"Brazil","Santa Catarina",,,,,,"Ocotea tenuiflora (Nees) Mez","",,"GBIF"
"","USP","SPFW","4891","Ocotea tenuiflora","","Lauraceae","Ocotea","tenuiflora","","(Nees) Mez","Serviço Florestal",,"",,"","Sem coletor",,,,"Brazil","Minas Gerais",,,,,"Ministério da Agricultura, Serviço Florestal, Seção de Tecnologia","Ocotea tenuiflora (Nees) Mez","",,"GBIF"
"","MBM","MBM","105699","Ocotea tenuiflora","","Lauraceae","Ocotea","tenuiflora","","(Nees) Mez","Wattimo, I de",,"","9990","","Martinelli, G",,,,"Brazil","Rio de Janeiro","Magé","Paraíso",,,,"Ocotea tenuiflora (Nees) Mez","",,"GBIF"
