"modified","institutionCode","collectionCode","catalogNumber","scientificName","identificationQualifier","family","genus","specificEpithet","infraspecificEpithet","scientificNameAuthorship","identifiedBy","dateIdentified","typeStatus","recordNumber","fieldNumber","recordedBy","year","month","day","country","stateProvince","municipality","locality","decimalLatitude","decimalLongitude","occurrenceRemarks","acceptedNameUsage","occurrenceID","comments","bibliographicCitation"
"","UFPR","UPCB","92417","Huberia consimilis","","Melastomataceae","Huberia","consimilis","","Baumgratz","Bochorny,T.",2017,"","2312","","Goldenberg, R. | Amorim, A.M. | Paixão, J.L.",2017,4,29,"Brazil","Bahia","Amargosa","Região da Serra do Timbó. Topo de serra com arbustivo-herbácea sobre lage de arenito, entremeada com fragmentos de floresta.",-13.106111,-39.701667,"Arbusto 4m. Frutos marrons.","Huberia consimilis Baumgratz","",,"GBIF"
"","UNICAMP","UEC","203216","Huberia consimilis","","Melastomataceae","Huberia","consimilis","","Baumgratz","Bochorny, T",2016,"","209","","Bochorny, T; Bacci, LF",2016,1,29,"Brazil","Rio de Janeiro","Macaé","Pico do Frade de Macaé, Nova Friburgo.",-22.210278,-42.073611,"Árvore, 3m, flores com pétalas brancas e estames amarelos, Próxima a trilha, no primeiro platô antes do acesso ao topo.","Huberia consimilis Baumgratz","",,"GBIF"
"","UNICAMP","UEC","203204","Huberia consimilis","","Melastomataceae","Huberia","consimilis","","Baumgratz","Bochorny, T",2016,"","225","","Bochorny, T; Bacci, LF",2016,4,17,"Brazil","Rio de Janeiro","Santa Maria Madalena","Brasil, Rio de Janeiro:Santa Maria Madalena.Parque Estadual do Desengano.",-21.891944,-41.910556,"Árvore, 4 m, frutos castanhos secos.","Huberia consimilis Baumgratz","",,"GBIF"
"","Comissão Executiva do Plano da Lavoura Cacaueira","CEPEC","139461","Huberia consimilis","","Melastomataceae","Huberia","consimilis","","Baumgratz","T. Bochorny",,"","263","","L. F. Bacci",2015,12,16,"Brazil","Bahia","WENCESLAU GUIMARÃES","Estação Ecológica Wenceslau Guimarães, trilha para o Pico do urubu.",,,"<ll>dwc_commonname:</ll>","Huberia consimilis Baumgratz","",,"GBIF"
"","UNICAMP","UEC","203219","Huberia consimilis","","Melastomataceae","Huberia","consimilis","","Baumgratz","Bochorny, T",2015,"","181","","Bochorny, T; Braga, LS",2015,12,23,"Brazil","Rio de Janeiro","Santa Maria Madalena","Pedra Debois.",-21.942778,-41.994722,"Arbusto, 3m, frutos secos antigos.","Huberia consimilis Baumgratz","",,"GBIF"
"","UFPR","UPCB","80330","Huberia consimilis","","Melastomataceae","Huberia","consimilis","","Baumgratz","Goldenberg, R.",2014,"","2110","","Goldenberg, R.",2014,10,15,"Brazil","Bahia","Lençois","Estrada entre Estiva (Afrânio Peixoto) e a BA-144",-12.272,-41.432,"Arbusto 3m; frutos velhos marrons, botões ainda pequenos verdes..","Huberia consimilis Baumgratz","",,"GBIF"
"","Comissão Executiva do Plano da Lavoura Cacaueira","CEPEC","148297","Huberia consimilis","","Melastomataceae","Huberia","consimilis","","Baumgratz","R. Goldenberg",,"","2110","","R. Goldenberg",2014,10,15,"Brazil","Bahia",,"Estrada entre Estiva (Afrânio Peixoto) e a BA-144",-12.271667,-41.432222,,"Huberia consimilis Baumgratz","",,"GBIF"
"","JBRJ","RB","RB00922881","Huberia consimilis","","Melastomataceae","Huberia","consimilis","","Baumgratz","R. Goldenberg",2014,"","2110","","R. Goldenberg",2014,10,15,"Brazil","Bahia","Lençóis","Estrada entre estiva (Afrânio Peixoto) e a BA-144.",-12.266667,-41.416667,"Arbusto 3 m; frutos velhos marrons, botões ainda pequenos verdes","Huberia consimilis Baumgratz","",,"GBIF"
"","NY","NY","02104664","Huberia consimilis","","Melastomataceae","Huberia","consimilis","","Baumgratz","R. Goldenberg",2014,"","2110","","R. Goldenberg",2014,10,15,"Brazil","Bahia",,"Estrada entre Estiva (Afrânio Peixoto) e a BA-144",-12.27172,-41.43214,,"Huberia consimilis Baumgratz","",,"GBIF"
"","JBRJ","RB","RB00922881","Huberia consimilis","","Melastomataceae","Huberia","consimilis","","Baumgratz","R. Goldenberg",2014,"","2110","","R. Goldenberg",2014,10,15,"Brazil","Bahia","Lençóis","Estrada entre estiva (Afrânio Peixoto) e a BA-144.",-12.26667,-41.41667,"arbusto, 3m; frutos velhos marrons, botões ainda pequenos verdes","Huberia consimilis Baumgratz","",,"GBIF"
"","Universidade Federal da Bahia","ALCB","123729","Huberia consimilis","","Melastomataceae","Huberia","consimilis","","Baumgratz","Coelho, J",2015,"","143","","Silva, SM",2014,12,15,"Brazil","Bahia","Santa Teresinha","Recôncavo Sul, Estrada da Pioneira em direção as antenas, depois do povoado de Pedra Branca, Serra da Jiboia, Reconcavo sul da Bahia.",-12.785278,-39.530278,"Calice verde, corola alva coma base amarelada, estames com filete amarelados e anteras amarelas.","Huberia consimilis Baumgratz","",,"GBIF"
"","UFPR","UPCB","92307","Huberia consimilis","","Melastomataceae","Huberia","consimilis","","Baumgratz","Coelho, J.",2015,"","143","","Silva, S.M.",2014,12,15,"Brazil","Bahia","Santa Terezinha","Estrada da Pioneira em direção das antenas, depois do povoado de Pedra Branca, Serra da Jibóia, Reconcavo sul da Bahia",-12.785278,-39.530278,"Árvore: cálice verde, corola alva com base amarelada, estames com filete amarelados e anteras amarelas..","Huberia consimilis Baumgratz","",,"GBIF"
"","UFPR","UPCB","81151","Huberia consimilis","","Melastomataceae","Huberia","consimilis","","Baumgratz","Bochorny, T.",2016,"","5395","","Pereira, O.J.",2013,4,29,"Brazil","Bahia","Mucuri","Rodovia Mucuri / Nova Viçosa - Km 6: Formação de mata seca.",-18.0867,-39.5508,"Planta com 6m, flor alba, estames amarelados..","Huberia consimilis Baumgratz","",,"GBIF"
"","Universidade Federal da Bahia","ALCB","110504","Huberia consimilis","","Melastomataceae","Huberia","consimilis","","Baumgratz","Guedes, ML",2014,"","20714","","Guedes, ML; Silva, MS dos; et al.",2013,8,17,"Brazil","Bahia","Santa Teresinha","Recôncavo Sul, ao redor da Torre.",-12.766667,-39.516667,"de ca 7 m de altura. Folhas cartáceas, discolores. Inflorescência com flores de pétalas cremes e filetes e anteras vináceas. Frutos cápsulas, maduras.","Huberia consimilis Baumgratz","",,"GBIF"
"","Universidade Federal da Bahia","ALCB","110577","Huberia consimilis","","Melastomataceae","Huberia","consimilis","","Baumgratz","Guedes, ML",2014,"","20797","","Guedes, ML; Silva, MS dos; et al.",2013,8,18,"Brazil","Bahia","Santa Teresinha","Recôncavo Sul, Próximo a torre.",-12.766667,-39.516667,"de ca 8 m de altura. Folhas cartáceas, discolores, com resina. Frutos cápsulas passadas.","Huberia consimilis Baumgratz","",,"GBIF"
"","UnB","UB","214995","Huberia consimilis","","Melastomataceae","Huberia","consimilis","","Baumgratz","Guedes, ML",2014,"","20797","","Guedes, ML; et al.",2013,8,18,"Brazil","Bahia","Santa Teresinha","Próximo a torre",-12.766667,-39.516667,"Árvore: de ca 8m de altura. Folhas cartáceas, discolores, com resina. Frutos cápsulas passadas; Mata:","Huberia consimilis Baumgratz","",,"GBIF"
"","Universidade Federal da Bahia","ALCB","98438","Huberia consimilis","","Melastomataceae","Huberia","consimilis","","Baumgratz","Guedes, ML",2011,"","17944","","Guedes, ML; Silva, LB da; Oliveira, MAJ; Silva, MS; Melo, IV de",2011,2,8,"Brazil","Bahia","Elísio Medrado","Recôncavo Sul, Serra da Jibóia",-12.85,-39.466667,"de ca 6 m de altura. Folhas cartáceas, discolores. Fruto cápsula.","Huberia consimilis Baumgratz","",,"GBIF"
"","UFPR","UPCB","71767","Huberia consimilis","","Melastomataceae","Huberia","consimilis","","Baumgratz","Michelangeli, F.A.",2011,"","1618","","Michelangeli, F.A.",2011,2,10,"Brazil","Rio de Janeiro","Santa Maria Madalena","Parque Estadual do Desengano, trail to summit of Pico do Desengano",,,"Tree 10 m tall, 10 cm DBH; hypanthium pale green, petals white; filaments, thecae and appendages yellow, connective dark yellow to orange.","Huberia consimilis Baumgratz","",,"GBIF"
"","UNICAMP","UEC","177865","Huberia consimilis","","Melastomataceae","Huberia","consimilis","","Baumgratz",,,"","1618","","Michelangeli, FA; Goldenberg, R; Caddah, MK; Reginato, M",2011,2,10,"Brazil","Rio de Janeiro","Santa Maria Madalena",,-22.486111,-42.523333,"Tree 10m tall, 10 cm DBH; hypanthium pale green, petals white; filaments, thecae and appendages yellow, conective dark yellow to orange.; Parque Estadual da Desengano, trai to summit of Pico do Desengano.","Huberia consimilis Baumgratz","",,"GBIF"
"","MO","MO","100610611","Huberia consimilis","","Melastomataceae","Huberia","consimilis","","Baumgratz","F.A. Michelangeli",2011,"","Michelangeli 1618","","Fabián A. Michelangeli|Renato Goldenberg|Mayara K. Caddah|Marcelo Reginato",2011,2,10,"Brazil","Rio de Janeiro",,"Parque Estadual do Desengano, trail to summit of Pico do Desengano. (21° 89' 10"" S, 41° 91' 24"" W)",,,,"Huberia consimilis Baumgratz","",,"GBIF"
"","JBRJ","RB","RB00739954","Huberia consimilis","","Melastomataceae","Huberia","consimilis","","Baumgratz","F.A. Baumgratz",,"","1618","","F.A. Michelangeli; R. Goldenberg; M.K. Caddah; M. Reginato",2011,2,10,"Brazil","Rio de Janeiro","Santa Maria Madalena","Parque Estadual do Desengano, trail to summit of Pico do Desengano.",-22.486111,-42.523333,"Tree 10m tall, 10 cm DBH; hypanthium pale green, petals white; filaments, thecae and appendages yellow, connective dark yellow to orange","Huberia consimilis Baumgratz","",,"GBIF"
"","CAS","BOT-BC","532768","Huberia consimilis","","Melastomataceae","Huberia","consimilis","","Baumgratz",,,"","1618","","Michelangeli, F. A.; Goldenberg, R.; Caddah, M. K.; Reginato, M.",2011,2,,"Brazil","Rio de Janeiro",,"Parque Estadual do Desengano, trail to summit of Pico do Desengano",-22.002778,-42.006667,"Tree 10 m tall, 10 cm DBH; hypanthium pale green, petals white; filaments, thecae and appendages yellow, connective dark yellow to orange. Actual coordinates on label:  21°89'10""S, 41°91'24""","Huberia consimilis Baumgratz","",,"GBIF"
"","NY","NY","1654167","Huberia consimilis","","Melastomataceae","Huberia","consimilis","","Baumgratz","F. A. Michelangeli",2011,"","1618","","F. A. Michelangeli",2011,2,10,"Brazil","Rio de Janeiro",,"Parque Estadual do Desengano, trail to summit of Pico do Desengano",-21.890983,-41.912433,,"Huberia consimilis Baumgratz","",,"GBIF"
"","UFPE","UFP","70026","Huberia consimilis","","Melastomataceae","Huberia","consimilis","","Baumgratz","Leão, T.; Lôbo, D.",2012,"","900","","Leão, T.",2011,10,6,"Brazil","Pernambuco","Lagoa do Gatos","RPPN Pedra D' Anta.",,,"Floresta Ombrófila.&nf;25 L 185777 9036364 (UTM SAD69).; Árvore. Exsudato de cor vermelha.","Huberia consimilis Baumgratz","",,"GBIF"
"","JBRJ","RB","RB00740192","Huberia consimilis","","Melastomataceae","Huberia","consimilis","","Baumgratz","T. Leão et D. Lôbo",2012,"","900","","T. Leão",2011,10,6,"Brazil","Pernambuco","Lagoa dos Gatos","RPPN PEdra D´Anta.",,,"Árvore. Exudato de cor vermelha","Huberia consimilis Baumgratz","",,"GBIF"
"","Comissão Executiva do Plano da Lavoura Cacaueira","CEPEC","111220","Huberia consimilis","","Melastomataceae","Huberia","consimilis","","Baumgratz","M. M. Coelho",,"","855","","Paixão, J. L.",2006,3,19,"Brazil","Bahia","ALMADINA","Serra do Concovado, Rod. Almadina/Coaraci, ca. 5km.",-14.703611,-39.6025,,"Huberia consimilis Baumgratz","",,"GBIF"
"","JBRJ","RB","RB00530319","Huberia consimilis","","Melastomataceae","Huberia","consimilis","","Baumgratz","J. F. A. Baumgratz",2008,"","855","","J. L. Paixão; L. Carlos, A. Jardim, M. Del Rei & Mardel",2006,3,19,"Brazil","Bahia","Almadina","Serra do Concovado, Rod. Almadina/Coaraci, ca. 5 km.",-14.703611,-39.6025,"Árvore, ca. 8 m de altura; folhas discolores; frutos passados e imaturos verdes.","Huberia consimilis Baumgratz","",,"GBIF"
"","UFPR","UPCB","56208","Huberia consimilis","","Melastomataceae","Huberia","consimilis","","Baumgratz","Goldenberg, R.",2007,"","732","","Lopes, M.M.M.",2006,5,23,"Brazil","Bahia","Almadina","Serra do Corcovado, 9,8km ao SW de Coarací na estrada para Almadina, daí N até a Fazenda São José",-14.705833,-39.603333,"Árvore ca. 4m, folhas membranáceas, levemente discolores, cálice verde-claro, corola branca. Coletada no topo da encosta. Floresta ombrófila densa montana..","Huberia consimilis Baumgratz","",,"GBIF"
"","Comissão Executiva do Plano da Lavoura Cacaueira","CEPEC","111976","Huberia consimilis","","Melastomataceae","Huberia","consimilis","","Baumgratz","R. Goldenberg & A. Amorim",,"","732","","Lopes, M. M. M.",2006,5,23,"Brazil","Bahia","ALMADINA","Serra do Corcovado. 9,8Km ao SW de Coarací na estrada para Almadina, daí N até a Fazenda São José. Proprietário Senhor Francisco.",-14.705833,-39.603333,,"Huberia consimilis Baumgratz","",,"GBIF"
"","JBRJ","RB","RB00555617","Huberia consimilis","","Melastomataceae","Huberia","consimilis","","Baumgratz","J.F.A. Baumgratz",2009,"","732","","Lopes, M.M.M.; L. C. de J. Gomes & B.R. dos Santos",2006,5,23,"Brazil","Bahia","Almadina","Serra do Corcovado. 9,8Km ao SW de Coarací na estrada para Almadina, daí N ATÉ A Fazenda São José. Proprietário Senhor Francisco. .",-14.705833,-39.603333,"Árvore ca. 4m alt. Folhas membranáceas, levemente discolores. Cálice verde-claro; corola branca. Coletada no topo da encosta.","Huberia consimilis Baumgratz","",,"GBIF"
"","NY","NY","01805752","Huberia consimilis","","Melastomataceae","Huberia","consimilis","","Baumgratz","F. A. Michelangeli",2013,"","732","","M. M. M. Lopes",2006,5,23,"Brazil","Bahia",,"Serra do Corcovado. 9.8 km ao SW de Coarací na estrada para Almadina, daí N até a Fazenda São José. Proprietário Senhor Francisco.",-14.7058,-39.6033,,"Huberia consimilis Baumgratz","",,"GBIF"
"","UFPR","UPCB","56273","Huberia consimilis","","Melastomataceae","Huberia","consimilis","","Baumgratz","Goldenberg, R.",2007,"","383","","Borges, R.A.X.",2006,12,17,"Brazil","Bahia","Almadina","Serra do Corcovado, 13,8km ao SW de Coaraci na estrada para Almadina, Fazenda São José",-14.705833,-39.603333,"Arvoreta ca. 3m, folhas discolores alvo-esverdeadas abaxialmente, nervuras creme, pedicelos esverdeados, corola alva, filetes vináceos, anteras amarelas. Borda da mata em afloramento. Floresta ombrófila densa montana..","Huberia consimilis Baumgratz","",,"GBIF"
"","Comissão Executiva do Plano da Lavoura Cacaueira","CEPEC","114904","Huberia consimilis","","Melastomataceae","Huberia","consimilis","","Baumgratz","Sem Informação",,"","383","","Borges, R.A.X.",2006,12,17,"Brazil","Bahia","ALMADINA","Serra do Corcovado. 13,8km ao SW de Coaraci na estrada para Almadina. Fazenda São José. Proprietário Senhor Francisco.",-14.705833,-39.603333,"Duplicatas: CEPEC, NY, UPCB, RB.","Huberia consimilis Baumgratz","",,"GBIF"
"","UFPR","UPCB","56207","Huberia consimilis","","Melastomataceae","Huberia","consimilis","","Baumgratz","Goldenberg, R.",2007,"","5484","","Amorim, A.M.",2005,12,11,"Brazil","Bahia","Ibirapitanga","32km N de Itamarati na BR 101, daí 6,8km E na estrada para a Torre da Embratel, Reserva Municipal Cachoeira do Pau",-13.890833,-39.459167,"Arvoreta ca. 3m, folhas verdes, brilhantes na face superior, cálice verde, corola alva, anteras amarelas. Em afloramento na subida da encosta. Floresta ombrófila densa sub-montana..","Huberia consimilis Baumgratz","",,"GBIF"
"","Comissão Executiva do Plano da Lavoura Cacaueira","CEPEC","110527","Huberia consimilis","","Melastomataceae","Huberia","consimilis","","Baumgratz","A. B. Jardim",,"","5484","","Amorim, A. M.",2005,12,11,"Brazil","Bahia","IBIRAPITANGA","22 km N de Itamarati na Br 101, daí 6,8 km E na estrada para a torre. Reserva Municipal Cachoeira do Pau.",-13.890833,-39.459167,"Material em sílica.","Huberia consimilis Baumgratz","",,"GBIF"
"","MO","MO","100666077","Huberia consimilis","","Melastomataceae","Huberia","consimilis","","Baumgratz","F.A. Michelangeli",2012,"","Amorim 5484","","André M. Amorim|et al.",2005,12,11,"Brazil","Bahia",,"32 km N de Itamarati na Br 101, daí 6.8 km E na estrada para a torre da Embratel. Reserva Municipal Cachoeira do Pau.",-13.890833,-39.459167,,"Huberia consimilis Baumgratz","",,"GBIF"
"","JBRJ","RB","RB00717646","Huberia consimilis","","Melastomataceae","Huberia","consimilis","","Baumgratz","J.F. Baumgratz",2012,"","5484","","A.M. Amorim; et al",2005,12,11,"Brazil","Bahia","Ibirapitanga","32 km N de Itamarati na BR 101, daí 6,8 km E na estrada para a torre da Embratel. Reserva Municipal Cachoeira do Pau.",,,"Arvoreta ca. 3m alt. Folhas verdes, brilhantes na face superior Cálice verde, corola alva, anteras amarelas. Em afloramento na subida da encosta.","Huberia consimilis Baumgratz","",,"GBIF"
"","NY","NY","01805759","Huberia consimilis","","Melastomataceae","Huberia","consimilis","","Baumgratz","F. A. Michelangeli",2012,"","5484","","A. M. Amorim",2005,12,11,"Brazil","Bahia",,"32 km N de Itamarati na BR 101, daí 6,8 km E na estrada para a torre da Embratel. Reserva Municipal Cachoeira do Pau",-13.8908,-39.4592,,"Huberia consimilis Baumgratz","",,"GBIF"
"","UEFS","HUEFS","89400","Huberia consimilis","","Melastomataceae","Huberia","consimilis","","Baumgratz","A.K.A.Santos",2004,"","54953","","Harley, R.M.",2004,2,23,"Brazil","Bahia","Rio de Contas","Pico das almas. Na subida, depois da área pedregosa chamada Portal do Pico, caminho para o topo. Entre pedras.",-13.523611,-41.960833,,"Huberia consimilis Baumgratz","",,"GBIF"
"","UEFS","HUEFS","93843","Huberia consimilis","","Melastomataceae","Huberia","consimilis","","Baumgratz",,,"","H4285","","Jardim, J.G.",2004,12,2,"Brazil","Bahia","Elísio Medrado","ca. 1km do povoadao de Monte Cruzeiro. Reserva Jequitibá (área experimental do GAMBÁ). Serra da Jibóia.",-12.869444,-39.471667,"Floresta Higrófila.","Huberia consimilis Baumgratz","",,"GBIF"
"","UNIVASF","HVASF","1541","Huberia consimilis","","Melastomataceae","Huberia","consimilis","","Baumgratz","E.C.O. Chagas",2011,"","1204","","J.A. Siqueira Filho",2002,1,4,"Brazil","Pernambuco","Jaqueira","RPPN Frei Caneca, Pedra do Cruzeiro",-8.723055,-35.838611,"Árvore com 5-6m alt. Caule quadrangular, com cicatrizes. Folhas com nervura central proeminente. Flores alvas, perfumadas, oito estames. Ovário ínfero, quatro lóculos e muitos óvulos. Anteras caudadas, amarelas, filetes de cor ocre.","Huberia consimilis Baumgratz","",,"GBIF"
"","UEFS","HUEFS","80009","Huberia consimilis","","Melastomataceae","Huberia","consimilis","","Baumgratz","A.K.A.Santos",2004,"","54453","","Harley, R.M.",2002,2,11,"Brazil","Bahia","Rio de Contas","Pico das Almas, na base da serra, entre pedras",-13.523333,-41.96,"Campo rupestre.","Huberia consimilis Baumgratz","",,"GBIF"
"","JBRJ","RB","RB00236586","Huberia consimilis","","Melastomataceae","Huberia","consimilis","","Baumgratz",,,"","54453","","R. M. Harley; A. M. Giulietti",2002,2,11,"Brazil","Bahia","Rio de Contas","Pico das Almas, na base da serra.",-13.523333,-41.96,"Arbusto ou árvore ca. 3m alt., tronco 1,5m comp. e ca. 6cm diâm. Folhas pouco discolores, a face superior verde mais escura. Inflorescências terminais com flores sobressaindo na folhagem, flores em dicásio, pedicelo e hipanto verde-claro, cálice verde externamente e creme internamente, pétalas 4, brancas com base amarela, filetes amarelo-claro, anteras, estilete e estigma amarelos.","Huberia consimilis Baumgratz","",,"GBIF"
"","JBRJ","RB","RB00236505","Huberia consimilis","","Melastomataceae","Huberia","consimilis","","Baumgratz","J. F. A. Baumgratz",,"","805","","J. F. A. Baumgratz; et al",2001,8,14,"Brazil","Rio de Janeiro","Macaé","Distrito de Frade, Crubixás, trilha p/ o Pico do Frade, Subida pela Faz. Crubixás; ao longo da trilha p/Pico do Frade,.",,,"Àrv. ca. 4m, helofila, peciolos verde-rosados; folhas verdes dicolores; fr. passados castanho-cinérios.","Huberia consimilis Baumgratz","",,"GBIF"
"","UFPE","UFP","32709","Huberia consimilis","","Melastomataceae","Huberia","consimilis","","Baumgratz",,,"","1204","","Siqueira-Filho, J.A.",2001,12,23,"Brazil","Pernambuco","Jaqueira","Usina Colônia., No caminho para a Pedra do Cruzeiro.",-8.723056,-35.838611,"árvore com 5- 6m alt . Caule quandrangular, com cicatrizes. Folhas com nervura central proeminente. Flores alvas, perfumadas, oito estames. Ovário ínfero, quatro lóculos e muitos óvulos. Anteras caudadas, amarelas, filetes de cor ocre.","Huberia consimilis Baumgratz","",,"GBIF"
"","IPA","IPA","59876","Huberia consimilis","","Melastomataceae","Huberia","consimilis","","Baumgratz","Chagas, E.C.O.",2010,"","321","","Nascimento, L.M.; Silva, A.G. da; Silva, A.G. da",2000,1,19,"Brazil","Pernambuco","Brejo da Madre de Deus","mata do campo.",-8.196111,-36.4,"Árvore ca. 4m de altura. Flores com sépalas verdes e pátalas brancas, estames amarelados. Frutos imaturos verdes. Aroma agradável.; Mata Estacional. Vegetação arbórea arbustiva. Frequênte.","Huberia consimilis Baumgratz","",,"GBIF"
"","Comissão Executiva do Plano da Lavoura Cacaueira","CEPEC","89685","Huberia consimilis","","Melastomataceae","Huberia","consimilis","","Baumgratz","R. Goldenberg",,"","321","","L. M. Nascimento",2000,1,19,"Brazil","Pernambuco","brejo da madre de deus","Mata do Campo.",,,,"Huberia consimilis Baumgratz","",,"GBIF"
"","UFRPE","PEUFR","34001","Huberia consimilis","","Melastomataceae","Huberia","consimilis","","Baumgratz","R. Goldenberg",2010,"","321","","L.M. Nascimento; A.G. da Silva",2000,1,19,"Brazil","Pernambuco","Brejo da Madre de Deus","Mata do Campo",,,"Árvore com cerca de 4 m de altura; flores com sépalas verdes e pétalas brancas; estames amarelos; frutos imaturos verdes; aroma agradável","Huberia consimilis Baumgratz","",,"GBIF"
"","UFPR","UPCB","48794","Huberia consimilis","","Melastomataceae","Huberia","consimilis","","Baumgratz","Bochorny, T.",2015,"","6279","","Queiroz, L.P.de",2000,6,16,"Brazil","Bahia","Santa Teresinha","Serra da Jibóia, ca. 4km de Pedra Brancas",,,"Árvore até 15m, copada, folhas cartáceas, flores com ovário e cálice verdes, pétalas brancas e anteras amarelas. Mata higrófila. Alt.: 760m s.n.m..","Huberia consimilis Baumgratz","",,"GBIF"
"","JBRJ","RB","RB00714067","Huberia consimilis","","Melastomataceae","Huberia","consimilis","","Baumgratz","J.F. Baumgratz",2012,"","6279","","L.P.  Queiroz; J.G. Sobrinho; l. Rios; F. Bravo; G. Melo",2000,6,16,"Brazil","Bahia","Santa Teresinha","Serra da Jiboia, cerca e 4km de Pedra Branca.",-12.253056,-39.475278,"árvore de a´te 15 m de alt. copada. Folhas cartáceas. flores com ovário e cálices verdes, pétalas brancas e anteras amarelas","Huberia consimilis Baumgratz","",,"GBIF"
"","K","Herbarium","K000973926","Huberia consimilis","","Melastomataceae","Huberia","consimilis","","Baumgratz","Baumgratz, J.F.A.",,"","779","","Baumgratz, J.F.A.; Bovini, M.; Silva, J.C.; Giordano, L.C.",2000,12,20,"Brazil",,"Macaé","Estrada p/ cidade de Frade, ca. 44km da BR101, após a bifurcação Frade/Tapera, seguindo estrada a direita em direção à trilha para o pico do Frade, na borda da mata de encosta à direita da estrada, próximo ao sítio Santa Bárbara.",-22.22,-42.08,,"Huberia consimilis Baumgratz","",,"GBIF"
"","USP","SPF","186604","Huberia consimilis","","Melastomataceae","Huberia","consimilis","","Baumgratz","Baumgratz, JFA",2000,"","779","","Baumgratz, JFA",2000,12,20,"Brazil","Rio de Janeiro","Macaé",,-22.216667,-42.083333,,"Huberia consimilis Baumgratz","",,"GBIF"
"","JBRJ","RB","RB00531240","Huberia consimilis","","Melastomataceae","Huberia","consimilis","","Baumgratz","J. F. Baumgratz",,"","779","","J. F. Baumgratz; L. C. Giordano, M. Bovini & J. C. Silva",2000,12,20,"Brazil","Rio de Janeiro","Macaé","Estrada p/ cidade de Frade, ca. 44 km da BR 101, após a bifurcação Frade/Tapera, seguindo estrada à direita em direção à trilha para o pico do Frade. .",-22.216667,-42.083333,"Árvore 8-9 m de altura, heliófila, pouco freqüente; ramos verdes a castanhos; folhas verdes discolores, pecíolos verdes; pedicelo floral, hipanto e cálice verdes; pétalas e estilete alvos; estames amarelos; coletadas amostra p/ estudos de DNA.","Huberia consimilis Baumgratz","",,"GBIF"
"","NY","NY","1018763","Huberia consimilis","","Melastomataceae","Huberia","consimilis","","Baumgratz","J. F. A. Baumgratz",2000,"","779","","J. F. A. Baumgratz",2000,12,20,"Brazil","Rio de Janeiro",,"Estrada p/cidade de Frade, ca. 44 km da BR 101, após a bifurcação Frade/Tapera, seguindo estrada à direita em direção à trilha para o pico do Frade. Próximo ao sítio Santa Bárbara",-22.23,-42.0983,,"Huberia consimilis Baumgratz","",,"GBIF"
"","IPA","IPA","59873","Huberia consimilis","","Melastomataceae","Huberia","consimilis","","Baumgratz","Chagas, E.C.O.",2010,"","202","","Silva, A.G. da; Silva, A.M. da; Oliveira, C.A.M.; Nascimento, L.M.; Silva, A.M. da; Oliveira, C.A.M.; Nascimento, L.M.",1999,12,29,"Brazil","Pernambuco","Brejo da Madre de Deus","Mata do Bituri, margem da estrada.",-8.2075,-36.392222,"Árvore com 4 a 5m de altura. Flores com pétalas brancas e sépalas verdes. estames amarelos.; Mata Estacional.","Huberia consimilis Baumgratz","",,"GBIF"
"","UFPR","UPCB","42276","Huberia consimilis","","Melastomataceae","Huberia","consimilis","","Baumgratz","Bochorny, T.",2015,"","202","","Silva, A.G.da",1999,12,29,"Brazil","Pernambuco","Brejo da Madre de Deus","Mata do Bituri, 08°12'27-415""S 36°23'730-320""W",,,"Árvore 4-5m, flores com pétalas brancas e sépalas verdes, estames amarelos. Margem da estrada, mata estacional. Alt. 920-1030m..","Huberia consimilis Baumgratz","",,"GBIF"
"","UFRPE","PEUFR","34002","Huberia consimilis","","Melastomataceae","Huberia","consimilis","","Baumgratz","R. Goldenberg",2010,"","202","","A.G. Silva; A.M. da Silva; C.A.M. de Oliveira; L.M. do Nascimento",1999,12,29,"Brazil","Pernambuco","Brejo da Madre de Deus","Mata do Bituri",-8.211389,-36.392222,"Árvore com 4 a 5 m de altura; flores com pétalas brancas e sépalas verdes; estames amarelos","Huberia consimilis Baumgratz","",,"GBIF"
