"modified","institutionCode","collectionCode","catalogNumber","scientificName","identificationQualifier","family","genus","specificEpithet","infraspecificEpithet","scientificNameAuthorship","identifiedBy","dateIdentified","typeStatus","recordNumber","fieldNumber","recordedBy","year","month","day","country","stateProvince","municipality","locality","decimalLatitude","decimalLongitude","occurrenceRemarks","acceptedNameUsage","occurrenceID","comments","bibliographicCitation"
"","IPA","IPA","53223","Ceiba glaziovii","","Malvaceae","Ceiba","glaziovii","","(Kuntze) K.Schum.","Bocage, A.",1994,"","842","","Lima, V.C.",1992,9,2,"Brazil","Pernambuco","Venturosa","Sítio Carrapateira.",,,"Árvore ca. 8m de altura. Flores alvas.; Caatinga.","Ceiba glaziovii (Kuntze) K.Schum.","",,"GBIF"
"","UFRPE","PEUFR","15588","Ceiba glaziovii","","Malvaceae","Ceiba","glaziovii","","(Kuntze) K.Schum.","A. dú Bocage",1993,"","842","","V. C. Lima",1992,9,2,"Brazil","Pernambuco","Venturosa","Sítio de carrapateira.",,,"Árvore de mais ou menos 8 m. Flores alvas.","Ceiba glaziovii (Kuntze) K.Schum.","",,"GBIF"
"","IPA","IPA","53285","Ceiba glaziovii","","Malvaceae","Ceiba","glaziovii","","(Kuntze) K.Schum.","Bocage, A.",1994,"","244","","Bocage, A.",1992,10,11,"Brazil","Pernambuco","Brejo da Madre de Deus","Subida para Brejo da Madre de Deus. 1km da cidade.",,,"Árvore ca. 8m. Frutos marrom. Frutos mais arredondados.; Caatinga.","Ceiba glaziovii (Kuntze) K.Schum.","",,"GBIF"
"","IPA","IPA","53288","Ceiba glaziovii","","Malvaceae","Ceiba","glaziovii","","(Kuntze) K.Schum.","Bocage, A.",1994,"","243","","Bocage, A.",1992,11,10,"Brazil","Pernambuco","Caruaru","Sítio Gaibeira. Margem da estrada junto a um plantio de algaroba, próximo a Itauna, caminho para Fazenda Nova.",,,"Árvore ca. 9m de altura. Frutos marrons, alongado.; Caatinga.","Ceiba glaziovii (Kuntze) K.Schum.","",,"GBIF"
"","Jardim Botânico Plantarum","HPL","4284","Ceiba glaziovii","","Malvaceae","Ceiba","glaziovii","","(Kuntze) K.Schum.","H. Lorenzi",1991,"","751","","H. Lorenzi",1991,7,11,"Brazil","Sp","Pradópolis","Fazenda Santa Cruz Pradópolis, cultivada",,,,"Ceiba glaziovii (Kuntze) K.Schum.","",,"GBIF"
"","IPA","IPA","53227","Ceiba glaziovii","","Malvaceae","Ceiba","glaziovii","","(Kuntze) K.Schum.","Bocage, A.",1994,"","198","","Bocage, A.",1991,9,16,"Brazil","Pernambuco","Alagoinha","Estrada de barro. Solo arenoso.",,,"Árvore ca. 5m de altura. Flores alvas com centro com estrias lilás, cálice verde e estames alvos.","Ceiba glaziovii (Kuntze) K.Schum.","",,"GBIF"
"","IPA","IPA","53228","Ceiba glaziovii","","Malvaceae","Ceiba","glaziovii","","(Kuntze) K.Schum.","Bocage, A.",1994,"","218","","Bocage, A.",1991,9,18,"Brazil","Pernambuco","Sertânia","Estrada de barro para Caroalina. Em frente a uma casa.",,,"Árvore ca. 10m de altura. Flores alvas. Planta com três barrigas.; Caatinga.","Ceiba glaziovii (Kuntze) K.Schum.","",,"GBIF"
"","IPA","IPA","53248","Ceiba glaziovii","","Malvaceae","Ceiba","glaziovii","","(Kuntze) K.Schum.","Bocage, A.",1994,"","223","","Bocage, A.",1991,9,18,"Brazil","Pernambuco","Venturosa","BR Pedra-Venturosa. Entre rochedos.",,,"Árvore ca. 6m de altura. Desgalhada. Flores brancas, com acúleos, com folhas.; Caatinga.","Ceiba glaziovii (Kuntze) K.Schum.","",,"GBIF"
"","IPA","IPA","53231","Ceiba glaziovii","","Malvaceae","Ceiba","glaziovii","","(Kuntze) K.Schum.","Bocage, A.",1994,"","231","","Bocage, A.",1991,9,19,"Brazil","Pernambuco","Riacho das Almas","Saindo da cidade em direção a Limoeiro.",,,"Árvore ca. 8m de altura. Caule com acúleos e intumescência.; Caatinga.","Ceiba glaziovii (Kuntze) K.Schum.","",,"GBIF"
"","IPA","IPA","53229","Ceiba glaziovii","","Malvaceae","Ceiba","glaziovii","","(Kuntze) K.Schum.","Bocage, A.",1994,"","207","","Bocage, A.",1991,9,17,"Brazil","Pernambuco","São José do Egito","Estrada para Tuparetama, em um roçado de milho.",,,"Árvore ca. 10m de altura. Flores alvas.; Caatinga.","Ceiba glaziovii (Kuntze) K.Schum.","",,"GBIF"
"","IPA","IPA","53230","Ceiba glaziovii","","Malvaceae","Ceiba","glaziovii","","(Kuntze) K.Schum.","Bocage, A.",1994,"","226","","Bocage, A.",1991,9,19,"Brazil","Pernambuco","Caruaru","Estrada para o Campo Experimental do IPA.",,,"Árvore ca. 10m de altura. Flores alvas, caule aculeado com folhas.; Caatinga.","Ceiba glaziovii (Kuntze) K.Schum.","",,"GBIF"
"","IPA","IPA","53249","Ceiba glaziovii","","Malvaceae","Ceiba","glaziovii","","(Kuntze) K.Schum.","Bocage, A.",1994,"","212","","Bocage, A.",1991,9,17,"Brazil","Pernambuco","Triunfo","Estrada de barro para Triunfo. Alto do Brocotó.",,,"Árvore ca. 15m de altura. Flores brancas. Tronco aculeado com folhas. Frutos +/- arredondados.; Caatinga.","Ceiba glaziovii (Kuntze) K.Schum.","",,"GBIF"
"","IPA","IPA","53284","Ceiba glaziovii","","Malvaceae","Ceiba","glaziovii","","(Kuntze) K.Schum.","Bocage, A.",1994,"","203","","Bocage, A.",1991,9,17,"Brazil","Pernambuco","Brejinho","Margem da estrada.",,,"Árvore ca. 12m de altura. Caule com aculeos e intumescência, casca cinza.; Caatinga.","Ceiba glaziovii (Kuntze) K.Schum.","",,"GBIF"
"","IPA","IPA","53283","Ceiba glaziovii","","Malvaceae","Ceiba","glaziovii","","(Kuntze) K.Schum.","Bocage, A.",1994,"","222","","Bocage, A.",1991,9,18,"Brazil","Pernambuco","Pedra","Rodovia de Arcoverde a Pedra. Margem da estrada.",,,"Árvore ca. 6m de altura. Flores alvas.; Caatinga.","Ceiba glaziovii (Kuntze) K.Schum.","",,"GBIF"
"","IPA","IPA","53282","Ceiba glaziovii","","Malvaceae","Ceiba","glaziovii","","(Kuntze) K.Schum.","Bocage, A.",1994,"","220","","Bocage, A.",1991,9,18,"Brazil","Pernambuco","Sertânia","Na divisa Sertânia/Arcoverde. Junto ao Rio dos Pereiros, distrito Amburana, dentro de um cercado.",,,"Árvore ca. 10m de altura. Flores alvas.; Caatinga.","Ceiba glaziovii (Kuntze) K.Schum.","",,"GBIF"
"","Universidade Federal do Ceará, UFC","EAC","17923","Ceiba glaziovii","","Malvaceae","Ceiba","glaziovii","","(Kuntze) K.Schum.",,,"","465","","Figueiredo, M.A.",1991,9,15,"Brazil","Ceará","Quixadá","Sa. do Estevão, Sertão central",,,"Árvore, +/- 12m, flor branca com estrias roxas; Caatinga arbórea/Mata seca","Ceiba glaziovii (Kuntze) K.Schum.","",,"GBIF"
"","UFRPE","PEUFR","12287","Ceiba glaziovii","","Malvaceae","Ceiba","glaziovii","","(Kuntze) K.Schum.","A. dú Bocage",1994,"",,"","E.Ferraz; E.Sampaio; M.Rodal",1991,9,13,"Brazil","Pernambuco","Triunfo","Estrada Triunfo-Calumbi",,,,"Ceiba glaziovii (Kuntze) K.Schum.","",,"GBIF"
"","UFRPE","PEUFR","15542","Ceiba glaziovii","","Malvaceae","Ceiba","glaziovii","","(Kuntze) K.Schum.","A. dú Bocage",1991,"","203","","A. dú Bocage",1991,9,17,"Brazil","Pernambuco","Brejinho",,,,"Árvore de mais ou menos 12 metros; caule com acúleos e intumescência, casca cinza","Ceiba glaziovii (Kuntze) K.Schum.","",,"GBIF"
"","UFRPE","PEUFR","15577","Ceiba glaziovii","","Malvaceae","Ceiba","glaziovii","","(Kuntze) K.Schum.","A. dú Bocage",1991,"","223","","A. dú Bocage",1991,9,18,"Brazil","Pernambuco","Venturosa","Entre rochedos. Caatinga.",,,"Árvore com mais ou menos 5m. Desgalhada. Flores alvas com acúleos, com folhas.","Ceiba glaziovii (Kuntze) K.Schum.","",,"GBIF"
"","UFRPE","PEUFR","15575","Ceiba glaziovii","","Malvaceae","Ceiba","glaziovii","","(Kuntze) K.Schum.","A. dú Bocage",1992,"","226","","A. dú Bocage",1991,9,19,"Brazil","Pernambuco","Caruaru","Estrada para o campo experimental do IPA.",,,"Árvore com mais ou menos 10m. Flores alvas, caule aculeado com folhas.","Ceiba glaziovii (Kuntze) K.Schum.","",,"GBIF"
"","UFRPE","PEUFR","15586","Ceiba glaziovii","","Malvaceae","Ceiba","glaziovii","","(Kuntze) K.Schum.","A. dú Bocage",1991,"","218","","A. dú Bocage",1991,9,18,"Brazil","Pernambuco","Sertania","Estrada de baroo para Caroalina, em frente a uma casa.",,,"Árvore de mais ou menos 10 m. Flores alvas. Planta com três barrigas.","Ceiba glaziovii (Kuntze) K.Schum.","",,"GBIF"
"","UFRPE","PEUFR","15574","Ceiba glaziovii","","Malvaceae","Ceiba","glaziovii","","(Kuntze) K.Schum.","A. dú Bocage",1991,"","231","","A. dú Bocage",1991,9,19,"Brazil","Pernambuco","Riacho das almas.","Saindo da cidade em direção á Limoeiro.",,,"Àrvore com mais ou menos 8m. Caule com acúleos e intumescência.","Ceiba glaziovii (Kuntze) K.Schum.","",,"GBIF"
"","UFRPE","PEUFR","15587","Ceiba glaziovii","","Malvaceae","Ceiba","glaziovii","","(Kuntze) K.Schum.","A. dú Bocage",1991,"","207","","A. dú Bocage",1991,9,17,"Brazil","Pernambuco","São José do Egito.","Estrada para Tuparetama,em um roçado de milho.",,,"Árvore de mais ou menos 10 m. Flores alvas.","Ceiba glaziovii (Kuntze) K.Schum.","",,"GBIF"
"","UFRPE","PEUFR","15568","Ceiba glaziovii","","Malvaceae","Ceiba","glaziovii","","(Kuntze) K.Schum.","A. dú Bocage",1991,"","220","","A. dú Bocage",1991,9,18,"Brazil","Pernambuco","Sertânia","Na divisa Sertânia/Arcoverde",,,"Árvore com mais ou menos 10m; flores alvas","Ceiba glaziovii (Kuntze) K.Schum.","",,"GBIF"
"","UFRPE","PEUFR","15593","Ceiba glaziovii","","Malvaceae","Ceiba","glaziovii","","(Kuntze) K.Schum.","A. dú Bocage",1991,"","198","","A. dú Bocage",1991,9,16,"Brazil","Pernambuco","Alagoinha","Estrada de barro",,,"Árvore + 5 cm. Flores alvas com centro com estrias lilás, cálice verdes e estames alvos. Latitude: 08º 27' 59"" S Longitude: 36º 46' 33"" W Altitude: 726m","Ceiba glaziovii (Kuntze) K.Schum.","",,"GBIF"
"","UFRPE","PEUFR","15573","Ceiba glaziovii","","Malvaceae","Ceiba","glaziovii","","(Kuntze) K.Schum.","A. dú Bocage",1991,"","212","","A. dú Bocage",1991,9,17,"Brazil","Pernambuco","Triunfo","Alto do brocotó.",,,"Àrvore com mais ou menos 15m. Flores alvas. Tronco aculeado com folhas. Frutos mais ou menos arredondados.","Ceiba glaziovii (Kuntze) K.Schum.","",,"GBIF"
"","UFRPE","PEUFR","15576","Ceiba glaziovii","","Malvaceae","Ceiba","glaziovii","","(Kuntze) K.Schum.","A. dú Bocage",1991,"","222","","A. dú Bocage",1991,9,18,"Brazil","Pernambuco","Pedra","Rodovia de Arcoverde a Pedra. Margem da estrada.",,,"Árvore com mais ou menos 6m. Flores alvas.","Ceiba glaziovii (Kuntze) K.Schum.","",,"GBIF"
"","IPA","IPA","52552","Ceiba glaziovii","","Malvaceae","Ceiba","glaziovii","","(Kuntze) K.Schum.","Bocage, A.",1994,"","235","","Bocage, A.",1991,10,22,"Brazil","Pernambuco","Caruaru","Sítio Gaibeira, margem da estrada, junto a um plantio de algaroba, próximo a Itauna.",,,"Árvore ca. 9m de altura. Flores alvas.","Ceiba glaziovii (Kuntze) K.Schum.","",,"GBIF"
"","IPA","IPA","52548","Ceiba glaziovii","","Malvaceae","Ceiba","glaziovii","","(Kuntze) K.Schum.","Bocage, A.",1994,"","238","","Bocage, A.",1991,10,23,"Brazil","Pernambuco","Caruaru","Campo Experimental do IPA. Capoeirão.",,,"Árvore ca. 6m de altura. Flores alvas.","Ceiba glaziovii (Kuntze) K.Schum.","",,"GBIF"
"","IPA","IPA","52550","Ceiba glaziovii","","Malvaceae","Ceiba","glaziovii","","(Kuntze) K.Schum.","Bocage, A.",1994,"","233","","Bocage, A.",1991,10,21,"Brazil","Pernambuco","Jataúba","Sítio Salobro, estrada de barro.",,,"Árvore ca. 9m de altura. Flores alvas. Tronco sem acúleos com intumescências. Com frutos.; Caatinga.","Ceiba glaziovii (Kuntze) K.Schum.","",,"GBIF"
"","IPA","IPA","52551","Ceiba glaziovii","","Malvaceae","Ceiba","glaziovii","","(Kuntze) K.Schum.","Bocage, A.",1994,"","232","","Bocage, A.",1991,10,21,"Brazil","Pernambuco","Poção","Próximo a cidade de poção.",,,"Árvore ca. 4,5m de altura. Flores alvas. 2 indivíduos.; Caatinga.","Ceiba glaziovii (Kuntze) K.Schum.","",,"GBIF"
"","IPA","IPA","52547","Ceiba glaziovii","","Malvaceae","Ceiba","glaziovii","","(Kuntze) K.Schum.","Bocage, A.",1994,"","234","","Bocage, A.",1991,10,21,"Brazil","Pernambuco","Jataúba","Salobro, estrada de barro para Jataúba.",,,"Árvore ca. 13m de altura. Flores alvas.; Caatinga.","Ceiba glaziovii (Kuntze) K.Schum.","",,"GBIF"
"","IPA","IPA","52549","Ceiba glaziovii","","Malvaceae","Ceiba","glaziovii","","(Kuntze) K.Schum.","Bocage, A.",1994,"","237","","Bocage, A.",1991,10,23,"Brazil","Pernambuco","Caruaru","Estação Experimental do IPA.",,,"Árvore ca. 10m de altura. Flores alvas.; Caatinga.","Ceiba glaziovii (Kuntze) K.Schum.","",,"GBIF"
"","IPA","IPA","53093","Ceiba glaziovii","","Malvaceae","Ceiba","glaziovii","","(Kuntze) K.Schum.","Bocage, A.",1994,"","22","","Guedes; et al.; et al.",1991,10,20,"Brazil","Pernambuco","Caruaru","Estação Experimental do IPA.",,,"Árvore.; Caatinga arbórea.","Ceiba glaziovii (Kuntze) K.Schum.","",,"GBIF"
"","UFRPE","PEUFR","15553","Ceiba glaziovii","","Malvaceae","Ceiba","glaziovii","","(Kuntze) K.Schum.","A. dú Bocage",1991,"","233","","A. dú Bocage",1991,10,21,"Brazil","Pernambuco","Jataúba","Sítio Salobro",,,"Árvore com mais ou menos 9m; troco sem acúleos com intumescência; flores alvas; com frutos","Ceiba glaziovii (Kuntze) K.Schum.","",,"GBIF"
"","UFRPE","PEUFR","15592","Ceiba glaziovii","","Malvaceae","Ceiba","glaziovii","","(Kuntze) K.Schum.","A. dú Bocage",1991,"","232","","A. dú Bocage",1991,10,21,"Brazil","Pernambuco","Poção","Proximo a cidade de Poção.",,,"Àrvore +ou- 4,5m. Flores alvas.","Ceiba glaziovii (Kuntze) K.Schum.","",,"GBIF"
"","UFRPE","PEUFR","15590","Ceiba glaziovii","","Malvaceae","Ceiba","glaziovii","","(Kuntze) K.Schum.","A. dú Bocage",1991,"","234","","A. dú Bocage",1991,10,21,"Brazil","Pernambuco","Jataúba","Estrada de barro para Jatuaba.",,,"Árvore com mais ou menos 13m. Flores alvas.","Ceiba glaziovii (Kuntze) K.Schum.","",,"GBIF"
"","UFRPE","PEUFR","15591","Ceiba glaziovii","","Malvaceae","Ceiba","glaziovii","","(Kuntze) K.Schum.","A. dú Bocage",1991,"","235","","A. dú Bocage",1991,10,22,"Brazil","Pernambuco","Caruaru","Margem da estrada, junto a um plantio de algaroba, próximo a itauna.",,,"Árvore com mais ou menos 9m. Flores alvas.","Ceiba glaziovii (Kuntze) K.Schum.","",,"GBIF"
"","UFRPE","PEUFR","15584","Ceiba glaziovii","","Malvaceae","Ceiba","glaziovii","","(Kuntze) K.Schum.","A. dú Bocage",1991,"","238","","A. dú Bocage",1991,10,23,"Brazil","Pernambuco","Caruaru","Campo experimental do IPA. Capoeirão.",,,"Árvore de mais ou menos 6 m. Flores alvas.","Ceiba glaziovii (Kuntze) K.Schum.","",,"GBIF"
"","IPA","IPA","52662","Ceiba glaziovii","","Malvaceae","Ceiba","glaziovii","","(Kuntze) K.Schum.","Bocage, A.",1994,"","21","","Bocage, A.",1990,7,11,"Brazil","Pernambuco","Triunfo","Subida para Triunfo, estrada de barro, Sítio Procotó.",,,"Árvore ca. 10m de altura. Flores brancas. 6 árvores nessa área.; Caatinga, solo argiloso.","Ceiba glaziovii (Kuntze) K.Schum.","",,"GBIF"
"","IPA","IPA","52666","Ceiba glaziovii","","Malvaceae","Ceiba","glaziovii","","(Kuntze) K.Schum.","Bocage, A.",1994,"","14","","Bocage, A.",1990,7,11,"Brazil","Pernambuco","Custódia","Barro Vermelho. Solo argiloso.",,,"Árvore ca. 8m. Tronco com 1m de área. Flores brancas com centro rosado.; Caatinga.","Ceiba glaziovii (Kuntze) K.Schum.","",,"GBIF"
"","UFRPE","PEUFR","15583","Ceiba glaziovii","","Malvaceae","Ceiba","glaziovii","","(Kuntze) K.Schum.","A. dú Bocage",1990,"","21","","A. dú Bocage",1990,7,11,"Brazil","Pernambuco","Triunfo","Estrada de barro, sítio protocô,",,,"Árvore de mais ou menos 10 m. Flores alvas, nessa área 6 árvores.","Ceiba glaziovii (Kuntze) K.Schum.","",,"GBIF"
"","UFRPE","PEUFR","15589","Ceiba glaziovii","","Malvaceae","Ceiba","glaziovii","","(Kuntze) K.Schum.","A. dú Bocage",1990,"","14","","A. dú Bocage",1990,7,11,"Brazil","Pernambuco","Custódia",,,,"Àrvore com mais ou menos 8m. Tronco com 1m. Flores alvas com centro rosado.","Ceiba glaziovii (Kuntze) K.Schum.","",,"GBIF"
"","IPA","IPA","52663","Ceiba glaziovii","","Malvaceae","Ceiba","glaziovii","","(Kuntze) K.Schum.","Bocage, A.",1994,"","567","","Rita Pereira; Bocage, A.; Bocage, A.",1990,9,13,"Brazil","Pernambuco","Tacaratu","Estrada de barro Petrolândia/Tacaratu.",,,"Árvore ca. 8m de altura. Flores alvas, caule com aculeos, com intumescência.; Caatinga.","Ceiba glaziovii (Kuntze) K.Schum.","",,"GBIF"
"","IPA","IPA","53286","Ceiba glaziovii","","Malvaceae","Ceiba","glaziovii","","(Kuntze) K.Schum.","Bocage, A.",1994,"","568","","Rita Pereira; Bocage, A.; Bocage, A.",1990,9,14,"Brazil","Pernambuco","Arcoverde","Estrada para Pedras. Na saída de Arcoverde. Solo arenoso.",,,"Árvore ca. 12m de altura. Flores alvas. Planta com acúleos.; Caatinga.","Ceiba glaziovii (Kuntze) K.Schum.","",,"GBIF"
"","Universidade Federal do Ceará, UFC","EAC","17005","Ceiba glaziovii","","Malvaceae","Ceiba","glaziovii","","(Kuntze) K.Schum.","Bocage, A.L.",1996,"","s.n.","","Cavalcanti, F.S.",1990,9,9,"Brazil","Ceará","Mulungu","São Roque",,,"Árvore, flor branca; Serra","Ceiba glaziovii (Kuntze) K.Schum.","",,"GBIF"
"","Comissão Executiva do Plano da Lavoura Cacaueira","CEPEC","72554","Ceiba glaziovii","","Malvaceae","Ceiba","glaziovii","","(Kuntze) K.Schum.","P. Gibbs & J. Semir",,"","3444","","R. M. Harley",1990,9,8,"Brazil","Bahia","JACOBINA","Barracão de Cima.",-11.027222,-40.559444,,"Ceiba glaziovii (Kuntze) K.Schum.","",,"GBIF"
"","UFRPE","PEUFR","15541","Ceiba glaziovii","","Malvaceae","Ceiba","glaziovii","","(Kuntze) K.Schum.","A. dú Bocage",1992,"","568","","Rita; Ana (188)",1990,9,14,"Brazil","Pernambuco","Arcoverde","Estrada para Pedra",,,"Árvore com mais ou menos 12m; flores alvas; planta com acúleos","Ceiba glaziovii (Kuntze) K.Schum.","",,"GBIF"
"","UFRPE","PEUFR","15585","Ceiba glaziovii","","Malvaceae","Ceiba","glaziovii","","(Kuntze) K.Schum.","A. dú Bocage",1990,"","567","","R. Pereira; A. dú Bocage (187)",1990,9,13,"Brazil","Pernambuco","Tacaratu","Estrada de barro Petrolândia/ Tacaratu.",,,"Àrvore com mais ou menos 8m. Flores alvas, caule com acúleos, com intumescência.","Ceiba glaziovii (Kuntze) K.Schum.","",,"GBIF"
"","Universidade Federal do Ceará, UFC","EAC","15137","Ceiba glaziovii","","Malvaceae","Ceiba","glaziovii","","(Kuntze) K.Schum.","Gibbs, P.",1987,"","s.n.","","Fernandes, A.",1987,7,12,"Brazil","Ceará","Meruoca","Encosta da Sa. da Meruoca",,,"Árvore , flor alva; Mata fresca","Ceiba glaziovii (Kuntze) K.Schum.","",,"GBIF"
"","Universidade Federal do Ceará, UFC","EAC","15083","Ceiba glaziovii","","Malvaceae","Ceiba","glaziovii","","(Kuntze) K.Schum.","Gibbs, P.",1987,"","s.n.","","Fernandes, A.",1987,9,6,"Brazil","Ceará","Meruoca","Encosta da Sa. da Meruoca",,,"Árvore , flor alva, coletado pólen para estudo taxinômico em 11/11/03 por Marileide Saba.; Mata seca","Ceiba glaziovii (Kuntze) K.Schum.","",,"GBIF"
"","UEFS","HUEFS","7433","Ceiba glaziovii","","Malvaceae","Ceiba","glaziovii","","(Kuntze) K.Schum.","F.França & A.Cordeiro",2000,"",,"","Oliveira, M.V.M.",1987,9,,"Brazil","Bahia","Feira de Santana",,,,,"Ceiba glaziovii (Kuntze) K.Schum.","",,"GBIF"
"","IPA","IPA","48739","Ceiba glaziovii","","Malvaceae","Ceiba","glaziovii","","(Kuntze) K.Schum.","Bocage, A.",1990,"","211","","Lima, V.C.; Gallindo, F.; Gallindo, F.",1986,4,16,"Brazil","Pernambuco","Triunfo","Estrada para Serra Talhada. Propriedade Boa Vista. Restos de antiga mata nebular. Solo argiloso.",,,"Árvore ca. 8-18m de altura.","Ceiba glaziovii (Kuntze) K.Schum.","",,"GBIF"
"","UEFS","HUEFS","9049","Ceiba glaziovii","","Malvaceae","Ceiba","glaziovii","","(Kuntze) K.Schum.","J.G.de Carvalho-Sobrinho",2003,"","882","","Sarmento, A.C.",1986,4,14,"Brazil","Bahia","Utinga",,-12.016667,-40.983333,,"Ceiba glaziovii (Kuntze) K.Schum.","",,"GBIF"
"","UFRGS","ICN","081943A","Ceiba glaziovii","","Malvaceae","Ceiba","glaziovii","","(Kuntze) K.Schum.","Bocage, A",1999,"","882","","Sarmento, AC; Bautista, HP",1986,4,14,"Brazil","Ba","Utinga","próximo à lagoa do Capim",-12.016667,-40.983333,"Doação HRB; Árvore com 9 m de altura; frutos jovens piriformes de cor verde; Área de pastagem da Floresta Estacional Decidual; latossolo vermelho-amarelo álico; textura argilosa; relevo plano a suave ondulado","Ceiba glaziovii (Kuntze) K.Schum.","",,"GBIF"
"","Universidade Federal do Ceará, UFC","EAC","14776","Ceiba glaziovii","","Malvaceae","Ceiba","glaziovii","","(Kuntze) K.Schum.","Gibbs, P.",1987,"","s.n.","","Fernandes, A.",1986,6,29,"Brazil","Paraíba","Campina Grande",,,,"Árvore aculeada","Ceiba glaziovii (Kuntze) K.Schum.","",,"GBIF"
"","UEFS","HUEFS","6059","Ceiba glaziovii","","Malvaceae","Ceiba","glaziovii","","(Kuntze) K.Schum.",,,"","997","","Queiroz, L.P.de",1986,10,4,"Brazil","Bahia","Anguera","Estrada do Feijão.",,,,"Ceiba glaziovii (Kuntze) K.Schum.","",,"GBIF"
"","UEFS","HUEFS","5875","Ceiba glaziovii","","Malvaceae","Ceiba","glaziovii","","(Kuntze) K.Schum.","J.Semir",1989,"","663","","Oliveira, E.L.P.G.de",1985,3,29,"Brazil","Bahia","Mairí",,,,,"Ceiba glaziovii (Kuntze) K.Schum.","",,"GBIF"
"","Instituto Nacional de Pesquisas da Amazônia (INPA)","Coleção Botânica, Instituto Nacional de Pesquisas da Amazônia (INPA)","156515","Ceiba glaziovii","","Malvaceae","Ceiba","glaziovii","","(Kuntze) K.Schum.","Ramos, J.F.",2004,"","429","","Mike Hopkins",1984,9,15,"Brazil","Paraíba",,"7 km estrada PB-238, trecho Teixeira/Desterro. Projeto RADAM/BRASIL/IBDF.",-7.133333,-37.1,,"Ceiba glaziovii (Kuntze) K.Schum.","",,"GBIF"
"","Universidade Federal da Bahia","ALCB","19642","Ceiba glaziovii","","Malvaceae","Ceiba","glaziovii","","(Kuntze) K.Schum.","Bocage, A",1995,"","429","","Fonseca, WN da; Santos, MM dos",1984,9,15,"Brazil","Paraíba","Teixeira","7 km estrada PB- 238, trecho Teixeira/ Desterro",-7.133333,-37.1,"Com 10 m de alt. Tronco com acúleos, diam. a altura do peito 1,00 m. Flores brancas, botões verde - claros.","Ceiba glaziovii (Kuntze) K.Schum.","",,"GBIF"
"","IPA","IPA","51328","Ceiba glaziovii","","Malvaceae","Ceiba","glaziovii","","(Kuntze) K.Schum.","Bocage, A.",1990,"","429","","Fonseca, W.N. da; Santos, M.M.; Santos, M.M.",1984,9,15,"Brazil","Paraíba","Teixeira","7km estrada PB-238, trecho Teixeira/Desterro. Vegetação: Estepe arbórea aberta.",-7.133333,-37.1,"Árvore ca. 10m de altura, diâmetro da copa 14m, tronco com acúleos, DAP 1m. Flores brancas, botões verde-claros. Ocorrência fraca.; Caatinga.","Ceiba glaziovii (Kuntze) K.Schum.","",,"GBIF"
"","UEFS","HUEFS","8671","Ceiba glaziovii","","Malvaceae","Ceiba","glaziovii","","(Kuntze) K.Schum.","J.G.de Carvalho-Sobrinho",2003,"","429","","Fonseca, W.N.da",1984,9,15,"Brazil","Paraíba","Teixeira",,-7.133333,-37.1,,"Ceiba glaziovii (Kuntze) K.Schum.","",,"GBIF"
"","MBM","MBM","122897","Ceiba glaziovii","","Malvaceae","Ceiba","glaziovii","","(Kuntze) K.Schum.","Gilbbs, PE",,"","429","","Fonseca, WN da",1984,9,15,"Brazil","Paraíba","Teixeira","7km na estrada PR-238, trecho Teixeira - Desterro",,,,"Ceiba glaziovii (Kuntze) K.Schum.","",,"GBIF"
"","USP","SPF","61036","Ceiba glaziovii","","Malvaceae","Ceiba","glaziovii","","(Kuntze) K.Schum.","Ilegível",,"","429","","Fonseca, WN",1984,9,15,"Brazil","Paraíba","Teixeira",,-7.133333,-37.1,,"Ceiba glaziovii (Kuntze) K.Schum.","",,"GBIF"
"","UFRGS","ICN","084914","Ceiba glaziovii","","Malvaceae","Ceiba","glaziovii","","(Kuntze) K.Schum.","Bocage, A",1999,"","429","","Fonseca, WN; Santos, MM",1984,9,15,"Brazil","Pb","Teixeira","7 km estrada PB-238, trecho Teixeira/Desterro",-7.133333,-37.1,"Doação HRB; Árvore com 10 m de altura, diâmetro da copa 14 m, tronco com acúleos, diâmetro à altura do peito 1 m. Flores brancas, botões verde-claros; Ocorrência fraca; estepe arbórea aberta","Ceiba glaziovii (Kuntze) K.Schum.","",,"GBIF"
"","MPEG","HERBMG","MG129930","Ceiba glaziovii","","Malvaceae","Ceiba","glaziovii","","(Kuntze) K.Schum.","Pinto, G.C.P.",,"",,"","Fonsêca,  W.N. da; Santos,  M.M.",1984,9,15,"Brazil","Paraíba",,"Teixeira",,,,"Ceiba glaziovii (Kuntze) K.Schum.","",,"GBIF"
"","JBRJ","RB","RB00059082","Ceiba glaziovii","","Malvaceae","Ceiba","glaziovii","","(Kuntze) K.Schum.","P. Cisno",2002,"","429","","Walmor N. da Fonseca ; Manoel M. Santos",1984,9,15,"Brazil","Paraíba","Teixeira","7 km da estrada PB-238, trecho Teixeira/Desterro.",,,"Árvore com 10m de altura, diâmetro da copa 14m, tronco com acúleos, diâmetro à altura do peito 1,00m. Flores brancas, botões verde -claros. Ocorrência fraca.","Ceiba glaziovii (Kuntze) K.Schum.","",,"GBIF"
"","NY","NY","01538946","Ceiba glaziovii","","Malvaceae","Ceiba","glaziovii","","(Kuntze) K.Schum.","P. E. Gibbs; J. Semir",2003,"","920","","I. L. do Amaral",1983,4,23,"Brazil","Pará",,"Estrada Santarém-Cuiabá, BR-163, km 794, Serra do Cachimbo, mais ou menos 7km dentro da mata.",-9.37,-54.9,,"Ceiba glaziovii (Kuntze) K.Schum.","",,"GBIF"
"","UFRPE","PEUFR","6335","Ceiba glaziovii","","Malvaceae","Ceiba","glaziovii","","(Kuntze) K.Schum.","A. dú Bocage",1994,"","213","","V.C.Andrade",1983,7,27,"Brazil","Pernambuco","Arcoverde","Margem esquerda da estrada 30Km de Arcoverde, sentido Pesqueira",,,"Árvore florida sem folhas; flores brancas com raios vermelhos, internamente as pétalas","Ceiba glaziovii (Kuntze) K.Schum.","",,"GBIF"
"","Universidade Federal da Bahia","ALCB","17591","Ceiba glaziovii","","Malvaceae","Ceiba","glaziovii","","(Kuntze) K.Schum.","Bocage, A",1995,"","274","","Silva, SB da; Pinto, GCP",1983,8,10,"Brazil","Bahia","Curaçá","Baixo Médio São Francisco, Faz. Mina",-9.216667,-39.916667,"Ca. de 8 -10 m de alt. Com tronco fusiforme, aculeado; floração plena.","Ceiba glaziovii (Kuntze) K.Schum.","",,"GBIF"
"","Universidade Federal do Ceará, UFC","EAC","12181","Ceiba glaziovii","","Malvaceae","Ceiba","glaziovii","","(Kuntze) K.Schum.","Gibbs, P.",1987,"","s.n.","","Figueiredo, M.A.",1983,8,8,"Brazil","Pernambuco",,"Iapa",,,"Árvore , flor branca; Agreste","Ceiba glaziovii (Kuntze) K.Schum.","",,"GBIF"
"","UEFS","HUEFS","3563","Ceiba glaziovii","","Malvaceae","Ceiba","glaziovii","","(Kuntze) K.Schum.","P.Gibbs & J.Semir",2004,"","274","","Silva, S.B.da",1983,8,10,"Brazil","Bahia","Curaçá",,-9.216667,-39.916667,,"Ceiba glaziovii (Kuntze) K.Schum.","",,"GBIF"
