"modified","institutionCode","collectionCode","catalogNumber","scientificName","identificationQualifier","family","genus","specificEpithet","infraspecificEpithet","scientificNameAuthorship","identifiedBy","dateIdentified","typeStatus","recordNumber","fieldNumber","recordedBy","year","month","day","country","stateProvince","municipality","locality","decimalLatitude","decimalLongitude","occurrenceRemarks","acceptedNameUsage","occurrenceID","comments","bibliographicCitation"
"","UFES","VIES","38261","Pavonia calyculosa","","Malvaceae","Pavonia","calyculosa","","A.St.-Hil. & Naudin","Rocha, D.",2015,"","537","","Julkoski, D.",2014,12,1,"Brazil","Espírito Santo","São Mateus",,,,,"Pavonia calyculosa A.St.-Hil. & Naudin","",,"GBIF"
"","UFES","VIES","23447","Pavonia calyculosa","","Malvaceae","Pavonia","calyculosa","","A.St.-Hil. & Naudin","E.M. Saddi",2012,"","778","","E.M. Saddi; P.O. Samor; S. Neves & R. Chaves",2012,7,17,"Brazil","Espírito Santo","Linhares","Parcela 4 para os estudos do EIA do Mineroduto Morro do Pilar/MG - Linhares/ES.",-19.378889,-39.920556,,"Pavonia calyculosa A.St.-Hil. & Naudin","",,"GBIF"
"","JBRJ","RB","RB00780770","Pavonia calyculosa","","Malvaceae","Pavonia","calyculosa","","A.St.-Hil. & Naudin","E.M.Saddi",,"","778","","E.M.Saddi; Pedro Otavio Samor, Silfo Neves & Roni Chaves",2012,7,17,"Brazil","Espírito Santo","Linhares","Parcela 4 para os estudos do EIA do Mineroduto Morro do Pilar/MG - Linhares/ES.",-19.378889,-39.920556,"Arvore com cerca de 7m de altura. Brácteas verdes, pétalas amarelas.","Pavonia calyculosa A.St.-Hil. & Naudin","",,"GBIF"
"","US","Botany","3668122","Pavonia calyculosa","","Malvaceae","Pavonia","calyculosa","","A.St.-Hil. & Naudin",,,"","170","","J. C. Lopes, E. R. Martins, J. Mangueira & K. R. Braga",2011,4,16,"Brazil","Espirito Santo",,"Linhares. Reserva Natural da Vale. Estrada Jacaranda - Caveuna. Floresta de Tabuleiro",-19.1504,-39.9287,,"Pavonia calyculosa A.St.-Hil. & Naudin","",,"GBIF"
"","JBRJ","RB","RB00759268","Pavonia calyculosa","","Malvaceae","Pavonia","calyculosa","","A.St.-Hil. & Naudin","R.R. Rodrigues",2011,"","170","","J.C. Lopes; E.R. Martins; J.R. Mangueira; K.R.R. Braga",2011,4,16,"Brazil","Espírito Santo","Linhares","Reserva Natural da Vale. Estrada Jacarandá-Caveuna. 19,15036 S 39,92869 W.",,,"Árvore, ca. 6m alt. Epicálice e cálice verdes, corola amarela.","Pavonia calyculosa A.St.-Hil. & Naudin","",,"GBIF"
"","Escola Superior de Agricultura Luiz de Queiroz, ESALQ","ESA","115108","Pavonia calyculosa","","Malvaceae","Pavonia","calyculosa","","A.St.-Hil. & Naudin","Rodrigues, R.R.",,"","170","","Lopes, J.C.",2011,4,16,"Brazil","Espírito Santo","Linhares",,,,,"Pavonia calyculosa A.St.-Hil. & Naudin","",,"GBIF"
"","JBRJ","RB","RB00580574","Pavonia calyculosa","","Malvaceae","Pavonia","calyculosa","","A.St.-Hil. & Naudin","M.G. Bovini",,"","10525","","L. Kollmann; L.Magnago",2008,1,31,"Brazil","Espírito Santo","Pinheiros","Santa Rita, terreno do Branco .",,,"Arbusto 3 m, flores verdes.","Pavonia calyculosa A.St.-Hil. & Naudin","",,"GBIF"
"","JBRJ","RB","RB00594334","Pavonia calyculosa","","Malvaceae","Pavonia","calyculosa","","A.St.-Hil. & Naudin","G.L. Esteves",,"","410","","Versieux, L.M.; Calvente, A.M. & Poubel, J.M.",2007,2,1,"Brazil","Espírito Santo","Pinheiros","Reserva Biológica Córrego do Veado, trilha de educação ambiental.",-18.370833,-40.141944,"Arbusto c/ ca. de 4m de altura, flores c/ cálice verde, corola amarela e anteras laranja. Prensado em álcool.","Pavonia calyculosa A.St.-Hil. & Naudin","",,"GBIF"
"","USP","SPF","181148","Pavonia calyculosa","","Malvaceae","Pavonia","calyculosa","","A.St.-Hil. & Naudin","Esteves, GL",,"","87","","Zuntini, AR",2007,7,26,"Brazil","Espírito Santo","Linhares","Reserva Natural Vale, Antiga estrada Jacaranda caviuna.",,,,"Pavonia calyculosa A.St.-Hil. & Naudin","",,"GBIF"
"","Reserva Natural Vale","CVRD","12276","Pavonia calyculosa","","Malvaceae","Pavonia","calyculosa","","A.St.-Hil. & Naudin","Geovane S. Siqueira",2009,"","87","","Zuntini, A.R. et al.",2007,7,26,"Brazil","Es","LINHARES",,,,"Cálice verde claro e pétalas amarelas. <ll>dwc_commonname:</ll> Algodoeiro","Pavonia calyculosa A.St.-Hil. & Naudin","",,"GBIF"
"","UEFS","HUEFS","123911","Pavonia calyculosa","","Malvaceae","Pavonia","calyculosa","","A.St.-Hil. & Naudin",,,"","633M","","Ferreira, M.A.P.",2006,4,10,"Brazil","Espírito Santo","Linhares","Reserva da Companhia Vale do Rio Doce. Estrada Parajú, Km 1.",,,"Mata de Tabuleiro.","Pavonia calyculosa A.St.-Hil. & Naudin","",,"GBIF"
"","Reserva Natural Vale","CVRD","11436","Pavonia calyculosa","","Malvaceae","Pavonia","calyculosa","","A.St.-Hil. & Naudin","Paula-Souza, J. & Paciencia, M.",2006,"","2431","","Paciencia, M.B.",2006,4,10,"Brazil","Es","LINHARES","Taxonomia de Campo USP, UNICAMP, ESAlq",,,"arbusto, 3m alt; pátalas amarelo-esverdeadas, sépalas verdes, estames amarelos <ll>dwc_commonname:</ll> Algodoeiro","Pavonia calyculosa A.St.-Hil. & Naudin","",,"GBIF"
"","Reserva Natural Vale","CVRD","11737","Pavonia calyculosa","","Malvaceae","Pavonia","calyculosa","","A.St.-Hil. & Naudin","Rodrigues, C.D.N.; Lorenzo, L.",2006,"","633","","Ferreira-Pinho, M.A.",2006,4,10,"Brazil","Es","LINHARES","Taxonomia de Campo USP, UNICAMP, ESAlq",,,"Calículo, cálice e corola verdes. <ll>dwc_commonname:</ll> Algodoeiro","Pavonia calyculosa A.St.-Hil. & Naudin","",,"GBIF"
"","JBRJ","RB","RB00422953","Pavonia calyculosa","","Malvaceae","Pavonia","calyculosa","","A.St.-Hil. & Naudin","C. D. N. Rodrigues e L. Lorenzo",,"","633","","M. A. Pinho-Ferreira; L. Lorenzo, C. D. N. Rodrigues, R. A. G. Viana, V. C. Souza e V. R. Scalon",2006,4,10,"Brazil","Espírito Santo","Linhares","Reserva da Campanhia Vale do Rio Doce. Estrada Parajú, km 1.",-19,-39,"Arbusto. Calículo, cálice e corola verdes.","Pavonia calyculosa A.St.-Hil. & Naudin","",,"GBIF"
"","Escola Superior de Agricultura Luiz de Queiroz, ESALQ","ESA","104396","Pavonia calyculosa","","Malvaceae","Pavonia","calyculosa","","A.St.-Hil. & Naudin","Rodrigues, C.N.D. & Lorenzo, L.",2006,"","633","","Pinho-Ferreira, M.A.M.",2006,4,10,"Brazil","Espírito Santo","Linhares",,,,,"Pavonia calyculosa A.St.-Hil. & Naudin","",,"GBIF"
"","Comissão Executiva do Plano da Lavoura Cacaueira","CEPEC","114266","Pavonia calyculosa","","Malvaceae","Pavonia","calyculosa","","A.St.-Hil. & Naudin","Sem Informação",,"","6291","","Amorim, A. M.",2006,9,16,"Brazil","Bahia","CAMACAN","RPPN Serra Bonita. 9,7 km de Camacan na estrada para Jacarecí. Daí 6 km SW na estrada para a RPPN e torre da Embratel.",-15.391667,-39.565278,"Flores em álcool.","Pavonia calyculosa A.St.-Hil. & Naudin","",,"GBIF"
"","MBML","MBML-HERBARIO","27574","Pavonia calyculosa","","Malvaceae","Pavonia","calyculosa","","A.St.-Hil. & Naudin",,,"","3079","","V. Demuner; L.F.S. Magnago, T. Cruz, Elias Bausen",2006,11,15,"Brazil","Espírito Santo","Governador Lindenberg","Córrego Dependência, Igreja de Imaculada Conceição",-19.219167,-40.536667,"Arbusto 2m, frutos verdes. Borda de mata, beira de asfalto.","Pavonia calyculosa A.St.-Hil. & Naudin","",,"GBIF"
"","JBRJ","RB","RB00580572","Pavonia calyculosa","","Malvaceae","Pavonia","calyculosa","","A.St.-Hil. & Naudin","M.G. Bovini",,"","3079","","V. Demuner; L.F.S. Magnago, T. Cruz & Elias Bausen",2006,11,15,"Brazil","Espírito Santo","Governador Lindenberg","Córrego Dependencia, Igreja de Imaculada Conceição.",-19.219167,-40.536667,"Arbusto 2 m, frutos verdes.","Pavonia calyculosa A.St.-Hil. & Naudin","",,"GBIF"
"","USP","SPF","169091","Pavonia calyculosa","","Malvaceae","Pavonia","calyculosa","","A.St.-Hil. & Naudin","Gonçalez, VM",2017,"","2796","","Fiaschi, P",2005,3,12,"Brazil","Bahia","Almadina",,-14.640833,-39.713056,,"Pavonia calyculosa A.St.-Hil. & Naudin","",,"GBIF"
"","NY","NY","1462156","Pavonia calyculosa","","Malvaceae","Pavonia","calyculosa","","A.St.-Hil. & Naudin","P. A. Fryxell",2008,"","2796","","P. Fiaschi",2005,3,12,"Brazil","Bahia",,"Rodovia de Almadina para Ibitupã, ca. 20 km. Fazenda São Roque, ca. 10 km da entrada do ramal.",-14.6408,-39.7131,,"Pavonia calyculosa A.St.-Hil. & Naudin","",,"GBIF"
"","JBRJ","RB","RB00216663","Pavonia calyculosa","","Malvaceae","Pavonia","calyculosa","","A.St.-Hil. & Naudin","M.G. Bovini",,"","5780","","L.S. Leoni",2004,6,15,"Brazil","Espírito Santo","Pinheiros","Rebio Córrego do Veado, fonte do Parajú REBIO Córrego do Veado",,,"Subarbusto lenhoso, ramos longos, brácteas de cor castanho, áalice verde e corola amarela","Pavonia calyculosa A.St.-Hil. & Naudin","",,"GBIF"
"","NY","NY","1419209","Pavonia calyculosa","","Malvaceae","Pavonia","calyculosa","","A.St.-Hil. & Naudin","P. A. Fryxell",2008,"","280","","J. L. Paixão",2003,11,12,"Brazil","Bahia",,"Rod. BA 650, Camamu/Travessão, Faz. Zumbi dos Palmares, Cachoeira de Crespe.",-14.068,-39.107,,"Pavonia calyculosa A.St.-Hil. & Naudin","",,"GBIF"
"","NY","NY","585581","Pavonia calyculosa","","Malvaceae","Pavonia","calyculosa","","A.St.-Hil. & Naudin","V. M. Gonçalez",2015,"","2","","F. S. Juchum",2000,1,4,"Brazil","Bahia",,"Na Rod. Jussari/Palmira ca. 15 km até a entrada que dá acesso para a Rod. Jussari/Itapé, ca. 2.2 km para a Faz. Sao Roque (Luís Fernando Verde)",-15.1954157528398,-39.4952160228309,,"Pavonia calyculosa A.St.-Hil. & Naudin","",,"GBIF"
"","UFES","VIES","32230","Pavonia calyculosa","","Malvaceae","Pavonia","calyculosa","","A.St.-Hil. & Naudin","V.M. Gonçalez",2016,"","6540","","Pereira, O.J.; Gomes, J.M.L. & Castro, R.",2000,10,3,"Brazil","Espírito Santo","Linhares",,,,,"Pavonia calyculosa A.St.-Hil. & Naudin","",,"GBIF"
"","Reserva Natural Vale","CVRD","4563","Pavonia calyculosa","","Malvaceae","Pavonia","calyculosa","","A.St.-Hil. & Naudin",,,"","2615","","Esteves, G.L.",1993,5,31,"Brazil","Es","LINHARES",,,,"<ll>dwc_commonname:</ll> Algodoeiro","Pavonia calyculosa A.St.-Hil. & Naudin","",,"GBIF"
"","NY","NY","406998","Pavonia calyculosa","","Malvaceae","Pavonia","calyculosa","","A.St.-Hil. & Naudin","P. A. Fryxell",1996,"","2615","","G. L. Esteves",1993,5,31,"Brazil","Espírito Santo",,"Reserva Florestal da Companhia Vale do Rio Doce",-19.138199,-39.961174,,"Pavonia calyculosa A.St.-Hil. & Naudin","",,"GBIF"
"","Reserva Natural Vale","CVRD","4140","Pavonia calyculosa","","Malvaceae","Pavonia","calyculosa","","A.St.-Hil. & Naudin",,,"","544","","Farias, G.L.",1992,8,5,"Brazil","Es","LINHARES","Bloco C.",,,"Arbusto abundante, flores com aroma desagradável, pétalas amarelo pálido. <ll>dwc_commonname:</ll> Algodoeiro","Pavonia calyculosa A.St.-Hil. & Naudin","",,"GBIF"
"","USP","SPF","76006","Pavonia calyculosa","","Malvaceae","Pavonia","calyculosa","","A.St.-Hil. & Naudin","Gonçalez, VM",2015,"","2399","","Esteves, GL",1992,10,16,"Brazil","Espírito Santo","Linhares","Reserva Natural Vale, No início da estrada Caingá.",,,,"Pavonia calyculosa A.St.-Hil. & Naudin","",,"GBIF"
"","Reserva Natural Vale","CVRD","2822","Pavonia calyculosa","","Malvaceae","Pavonia","calyculosa","","A.St.-Hil. & Naudin","Paul A. Fryxell",1992,"","371","","Farias, G.L.",1990,7,31,"Brazil","Es","LINHARES",,,,"<ll>dwc_commonname:</ll> Algodoeiro","Pavonia calyculosa A.St.-Hil. & Naudin","",,"GBIF"
"","UNICAMP","UEC","53789","Pavonia calyculosa","","Malvaceae","Pavonia","calyculosa","","A.St.-Hil. & Naudin","Esteves, GL",1996,"","22122","","Buzato, S; Franco, ALM",1989,8,1,"Brazil","Espírito Santo","Linhares","Reserva da Vale do Rio Doce",,,"Arbusto 4m,folhas alternas flores amarelas","Pavonia calyculosa A.St.-Hil. & Naudin","",,"GBIF"
"","JBRJ","RB","RB00216667","Pavonia calyculosa","","Malvaceae","Pavonia","calyculosa","","A.St.-Hil. & Naudin","M.G.Bovini",,"","22122","","Buzato",1989,8,1,"Brazil","Espírito Santo","Linhares","Reserva da Vale do Rio Doce.",,,"Arbusto, 4m, folhas alternas flores amarelas","Pavonia calyculosa A.St.-Hil. & Naudin","",,"GBIF"
"","Instituto Nacional de Pesquisas da Amazônia (INPA)","Coleção Botânica, Instituto Nacional de Pesquisas da Amazônia (INPA)","132358","Pavonia calyculosa","","Malvaceae","Pavonia","calyculosa","","A.St.-Hil. & Naudin","Krapovickas, A.",1985,"","48718","","Mike Hopkins",1984,12,8,"Brazil","Bahia",,,,,,"Pavonia calyculosa A.St.-Hil. & Naudin","",,"GBIF"
"","Comissão Executiva do Plano da Lavoura Cacaueira","CEPEC","37427","Pavonia calyculosa","","Malvaceae","Pavonia","calyculosa","","A.St.-Hil. & Naudin","A. Krapovickas",,"","48718","","G. Hatschbach",1984,12,8,"Brazil","Bahia","NOVA VIÇOSA","Km 87.",,,,"Pavonia calyculosa A.St.-Hil. & Naudin","",,"GBIF"
"","MO","MO","3329211","Pavonia calyculosa","","Malvaceae","Pavonia","calyculosa","","A.St.-Hil. & Naudin","A. Krapovickas",1985,"","Hatschbach 48718","","Gert G. Hatschbach|J.M. Silva",1984,12,8,"Brazil","Bahia",,"87 (mun Nova Viçosa).",,,,"Pavonia calyculosa A.St.-Hil. & Naudin","",,"GBIF"
"","US","Botany","3076777","Pavonia calyculosa","","Malvaceae","Pavonia","calyculosa","","A.St.-Hil. & Naudin",,,"","48718","","G. Hatschbach & J. M. Silva",1984,12,8,"Brazil","Bahia",,"87 (mun. nova vicosa)",,,,"Pavonia calyculosa A.St.-Hil. & Naudin","",,"GBIF"
"","NY","NY","407005","Pavonia calyculosa","","Malvaceae","Pavonia","calyculosa","","A.St.-Hil. & Naudin","P. A. Fryxell",1993,"","48718","","G. G. Hatschbach",1984,12,8,"Brazil","Bahia",,"87",-17.8956713789075,-39.3716065781526,,"Pavonia calyculosa A.St.-Hil. & Naudin","",,"GBIF"
"","MPEG","HERBMG","MG112940","Pavonia calyculosa","","Malvaceae","Pavonia","calyculosa","","A.St.-Hil. & Naudin","Krapovickas, A.",,"",,"","Hatschbach, G.; Silva, M.G. da",1984,12,8,"Brazil","Bahia",,"Nova Viçosa",,,,"Pavonia calyculosa A.St.-Hil. & Naudin","",,"GBIF"
"","UFES","VIES","23446","Pavonia calyculosa","","Malvaceae","Pavonia","calyculosa","","A.St.-Hil. & Naudin","M.G. Bovini",2003,"","1798","","A.L. Peixoto; H.C. Lima",1983,4,21,"Brazil","Espírito Santo","Linhares","Reserva Florestal CVRD.",,,,"Pavonia calyculosa A.St.-Hil. & Naudin","",,"GBIF"
"","JBRJ","RB","RB00216679","Pavonia calyculosa","","Malvaceae","Pavonia","calyculosa","","A.St.-Hil. & Naudin","M.G.Bovini",,"","1798","","A.L.Peixoto; H.C. de Lima",1983,4,21,"Brazil","Espírito Santo","Linhares","Reserva Florestal da CVRD. Reserva Florestal da CVRD",,,"Árvore com ca 3m de altura, muito ramificada, flores com calice verde, corola amarela, e androforo vermelho","Pavonia calyculosa A.St.-Hil. & Naudin","",,"GBIF"
"","IAC","IAC","25814","Pavonia calyculosa","","Malvaceae","Pavonia","calyculosa","","A.St.-Hil. & Naudin","G.L. Esteves",1997,"","241","","D.A. Folli",1980,7,16,"Brazil","Espírito Santo","Linhares","Reserva Florestal CVRD, est. Caingá, Km 0,870",-19.3911,-40.0722,"Doação da C.V.R.D n.617","Pavonia calyculosa A.St.-Hil. & Naudin","",,"GBIF"
"","Reserva Natural Vale","CVRD","617","Pavonia calyculosa","","Malvaceae","Pavonia","calyculosa","","A.St.-Hil. & Naudin","Paul A. Fryxell",1992,"","241","","Folli, D.A.",1980,7,16,"Brazil","Es","LINHARES",,,,"<ll>dwc_commonname:</ll> Algodoeiro","Pavonia calyculosa A.St.-Hil. & Naudin","",,"GBIF"
"","NY","NY","407001","Pavonia calyculosa","","Malvaceae","Pavonia","calyculosa","","A.St.-Hil. & Naudin","G. L. Esteves",1994,"","241","","D. A. Folli",1980,7,16,"Brazil","Espírito Santo",,"Reserva Florestal da CVRD. Est. CAINGA, ant. 234, km 0,870, lado esquerdo",-19.3949002236543,-40.071853011446,,"Pavonia calyculosa A.St.-Hil. & Naudin","",,"GBIF"
"","UFES","VIES","23448","Pavonia calyculosa","","Malvaceae","Pavonia","calyculosa","","A.St.-Hil. & Naudin","G.L. Esteves",1996,"","5009","","G. Martinelli",1978,9,27,"Brazil","Espírito Santo","Linhares","Reserva Florestal CVRD, Floresta SA.",,,,"Pavonia calyculosa A.St.-Hil. & Naudin","",,"GBIF"
"","JBRJ","RB","RB00216701","Pavonia calyculosa","","Malvaceae","Pavonia","calyculosa","","A.St.-Hil. & Naudin","G.L.Esteves",,"","5009","","G. Martinelli",1978,9,27,"Brazil","Espírito Santo","Linhares","Reserva Florestal CVRD, Floresta SA.",,,"Esciófila, extrato arbustivo, folhas verdes discolor, flores com cálice vinoso, calice verde, corola amarela com as bordas das petalas com nuances vinosos escuros, estames amarelos, frutos imaturos","Pavonia calyculosa A.St.-Hil. & Naudin","",,"GBIF"
"","JBRJ","RB","RB00218314","Pavonia calyculosa","","Malvaceae","Pavonia","calyculosa","","A.St.-Hil. & Naudin","Victor Martins Gonçalvez",2015,"","347","","J. Spada",1974,10,9,"Brazil","Espírito Santo","Linhares","Estrada X2, talhão 405. Reserva Floresta CVRD",,,"Arbusto com cerca de 8 metros de altura, com o fuste de cerca de 4 metros de altura, flor amarela, botão floral verde escuro.","Pavonia calyculosa A.St.-Hil. & Naudin","",,"GBIF"
"","Comissão Executiva do Plano da Lavoura Cacaueira","CEPEC","5928","Pavonia calyculosa","","Malvaceae","Pavonia","calyculosa","","A.St.-Hil. & Naudin","A. Krapovickas",,"","946","","T. S. dos Santos",1970,7,15,"Brazil","Espírito Santo","LINHARES","Vale do Rio Doce.",,,,"Pavonia calyculosa A.St.-Hil. & Naudin","",,"GBIF"
"","Comissão Executiva do Plano da Lavoura Cacaueira","CEPEC","4590","Pavonia calyculosa","","Malvaceae","Pavonia","calyculosa","","A.St.-Hil. & Naudin","A. Krapovickas",,"","3879","","R. P. Belém",1968,7,16,"Brazil","Bahia","MUCURÍ","BA/ES, Vale do Rio Mucuri, ao lado da BR-101.",,,,"Pavonia calyculosa A.St.-Hil. & Naudin","",,"GBIF"
"","Comissão Executiva do Plano da Lavoura Cacaueira","CEPEC","4581","Pavonia calyculosa","","Malvaceae","Pavonia","calyculosa","","A.St.-Hil. & Naudin","A. Krapovickas",,"","3882","","R. P. Belém",1968,7,16,"Brazil","Bahia","MUCURÍ","BA/ES, Vale do Rio Mucuri, ao lado da BR-101.",,,,"Pavonia calyculosa A.St.-Hil. & Naudin","",,"GBIF"
"","K","Herbarium","K001217776","Pavonia calyculosa","","Malvaceae","Pavonia","calyculosa","","A.St.-Hil. & Naudin",,,"","3882","","Belém, R.P.",1968,7,16,"Brazil",,,"Vale do Rio Mucurí, ao lado da Rodovia Br 101.",,,,"Pavonia calyculosa A.St.-Hil. & Naudin","",,"GBIF"
"","US","Botany","2884010","Pavonia calyculosa","","Malvaceae","Pavonia","calyculosa","","A.St.-Hil. & Naudin",,,"","3882","","R. P. Belém",1968,7,16,"Brazil","Bahia",,"Ao lado da Rodovia BR 101. Vale de Rio Mucurí. Regiao Bahia - Espirito Santo",,,,"Pavonia calyculosa A.St.-Hil. & Naudin","",,"GBIF"
"","NY","NY","407000","Pavonia calyculosa","","Malvaceae","Pavonia","calyculosa","","A.St.-Hil. & Naudin","P. A. Fryxell",1998,"","3879","","R. P. Belém",1968,7,16,"Brazil","Bahia",,"Vale do Rio Mucurí, ao lado da Rodovia BR 101",-18.098499,-39.89346,,"Pavonia calyculosa A.St.-Hil. & Naudin","",,"GBIF"
"","NY","NY","406999","Pavonia calyculosa","","Malvaceae","Pavonia","calyculosa","","A.St.-Hil. & Naudin","G. L. Esteves",1994,"","3882","","R. P. Belém",1968,7,16,"Brazil","Bahia",,"Vale do Rio Mucurí, ao lado da Rodovia BR 101",-18.098499,-39.89346,"coleçao de madeira","Pavonia calyculosa A.St.-Hil. & Naudin","",,"GBIF"
"","MO","MO","3050404","Pavonia calyculosa","","Malvaceae","Pavonia","calyculosa","","A.St.-Hil. & Naudin","P. Fryxell",1998,"","Belém 3879","","Romeu P. Belém",1968,,,"Brazil","Bahia",,"Vale do Rio Mucurí, ao lado da Rodovia BR 101. Mata de terra firme.",,,,"Pavonia calyculosa A.St.-Hil. & Naudin","",,"GBIF"
"","JBRJ","RB","RB00216688","Pavonia calyculosa","","Malvaceae","Pavonia","calyculosa","","A.St.-Hil. & Naudin","G.L.Esteves",1996,"","4047","","A.P.Duarte",1953,11,27,"Brazil","Espírito Santo","Guarapari",,,,"planta, flores amarelas","Pavonia calyculosa A.St.-Hil. & Naudin","",,"GBIF"
"","JBRJ","RB","RB00216690","Pavonia calyculosa","","Malvaceae","Pavonia","calyculosa","","A.St.-Hil. & Naudin","G.L.Esteves",1996,"","4208","","A.P.Duarte",1953,11,26,"Brazil","Espírito Santo","Guarapari",,,,"planta","Pavonia calyculosa A.St.-Hil. & Naudin","",,"GBIF"
"","US","Botany","2439262","Pavonia calyculosa","","Malvaceae","Pavonia","calyculosa","","A.St.-Hil. & Naudin",,,"","20069a","","R. L. Fróes",1942,11,24,"Brazil","Bahia",,"Itambe, Rio Pardo.",,,,"Pavonia calyculosa A.St.-Hil. & Naudin","",,"GBIF"
"","NY","NY","407003","Pavonia calyculosa","","Malvaceae","Pavonia","calyculosa","","A.St.-Hil. & Naudin","P. A. Fryxell",1992,"","20069a","","R. de Lemos Fróes",1942,11,24,"Brazil","Bahia",,"Rio Pardo",-15.2487171410569,-40.6241905069502,,"Pavonia calyculosa A.St.-Hil. & Naudin","",,"GBIF"
"","NY","NY","407002","Pavonia calyculosa","","Malvaceae","Pavonia","calyculosa","","A.St.-Hil. & Naudin","P. A. Fryxell",1993,"","1267036","","R. de Lemos Fróes",1942,11,9,"Brazil","Bahia",,"On road to Sao Paulinho",-14.8698088924156,-40.8392046895446,"2nd label on sheet: partially covered; hard to read","Pavonia calyculosa A.St.-Hil. & Naudin","",,"GBIF"
"","US","Botany","2439232","Pavonia calyculosa","","Malvaceae","Pavonia","calyculosa","","A.St.-Hil. & Naudin",,,"","20054","","R. L. Fróes",1942,12,4,"Brazil","Bahia",,"Rio Pardo, Itambé.",,,,"Pavonia calyculosa A.St.-Hil. & Naudin","",,"GBIF"
"","NY","NY","407004","Pavonia calyculosa","","Malvaceae","Pavonia","calyculosa","","A.St.-Hil. & Naudin","P. A. Fryxell",1992,"","20054","","R. de Lemos Fróes",1942,12,4,"Brazil","Bahia",,"Entre Itambé e Rio Pardo",-15.2487171410569,-40.6241905069502,"3097 stamped beside NYBG stamp","Pavonia calyculosa A.St.-Hil. & Naudin","",,"GBIF"
"","MNHN","P","P02285701","Pavonia calyculosa","","Malvaceae","Pavonia","calyculosa","","A.St.-Hil. & Naudin",,,"",,"","Blanchet",,,,"Brazil",,,,,,,"Pavonia calyculosa A.St.-Hil. & Naudin","",,"GBIF"
"","MNHN","P","P02285702","Pavonia calyculosa","","Malvaceae","Pavonia","calyculosa","","A.St.-Hil. & Naudin",,,"",,"","Blanchet",,,,"Brazil",,,,,,,"Pavonia calyculosa A.St.-Hil. & Naudin","",,"GBIF"
"","MBM","MBM","84305","Pavonia calyculosa","","Malvaceae","Pavonia","calyculosa","","A.St.-Hil. & Naudin","Krapovickas, A",,"","946","","Santos, TS",,,,"Brazil","Espírito Santo","Linhares","Vale do Rio Doce",,,,"Pavonia calyculosa A.St.-Hil. & Naudin","",,"GBIF"
"","MBM","MBM","97884","Pavonia calyculosa","","Malvaceae","Pavonia","calyculosa","","A.St.-Hil. & Naudin","Krapovickas, A",,"","48718","","Hatschbach, G",,,,"Brazil","Bahia","Nova Viçosa","87",,,,"Pavonia calyculosa A.St.-Hil. & Naudin","",,"GBIF"
"","G","Geneva Herbarium – General Collection (G)","G-G-250034/1","Pavonia calyculosa","","Malvaceae","Pavonia","calyculosa","","A.St.-Hil. & Naudin",,,"",,"","Blanchet, J. S. (Coll. De Candolle)",,,,"Brazil",,,"Bahia - Bahia/Estado da Bahia",-12.18306,-41.99722,,"Pavonia calyculosa A.St.-Hil. & Naudin","",,"GBIF"
"","G","Geneva Herbarium – General Collection (G)","G-G-250034/2","Pavonia calyculosa","","Malvaceae","Pavonia","calyculosa","","A.St.-Hil. & Naudin","Fryxell, P. A. (1991)",,"",,"","Blanchet, J. S. (Coll. Moricand)",,,,"Brazil",,,"Bahia - Bahia/Estado da Bahia",-12.18306,-41.99722,,"Pavonia calyculosa A.St.-Hil. & Naudin","",,"GBIF"
"","F","Botany","V0063001F","Pavonia calyculosa","","Malvaceae","Pavonia","calyculosa","","A.St.-Hil. & Naudin",,,"","2117","","J. S. Blanchet",,,,"Brazil",,,,-10.8339,-52.8731,,"Pavonia calyculosa A.St.-Hil. & Naudin","",,"GBIF"
"","MO","MO","100735131","Pavonia calyculosa","","Malvaceae","Pavonia","calyculosa","","A.St.-Hil. & Naudin",,,"","Blanchet 2117","","Jacques S. Blanchet",,,,"Brazil","Bahia",,,,,,"Pavonia calyculosa A.St.-Hil. & Naudin","",,"GBIF"
"","NY","NY","7242","Pavonia calyculosa","","Malvaceae","Pavonia","calyculosa","","A.St.-Hil. & Naudin",,,"","2117","","J. S. Blanchet",,,,"Brazil","Bahia",,,-15.159747,-39.039072,"Collection date: acc. 1835","Pavonia calyculosa A.St.-Hil. & Naudin","",,"GBIF"
"","NHMUK","BOT","BM013727144","Pavonia calyculosa","","Malvaceae","Pavonia","calyculosa","","A.St.-Hil. & Naudin",,,"",,"",,,,,,,,,,,,"Pavonia calyculosa A.St.-Hil. & Naudin","",,"GBIF"
"","NHMUK","BOT","BM013727143","Pavonia calyculosa","","Malvaceae","Pavonia","calyculosa","","A.St.-Hil. & Naudin",,,"",,"",,,,,,,,,,,,"Pavonia calyculosa A.St.-Hil. & Naudin","",,"GBIF"
"","UNESP-IBB","BOTUW","719","Pavonia calyculosa","","Malvaceae","Pavonia","calyculosa","","A.St.-Hil. & Naudin",,,"",,"",,,,,"Brazil","Espírito Santo",,"Comp. Vale do Rio Doce",-19.866667,-40.533333,,"Pavonia calyculosa A.St.-Hil. & Naudin","",,"GBIF"
"","MNHN","P","P06607764","Pavonia calyculosa","","Malvaceae","Pavonia","calyculosa","","A.St.-Hil. & Naudin",,,"",,"",,,,,,,,,,,,"Pavonia calyculosa A.St.-Hil. & Naudin","",,"GBIF"
"","MNHN","P","P06607765","Pavonia calyculosa","","Malvaceae","Pavonia","calyculosa","","A.St.-Hil. & Naudin",,,"",,"",,,,,,,,,,,,"Pavonia calyculosa A.St.-Hil. & Naudin","",,"GBIF"
"","K","Herbarium","K000535337","Pavonia calyculosa","","Malvaceae","Pavonia","calyculosa","","A.St.-Hil. & Naudin","Fryxell, P.",,"","2117","","Blanchet",,,,"Brazil",,,"Ilhios [Ilheos]",,,"Moricand  Herbarium Hookerianum 1867  Associated with K000535338","Pavonia calyculosa A.St.-Hil. & Naudin","",,"GBIF"
"","K","Herbarium","K000535338","Pavonia calyculosa","","Malvaceae","Pavonia","calyculosa","","A.St.-Hil. & Naudin",,,"","2117","","Blanchet",,,,"Brazil",,,"Ilheos",,,"Jlheos  Associated with K000535337","Pavonia calyculosa A.St.-Hil. & Naudin","",,"GBIF"
