"modified","institutionCode","collectionCode","catalogNumber","scientificName","identificationQualifier","family","genus","specificEpithet","infraspecificEpithet","scientificNameAuthorship","identifiedBy","dateIdentified","typeStatus","recordNumber","fieldNumber","recordedBy","year","month","day","country","stateProvince","municipality","locality","decimalLatitude","decimalLongitude","occurrenceRemarks","acceptedNameUsage","occurrenceID","comments","bibliographicCitation"
"","Cenargen","CEN","97457","Chomelia parviflora","","Rubiaceae","Chomelia","parviflora","","(Müll.Arg.) Müll.Arg.","P. Delprete",2016,"","5289","","Anderson Cássio Sevilha",2015,10,16,"Brazil","Ma","CAROLINA","Parque Nacional Chapada das Mesas. Sítio Buenos Aires.",-6.950555,-47.371388,,"Chomelia parviflora (Müll.Arg.) Müll.Arg.","",,"GBIF"
"","JBRJ","RB","RB01131587","Chomelia parviflora","","Rubiaceae","Chomelia","parviflora","","(Müll.Arg.) Müll.Arg.","M.C. Pessoa",2014,"","864","","M.C. Pessoa; G.D. Colletta; M.A.P. Ferreira; O. Rodrigues de Campos",2014,4,13,"Brazil","São Paulo","São Miguel Arcanjo","P.E. Carlos Botelho, trilha da represa.",,,,"Chomelia parviflora (Müll.Arg.) Müll.Arg.","",,"GBIF"
"","UEFS","HUEFS","179305","Chomelia parviflora","","Rubiaceae","Chomelia","parviflora","","(Müll.Arg.) Müll.Arg.","P.Delprete",2014,"","56528","","Harley, R.M.",2012,1,27,"Brazil","Maranhão","Sambaiba","Margem da estrada BR 230, 11 km da divisa do município em direção a São Raimundo das Mangabeiras.",-6.906389,-45.294444,"Cerrado.","Chomelia parviflora (Müll.Arg.) Müll.Arg.","",,"GBIF"
"","UFSCar","SORO","4471","Chomelia parviflora","","Rubiaceae","Chomelia","parviflora","","(Müll.Arg.) Müll.Arg.",,,"","36","","Grimaldi, M.C.; Caramez, M.B.",2012,12,16,"Brazil","São Paulo","São Miguel Arcanjo","Parque Estadual Carlos Botelho. Trilha do Braço",,,"Arbusto. 821m","Chomelia parviflora (Müll.Arg.) Müll.Arg.","",,"GBIF"
"","Cenargen","CEN","99726","Chomelia parviflora","","Rubiaceae","Chomelia","parviflora","","(Müll.Arg.) Müll.Arg.","P. Delprete",,"","14298","","Glocimar Pereira-Silva",2009,4,27,"Brazil","To","GOIATINS","Estrada aldeia indígena Krahó Santa Cruz - Itacajá, km 04. Área indígena Krahó.",-8.478611,-47.67,"Área de influência indireta.","Chomelia parviflora (Müll.Arg.) Müll.Arg.","",,"GBIF"
"","UnB","UB","142489","Chomelia parviflora","","Rubiaceae","Chomelia","parviflora","","(Müll.Arg.) Müll.Arg.","Delprete, PG",2010,"","10328","","Delprete, PG; Silva, JC",2007,9,19,"Brazil","Tocantins","Mateiros","Região do Jalapão. Região das dunas",-10.563889,-46.661111,"Folhas papiráceas, discolores. Frutos inicialmente brancos, passando a branco-esverdeado a vermelhos quase pretos.; Arbusto 0,5-1,3m, muito ramificado. Frutos carnosos.; Campo sujo dominado por gramíneas, com muitas ervas e pequenos arbustos. Solo de","Chomelia parviflora (Müll.Arg.) Müll.Arg.","",,"GBIF"
"","UnB","UB","142487","Chomelia parviflora","","Rubiaceae","Chomelia","parviflora","","(Müll.Arg.) Müll.Arg.","Delprete, PG",2010,"","10332B","","Delprete, PG; Silva, JC",2007,9,19,"Brazil","Tocantins","Mateiros","Região do Jalapão. Trilha entre a estrada e o Fervedouro",-10.373611,-46.518056,"Folhas papiráceas, discolores. Frutos passando de brancos a branco-esverdeados a quase pretos.; Arbusto de 0,5-1,3m, muito ramificado. Frutos carnosos.; Campo sujo, na beira da trilha. Solo de areia branca","Chomelia parviflora (Müll.Arg.) Müll.Arg.","",,"GBIF"
"","JBRJ","RB","RB00619373","Chomelia parviflora","","Rubiaceae","Chomelia","parviflora","","(Müll.Arg.) Müll.Arg.","P. G. Delprete",2010,"","10328","","P. G. Delprete; J. C. Silva",2007,9,19,"Brazil","Tocantins","Mateiros","Região do Jalapão. Região das dunas. .",-10.563889,-46.661111,"Arbustos de ca. 50-130 cm, muito ramificados. Folhas papiráceas, discolores. Frutos carnosos, inicialmente brancos, passando a branco-esverdeado a vermelhos quase pretos.","Chomelia parviflora (Müll.Arg.) Müll.Arg.","",,"GBIF"
"","JBRJ","RB","RB00619378","Chomelia parviflora","","Rubiaceae","Chomelia","parviflora","","(Müll.Arg.) Müll.Arg.","P. G. Delprete",2010,"","10332B","","P. G. Delprete; J. C. Silva",2007,9,19,"Brazil","Tocantins","Mateiros","Região do Jalapão. Trilha entre a estrada .",-10.373611,-46.518056,"Arbustos de ca. 50-130 cm, muito ramificados. Folhas papiráceas, discolores. Frutos carnosos, passando de brancos a branco-esverdeados a quase pretos.","Chomelia parviflora (Müll.Arg.) Müll.Arg.","",,"GBIF"
"","UFG","UFG","43382","Chomelia parviflora","","Rubiaceae","Chomelia","parviflora","","(Müll.Arg.) Müll.Arg.","Delprete, P.G.",2010,"","10332","","Delprete, P.G.; J.C. Silva",2007,9,19,"Brazil","Tocantins","Mateiros",,-10,-47,,"Chomelia parviflora (Müll.Arg.) Müll.Arg.","",,"GBIF"
"","UFG","UFG","43389","Chomelia parviflora","","Rubiaceae","Chomelia","parviflora","","(Müll.Arg.) Müll.Arg.","Delprete, P.G.",2010,"","10328","","Delprete, P.G.; J.C. Silva",2007,9,19,"Brazil","Tocantins","Mateiros",,-11,-47,,"Chomelia parviflora (Müll.Arg.) Müll.Arg.","",,"GBIF"
"","Universidade Federal do Ceará, UFC","EAC","48557","Chomelia parviflora","","Rubiaceae","Chomelia","parviflora","","(Müll.Arg.) Müll.Arg.","Delprete, P.G.",2011,"","4828","","Miranda, A.M.",2005,1,25,"Brazil","Piauí","Uruçuí","Faz. Boa Vista",,,"Arbusto, ca. 1,80m, caule marrom, folha membranácea, fruto imaturo verde.; Cerradão","Chomelia parviflora (Müll.Arg.) Müll.Arg.","",,"GBIF"
"","Universidade Federal Rural de Pernambuco","HST","13589","Chomelia parviflora","","Rubiaceae","Chomelia","parviflora","","(Müll.Arg.) Müll.Arg.","P.G.Delprete",2013,"","4829","","A.M.Miranda; et al.",2005,1,25,"Brazil","Piauí","Uruçuí","Fazenda Boa Vista",,,"Arbusto ca. 1,60 m alt.; caule amarronzado; folhas fracamente crassas; frutos imaturos verdes.","Chomelia parviflora (Müll.Arg.) Müll.Arg.","",,"GBIF"
"","Universidade Federal de Mato Grosso","CNMT","3434","Chomelia parviflora","","Rubiaceae","Chomelia","parviflora","","(Müll.Arg.) Müll.Arg.","Pereira, J.B.",2010,"",,"","Pereira-Silva, G.; Santos, A.A. ; Sinigalia. C. ; Guarino, E.S.G. ; Santos. J.R. ; Moreira. G. A. ; Pereira, J.B. ; Amaral, J.P.",2005,2,23,"Brazil","Tocantins","Aguiarnópolis","Margem direita do Rio Campo Alegre, próximo à foz.",-6.862778,-47.538889,"Área de influência direta (lago). Frutos imaturos verde vináceo. Relevo suave ondulado. Solo arenoso.Doação Embrapa - CENARGEM. Herbário CEN","Chomelia parviflora (Müll.Arg.) Müll.Arg.","",,"GBIF"
"","Cenargen","CEN","66727","Chomelia parviflora","","Rubiaceae","Chomelia","parviflora","","(Müll.Arg.) Müll.Arg.","P. Delprete",,"","9593","","Glocimar Pereira-Silva",2005,2,23,"Brazil","To","AGUIARNÓPOLIS","Margem direita do rio Campo Alegre, próximo à foz.",-6.862778,-47.538888,"Área de influência direta (lago).","Chomelia parviflora (Müll.Arg.) Müll.Arg.","",,"GBIF"
"","UFG","UFG","40966","Chomelia parviflora","","Rubiaceae","Chomelia","parviflora","","(Müll.Arg.) Müll.Arg.","Delprete, P.G.",2006,"","s.n.","","Delprete, P.G.; Lorenzi, H.; Lombardi, J. & Gonçalves, E.",2005,11,3,"Brazil","Tocantins","Miracema do Tocantins",,-10,-48,,"Chomelia parviflora (Müll.Arg.) Müll.Arg.","",,"GBIF"
"","UFG","UFG","40969","Chomelia parviflora","","Rubiaceae","Chomelia","parviflora","","(Müll.Arg.) Müll.Arg.","Delprete, P.G.",2006,"","s.n.","","Delprete, P.G.; Lorenzi, H.; Lombardi, J. & Gonçalves, E.",2005,11,3,"Brazil","Tocantins","Miracema do Tocantins",,-10,-48,,"Chomelia parviflora (Müll.Arg.) Müll.Arg.","",,"GBIF"
"","Jardim Botânico Plantarum","HPL","10951","Chomelia parviflora","","Rubiaceae","Chomelia","parviflora","","(Müll.Arg.) Müll.Arg.","P.G. Delprete",2006,"","9253","","P.G. Delprete, H. Lorenzi et al.",2005,11,3,"Brazil","To","Miracema do Tocantins","Coletado ca.. 3 km em direção de Lajeado (TO-070); em área de cerrado, com solo de areia branca. S 9° 35' 13""; W 48° 24' 32"" (230m.s.m.)",,,,"Chomelia parviflora (Müll.Arg.) Müll.Arg.","",,"GBIF"
"","Jardim Botânico Plantarum","HPL","10976","Chomelia parviflora","","Rubiaceae","Chomelia","parviflora","","(Müll.Arg.) Müll.Arg.","P.G. Delprete",2006,"","9250","","P.G. Delprete, H. Lorenzi et al.",2005,11,3,"Brazil","To","Miracema do Tocantins","Coletado ca.. 3 km em direção de Lajeado (TO-070); em área de cerrado, com solo de areia branca. S 9° 35' 13""; W 48° 24' 32"" (230m.s.m.)",,,,"Chomelia parviflora (Müll.Arg.) Müll.Arg.","",,"GBIF"
"","UnB","UB","112559","Chomelia parviflora","","Rubiaceae","Chomelia","parviflora","","(Müll.Arg.) Müll.Arg.","Delprete, PG",2006,"","9250","","Delprete, PG; et al.",2005,11,3,"Brazil","Tocantins","Miracema do Tocantins","3km em direção de Lajeado (TO-070)",-9.586944,-48.408889,"Ramos finos e delicados. Folhas cartáceas, finas.; Arbusto 0,4-0,7m. Fruto imaturo verde-claro.; Cerrado.","Chomelia parviflora (Müll.Arg.) Müll.Arg.","",,"GBIF"
"","K","Herbarium","K001194863","Chomelia parviflora","","Rubiaceae","Chomelia","parviflora","","(Müll.Arg.) Müll.Arg.",,,"","9250","","Lorenzi, H.",2005,11,3,"Brazil",,"Miracema do Tocantins","3 km em direção de Lageado (TO-070).",,,,"Chomelia parviflora (Müll.Arg.) Müll.Arg.","",,"GBIF"
"","NY","NY","1182951","Chomelia parviflora","","Rubiaceae","Chomelia","parviflora","","(Müll.Arg.) Müll.Arg.","P. G. Delprete",2006,"","9253","","P. G. Delprete",2005,11,3,"Brazil","Tocantins",,"3 km em direção de Lajeado (TO-070).",-9.5869,-48.4089,,"Chomelia parviflora (Müll.Arg.) Müll.Arg.","",,"GBIF"
"","NY","NY","1146618","Chomelia parviflora","","Rubiaceae","Chomelia","parviflora","","(Müll.Arg.) Müll.Arg.","P. G. Delprete",2006,"","9250","","P. G. Delprete",2005,11,2,"Brazil","Tocantins",,"3 km em direção de Lajeado (TO-070).",-9.5869,-48.4089,,"Chomelia parviflora (Müll.Arg.) Müll.Arg.","",,"GBIF"
"","K","Herbarium","K001212173","Chomelia parviflora","","Rubiaceae","Chomelia","parviflora","","(Müll.Arg.) Müll.Arg.",,,"","2177","","Mello-Silva, R.",2003,11,8,"Brazil",,"Tapiraí","Claros, sítio Palmira, próximo ao rio Claro e à igreja da Congregação Cristã.",,,,"Chomelia parviflora (Müll.Arg.) Müll.Arg.","",,"GBIF"
"","MPEG","HERBMG","MG169198","Chomelia parviflora","","Rubiaceae","Chomelia","parviflora","","(Müll.Arg.) Müll.Arg.",,,"",,"","Lobato, L.C.B.",2001,9,9,"Brazil","Pará",,"Conceição do Araguaia",,,,"Chomelia parviflora (Müll.Arg.) Müll.Arg.","",,"GBIF"
"","MPEG","HERBMG","MG164574","Chomelia parviflora","","Rubiaceae","Chomelia","parviflora","","(Müll.Arg.) Müll.Arg.",,,"",,"","Lobato, L.C.B.",2000,9,27,"Brazil","Pará",,"Conceição do Araguaia",,,,"Chomelia parviflora (Müll.Arg.) Müll.Arg.","",,"GBIF"
"","USP","SPF","153567","Chomelia parviflora","","Rubiaceae","Chomelia","parviflora","","(Müll.Arg.) Müll.Arg.","Anônimo",,"","2752","","Lobato, LCB",2000,9,27,"Brazil","Pará","Conceição do Araguaia",,,,,"Chomelia parviflora (Müll.Arg.) Müll.Arg.","",,"GBIF"
"","Instituto de Botânica","SP","359153","Chomelia parviflora","","Rubiaceae","Chomelia","parviflora","","(Müll.Arg.) Müll.Arg.",,,"","2752","","Lobato, LCB; Almeida, SS; Silva, ASL",2000,9,27,"Brazil","Pará","Conceição do Araguaia","Rio Araguaia, São José dos 3 Morros, mata sobre serra, solo pedregoso",,,,"Chomelia parviflora (Müll.Arg.) Müll.Arg.","",,"GBIF"
"","UFG","UFG","29836","Chomelia parviflora","","Rubiaceae","Chomelia","parviflora","","(Müll.Arg.) Müll.Arg.","Delprete, P.",2006,"","6432","","Árbocz, G.F.",1999,1,13,"Brazil","Tocantins","Porto Nacional",,-10,-48,,"Chomelia parviflora (Müll.Arg.) Müll.Arg.","",,"GBIF"
"","US","Botany","3372183","Chomelia parviflora","","Rubiaceae","Chomelia","parviflora","","(Müll.Arg.) Müll.Arg.",,,"","3522","","M. A.  Silva, F. R. Mendonca, F. C. A. Oliveira, D. Alvarenga & E. Cardoso",1997,11,8,"Brazil","Bahia",,"Municipio de Sao Desiderio, 34 km da vila Roda Velha em direcao a Estiva, antiga estrada de terra",-12.5622,-45.5739,,"Chomelia parviflora (Müll.Arg.) Müll.Arg.","",,"GBIF"
"","NY","NY","01096583","Chomelia parviflora","","Rubiaceae","Chomelia","parviflora","","(Müll.Arg.) Müll.Arg.","P. G. Delprete",,"","3522","","M. Aparecida da Silva",1997,11,8,"Brazil","Bahia",,"34km da vila Roda Velha em direçao a Estiva, antiga estrada de terra",-12.5511,-45.5739,,"Chomelia parviflora (Müll.Arg.) Müll.Arg.","",,"GBIF"
"","NY","NY","01096585","Chomelia parviflora","","Rubiaceae","Chomelia","parviflora","","(Müll.Arg.) Müll.Arg.","P. G. Delprete",,"","1023","","D. Alvarenga",1997,11,7,"Brazil","Bahia",,"Estrada de chao entre Roda Velha e Estiva",-12.7056,-39.7639,,"Chomelia parviflora (Müll.Arg.) Müll.Arg.","",,"GBIF"
"","NY","NY","01096584","Chomelia parviflora","","Rubiaceae","Chomelia","parviflora","","(Müll.Arg.) Müll.Arg.","P. G. Delprete",,"","3506","","M. Aparecida da Silva",1997,11,7,"Brazil","Bahia",,"02 km da vila Roda Velha em direçao a cidade, parte da estrada de terra depois do asfalto",-12.7056,-39.8139,,"Chomelia parviflora (Müll.Arg.) Müll.Arg.","",,"GBIF"
"","Cenargen","CEN","27868","Chomelia parviflora","","Rubiaceae","Chomelia","parviflora","","(Müll.Arg.) Müll.Arg.","P. Delprete",2008,"","3227","","Bruno Machado Teles Walter",1996,2,24,"Brazil","Ma","BALSAS","Reservas de cerrado entre plantios de soja. Ao sul da vila Kissy. Projeto BATAVO/CAMPO, lote 23.",-8.633333,-46.716666,"Planta coletada em locais com vegetação arbórea mais rala.","Chomelia parviflora (Müll.Arg.) Müll.Arg.","",,"GBIF"
"","Cenargen","CEN","30097","Chomelia parviflora","","Rubiaceae","Chomelia","parviflora","","(Müll.Arg.) Müll.Arg.","P. Delprete",2008,"","3413","","Glocimar Pereira-Silva",1996,3,7,"Brazil","Ma","BALSAS","Projeto de Balsas; Condominio Kissy; Lote 23.",,,,"Chomelia parviflora (Müll.Arg.) Müll.Arg.","",,"GBIF"
"","Cenargen","CEN","30147","Chomelia parviflora","","Rubiaceae","Chomelia","parviflora","","(Müll.Arg.) Müll.Arg.","P. Delprete",2008,"","3463","","Glocimar Pereira-Silva",1996,3,9,"Brazil","Ma","BALSAS","Projeto de Balsas; Condominio Kissy; Lote 23.",,,,"Chomelia parviflora (Müll.Arg.) Müll.Arg.","",,"GBIF"
"","UEFS","HUEFS","34590","Chomelia parviflora","","Rubiaceae","Chomelia","parviflora","","(Müll.Arg.) Müll.Arg.","M.C.Pessoa",2014,"","1061","","Funch, L.S.",1996,12,10,"Brazil","Bahia","Lençóis",,,,"""Capitinga"", vegetacão arbustiva em solo arenoso.","Chomelia parviflora (Müll.Arg.) Müll.Arg.","",,"GBIF"
"","K","Herbarium","K001212170","Chomelia parviflora","","Rubiaceae","Chomelia","parviflora","","(Müll.Arg.) Müll.Arg.","Pessôa, M.C.",,"","1061","","Funch, L.S.; Funch, R.",1996,12,10,"Brazil",,"Lençóis",,,,,"Chomelia parviflora (Müll.Arg.) Müll.Arg.","",,"GBIF"
"","JBRJ","RB","RB01132074","Chomelia parviflora","","Rubiaceae","Chomelia","parviflora","","(Müll.Arg.) Müll.Arg.","V.C. Souza",,"","963","","P.L.R. Moraes; H.C. Lima; D.S. Farias",1994,4,24,"Brazil","São Paulo","São Miguel Arcanjo","Parque Estadual Calos Botelho",,,,"Chomelia parviflora (Müll.Arg.) Müll.Arg.","",,"GBIF"
"","Instituto de Botânica","SP","487313","Chomelia parviflora","","Rubiaceae","Chomelia","parviflora","","(Müll.Arg.) Müll.Arg.","Barbosa, MRV",2007,"","VFF41","","Ferreira, VF; Sanches, CD; Bastos, EB; Gorenstein, MR; Hoffmann, JR",1994,9,6,"Brazil","São Paulo","Cananéia","Estrada Cananeia - Pariquera-Açú (via ponte), ca. 19 km de Cananéia, beira de mata",-24.900806,-47.84175,,"Chomelia parviflora (Müll.Arg.) Müll.Arg.","",,"GBIF"
"","UnB","UB","166746","Chomelia parviflora","","Rubiaceae","Chomelia","parviflora","","(Müll.Arg.) Müll.Arg.","Delprete, PG",2008,"","6756","","Ratter, JA; et al.",1993,7,7,"Brazil","Maranhão",,"Top of Serra de madeira, near Carolina",-7.183333,-47.433333,"Tree 3m.; In sparse cerrado on a steep rocky hillside","Chomelia parviflora (Müll.Arg.) Müll.Arg.","",,"GBIF"
"","K","Herbarium","K001194862","Chomelia parviflora","","Rubiaceae","Chomelia","parviflora","","(Müll.Arg.) Müll.Arg.",,,"","s.n.","","Ratter, J.A.",1993,7,4,"Brazil",,,"Top of Serra de Madeira, nr Carolina.",,,,"Chomelia parviflora (Müll.Arg.) Müll.Arg.","",,"GBIF"
"","Cenargen","CEN","18357","Chomelia parviflora","","Rubiaceae","Chomelia","parviflora","","(Müll.Arg.) Müll.Arg.","P. Delprete",2008,"","2152","","Bruno Machado Teles Walter",1993,10,23,"Brazil","Ba","CORRENTINA","Fazenda Jatobá, na grande ""Reserva"" da fazenda. Sudoeste do município, próximo à divisa GO/BR; Distante aproximadamente 40 km de Posse/GO.",,,"Grande ""reserva"" da fazenda. Minúsculas flores esverdeadas. Doação da Flora do Brasil.","Chomelia parviflora (Müll.Arg.) Müll.Arg.","",,"GBIF"
"","NY","NY","885329","Chomelia parviflora","","Rubiaceae","Chomelia","parviflora","","(Müll.Arg.) Müll.Arg.","P. G. Delprete",2006,"","2152","","B. M. T. Walter",1993,10,22,"Brazil","Bahia",,"Fazenda Jatobá. Sudoeste do municipio, próximo à divisa GO/BA; distante approx. 40 km de Posse/GO.",-13.3469726562973,-44.636953019445,,"Chomelia parviflora (Müll.Arg.) Müll.Arg.","",,"GBIF"
"","NY","NY","01096582","Chomelia parviflora","","Rubiaceae","Chomelia","parviflora","","(Müll.Arg.) Müll.Arg.","P. G. Delprete",,"","136","","A. V. Rezende",1991,1,9,"Brazil","Bahia",,"Fazenda Jatobá.Escribe lado oeste da reserva biológica entre eixão e eixinho.",,,,"Chomelia parviflora (Müll.Arg.) Müll.Arg.","",,"GBIF"
"","UnB","UB","166747","Chomelia parviflora","","Rubiaceae","Chomelia","parviflora","","(Müll.Arg.) Müll.Arg.","Delprete, PG",2008,"","241","","Viollati, LG; Machado, JWB; Eira, MTS",1991,3,4,"Brazil","Bahia",,"Fazenda Jatobá. Estrada da Fazenda Salgada",-13,-45.75,"Arbusto. Frutos verdes e com superfície superior vinho.; Cerrado-ss","Chomelia parviflora (Müll.Arg.) Müll.Arg.","",,"GBIF"
"","NY","NY","885330","Chomelia parviflora","","Rubiaceae","Chomelia","parviflora","","(Müll.Arg.) Müll.Arg.","P. G. Delprete",2005,"","241","","L. G. Viollati",1991,3,4,"Brazil","Bahia",,"Fazenda Jatobá. Estrada da Fazenda Salgada.",,,,"Chomelia parviflora (Müll.Arg.) Müll.Arg.","",,"GBIF"
"","UFMA","MAR","2899","Chomelia parviflora","","Rubiaceae","Chomelia","parviflora","","(Müll.Arg.) Müll.Arg.",,,"",,"","Ferreira, J. e N. Figueiredo",1988,8,27,"Brazil","Maranhão","São Luís","Reserva Florestal do Sacavém (Mata da CAEMA)",-2.567703,-44.262222,"Arbusto com mais ou menos 4m, flores brancas, beira da mata","Chomelia parviflora (Müll.Arg.) Müll.Arg.","",,"GBIF"
"","UFMA","MAR","2889","Chomelia parviflora","","Rubiaceae","Chomelia","parviflora","","(Müll.Arg.) Müll.Arg.",,,"",,"","J.R;D",1988,8,27,"Brazil","Maranhão","São Luís","Reserva Florestal do Sacavém (Mata da CAEMA)",-2.567703,-44.262222,,"Chomelia parviflora (Müll.Arg.) Müll.Arg.","",,"GBIF"
"","UnB","UB","166718","Chomelia parviflora","","Rubiaceae","Chomelia","parviflora","","(Müll.Arg.) Müll.Arg.",,,"","45297","","Hatschbach, G",1982,9,10,"Brazil","Paraná","São José dos Pinhais","Purgatório",,,"Arbusto 3m. Flor alva.; Mata pluvial encosta de pequeno morro","Chomelia parviflora (Müll.Arg.) Müll.Arg.","",,"GBIF"
"","Instituto Nacional de Pesquisas da Amazônia (INPA)","Coleção Botânica, Instituto Nacional de Pesquisas da Amazônia (INPA)","127778","Chomelia parviflora","","Rubiaceae","Chomelia","parviflora","","(Müll.Arg.) Müll.Arg.","Boom, B.M.",1985,"","1706","","Mike Hopkins",1981,12,5,"Brazil","Pará",,"Serra dos Carajás, 25-30 km NW of Serra Norte mining camp. Hilly scrub on ferrous rock outcrop.",-5.916667,-50.43,,"Chomelia parviflora (Müll.Arg.) Müll.Arg.","",,"GBIF"
"","K","Herbarium","K001194861","Chomelia parviflora","","Rubiaceae","Chomelia","parviflora","","(Müll.Arg.) Müll.Arg.",,,"","1706","","Daly, D.C.",1981,12,5,"Brazil",,,"Serra dos Carajás. 25-30 km NW of Serra Norte mining camp.",,,,"Chomelia parviflora (Müll.Arg.) Müll.Arg.","",,"GBIF"
"","MPEG","HERBMG","MG089693","Chomelia parviflora","","Rubiaceae","Chomelia","parviflora","","(Müll.Arg.) Müll.Arg.","Delprete, P.G.",,"",,"","Daly, D.C.",1981,12,5,"Brazil","Pará",,"Pará",-5.916667,-50.433333,,"Chomelia parviflora (Müll.Arg.) Müll.Arg.","",,"GBIF"
"","US","Botany","3265261","Chomelia parviflora","","Rubiaceae","Chomelia","parviflora","","(Müll.Arg.) Müll.Arg.",,,"","1706","","D. C. Daly, R. Callejas, M. G. Silva, E. L. Taylor & et al.",1981,12,5,"Brazil","Pará",,"Brazilian Amazonia, Serra dos Carajas, 25-30km NW of Serra Norte mining camp",-5.92,-50.43,,"Chomelia parviflora (Müll.Arg.) Müll.Arg.","",,"GBIF"
"","NY","NY","01060756","Chomelia parviflora","","Rubiaceae","Chomelia","parviflora","","(Müll.Arg.) Müll.Arg.","B. M. Boom",1985,"","1706","","D. C. Daly",1981,12,5,"Brazil","Pará",,"Serra dos Carajás, 25-30 km NW of Serra Norte mining camp. Hilly scrub on ferrous rock outcrop.",-5.916667,-50.433333,,"Chomelia parviflora (Müll.Arg.) Müll.Arg.","",,"GBIF"
"","Instituto Nacional de Pesquisas da Amazônia (INPA)","Coleção Botânica, Instituto Nacional de Pesquisas da Amazônia (INPA)","120014","Chomelia parviflora","","Rubiaceae","Chomelia","parviflora","","(Müll.Arg.) Müll.Arg.","Delprete, P.G.",2005,"","8561","","Mike Hopkins",1980,2,9,"Brazil","Pará",,"Range of hills ca. 20 km west of Redenção, near Corrego São João and Troncamento Santa Teresa.",-8.05,-50.17,,"Chomelia parviflora (Müll.Arg.) Müll.Arg.","",,"GBIF"
"","Instituto Nacional de Pesquisas da Amazônia (INPA)","Coleção Botânica, Instituto Nacional de Pesquisas da Amazônia (INPA)","120296","Chomelia parviflora","","Rubiaceae","Chomelia","parviflora","","(Müll.Arg.) Müll.Arg.","""Kirkbride Jr., J.H.; J.H.""",1981,"","9067","","Mike Hopkins",1980,2,24,"Brazil","Pará",,"Range of north-south lying hills about 10 km west of Conceição do Araguaia.",-8.266667,-49.37,,"Chomelia parviflora (Müll.Arg.) Müll.Arg.","",,"GBIF"
"","UnB","UB","193704","Chomelia parviflora","","Rubiaceae","Chomelia","parviflora","","(Müll.Arg.) Müll.Arg.","Kirkbride Junior, JH",1981,"","9067","","Plowman, TC; et al.",1980,2,24,"Brazil","Pará","Conceição do Araguaia","Range of north-souh lying hills about 10km west of Conceição do Araguaia",-8.266667,-49.366667,"Shrub 3m. Fruits green","Chomelia parviflora (Müll.Arg.) Müll.Arg.","",,"GBIF"
"","MPEG","HERBMG","MG079765","Chomelia parviflora","","Rubiaceae","Chomelia","parviflora","","(Müll.Arg.) Müll.Arg.","Delprete, P.G.",,"",,"","Plowman, T.",1980,2,9,"Brazil","Pará",,"Conceição do Araguaia",-8.05,-50.166667,,"Chomelia parviflora (Müll.Arg.) Müll.Arg.","",,"GBIF"
"","MPEG","HERBMG","MG080241","Chomelia parviflora","","Rubiaceae","Chomelia","parviflora","","(Müll.Arg.) Müll.Arg.","Kirkbride Jr., J.H.",,"",,"","Plowman, T.",1980,2,24,"Brazil","Pará",,"Conceição do Araguaia",-8.266667,-49.366667,,"Chomelia parviflora (Müll.Arg.) Müll.Arg.","",,"GBIF"
"","US","Botany","2978719","Chomelia parviflora","","Rubiaceae","Chomelia","parviflora","","(Müll.Arg.) Müll.Arg.",,,"","9067","","T. C. Plowman, G. Davidse, N. A. Rosa, C. S. Rosário & M. R. Santos",1980,2,24,"Brazil","Pará",,"Municipio Conceicao Do Araguaia: range of north-south lying hills about 10 km. west of Conceicao do Araguaia",-8.27,-49.37,,"Chomelia parviflora (Müll.Arg.) Müll.Arg.","",,"GBIF"
"","NY","NY","396619","Chomelia parviflora","","Rubiaceae","Chomelia","parviflora","","(Müll.Arg.) Müll.Arg.","J. H. Kirkbride Jr.",1981,"","9067","","T. C. Plowman",1980,2,24,"Brazil","Pará",,"Range of north-south lying hills about 10 km west of Conceiçao do Araguaia",-8.27,-49.37,,"Chomelia parviflora (Müll.Arg.) Müll.Arg.","",,"GBIF"
"","NY","NY","01060757","Chomelia parviflora","","Rubiaceae","Chomelia","parviflora","","(Müll.Arg.) Müll.Arg.","P. G. Delprete",2005,"","8561","","T. C. Plowman",1980,2,9,"Brazil","Pará",,"Range of hills ca. 20 km west of Redenção, near Corrego São João and Troncamento Santa Teresa.",-8.05,-50.166667,,"Chomelia parviflora (Müll.Arg.) Müll.Arg.","",,"GBIF"
"","NY","NY","396620","Chomelia parviflora","","Rubiaceae","Chomelia","parviflora","","(Müll.Arg.) Müll.Arg.","B. M. Boom",1981,"","13330","","S. A. Mori",1980,3,1,"Brazil","Bahia",,"BR 242, km 216, a 12 km ao N de lençois",-12.5669562453856,-41.3897405625552,,"Chomelia parviflora (Müll.Arg.) Müll.Arg.","",,"GBIF"
"","UnB","UB","166745","Chomelia parviflora","","Rubiaceae","Chomelia","parviflora","","(Müll.Arg.) Müll.Arg.","Delprete, PG",2008,"","42064","","Hatschbach, G",1979,3,11,"Brazil","Bahia","Barreiras","Rodovia BR-020. 50km L de Roda Velha",,,"Arbusto ramoso 1,5m. Frutos vinosos.; Cerrado","Chomelia parviflora (Müll.Arg.) Müll.Arg.","",,"GBIF"
"","US","Botany","3428914","Chomelia parviflora","","Rubiaceae","Chomelia","parviflora","","(Müll.Arg.) Müll.Arg.",,,"","42064","","G. Hatschbach",1979,3,11,"Brazil","Bahia",,"Rod. BR-020, 50km L de Roda Velha (Mun. Barreiras)",,,,"Chomelia parviflora (Müll.Arg.) Müll.Arg.","",,"GBIF"
"","IPA","IPA","32733","Chomelia parviflora","","Rubiaceae","Chomelia","parviflora","","(Müll.Arg.) Müll.Arg.","Kirkbride, J.H.",,"","19014","","Harley, R.M.",1977,2,24,"Brazil","Bahia",,"Serra do Açuruá, 1,5 km S of São Inácio on Gentio do Ouro road.",-11.116667,-42.733333,"Tree to 4m. Leaves rather bright green above, paler beneath. Fruit glossy reddish-black, soft.; Cerrado on shallow rocky soils.","Chomelia parviflora (Müll.Arg.) Müll.Arg.","",,"GBIF"
"","UnB","UB","166748","Chomelia parviflora","","Rubiaceae","Chomelia","parviflora","","(Müll.Arg.) Müll.Arg.","Delprete, PG",2008,"","19014","","Harley, RM; et al.",1977,2,24,"Brazil","Bahia",,"1,5km S of São Inácio on Gentio do Ouro road",-11.116667,-42.733333,"Tree 4m. Leaves rather bright green above, paler beneath. Fruit glossy reddish-black, soft.; Cerrado on shallow rocky soils","Chomelia parviflora (Müll.Arg.) Müll.Arg.","",,"GBIF"
