"modified","institutionCode","collectionCode","catalogNumber","scientificName","identificationQualifier","family","genus","specificEpithet","infraspecificEpithet","scientificNameAuthorship","identifiedBy","dateIdentified","typeStatus","recordNumber","fieldNumber","recordedBy","year","month","day","country","stateProvince","municipality","locality","decimalLatitude","decimalLongitude","occurrenceRemarks","acceptedNameUsage","occurrenceID","comments","bibliographicCitation"
"","Universidade Federal de Minas Gerais","BHCB","191180","Cyanocephalus lippioides","","Lamiaceae","Cyanocephalus","lippioides","","(Pohl ex Benth.) Harley & J.F.B.Pastore",,2018,"","971","","Quaresma, AS; Meyer, PB",2018,5,15,"Brazil","Minas Gerais","Nova Lima",,-20.114447,-43.96195,"Campo sujo","Cyanocephalus lippioides (Pohl ex Benth.) Harley & J.F.B.Pastore","",,"GBIF"
"","Universidade Federal de Minas Gerais","BHCB","181699","Cyanocephalus lippioides","","Lamiaceae","Cyanocephalus","lippioides","","(Pohl ex Benth.) Harley & J.F.B.Pastore",,,"","s.n.","","Brina, AE",2015,3,9,"Brazil","Minas Gerais","Itabirito",,-20.420056,-43.916944,"Subarbusto; Canga Nodular","Cyanocephalus lippioides (Pohl ex Benth.) Harley & J.F.B.Pastore","",,"GBIF"
"","Universidade Federal de Juiz de Fora","CESJ","66568","Cyanocephalus lippioides","","Lamiaceae","Cyanocephalus","lippioides","","(Pohl ex Benth.) Harley & J.F.B.Pastore","M.C.A. Mota",2015,"","35","","J.G.F. Mendonça; E. Landroz; F.A. Carvalho; J.H.C. Ribeiro; L.D. Santana",2015,5,25,"Brazil","MInas Gerais","Baependi","Parque Estadual da Serra do Papagaio, Chapadão",-22.131111,-44.721389,"Erva, 50cm. Campo de Altitude. Caule piloso, folha discolor e com cheiro, inflorescência arroxeada.","Cyanocephalus lippioides (Pohl ex Benth.) Harley & J.F.B.Pastore","",,"GBIF"
"","Universidade Federal de Juiz de Fora","CESJ","66587","Cyanocephalus lippioides","","Lamiaceae","Cyanocephalus","lippioides","","(Pohl ex Benth.) Harley & J.F.B.Pastore","M.C.A. Mota",2015,"","55","","J.G.F. Mendonça; T.O. Orsi; L.D. Santana; J.H.C. Ribeiro",2015,6,18,"Brazil","MInas Gerais","Baependi","Parque Estadual da Serra do Papagaio, Perto da Sede do PESP",-22.142081,-44.730644,"Erva, 60cm. Campo de Altitude. Folhas verde claro com tricomas brancos. Flores liláses com base da corola alva.","Cyanocephalus lippioides (Pohl ex Benth.) Harley & J.F.B.Pastore","",,"GBIF"
"","FZB-BH","BHZB","10880","Cyanocephalus lippioides","","Lamiaceae","Cyanocephalus","lippioides","","(Pohl ex Benth.) Harley & J.F.B.Pastore","Meyer, P.B.",2014,"","4638","","Rezende, S.G et al.",2014,7,2,"Brazil","Mg","Ouro Preto","Distrito de Miguel Burnier, Mina da Gerdau.",-20.44,-43.801944,"Doação de duplicata para herbário CTBS em julho de 2016","Cyanocephalus lippioides (Pohl ex Benth.) Harley & J.F.B.Pastore","",,"GBIF"
"","USP","SPF","209244","Cyanocephalus lippioides","","Lamiaceae","Cyanocephalus","lippioides","","(Pohl ex Benth.) Harley & J.F.B.Pastore","Antar, GM",2017,"","190","","Antar, GM; et al.",2013,6,21,"Brazil","Minas Gerais","Rio Vermelho","Serra do Ambrósio, Vargem do anjo, virando para Mato Virgem.",-18.144139,-43.03725,"Arbusto ca. 60 cm alt. Perianto arroxeado.; Campo rupestre. Solo arenoso seco.","Cyanocephalus lippioides (Pohl ex Benth.) Harley & J.F.B.Pastore","",,"GBIF"
"","UFV","VIC","43232","Cyanocephalus lippioides","","Lamiaceae","Cyanocephalus","lippioides","","(Pohl ex Benth.) Harley & J.F.B.Pastore",,,"","1980","","Simon, M.F.; et al.",2013,8,22,"Brazil","Minas Gerais","São Roque de Minas","Estrada vicinal a 10 km W da entrada para a Cachoeira Casca D'Anta. &nf;&nf;Alt.: 1174m &nf;Lat.: 20º18'54""&nf;Long.: 46º35""'15"" O",,,"Arbusto de 1 m, flores lilases.","Cyanocephalus lippioides (Pohl ex Benth.) Harley & J.F.B.Pastore","",,"GBIF"
"","Cenargen","CEN","86994","Cyanocephalus lippioides","","Lamiaceae","Cyanocephalus","lippioides","","(Pohl ex Benth.) Harley & J.F.B.Pastore","J. F. B. Pastore",2013,"","1980","","Marcelo Fragomeni Simon",2013,8,22,"Brazil","Mg","SAO ROQUE DE MINAS","Estrada vicinal a 10 km W da entrada para a Cachoeira Casca D'Anta.",-20.315,-46.5875,"Arbusto 1 m. Flores lilases.","Cyanocephalus lippioides (Pohl ex Benth.) Harley & J.F.B.Pastore","",,"GBIF"
"","S","VascularPlants","S14-44000","Cyanocephalus lippioides","","Lamiaceae","Cyanocephalus","lippioides","","(Pohl ex Benth.) Harley & J.F.B.Pastore",,,"","4282","","E. Emanuelsson",2012,10,18,"Brazil","Minas Gerais",,"Minas Gerais, Serra da Canastra.",,,,"Cyanocephalus lippioides (Pohl ex Benth.) Harley & J.F.B.Pastore","",,"GBIF"
"","UFSJ","HUFSJ","4327","Cyanocephalus lippioides","","Lamiaceae","Cyanocephalus","lippioides","","(Pohl ex Benth.) Harley & J.F.B.Pastore","Sobral, M",2012,"","15169","","Sobral, M",2012,11,19,"Brazil","Minas Gerais","Nazareno","BR-265",-21.253694,-44.53275,"Erva até 0,4 m; inflorescências purúreo-claras.","Cyanocephalus lippioides (Pohl ex Benth.) Harley & J.F.B.Pastore","",,"GBIF"
"","JBRJ","RB","RB00780535","Cyanocephalus lippioides","","Lamiaceae","Cyanocephalus","lippioides","","(Pohl ex Benth.) Harley & J.F.B.Pastore","M. Sobral",2012,"","15169","","M. Sobral",2012,11,19,"Brazil","Minas Gerais","Nazareno","BR-265.",-21.253611,-44.532778,"Erva até 0,4m; inflorescências purúreo-claras","Cyanocephalus lippioides (Pohl ex Benth.) Harley & J.F.B.Pastore","",,"GBIF"
"","Universidade Federal de Minas Gerais","BHCB","159763","Cyanocephalus lippioides","","Lamiaceae","Cyanocephalus","lippioides","","(Pohl ex Benth.) Harley & J.F.B.Pastore",,,"","5077","","Tameirão Neto, E; Mansur, T; Vidal, CV",2011,9,8,"Brazil","Minas Gerais","Brumadinho","Serra da Moeda",-20.097367,-43.992256,"Campo limpo, herbáceo","Cyanocephalus lippioides (Pohl ex Benth.) Harley & J.F.B.Pastore","",,"GBIF"
"","JBRJ","RB","RB00867435","Cyanocephalus lippioides","","Lamiaceae","Cyanocephalus","lippioides","","(Pohl ex Benth.) Harley & J.F.B.Pastore","E. Tameirão Neto",,"","5077","","E. Tameirão Neto; T. Mansur; C.V. Vidal",2011,9,8,"Brazil","Minas Gerais","Brumadinho","Serra da Moeda.",-20.0975,-43.992222,"Herbáceo","Cyanocephalus lippioides (Pohl ex Benth.) Harley & J.F.B.Pastore","",,"GBIF"
"","Universidade Federal de Minas Gerais","BHCB","145799","Cyanocephalus lippioides","","Lamiaceae","Cyanocephalus","lippioides","","(Pohl ex Benth.) Harley & J.F.B.Pastore",,2010,"","86","","Mansur, T; Tameirão Neto, E",2010,8,5,"Brazil","Minas Gerais","Rio Acima",,-20.038486,-44.277778,"Campo limpo","Cyanocephalus lippioides (Pohl ex Benth.) Harley & J.F.B.Pastore","",,"GBIF"
"","UFU","HUFU","55387","Cyanocephalus lippioides","","Lamiaceae","Cyanocephalus","lippioides","","(Pohl ex Benth.) Harley & J.F.B.Pastore",,,"","60","","Rocha, G.P.E.; Nogueira-Ferreira, F.H.; Ferrari, B.P.; Rufino, N.C.G. & Bartelli, B.F.",2009,6,18,"Brazil","Minas Gerais","Araguari","Fazenda Furna, trevo da rodovia BR-050, eixo Araguari-Caldas Novas.",-18.606389,-48.303611,"Área de influência indireta do rio Araguari. Cerrado s.s., tendendo para cerradão e mata estacional semi0decídua.","Cyanocephalus lippioides (Pohl ex Benth.) Harley & J.F.B.Pastore","",,"GBIF"
"","UFU","HUFU","55396","Cyanocephalus lippioides","","Lamiaceae","Cyanocephalus","lippioides","","(Pohl ex Benth.) Harley & J.F.B.Pastore",,,"","53","","Rocha, G.P.E.; Nogueira-Ferreira, F.H.; Ferrari, B.P.; Rufino, N.C.G. & Bartelli, B.F.",2009,6,18,"Brazil","Minas Gerais","Araguari","Fazenda Furna, trevo da rodovia BR-050, eixo Araguari-Caldas Novas.",-18.606389,-48.303611,"Herbácea, ca. 1,3 m alt. Ilflorescência globosa e brácteas finas.; Área de influência indireta do rio Araguari. Cerrado s.s., tendendo para cerradão e mata estacional semi0decídua.","Cyanocephalus lippioides (Pohl ex Benth.) Harley & J.F.B.Pastore","",,"GBIF"
"","FZB-BH","BHZB","7609","Cyanocephalus lippioides","","Lamiaceae","Cyanocephalus","lippioides","","(Pohl ex Benth.) Harley & J.F.B.Pastore","R. M. Harley",2015,"","50","","Mendes, M.S. et al.",2007,6,1,"Brazil","Mg","Mariana","Mina de Conta História",-20.265278,-43.527778,"BHCB 123857. Doada pela SETE Soluções Consultoria. Lat. 20° 15' 55'' S; Long. 43° 31' 40'' O; 990 1120m. Outro coletor: Brina, AE. & Neves, GS. Com duplicata.Anteriormente ni","Cyanocephalus lippioides (Pohl ex Benth.) Harley & J.F.B.Pastore","",,"GBIF"
"","Universidade Federal de Minas Gerais","BHCB","123857","Cyanocephalus lippioides","","Lamiaceae","Cyanocephalus","lippioides","","(Pohl ex Benth.) Harley & J.F.B.Pastore",,2017,"","50","","Mendes, MS; et al.",2007,6,,"Brazil","Minas Gerais","Mariana","Mina de conta história.",-20.265278,-43.527778,"Arbusto.; Campo ferruginoso.","Cyanocephalus lippioides (Pohl ex Benth.) Harley & J.F.B.Pastore","",,"GBIF"
"","Universidade Tecnológica Federal do Paraná","HCF","5502","Cyanocephalus lippioides","","Lamiaceae","Cyanocephalus","lippioides","","(Pohl ex Benth.) Harley & J.F.B.Pastore","J. Cordeiro & E. Barboza",2009,"","352","","A.R. Silva",2007,7,14,"Brazil","Mg","Boa Esperança","Serra da Boa Esperança",,,"arbusto ramificado ca. 0,30 m de altura, em meio a gramíneas. Flores roxas em área de cerrado.","Cyanocephalus lippioides (Pohl ex Benth.) Harley & J.F.B.Pastore","",,"GBIF"
"","Universidade Tecnológica Federal do Paraná","HCF","6166","Cyanocephalus lippioides","","Lamiaceae","Cyanocephalus","lippioides","","(Pohl ex Benth.) Harley & J.F.B.Pastore","J. Cordeiro & E. Barboza",2009,"","592","","A.R. Silva",2007,10,13,"Brazil","Mg","Boa Esperança","Fazenda Rancharia, BR 265, Km 2",-21.165028,-45.635472,"subarbusto ca. 0,90 m, heliófito, com flores roxas.","Cyanocephalus lippioides (Pohl ex Benth.) Harley & J.F.B.Pastore","",,"GBIF"
"","Universidade Tecnológica Federal do Paraná","HCF","4365","Cyanocephalus lippioides","","Lamiaceae","Cyanocephalus","lippioides","","(Pohl ex Benth.) Harley & J.F.B.Pastore","M.G. Caxambu",2009,"","445","","H.C.L. Geraldino",2006,7,30,"Brazil","Mg","Boa Esperança","Fazenda Rancharia, BR 265, Km 2",-21.16625,-45.638467,"Herbácea, ereta, heliófita, com flores azuis em inflorescências terminais. Cerrado.","Cyanocephalus lippioides (Pohl ex Benth.) Harley & J.F.B.Pastore","",,"GBIF"
"","MBM","MBM","407387","Cyanocephalus lippioides","","Lamiaceae","Cyanocephalus","lippioides","","(Pohl ex Benth.) Harley & J.F.B.Pastore","Caxambu, MG",2009,"","445","","Geraldino, HCL",2006,7,30,"Brazil","Minas Gerais","Boa Esperança","Fazenda Rancharia, BR 265, km 2.",-21.16625,-45.638467,"Herbácea, ereta, heliófita, com flores azuis em inflorescências terminais.; Cerrado; Solo: Argissolo; Relevo: ondulado.","Cyanocephalus lippioides (Pohl ex Benth.) Harley & J.F.B.Pastore","",,"GBIF"
"","UFU","HUFU","42346","Cyanocephalus lippioides","","Lamiaceae","Cyanocephalus","lippioides","","(Pohl ex Benth.) Harley & J.F.B.Pastore",,,"","s.n.","","Silva, P.S.; et al.",2005,5,2,"Brazil","Minas Gerais","Uberlândia","Reserva do Clube Caça e Pesca Itororó",,,"Arbusto, ca. 1,7 m. Caule e folhas pilosas com inflorescência em capítulos. Flore com corola arroxeada.; Cerrado.","Cyanocephalus lippioides (Pohl ex Benth.) Harley & J.F.B.Pastore","",,"GBIF"
"","UFU","HUFU","43843","Cyanocephalus lippioides","","Lamiaceae","Cyanocephalus","lippioides","","(Pohl ex Benth.) Harley & J.F.B.Pastore","Melo, K.B.S.",2007,"","4174","","Nakajima, J.N.; Romero, R.; Castro, W.S.; Melo, K.B.S. & Bernardes, P.H.N.",2005,12,9,"Brazil","Minas Gerais",,"Região da Represa de Furnas., Morro em frente a Pousada do Rio Turvo.",,,"Subarbusto, ca. 0,8 m. Cálice verde, corola alva.; Campo rupestre.","Cyanocephalus lippioides (Pohl ex Benth.) Harley & J.F.B.Pastore","",,"GBIF"
"","UFU","HUFU","36838","Cyanocephalus lippioides","","Lamiaceae","Cyanocephalus","lippioides","","(Pohl ex Benth.) Harley & J.F.B.Pastore","Pacheco, R.A.",2004,"","925","","Amorim, E.H.; Hattori, E.K.O. & Barbosa, J.M.",2004,5,1,"Brazil","Minas Gerais","Perdizes","Galheiros, Penísula.",,,"Subarbusto, ca. 1 m. Brácteas roxas, corola alva e roxa.","Cyanocephalus lippioides (Pohl ex Benth.) Harley & J.F.B.Pastore","",,"GBIF"
"","UFU","HUFU","36852","Cyanocephalus lippioides","","Lamiaceae","Cyanocephalus","lippioides","","(Pohl ex Benth.) Harley & J.F.B.Pastore","Pacheco, R.A.",2004,"","982","","Amorim, E.H.; Hattori, E.K.O. & Barbosa, J.M.",2004,5,1,"Brazil","Minas Gerais","Perdizes","Galheiros, Céu do cavalo.",,,"Subarbusto, ca. 0,5 m. Brácteas marrons, corola lilás.","Cyanocephalus lippioides (Pohl ex Benth.) Harley & J.F.B.Pastore","",,"GBIF"
"","S","VascularPlants","S15-31088","Cyanocephalus lippioides","","Lamiaceae","Cyanocephalus","lippioides","","(Pohl ex Benth.) Harley & J.F.B.Pastore",,,"","925","","E. H. Amorim, E. K. O. Hattori & J. M. Barbosa",2004,5,1,"Brazil","Minas Gerais",,"Procedência: Península., EPDA. Galheiro, mun. Perdizes, Minas GErias, Brasil.",,,,"Cyanocephalus lippioides (Pohl ex Benth.) Harley & J.F.B.Pastore","",,"GBIF"
"","UFU","HUFU","33929","Cyanocephalus lippioides","","Lamiaceae","Cyanocephalus","lippioides","","(Pohl ex Benth.) Harley & J.F.B.Pastore",,,"","838","","Mendes, S.; Arruda, R.; Amorim, E.H. & Araújo, G.M.",2003,5,10,"Brazil","Minas Gerais","Perdizes","Estação Ambiental Galheiro, EPDA - Galheiro, Macega.",,,"Herbáceo ca. de 0,4 m. Capítulos lilás.; Cerrado.","Cyanocephalus lippioides (Pohl ex Benth.) Harley & J.F.B.Pastore","",,"GBIF"
"","UFU","HUFU","33961","Cyanocephalus lippioides","","Lamiaceae","Cyanocephalus","lippioides","","(Pohl ex Benth.) Harley & J.F.B.Pastore","Pacheco, R.A.",2004,"","727","","Mendes, S.; Arruda, R.; Amorim, E.H. & Araújo, G.M.",2003,5,9,"Brazil","Minas Gerais","Perdizes","Galheiros, Céu do cavalo.",,,"Subarbusto, ca. 0,5 m. Capítulos roxos.; Cerrado.","Cyanocephalus lippioides (Pohl ex Benth.) Harley & J.F.B.Pastore","",,"GBIF"
"","UFU","HUFU","33992","Cyanocephalus lippioides","","Lamiaceae","Cyanocephalus","lippioides","","(Pohl ex Benth.) Harley & J.F.B.Pastore",,,"","898","","Mendes, S.; Arruda, R.; Amorim, E.H. & Araújo, G.M.",2003,5,10,"Brazil","Minas Gerais","Perdizes","Galheiros, Gerônimo.",,,"Herbáceo, ca. 0,8 m. Capítulos lilás.; Cerrado.","Cyanocephalus lippioides (Pohl ex Benth.) Harley & J.F.B.Pastore","",,"GBIF"
"","UFU","HUFU","36177","Cyanocephalus lippioides","","Lamiaceae","Cyanocephalus","lippioides","","(Pohl ex Benth.) Harley & J.F.B.Pastore",,,"","385","","Alves, A.S.S.; Alves, A.A.",2003,5,31,"Brazil","Minas Gerais","Lagamar","Reserva Vagetal da Companhia Mineira de Metais",,,"Subarbusto, ca. 0,4 m. Flor lilás.; Cerrado Sentido Restrito-típico.","Cyanocephalus lippioides (Pohl ex Benth.) Harley & J.F.B.Pastore","",,"GBIF"
"","UFU","HUFU","35274","Cyanocephalus lippioides","","Lamiaceae","Cyanocephalus","lippioides","","(Pohl ex Benth.) Harley & J.F.B.Pastore","Fleury-Silva, H.R.",2003,"","05","","Menezes, C.; Cunha, F.L.R. & Perim, M.A.A.",2003,5,30,"Brazil","Minas Gerais","Uberlândia","Parque Municipal Victório Siquerolli",,,"Subarbusto, ca. 0,5 m. Cálice arroxeado, corola lilás, antera amarela, filete roxo e bráctea verde.; Borda de cerradão.","Cyanocephalus lippioides (Pohl ex Benth.) Harley & J.F.B.Pastore","",,"GBIF"
"","UFU","HUFU","35273","Cyanocephalus lippioides","","Lamiaceae","Cyanocephalus","lippioides","","(Pohl ex Benth.) Harley & J.F.B.Pastore","Fleury-Silva, H.R.",2003,"","3","","Manfiolli, A.O.; Jogo, D.A.",2003,6,6,"Brazil","Minas Gerais","Uberlândia","Parque Municipal Victório Siquerolli",,,"Herbáceo, ca. 0,5 m. Cálice verde e vinho, corola lilás e estilete e antera lilás.; Cerrado alterado.","Cyanocephalus lippioides (Pohl ex Benth.) Harley & J.F.B.Pastore","",,"GBIF"
"","FZB-BH","BHZB","3743","Cyanocephalus lippioides","","Lamiaceae","Cyanocephalus","lippioides","","(Pohl ex Benth.) Harley & J.F.B.Pastore","R.M,Harley",2015,"",,"","Fernandes, M.G.C.",2003,7,15,"Brazil","Mg","Congonhas",,,,"Altitude 1700m. Doação de duplicata para Herbário HUEFS , Maio 2019","Cyanocephalus lippioides (Pohl ex Benth.) Harley & J.F.B.Pastore","",,"GBIF"
"","UFU","HUFU","34017","Cyanocephalus lippioides","","Lamiaceae","Cyanocephalus","lippioides","","(Pohl ex Benth.) Harley & J.F.B.Pastore",,,"","923","","Mendes, S.; Araújo, G.M.",2003,7,4,"Brazil","Minas Gerais","Perdizes","Galheiros, Céu do cavalo.",,,"Herbácea, ca. 0,4 m. Brácteas involucrais verdes e capítulos lilás.; Cerrado.","Cyanocephalus lippioides (Pohl ex Benth.) Harley & J.F.B.Pastore","",,"GBIF"
"","Escola Superior de Agricultura Luiz de Queiroz, ESALQ","ESA","122288","Cyanocephalus lippioides","","Lamiaceae","Cyanocephalus","lippioides","","(Pohl ex Benth.) Harley & J.F.B.Pastore",,,"","584","","Vincent, R.C.; Viana, P.L.; Sobral, M.",2003,7,31,"Brazil","Minas Gerais","Nova Lima","Sa. da Calçada/Retiro das Pedras",,,"Campo rupestre quartzítico nodular","Cyanocephalus lippioides (Pohl ex Benth.) Harley & J.F.B.Pastore","",,"GBIF"
"","UEFS","HUEFS","251813","Cyanocephalus lippioides","","Lamiaceae","Cyanocephalus","lippioides","","(Pohl ex Benth.) Harley & J.F.B.Pastore",,,"","BHZB3743","","Fernandes, M.G.C.",2003,7,15,"Brazil","Minas Gerais","Congonhas",,,,"Campo rupestre.","Cyanocephalus lippioides (Pohl ex Benth.) Harley & J.F.B.Pastore","",,"GBIF"
"","FZB-BH","BHZB","2225","Cyanocephalus lippioides","","Lamiaceae","Cyanocephalus","lippioides","","(Pohl ex Benth.) Harley & J.F.B.Pastore","R. M. Harley",2015,"",,"","Rezende, S.G. & Werneck, M.",2003,12,1,"Brazil","Mg","Nova Lima","Vale Cristais",,,"Anteriormente identificada como Hyptis lippioides. COM DUPLICATA","Cyanocephalus lippioides (Pohl ex Benth.) Harley & J.F.B.Pastore","",,"GBIF"
"","UFU","HUFU","27205","Cyanocephalus lippioides","","Lamiaceae","Cyanocephalus","lippioides","","(Pohl ex Benth.) Harley & J.F.B.Pastore",,,"","41","","Mendes, S.; Amorin, E.H.; Nakajima, J.N. & Arruda, R.",2002,5,18,"Brazil","Minas Gerais","Perdizes","Galheiros, Trilha dos Primatas.",,,"Herbáceo, ca. 0,8 m. Brácteas involucrais verdes e papilho lilás.; Cerrado.","Cyanocephalus lippioides (Pohl ex Benth.) Harley & J.F.B.Pastore","",,"GBIF"
"","UFU","HUFU","27258","Cyanocephalus lippioides","","Lamiaceae","Cyanocephalus","lippioides","","(Pohl ex Benth.) Harley & J.F.B.Pastore",,,"","02","","Amorin, E.H.; Mendes, S.; Nakajima, J.N. & Arruda, R.",2002,5,16,"Brazil","Minas Gerais","Perdizes","Galheiros, Estrada para Gerônimo.",,,"Herbáceo, ca. 0,8 m. Inflorescência lilás, cálice verde e antera amarela.; Cerrado rupestre.","Cyanocephalus lippioides (Pohl ex Benth.) Harley & J.F.B.Pastore","",,"GBIF"
"","MBM","MBM","304297","Cyanocephalus lippioides","","Lamiaceae","Cyanocephalus","lippioides","","(Pohl ex Benth.) Harley & J.F.B.Pastore",,,"","109","","Sá, KLVR de",2002,5,13,"Brazil","Paraná","São Jerônimo da Serra","Reserva Indígena São Jerônimo",,,,"Cyanocephalus lippioides (Pohl ex Benth.) Harley & J.F.B.Pastore","",,"GBIF"
"","Escola Superior de Agricultura Luiz de Queiroz, ESALQ","ESA","103530","Cyanocephalus lippioides","","Lamiaceae","Cyanocephalus","lippioides","","(Pohl ex Benth.) Harley & J.F.B.Pastore",,,"","2","","Amorim, E.H.",2002,5,16,"Brazil","Minas Gerais","Perdizes",,,,,"Cyanocephalus lippioides (Pohl ex Benth.) Harley & J.F.B.Pastore","",,"GBIF"
"","UFU","HUFU","28096","Cyanocephalus lippioides","","Lamiaceae","Cyanocephalus","lippioides","","(Pohl ex Benth.) Harley & J.F.B.Pastore",,,"","119","","Amorim, E.H.; Mendes, S.; Nakajima, J.N. & Arruda, R.",2002,6,27,"Brazil","Minas Gerais","Perdizes","Galheiros, Próximo ao Alojamento, Estação Ambiental Galheiro.",-19.219722,-47.153056,"Herbácea, ca. 0,5 m. Cálice de verde a vinho, corola roxa.; Cerrado rupestre.","Cyanocephalus lippioides (Pohl ex Benth.) Harley & J.F.B.Pastore","",,"GBIF"
"","UFV","VIC","041328","Cyanocephalus lippioides","","Lamiaceae","Cyanocephalus","lippioides","","(Pohl ex Benth.) Harley & J.F.B.Pastore",,,"","75","","de Paula, C.C.; et al.",2002,6,9,"Brazil","Minas Gerais","Ouro Branco","Serra de Ouro Branco, Área 2.",,,"Terrestre, floresta de galeria,subarbusto de 0,80 m, freguência de 5 individuos em raio de cerca de 5 m, folhas verde escuro, séplas vinho com pêlo esbranquiçado, pêlo esbranquiçado,pétalas brancas de ápice róseo, ocorre em área degrad","Cyanocephalus lippioides (Pohl ex Benth.) Harley & J.F.B.Pastore","",,"GBIF"
"","UFV","VIC","041319","Cyanocephalus lippioides","","Lamiaceae","Cyanocephalus","lippioides","","(Pohl ex Benth.) Harley & J.F.B.Pastore",,,"","98","","de Paula, C.C.; et al.",2002,6,21,"Brazil","Minas Gerais","Ouro Branco","Serra de Ouro Branco, Área 2.",,,,"Cyanocephalus lippioides (Pohl ex Benth.) Harley & J.F.B.Pastore","",,"GBIF"
"","Escola Superior de Agricultura Luiz de Queiroz, ESALQ","ESA","122256","Cyanocephalus lippioides","","Lamiaceae","Cyanocephalus","lippioides","","(Pohl ex Benth.) Harley & J.F.B.Pastore",,,"","537","","Vincent, R.C.",2002,6,5,"Brazil","Minas Gerais","Nova Lima","Sa. da Calçada/Retiro das Pedras",,,"Campo rupestre quartzítico nodular","Cyanocephalus lippioides (Pohl ex Benth.) Harley & J.F.B.Pastore","",,"GBIF"
"","FZB-BH","BHZB","3397","Cyanocephalus lippioides","","Lamiaceae","Cyanocephalus","lippioides","","(Pohl ex Benth.) Harley & J.F.B.Pastore","R. M. Harley",2015,"","1199","","Fernandes, M.G.C.",2001,7,26,"Brazil","Mg","Ouro Preto","Estação Ecológica do Tripuí",,,"Frequente no campo.Anteriormente identiificada como Hyptis sp.","Cyanocephalus lippioides (Pohl ex Benth.) Harley & J.F.B.Pastore","",,"GBIF"
"","Universidade Federal de Minas Gerais","BHCB","75457","Cyanocephalus lippioides","","Lamiaceae","Cyanocephalus","lippioides","","(Pohl ex Benth.) Harley & J.F.B.Pastore",,,"","80","","Viana, PL",2001,7,3,"Brazil","Minas Gerais","Brumadinho","Retiro das Pedras",,,"Arbusto 1,5 m.","Cyanocephalus lippioides (Pohl ex Benth.) Harley & J.F.B.Pastore","",,"GBIF"
"","Universidade Federal de Minas Gerais","BHCB","75594","Cyanocephalus lippioides","","Lamiaceae","Cyanocephalus","lippioides","","(Pohl ex Benth.) Harley & J.F.B.Pastore",,,"","150","","Viana, PL",2001,8,20,"Brazil","Minas Gerais","Brumadinho","Retiro das Pedras",,,"Arbusto","Cyanocephalus lippioides (Pohl ex Benth.) Harley & J.F.B.Pastore","",,"GBIF"
"","UFU","HUFU","22971","Cyanocephalus lippioides","","Lamiaceae","Cyanocephalus","lippioides","","(Pohl ex Benth.) Harley & J.F.B.Pastore",,,"","s.n","","Araújo, G.M.; Coelho, C.",2000,5,12,"Brazil","Minas Gerais","Uberlândia","Estrada para Campo Florido, Vereda situada próximo a estrada para Campo Florido a 20Km do centro de Uberlândia. Borda da vereda, lado direito.",,,"Flor roxa clara.; Vereda.","Cyanocephalus lippioides (Pohl ex Benth.) Harley & J.F.B.Pastore","",,"GBIF"
"","Escola Superior de Agricultura Luiz de Queiroz, ESALQ","ESA","122067","Cyanocephalus lippioides","","Lamiaceae","Cyanocephalus","lippioides","","(Pohl ex Benth.) Harley & J.F.B.Pastore",,,"","155","","Vincent, R.C.",2000,6,28,"Brazil","Minas Gerais","Nova Lima","Sa. do Rola-Moça",,,"Campo sobre canga hematítica nodular","Cyanocephalus lippioides (Pohl ex Benth.) Harley & J.F.B.Pastore","",,"GBIF"
"","UEFS","HUEFS","35957","Cyanocephalus lippioides","","Lamiaceae","Cyanocephalus","lippioides","","(Pohl ex Benth.) Harley & J.F.B.Pastore",,,"","1","","Silveira, V.M.",1998,5,16,"Brazil","Minas Gerais","Brumadinho","Serra da Moeda",-20.1,-43.983333,,"Cyanocephalus lippioides (Pohl ex Benth.) Harley & J.F.B.Pastore","",,"GBIF"
"","Universidade Federal de Minas Gerais","BHCB","43066","Cyanocephalus lippioides","","Lamiaceae","Cyanocephalus","lippioides","","(Pohl ex Benth.) Harley & J.F.B.Pastore",,2017,"","218","","Sousa, G",1998,7,31,"Brazil","Minas Gerais","Belo Horizonte","Copasa-barreiro.",,,"Flores rosa. Herbácea 40 cm,.; Margem da mata.","Cyanocephalus lippioides (Pohl ex Benth.) Harley & J.F.B.Pastore","",,"GBIF"
"","USP","SPF","132941","Cyanocephalus lippioides","","Lamiaceae","Cyanocephalus","lippioides","","(Pohl ex Benth.) Harley & J.F.B.Pastore","Silva-Luz, CL",2015,"","671","","Rapini, A",1998,8,16,"Brazil","Minas Gerais","Ouro Branco","Serra do Ouro Branco",-20.505278,-40.633889,,"Cyanocephalus lippioides (Pohl ex Benth.) Harley & J.F.B.Pastore","",,"GBIF"
"","UEFS","HUEFS","35946","Cyanocephalus lippioides","","Lamiaceae","Cyanocephalus","lippioides","","(Pohl ex Benth.) Harley & J.F.B.Pastore",,,"","1836","","Lombardi, J.A.",1997,7,13,"Brazil","Minas Gerais","São Roque de Minas","Parque Nacional da Serra Canastra.",-20.171389,-46.664444,"Campo limpo.","Cyanocephalus lippioides (Pohl ex Benth.) Harley & J.F.B.Pastore","",,"GBIF"
"","UEFS","HUEFS","35913","Cyanocephalus lippioides","","Lamiaceae","Cyanocephalus","lippioides","","(Pohl ex Benth.) Harley & J.F.B.Pastore",,,"","7","","Barros, A.",1997,8,12,"Brazil","Minas Gerais","Brumadinho","Retiro das Pedras.",-20.093056,-43.983611,"Campo: 1.","Cyanocephalus lippioides (Pohl ex Benth.) Harley & J.F.B.Pastore","",,"GBIF"
"","UEFS","HUEFS","49662","Cyanocephalus lippioides","","Lamiaceae","Cyanocephalus","lippioides","","(Pohl ex Benth.) Harley & J.F.B.Pastore","R.M.Harley",2001,"","7","","Barros, A.",1997,8,12,"Brazil","Minas Gerais","Brumadinho","Retiro das Pedras.",-20.083333,-43.983333,"Campo.","Cyanocephalus lippioides (Pohl ex Benth.) Harley & J.F.B.Pastore","",,"GBIF"
"","MN","R","231477","Cyanocephalus lippioides","","Lamiaceae","Cyanocephalus","lippioides","","(Pohl ex Benth.) Harley & J.F.B.Pastore","Harley, R.M.",,"","5622","","Alves, R.J.V.",1996,7,9,"Brazil","Minas Gerais","Carrancas",,,,,"Cyanocephalus lippioides (Pohl ex Benth.) Harley & J.F.B.Pastore","",,"GBIF"
