"modified","institutionCode","collectionCode","catalogNumber","scientificName","identificationQualifier","family","genus","specificEpithet","infraspecificEpithet","scientificNameAuthorship","identifiedBy","dateIdentified","typeStatus","recordNumber","fieldNumber","recordedBy","year","month","day","country","stateProvince","municipality","locality","decimalLatitude","decimalLongitude","occurrenceRemarks","acceptedNameUsage","occurrenceID","comments","bibliographicCitation"
"","MBML","MBML-HERBARIO","53137","Macrocarpaea glaziovii","","Gentianaceae","Macrocarpaea","glaziovii","","Gilg","Fraga/2018",,"","632","","F. Z. Saiter; D.S. Sylva, J.M. Rodrigues",2017,10,15,"Brazil","Espírito Santo","Cariacica","Alto Roda D#?#Água, estrada que margeia a REBIO Duas Bocas.",-20.3125,-40.493056,"Arbusto com 2 m de altura com flores amarelo-esverdeadas.","Macrocarpaea glaziovii Gilg","",,"GBIF"
"","JBRJ","RB","RB01162870","Macrocarpaea glaziovii","","Gentianaceae","Macrocarpaea","glaziovii","","Gilg","Elsie F. Guimarães & T. S. Mendes",2016,"","905","","P. Rosa; C. Baez, T. Lima, D. Maurenza, R. Negrão, L. Moraes, M. Moraes, G. Overney",2016,8,8,"Brazil","Rio de Janeiro","Silva Jardim","Serra de Macaé de Cima, localidade de Macaé de Cima, início da trilha do vale do rio das Flores para a cumeada das velutinas. Mata nebular, em direção ao pico da velutina. APA Macaé de Cima",-22.436389,-42.505,"Terrícola, beira da picada para o pico da velutina. Caule verde, folhas discolores verdes. Flores com cálice verde-claro, pétalas alvas.","Macrocarpaea glaziovii Gilg","",,"GBIF"
"","JBRJ","RB","RB01174622","Macrocarpaea glaziovii","","Gentianaceae","Macrocarpaea","glaziovii","","Gilg","E.F. Guimarães",2016,"","19400","","G.Martinelli; D.Maurenza, R.Negrão,M.Moraes",2016,8,10,"Brazil","Rio de Janeiro","Nova Friburgo","Macaé de Cima, nascente do Rio das Flores, acima do Sítio Sophronitis. mata atlântica de altitude. APA de Macaé de Cima",-22.435833,-42.524722,"arbusto, 1,40m, ciófila; folhas verdes, concolores; flores em botões de cor verde-claro; frutos imaturos de cor verde, quando maduros de cor castanho.","Macrocarpaea glaziovii Gilg","",,"GBIF"
"","JBRJ","RB","RB01200231","Macrocarpaea glaziovii","","Gentianaceae","Macrocarpaea","glaziovii","","Gilg","H.C. de Lima",,"","8451","","Haroldo C. de Lima; J.M.A. Braga, L.J.T. Cardoso, C. de Carvalho & W. da Silva",2016,11,3,"Brazil","Rio de Janeiro","Petrópolis","Estrada do Imperador, próximo a Vargem Grande. Mata de altitude. Reserva Biológica do Tinguá",-22.482778,-43.267778,"Arbusto com 1,5 m alt. Inflorescências com ramos opostos-cruzados, flores com cálice verde e corola alvo-esverdeada. Ocasional em locais úmidos.","Macrocarpaea glaziovii Gilg","",,"GBIF"
"","Pontifícia Universidade Católica do Rio de Janeiro","FCAB","7573","Macrocarpaea glaziovii","","Gentianaceae","Macrocarpaea","glaziovii","","Gilg","H.C. de Lima",2016,"","8451","","Haroldo C. de Lima; J.M.A. Braga; L.J.T. Cardoso; C. de Carvalho; W. da Silva",2016,11,3,"Brazil","Rio de Janeiro","Petropólis","Reserva Biológica do Tinguá., Estrada do Imperador, próximo a Vargem Grande.",-22.482778,-43.277778,"Arbusto com 1,5 m alt. inflorescências com ramos opostos-cruzados, flores com cálice verde e corola alvo-esverdeada. Ocasional em locais úmidos.; Mata de altitude.","Macrocarpaea glaziovii Gilg","",,"GBIF"
"","JBRJ","RB","RB00871942","Macrocarpaea glaziovii","","Gentianaceae","Macrocarpaea","glaziovii","","Gilg","C.N.Fraga (via foto)",2014,"","1513","","M. S. Wängler; V. S. Ferreira, E.L. Jacques, C.F.de Andrade & J.F.C.Santos",2014,3,13,"Brazil","Rio de Janeiro","Miguel Pereira","Estrada do Imperador. Na beira da estrada. REBIO Tinguá",-22.486389,-43.305278,"Frutos castanhos","Macrocarpaea glaziovii Gilg","",,"GBIF"
"","JBRJ","RB","RB00904941","Macrocarpaea glaziovii","","Gentianaceae","Macrocarpaea","glaziovii","","Gilg","M. M. Saavedra",2014,"","s/n","","Scarponi, T. M.; Nascimento, L. S.;  Ammon, R. A. & Hottz, D.",2014,8,13,"Brazil","Rio de Janeiro","Nova Friburgo","Conglomerado 14-2-10-68-R. UTM E(768691m) N(7519456m). Fuso do GPS (23K).",,,"Arbusto com 1,6 metros de altura, base reta. Flor branca.","Macrocarpaea glaziovii Gilg","",,"GBIF"
"","UFES","VIES","34075","Macrocarpaea glaziovii","","Gentianaceae","Macrocarpaea","glaziovii","","Gilg","Zorzanelli, J.P.F.",2015,"","823","","Zorzanelli, J.P.F.; Silva, A.E. & Pinto-Junior, H.V.",2013,9,14,"Brazil","Espírito Santo","Ibitirama","Parque Nacional do Caparaó.",,,,"Macrocarpaea glaziovii Gilg","",,"GBIF"
"","UFES","VIES","30204","Macrocarpaea glaziovii","","Gentianaceae","Macrocarpaea","glaziovii","","Gilg","Zorzanelli, J.P.F.",2012,"","83","","Zorzanelli, J.P.F.; Carvalho Filho, J.H.",2011,8,26,"Brazil","Espírito Santo","Iúna","Serra do Valentim.",,,,"Macrocarpaea glaziovii Gilg","",,"GBIF"
"","JBRJ","RB","RB00915704","Macrocarpaea glaziovii","","Gentianaceae","Macrocarpaea","glaziovii","","Gilg","E.F. Guimarães",,"","681","","R. de O. Perdiz; L.C. Gomes; L. Daneu; G. Carvalho",2010,5,22,"Brazil","Bahia","Barro Preto","Serra da Pedra Lascada.",-14.770833,-39.536111,"Arvoreta 6m de altura. Flores em botão. Em clareira. Mesma espécie do invíduo RP 692, este um arbusto","Macrocarpaea glaziovii Gilg","",,"GBIF"
"","MO","MO","100432472","Macrocarpaea glaziovii","","Gentianaceae","Macrocarpaea","glaziovii","","Gilg",,,"","Grant 10-4641","","Jason R. Grant|et al.",2010,11,22,"Brazil","Rio de Janeiro",,"Cidade do Rio de Janeiro, Parque Nacional da Tijuca, estrada do Sumaré.",-12.454722,-43.241667,,"Macrocarpaea glaziovii Gilg","",,"GBIF"
"","NY","NY","1281299","Macrocarpaea glaziovii","","Gentianaceae","Macrocarpaea","glaziovii","","Gilg",,,"","10-4641","","J. R. Grant",2010,11,22,"Brazil","Rio de Janeiro",,"Cidade de Rio de Janeiro, Parque Nacional da Tijuca, estrada do Sumaré.",-22.95622,-43.24175,,"Macrocarpaea glaziovii Gilg","",,"GBIF"
"","NY","NY","1281298","Macrocarpaea glaziovii","","Gentianaceae","Macrocarpaea","glaziovii","","Gilg",,,"","10-4640","","J. R. Grant",2010,11,22,"Brazil","Rio de Janeiro",,"Cidade de Rio de Janeiro, Parque Nacional da Tijuca, estrada do Sumaré.",-22.94869,-43.22036,,"Macrocarpaea glaziovii Gilg","",,"GBIF"
"","NY","NY","1281296","Macrocarpaea glaziovii","","Gentianaceae","Macrocarpaea","glaziovii","","Gilg",,,"","10-4639","","J. R. Grant",2010,11,20,"Brazil","Rio de Janeiro",,"Cidade de Rio de Janeiro, Parque Nacional da Tijuca, estrada do Sumaré.",-22.95622,-43.28936,,"Macrocarpaea glaziovii Gilg","",,"GBIF"
"","NY","NY","1281297","Macrocarpaea glaziovii","","Gentianaceae","Macrocarpaea","glaziovii","","Gilg",,,"","10-4639","","J. R. Grant",2010,11,20,"Brazil","Rio de Janeiro",,"Cidade de Rio de Janeiro, Parque Nacional da Tijuca, estrada do Sumaré.",-22.95622,-43.28936,,"Macrocarpaea glaziovii Gilg","",,"GBIF"
"","NY","NY","1281300","Macrocarpaea glaziovii","","Gentianaceae","Macrocarpaea","glaziovii","","Gilg",,,"","10-4641","","J. R. Grant",2010,11,22,"Brazil","Rio de Janeiro",,"Cidade de Rio de Janeiro, Parque Nacional da Tijuca, estrada do Sumaré.",-22.95622,-43.24175,,"Macrocarpaea glaziovii Gilg","",,"GBIF"
"","NY","NY","1281295","Macrocarpaea glaziovii","","Gentianaceae","Macrocarpaea","glaziovii","","Gilg",,,"","10-4638","","J. R. Grant",2010,11,20,"Brazil","Rio de Janeiro",,"Cidade de Rio de Janeiro, Parque Nacional da Tijuca, estrada do Sumaré.",-22.945054,-43.226672,,"Macrocarpaea glaziovii Gilg","",,"GBIF"
"","MO","MO","100432460","Macrocarpaea glaziovii","","Gentianaceae","Macrocarpaea","glaziovii","","Gilg",,,"","Grant 09-4604","","Jason R. Grant|Louis Zeltner|B.R. Silva|Vincent Trunz",2009,11,20,"Brazil","Rio de Janeiro",,"Cidade do Rio de Janeiro, estrada do Sumaré, à 1.5 km da estrada Redentor.",-22.954444,-43.241667,,"Macrocarpaea glaziovii Gilg","",,"GBIF"
"","MO","MO","100432461","Macrocarpaea glaziovii","","Gentianaceae","Macrocarpaea","glaziovii","","Gilg",,,"","Grant 09-4606","","Jason R. Grant|Louis Zeltner|B.R. Silva|Vincent Trunz",2009,11,21,"Brazil","Rio de Janeiro",,"Estrada Fazenda São João, 0.5 km da estrada RJ 116.",-22.359444,-42.516111,,"Macrocarpaea glaziovii Gilg","",,"GBIF"
"","NY","NY","1281294","Macrocarpaea glaziovii","","Gentianaceae","Macrocarpaea","glaziovii","","Gilg",,,"","09-4606","","J. R. Grant",2009,11,21,"Brazil","Rio de Janeiro",,"Estrada Fazenda São João, 0.5 km da estrada RJ 116.",-22.35936,-42.51622,,"Macrocarpaea glaziovii Gilg","",,"GBIF"
"","NY","NY","1281287","Macrocarpaea glaziovii","","Gentianaceae","Macrocarpaea","glaziovii","","Gilg",,,"","09-4603","","J. R. Grant",2009,11,20,"Brazil","Rio de Janeiro",,"Cidade do Rio de Janeiro. Parque Nacional da Tijuca, estrada da Vista Chinesa.",-22.96825,-43.25844,,"Macrocarpaea glaziovii Gilg","",,"GBIF"
"","NY","NY","1281290","Macrocarpaea glaziovii","","Gentianaceae","Macrocarpaea","glaziovii","","Gilg",,,"","09-4604","","J. R. Grant",2009,11,20,"Brazil","Rio de Janeiro",,"Cidade do Rio de Janeiro. Estrada do Sumaré, à 1.5 km da estrada Redentor.",-22.95456,-43.24169,,"Macrocarpaea glaziovii Gilg","",,"GBIF"
"","NY","NY","1281288","Macrocarpaea glaziovii","","Gentianaceae","Macrocarpaea","glaziovii","","Gilg",,,"","09-4603","","J. R. Grant",2009,11,20,"Brazil","Rio de Janeiro",,"Cidade do Rio de Janeiro. Parque Nacional da Tijuca, estrada da Vista Chinesa.",-22.96825,-43.25844,,"Macrocarpaea glaziovii Gilg","",,"GBIF"
"","NY","NY","1281289","Macrocarpaea glaziovii","","Gentianaceae","Macrocarpaea","glaziovii","","Gilg",,,"","09-4604","","J. R. Grant",2009,11,20,"Brazil","Rio de Janeiro",,"Cidade do Rio de Janeiro. Estrada do Sumaré, à 1.5 km da estrada Redentor.",-22.95456,-43.24169,,"Macrocarpaea glaziovii Gilg","",,"GBIF"
"","NY","NY","1281293","Macrocarpaea glaziovii","","Gentianaceae","Macrocarpaea","glaziovii","","Gilg",,,"","09-4606","","J. R. Grant",2009,11,21,"Brazil","Rio de Janeiro",,"Estrada Fazenda São João, 0.5 km da estrada RJ 116.",-22.35936,-42.51622,,"Macrocarpaea glaziovii Gilg","",,"GBIF"
"","USP","SPF","226820","Macrocarpaea glaziovii","","Gentianaceae","Macrocarpaea","glaziovii","","Gilg","Grant, JR",2009,"","094606","","Grant, JR",2009,11,21,"Brazil","Rio de Janeiro","Nova Friburgo","Estrada Fazenda São João.",-22.359361,-42.516222,,"Macrocarpaea glaziovii Gilg","",,"GBIF"
"","USP","SPF","226818","Macrocarpaea glaziovii","","Gentianaceae","Macrocarpaea","glaziovii","","Gilg","Grant, JR",2009,"","094604","","Grant, JR",2009,11,20,"Brazil","Rio de Janeiro","Rio de Janeiro","Estrada do Sumaré.",-22.954556,-43.241694,,"Macrocarpaea glaziovii Gilg","",,"GBIF"
"","USP","SPF","226817","Macrocarpaea glaziovii","","Gentianaceae","Macrocarpaea","glaziovii","","Gilg","Grant, JR",2009,"","094603","","Grant, JR",2009,11,20,"Brazil","Rio de Janeiro","Rio de Janeiro","Parque Nacional da Tijuca",-22.96825,-43.258444,,"Macrocarpaea glaziovii Gilg","",,"GBIF"
"","Comissão Executiva do Plano da Lavoura Cacaueira","CEPEC","125777","Macrocarpaea glaziovii","","Gentianaceae","Macrocarpaea","glaziovii","","Gilg","J. R. Grant",,"","10582","","L. Kollmann",2008,2,13,"Brazil","Espírito Santo","castelo","Parque Estadual do Forno Grande Localidade de Bateias.",-20.526944,-41.102222,,"Macrocarpaea glaziovii Gilg","",,"GBIF"
"","MBML","MBML-HERBARIO","34098","Macrocarpaea glaziovii","","Gentianaceae","Macrocarpaea","glaziovii","","Gilg","E.F.Guimarães-10/2008",,"","10582","","L. Kollmann; et al",2008,2,13,"Brazil","Espírito Santo","Castelo","Parque Estadual do Forno Grande",-20.526944,-41.101667,"Erva 2m na sombra, frutos verdes. Material prensado em álcool.","Macrocarpaea glaziovii Gilg","",,"GBIF"
"","JBRJ","RB","RB00521957","Macrocarpaea glaziovii","","Gentianaceae","Macrocarpaea","glaziovii","","Gilg","J.R.Grant",2009,"","10582","","L. Kollmann; C.N. Fraga, R.C. Forzza, A.P. Fontana & P.H. Labiak",2008,2,13,"Brazil","Espírito Santo","Castelo","Localidade de Bateias. Floresta Ombrófila Densa Altomontana. Parque Estadual do Forno Grande",-20.526944,-41.101667,"Erva 2m na sombra, frutos verdes. Material prensado em álcool.","Macrocarpaea glaziovii Gilg","",,"GBIF"
"","Universidade Federal de Juiz de Fora","CESJ","48855","Macrocarpaea glaziovii","","Gentianaceae","Macrocarpaea","glaziovii","","Gilg",,,"","247","","K. Antunes; N.L. Abreu; P.L. Viana; F.S. Souza; N.F.O. Mota; T.E. Almeida; A.M. Teles; B.No",2007,4,10,"Brazil","Minas Gerais","Rio Preto","Serra Negra, Trilha para o Burro de Ouro.",,,"Erva terrestre, ca. 1m, em campo com solo arenoso. Frutos.","Macrocarpaea glaziovii Gilg","",,"GBIF"
"","JBRJ","RB","RB00514945","Macrocarpaea glaziovii","","Gentianaceae","Macrocarpaea","glaziovii","","Gilg","S.Pessoa & M.Nadruz",2008,"","2082","","M. Nadruz; A.C.G.Ramos, N.L.A.Nunes, A.Lobão, C.Cronemberg, Edivandro & Ernesto",2007,9,27,"Brazil","Rio de Janeiro","Magé","Distrito de Santo Aleixo, trilha coruja-italianos. Parque Nacional Serra dos Órgãos",,,"Lâmina membranácea levemente discolor; botões esverdeados; cálice esverdeado e corola creme; fruto cor de palha; caule oco.","Macrocarpaea glaziovii Gilg","",,"GBIF"
"","JBRJ","RB","RB00514947","Macrocarpaea glaziovii","","Gentianaceae","Macrocarpaea","glaziovii","","Gilg","J.R. Grant",2009,"","2083","","M. Nadruz; A.C.G.Ramos, N.L.A.Nunes, A.Lobão, C.Cronemberg, Edivandro & Ernesto",2007,9,27,"Brazil","Rio de Janeiro","Magé","Distrito de Santo Aleixo, trilha coruja-italianos, beirando o rio. Parque Nacional Serra dos Órgãos",,,"Lâmina membranácea, levemente discolor; botôes esverdeados.","Macrocarpaea glaziovii Gilg","",,"GBIF"
"","JBRJ","RB","RB00514944","Macrocarpaea glaziovii","","Gentianaceae","Macrocarpaea","glaziovii","","Gilg","J.R. Grant",2009,"","1992","","M. Nadruz; A.C.G. Ramos, N.L. Ramos, A.Lobão e C.Cronemberg",2007,9,25,"Brazil","Rio de Janeiro","Magé","Distrito Santo Aleixo, trilha para o Pico Grande, fazenda Floresta do Pico. Parque Nacional Serra dos Órgãos",,,"Arvoreta; lâmina membranácea opaca; fruto passado amarronzado; talo oco.","Macrocarpaea glaziovii Gilg","",,"GBIF"
"","Universidade Federal de Juiz de Fora","CESJ","49508","Macrocarpaea glaziovii","","Gentianaceae","Macrocarpaea","glaziovii","","Gilg","E.F.Guimarães",2008,"","2490","","F.R.G. Salimena; P.H. Nobre",2007,10,6,"Brazil","Minas Gerais","Rio Preto","RPPN Mato Limpo, Gruta dos Macacos.",,,"Erva, folhas carnosas, flores alvas, estames creme. Interior de mata de grota úmida. Lapa.","Macrocarpaea glaziovii Gilg","",,"GBIF"
"","Comissão Executiva do Plano da Lavoura Cacaueira","CEPEC","112221","Macrocarpaea glaziovii","","Gentianaceae","Macrocarpaea","glaziovii","","Gilg","Sem Informação",,"","807","","Lopes, M. M. M.",2006,6,6,"Brazil","Bahia","CAMACAN","RPPN Serra Bonita. 9,7 km W de Camacã na estrada para Jacarecí, daí 6 km SW na estrada para a RPPN e Torre da Embratel. Trilha do mirante, até a Torre.",-15.391667,-39.565278,,"Macrocarpaea glaziovii Gilg","",,"GBIF"
"","Universidade Federal de Minas Gerais","BHCB","86591","Macrocarpaea glaziovii","","Gentianaceae","Macrocarpaea","glaziovii","","Gilg",,,"","5867","","Lombardi, JA; Salino, A; Mota, RC da; Almeida, TE; Viana, PL",2004,3,7,"Brazil","Minas Gerais","Santa Maria do Salto","Fazenda Duas Barras.",-16.413889,-40.049278,"Interior e borda de mata hidrófila em encosta e pasto adjacente. Arbusto ca. 3m, folhas cartáceas, frutos imaturos verdes. Prensado em álcool. Iventário Biológico nos Vales dos Rios Jequitinhonha e Mucuri, Estados de Minas e Bahia. No dia 28/09/2010,","Macrocarpaea glaziovii Gilg","",,"GBIF"
"","NY","NY","1801146","Macrocarpaea glaziovii","","Gentianaceae","Macrocarpaea","glaziovii","","Gilg",,,"","1318","","B. R. Silva",2004,5,11,"Brazil","Rio de Janeiro",,"Floresta da Tijuca, Estrada da Vista Chinesa, perto da trilha para o Morro Queimado.",-22.9705,-43.25797,,"Macrocarpaea glaziovii Gilg","",,"GBIF"
"","MBML","MBML-HERBARIO","20050","Macrocarpaea glaziovii","","Gentianaceae","Macrocarpaea","glaziovii","","Gilg","in dupl.: Elsie F.Guimarães/03",,"","2025","","R.R. Vervloet; et al",2003,3,20,"Brazil","Espírito Santo","Santa Teresa","Reserva Biológica Augusto Ruschi - Nova Lombardia",-19.9075,-40.553056,"Planta de 2m, frutos imaturos de cor verde, meia encosta, dossel 16m.","Macrocarpaea glaziovii Gilg","",,"GBIF"
"","JBRJ","RB","RB00390883","Macrocarpaea glaziovii","","Gentianaceae","Macrocarpaea","glaziovii","","Gilg","J.R. Grant",2009,"","2025","","R.R. Vervloet; E. Bausen",2003,3,20,"Brazil","Espírito Santo","Santa Teresa","Nova Lombardia. Reserva Biológica Augusto Ruschi, Linha de divisa, lado esquerdo, seguindo córrego. Reserva Biológica Augusto Ruschi",,,"Planta de 2m, frutos imaturos de cor verde.","Macrocarpaea glaziovii Gilg","",,"GBIF"
"","MBML","MBML-HERBARIO","21475","Macrocarpaea glaziovii","","Gentianaceae","Macrocarpaea","glaziovii","","Gilg","V. Demuner/10-02-2006",,"","539","","J. Rossini; et al",2003,9,5,"Brazil","Espírito Santo","Santa Teresa","Reserva Biológica Augusto Ruschi - Nova Lombardia",-19.9075,-40.553056,"Arbusto 1,6m. Frutos marrons.","Macrocarpaea glaziovii Gilg","",,"GBIF"
"","USP","SPF","164127","Macrocarpaea glaziovii","","Gentianaceae","Macrocarpaea","glaziovii","","Gilg","Grant, JR",2009,"","539","","Rossini, J",2003,9,5,"Brazil","Espírito Santo","Santa Teresa","Reserva Biológica Augusto Ruschi",,,,"Macrocarpaea glaziovii Gilg","",,"GBIF"
"","JBRJ","RB","RB00583821","Macrocarpaea glaziovii","","Gentianaceae","Macrocarpaea","glaziovii","","Gilg","E.F.Guimarães",2009,"","1856","","S.J.Silva Neto; et al.",2003,10,22,"Brazil","Rio de Janeiro","Itatiaia","Parque Nacional do Itatiais. Maromba próximo, ao lado da escada.",-22.25,-44.066667,"Arbusto; folhas concolores sub-coriáceas; botões alvo-esverdeados com cálice verde; flores com cálice verde e corola alvo-esverdeada.","Macrocarpaea glaziovii Gilg","",,"GBIF"
"","JBRJ","RB","RB00583841","Macrocarpaea glaziovii","","Gentianaceae","Macrocarpaea","glaziovii","","Gilg","E.F.Guimarães",2010,"","32","","M.B.F.Canela; et al.",2003,10,12,"Brazil","Rio de Janeiro","Itatiaia","Parque Nacional do Itatiaia. Trila para as cachoeiras do Itaporani e Véu da Noiva.",-22.25,-44.566667,"Erva ereta. Folhas opostas cruzadas. Corola branca esverdeadas, sépala verde. Antese noturna, odor de verduras frescas. Protândrica.","Macrocarpaea glaziovii Gilg","",,"GBIF"
"","NY","NY","1844378","Macrocarpaea glaziovii","","Gentianaceae","Macrocarpaea","glaziovii","","Gilg",,,"","1856","","S. J. da Silva Neto",2003,10,22,"Brazil","Rio de Janeiro",,"Parque Nacional do Itatiaia. Maromba próximo, ao lado da escada.",-22.35833,-44.65833,,"Macrocarpaea glaziovii Gilg","",,"GBIF"
"","IF","SPSF","31768","Macrocarpaea glaziovii","","Gentianaceae","Macrocarpaea","glaziovii","","Gilg",,,"","649","","R.G.Udulutsch",2002,4,22,"Brazil","Sp","Sete Barras","Parque Estadual Carlos Botelho - Núcleo Sete Barras",-24.183611,-47.994167,"COLETA: XLS: SPSFAntigo; GEOGRAFIA: floresta ombrofila densa&nf;;","Macrocarpaea glaziovii Gilg","",,"GBIF"
"","JBRJ","RB","RB00113381","Macrocarpaea glaziovii","","Gentianaceae","Macrocarpaea","glaziovii","","Gilg","J.R. Grant",2009,"","2214","","M.G. Bovini; L.C. GIORDANO, E.F. GUIMARÃES,S.J.S.NETO ET W. DA SILVA",2002,10,24,"Brazil","Rio de Janeiro","Nova Iguaçu","DISTRITO DE TINGUÁ, RESERVA BIOLÓGICA ESTRADA DO OURO. Tinguá",,,"ERVA CIÓFILA EM BARRANCO ÚMIDO. FOLHAS MEMBRANÁCEAS, CONCOLARES . CÁLICE VERDE ESCURO, COROLA CREME; FILETE ESVERDEADO E ANTERAS AMARELAS","Macrocarpaea glaziovii Gilg","",,"GBIF"
"","MBML","MBML-HERBARIO","15620","Macrocarpaea glaziovii","","Gentianaceae","Macrocarpaea","glaziovii","","Gilg","H.Q.Boudet Fernandes/Fev.-2004",,"","5046","","L. Kollmann; et al",2001,11,27,"Brazil","Espírito Santo","Santa Teresa","Reserva Biológica Augusto Ruschi - Nova Lombardia",-19.9075,-40.553056,"Planta 1m na sombra. Sépalas verdes. Estigma branco.","Macrocarpaea glaziovii Gilg","",,"GBIF"
"","MBML","MBML-HERBARIO","13241","Macrocarpaea glaziovii","","Gentianaceae","Macrocarpaea","glaziovii","","Gilg","in dupl.: Elsie F.Guimarães/03",,"","1253","","V. Demuner; et al",2000,7,25,"Brazil","Espírito Santo","Fundão","Goiapaba-Açu",-19.914167,-40.472222,"Arbusto 1,5m, botões florais verdes, frutos jovens de cor verde e frutos velhos secos. Borda de mata secundária. Próximo a lagoa.","Macrocarpaea glaziovii Gilg","",,"GBIF"
"","JBRJ","RB","RB00419180","Macrocarpaea glaziovii","","Gentianaceae","Macrocarpaea","glaziovii","","Gilg","J.R. Grant",,"","1253","","V. Demuner; E. Bausen e W. Pizziolo",2000,7,25,"Brazil","Espírito Santo","Fundão","Goiapaba - Açu.",,,"Arbusto 1,5 m, botões florais verdes, frutos jovens de cor verde e frutos velhos secos.","Macrocarpaea glaziovii Gilg","",,"GBIF"
"","JBRJ","RB","RB00113344","Macrocarpaea glaziovii","","Gentianaceae","Macrocarpaea","glaziovii","","Gilg","J.R. Grant",2009,"","99/09","","A. ANDERSON; L.Y.S. AONA,A.D. FARIA,J.C. GALVÃO &R.BELINELLO",1999,1,19,"Brazil","Rio de Janeiro","Nova Friburgo","RESERVA MACAÉ DE CIMA , ESTRADA DE TERRA, CERCA DE 900M DO HOTEL SÃO JOÃO.",,,,"Macrocarpaea glaziovii Gilg","",,"GBIF"
"","JBRJ","RB","RB00583750","Macrocarpaea glaziovii","","Gentianaceae","Macrocarpaea","glaziovii","","Gilg","E.F.Guimarães",2001,"","3774","","J.M.A.Braga; et al.",1997,1,13,"Brazil","Rio de Janeiro","Itatiaia","Parque Nacional do Itatiaia. Próximidades da ponte do Maromba, margem do rio Campo Belo.",-22.25,-44.566667,"Erva, heliófila. Folhas membranáceas. Frutos imaturos verde e maduros secos. Mata alterada e densa.","Macrocarpaea glaziovii Gilg","",,"GBIF"
"","NY","NY","1801145","Macrocarpaea glaziovii","","Gentianaceae","Macrocarpaea","glaziovii","","Gilg","J. R. Grant",,"","1738","","L. C. d. S. Giordano",1994,10,27,"Brazil","Rio de Janeiro",,"Estrada atrás do Posto Policial da Rodovia Cachoeira de Macacu-Nova Friburgo (lado esquerdo sentido Nova Friburgo), após à entrada do caminho para o Sítio Campinho.",,,,"Macrocarpaea glaziovii Gilg","",,"GBIF"
"","JBRJ","RB","RB00113357","Macrocarpaea glaziovii","","Gentianaceae","Macrocarpaea","glaziovii","","Gilg","J.R. Grant",2009,"","13","","T.S. PEREIRA ; ET AL",1993,2,16,"Brazil","Rio de Janeiro","Nova Friburgo","RESERVA  ECOLÓGICA  MUNICIPAL  DE  MACAÉ  E  CIMA  .  PICADA  P/PARCELA  1  barranco  Á  DIREITA  DE  QUEM  SOBE  PARCELA  1.",-22.55,-42.5,"ERVA CERCA 1,20 CM , FOLHAS CONCOLARES , FINOS FRUTOS CAPSULA C/SEPALAS PERSISTENTES, SEMENTES MINUSCULAS DE COR PARDA  ( SEMENTES E ESTACAS NO HORTO)","Macrocarpaea glaziovii Gilg","",,"GBIF"
"","IF","SPSF","15419","Macrocarpaea glaziovii","","Gentianaceae","Macrocarpaea","glaziovii","","Gilg",,,"","1000","","M.Sugiyama & M. Kirizawa",1992,9,21,"Brazil","Sp","São Miguel Arcanjo","Parque Estadual Carlos Botelho",,,"COLETA: XLS: SPSFAntigo; GEOGRAFIA: em barranco umido&nf;;","Macrocarpaea glaziovii Gilg","",,"GBIF"
"","NY","NY","644326","Macrocarpaea glaziovii","","Gentianaceae","Macrocarpaea","glaziovii","","Gilg","J. R. Grant",1999,"","134","","C. M. B. Correia",1990,9,11,"Brazil","Rio de Janeiro",,"Nova Friburgo, Reserva Ecológica Municipal de Macaé de Cima, Sítio Sophronites",-22,-42.05,,"Macrocarpaea glaziovii Gilg","",,"GBIF"
"","IF","SPSF","24107","Macrocarpaea glaziovii","","Gentianaceae","Macrocarpaea","glaziovii","","Gilg",,,"","20","","E.A.Anunciaçao",1990,10,17,"Brazil","Sp","Iguape","Estação Ecológica Juréia-Itatins",,,"COLETA: XLS: SPSFAntigo; GEOGRAFIA: margem do Rio Verde&nf;;","Macrocarpaea glaziovii Gilg","",,"GBIF"
"","K","Herbarium","K001049336","Macrocarpaea glaziovii","","Gentianaceae","Macrocarpaea","glaziovii","","Gilg",,,"","2586","","Farney, C.",1990,11,25,"Brazil",,"Paraty","Apa-Cairuçu. Pico do Cairuçu, acesso pela praia Negra.",,,,"Macrocarpaea glaziovii Gilg","",,"GBIF"
"","K","Herbarium","K001049337","Macrocarpaea glaziovii","","Gentianaceae","Macrocarpaea","glaziovii","","Gilg",,,"","2498","","Farney, C.",1990,11,21,"Brazil",,"Paraty","Apa-cairuçu, Parati-Mirim. Ponta da Barra.",,,,"Macrocarpaea glaziovii Gilg","",,"GBIF"
"","Instituto de Botânica","SP","246625","Macrocarpaea glaziovii","","Gentianaceae","Macrocarpaea","glaziovii","","Gilg",,,"","2054","","Barros, F; Ribeiro, JELS",1990,12,5,"Brazil","São Paulo","Cananéia","Ilha do Cardoso, Próximo ao Pico do Morro do Cardoso",,,,"Macrocarpaea glaziovii Gilg","",,"GBIF"
"","IPA","IPA","65453","Macrocarpaea glaziovii","","Gentianaceae","Macrocarpaea","glaziovii","","Gilg","Dalcin, E.C.",,"","13339","","Martinelli, G.; et al.; et al.",1989,6,28,"Brazil","Rio de Janeiro","Santa Maria Madalena","Parque Estadual do Desengano, Pedra do Desengano.",,,"Arbusto monopodial 1,65m, heliófila. Caule amarelo junto ao ápice; folhas discolores ; flores com cálice verde, corola alvacenta, estames alvos; botões florais verde-alvacentos; frutos imaturos de cor verde.; Campos de Altitude.","Macrocarpaea glaziovii Gilg","",,"GBIF"
"","JBRJ","RB","RB00113576","Macrocarpaea glaziovii","","Gentianaceae","Macrocarpaea","glaziovii","","Gilg","Jason R. Grant",2004,"","32","","C. M. Vieira; Et al",1989,6,21,"Brazil","Rio de Janeiro","Nova Friburgo","Reserva ecológica mun. de Macaé de Cima. Caminho para os Pirineus.",-22.55,-42.5,"Subarbusto, 0,5m de alt, folhas verdes levemente discolores, flores com botões florais verdes, frutos pardacentos.","Macrocarpaea glaziovii Gilg","",,"GBIF"
"","MO","MO","2790468","Macrocarpaea glaziovii","","Gentianaceae","Macrocarpaea","glaziovii","","Gilg","J. R. Grant",2007,"","Vieira 78","","Cláudia M. Vierira",1989,,,"Brazil",,,"Rio de janeiro, Nova Friburgo, Reserva Ecológica Municipal de macaé de Cima, 22:00S, 042:03W",,,,"Macrocarpaea glaziovii Gilg","",,"GBIF"
