"modified","institutionCode","collectionCode","catalogNumber","scientificName","identificationQualifier","family","genus","specificEpithet","infraspecificEpithet","scientificNameAuthorship","identifiedBy","dateIdentified","typeStatus","recordNumber","fieldNumber","recordedBy","year","month","day","country","stateProvince","municipality","locality","decimalLatitude","decimalLongitude","occurrenceRemarks","acceptedNameUsage","occurrenceID","comments","bibliographicCitation"
"","JBRJ","RB","RB00853989","Hymenaea cangaceira","","Fabaceae","Hymenaea","cangaceira","","R.B.Pinto, Mansano & A.M.G.Azevedo","R.B.Pinto , Mansano & A.M.G.Azevedo",2017,"","6594","","B.M.T. Walter; C.E.B. Proença; I.R. Costa; S.R. Silva",2014,1,22,"Brazil","Ceará","Jardim","Arredores da cidade de Jardim, nas proximidades do mirante do Padre Cícero (estátua).",-7.493333,-39.3625,"Árvore com 3m de altura","Hymenaea cangaceira R.B.Pinto, Mansano & A.M.G.Azevedo","",,"GBIF"
"","UNIVASF","HVASF","22200","Hymenaea cangaceira","","Fabaceae","Hymenaea","cangaceira","","R.B.Pinto, Mansano & A.M.G.Azevedo","R.B. Pinto",2017,"","3281","","A.C.P. Oliveira",2014,2,4,"Brazil","Pernambuco","Arcoverde","Serra das Varas, ca. de 2 Km ao Sul da localidade Caraíbas de Cima. Brejo de Altitude (Floresta Estacional Semidecídua de Terras Baixas)",-8.44275,-36.96475,"Arbustivo, ca. de 2,0 m alt.. Folíolos coriáceos, face superior verde-escura, inferior verde-claro. Flores com corola alva a amarelada.","Hymenaea cangaceira R.B.Pinto, Mansano & A.M.G.Azevedo","",,"GBIF"
"","UNIVASF","HVASF","19345","Hymenaea cangaceira","","Fabaceae","Hymenaea","cangaceira","","R.B.Pinto, Mansano & A.M.G.Azevedo","R.B. Pinto",2017,"","2328","","A.C.P. Oliveira",2013,1,29,"Brazil","Ceará","Mauriti","Sítio Bananeira",-7.323611,-38.558694,"Árvore com ca. de 7,00m alt.. Folha composta e alterna. Botões verdes. Flor branca.","Hymenaea cangaceira R.B.Pinto, Mansano & A.M.G.Azevedo","",,"GBIF"
"","IPA","IPA","88233","Hymenaea cangaceira","","Fabaceae","Hymenaea","cangaceira","","R.B.Pinto, Mansano & A.M.G.Azevedo","Pinto, R.B.",2017,"","8","","Melo, L.L.S.; Silva, V.F.; Silva, V.F.",2012,1,27,"Brazil","Pernambuco","Glória do Goitá","Mata das Negras.",,,"Árvore ca. 6 m de altura, muito ramificado; caule marrom; flores em botões verde-amarronzados.","Hymenaea cangaceira R.B.Pinto, Mansano & A.M.G.Azevedo","",,"GBIF"
"","UNIVASF","HVASF","14191","Hymenaea cangaceira","","Fabaceae","Hymenaea","cangaceira","","R.B.Pinto, Mansano & A.M.G.Azevedo","R.B. Pinto",2017,"","95","","C.R.S. Oliveira",2012,1,25,"Brazil","Pernambuco","Buíque","Parque Nacional do Catimbau, Vale do Catimbau, próximo a Serra de Jerusalém",-8.59125,-37.247833,"Árvore, ca. 5 m alt. Pré-floração imbricada. Flores polistêmones, com pétalas alvas, sépalas esverdeadas, ovário súpero, cálice persistente.","Hymenaea cangaceira R.B.Pinto, Mansano & A.M.G.Azevedo","",,"GBIF"
"","Universidade Federal Rural de Pernambuco","HST","19485","Hymenaea cangaceira","","Fabaceae","Hymenaea","cangaceira","","R.B.Pinto, Mansano & A.M.G.Azevedo","R.B.Pinto",2017,"","8","","L.L.S.Melo; V.F.Silva",2012,1,27,"Brazil","Pernambuco","Glória de Goitá","Mata das Negras",,,"Árvore ca. 6 m alt., muito ramificado; caule marrom; flores em botões verde-amarronzados.","Hymenaea cangaceira R.B.Pinto, Mansano & A.M.G.Azevedo","",,"GBIF"
"","UNIVASF","HVASF","14929","Hymenaea cangaceira","","Fabaceae","Hymenaea","cangaceira","","R.B.Pinto, Mansano & A.M.G.Azevedo","R.B. Pinto",2017,"","599","","E.V.R. Ferreira",2012,4,2,"Brazil","Pernambuco","Buíque","Parque Nacional do Catimbau, trilha do Chapadão",-8.5255,-37.241888,"Árvore ca. de 6m alt.Caule com lenticelas. Folhas compostas, alternas, pilosas na face axial. Legume imaturo.","Hymenaea cangaceira R.B.Pinto, Mansano & A.M.G.Azevedo","",,"GBIF"
"","UEFS","HUEFS","186224","Hymenaea cangaceira","","Fabaceae","Hymenaea","cangaceira","","R.B.Pinto, Mansano & A.M.G.Azevedo","R.B.Pinto",2017,"","106","","Souza, I.M.",2012,4,4,"Brazil","Bahia","Palmeiras","Fazenda Rio Preto.",,,"Caatinga.","Hymenaea cangaceira R.B.Pinto, Mansano & A.M.G.Azevedo","",,"GBIF"
"","UNIVASF","HVASF","17756","Hymenaea cangaceira","","Fabaceae","Hymenaea","cangaceira","","R.B.Pinto, Mansano & A.M.G.Azevedo","R.B. Pinto",2017,"","671","","D.G. Oliveira",2012,11,14,"Brazil","Paraíba","Esperança","Distrito da Lagoa de Pedra. Fazenda Timbaúba. Margem esquerda da estrada",-7.014833,-35.880361,"Árvore ca. de 6,00m alt.. Caule amarronzado. Folhas bifolioladas, alternas, glabras. Flores alvas, sépalas amarronzadas.","Hymenaea cangaceira R.B.Pinto, Mansano & A.M.G.Azevedo","",,"GBIF"
"","IPA","IPA","85372","Hymenaea cangaceira","","Fabaceae","Hymenaea","cangaceira","","R.B.Pinto, Mansano & A.M.G.Azevedo","Pinto, R.B.",2017,"","15","","Costa, A.C.G.; Nadia, T.C.L.; Barral, E.C.; Ferreira, S.M.; Nadia, T.C.L.; Barral, E.C.; Ferreira, S.M.",2011,1,13,"Brazil","Pernambuco","Buíque","Parque Nacional do Catimbau, Serrinha.",,,"Árvore ca. 4m de altura. Flores brancas, noturnas.","Hymenaea cangaceira R.B.Pinto, Mansano & A.M.G.Azevedo","",,"GBIF"
"","UFPE","UFP","63766","Hymenaea cangaceira","","Fabaceae","Hymenaea","cangaceira","","R.B.Pinto, Mansano & A.M.G.Azevedo","Pinto, R.B.",2017,"","15","","Costa, A.C.G.; Nadia, T.C.L.; Barral, E.C. & Ferreira, S.M.",2011,1,13,"Brazil","Pernambuco","Buíque","Parque Nacional do Catimbau, Serrinha.",,,"Árvore ca. 4m de altura. Florest brancas, noturnas.","Hymenaea cangaceira R.B.Pinto, Mansano & A.M.G.Azevedo","",,"GBIF"
"","IPA","IPA","84888","Hymenaea cangaceira","","Fabaceae","Hymenaea","cangaceira","","R.B.Pinto, Mansano & A.M.G.Azevedo","Pinto, R.B.",2017,"","1662","","Silva, A.G.; Barbosa, J.I.S.; Alves, J.; Silva, M.V.; Barbosa, J.I.S.; Alves, J.; Silva, M.V.",2010,6,10,"Brazil","Pernambuco","Buíque","Parque Nacional do Catimbau, Árvore com 6m.",-8.4,-37.158333,"Flores ALvas.","Hymenaea cangaceira R.B.Pinto, Mansano & A.M.G.Azevedo","",,"GBIF"
"","UNIVASF","HVASF","9007","Hymenaea cangaceira","","Fabaceae","Hymenaea","cangaceira","","R.B.Pinto, Mansano & A.M.G.Azevedo","R.B. Pinto",2017,"","1","","J.V.A. Ferreira",2010,8,10,"Brazil","Ceará","Mauriti","Área de Canal Lote 6",-7.530819,-38.785091,"Árvore cerca de 2,5 m de alt. Frutos Imaturos verdes","Hymenaea cangaceira R.B.Pinto, Mansano & A.M.G.Azevedo","",,"GBIF"
"","UNIVASF","HVASF","9372","Hymenaea cangaceira","","Fabaceae","Hymenaea","cangaceira","","R.B.Pinto, Mansano & A.M.G.Azevedo","R.B. Pinto",2017,"","7078","","A.P. Fontana",2010,8,3,"Brazil","Pernambuco","Sertânia","Brejo Velho, Serra Jabitacá, Síto Bolandera, Propriedade do Sra Josefa Soares de Lima",-7.975805,-37.349361,"Árvore ca. 5m. Frutos marrons.","Hymenaea cangaceira R.B.Pinto, Mansano & A.M.G.Azevedo","",,"GBIF"
"","UNIVASF","HVASF","3149","Hymenaea cangaceira","","Fabaceae","Hymenaea","cangaceira","","R.B.Pinto, Mansano & A.M.G.Azevedo","R.B. Pinto",2017,"","1930","","J.G. Carvalho-Sobrinho",2009,2,9,"Brazil","Ceará","Brejo Santo","estrada para Açude Atalho. Encrave de Cerrado.",-7.589305,-38.882444,"Árvore ca. 2,0m alt. Cálice amarronzado, pétalas creme, androceu alvo, ovário castanho. OBS.: Fotos.","Hymenaea cangaceira R.B.Pinto, Mansano & A.M.G.Azevedo","",,"GBIF"
"","UEFS","HUEFS","149623","Hymenaea cangaceira","","Fabaceae","Hymenaea","cangaceira","","R.B.Pinto, Mansano & A.M.G.Azevedo","R.B.Pinto",2017,"","1930","","Carvalho-Sobrinho, J.G.de",2009,2,9,"Brazil","Ceará","Brejo Santo","Estrada para Açude Atalho.",,,,"Hymenaea cangaceira R.B.Pinto, Mansano & A.M.G.Azevedo","",,"GBIF"
"","UNIVASF","HVASF","3374","Hymenaea cangaceira","","Fabaceae","Hymenaea","cangaceira","","R.B.Pinto, Mansano & A.M.G.Azevedo","R.B. Pinto",2017,"","898","","J.R. Maciel",2009,3,25,"Brazil","Paraíba","Monteiro","Serrote da Onça. Afloramentos rochosos.",-7.846833,-37.112972,"Árvore ca. 3m alt. Frutos verdes.","Hymenaea cangaceira R.B.Pinto, Mansano & A.M.G.Azevedo","",,"GBIF"
"","Universidade Federal de Sergipe, UFS","ASE","15310","Hymenaea cangaceira","","Fabaceae","Hymenaea","cangaceira","","R.B.Pinto, Mansano & A.M.G.Azevedo","Pinto, RB",2017,"","139","","Lima, JS",2009,4,16,"Brazil","Sergipe","Areia Branca","Povoado Caroba",-10.758056,-37.315,"Arbórea.; Arbórea.; Interior da Mata.","Hymenaea cangaceira R.B.Pinto, Mansano & A.M.G.Azevedo","",,"GBIF"
"","UFPE","UFP","51699","Hymenaea cangaceira","","Fabaceae","Hymenaea","cangaceira","","R.B.Pinto, Mansano & A.M.G.Azevedo","Pinto, R.B.",2017,"","s.n.","","Maranhão, C.A. de",2008,1,25,"Brazil","Pernambuco","Serra Talhada","Fazenda Malhada da Areia, PE-930; Serra Talhada - Floresta, 9km à direita, depois, 24km.",,,"Árvore; em floração.; Árvore; em floração.","Hymenaea cangaceira R.B.Pinto, Mansano & A.M.G.Azevedo","",,"GBIF"
"","UFPE","UFP","60452","Hymenaea cangaceira","","Fabaceae","Hymenaea","cangaceira","","R.B.Pinto, Mansano & A.M.G.Azevedo","Pinto, R.B.",2017,"","345","","Córdula, E.; Melo, Y.; Pinheiro, K.; Amorim, B.S. & Sotero, D.",2008,1,6,"Brazil","Pernambuco","Mirandiba","Sítio Malhada da Areia",,,"Árvore, 4,5m alt.; flores brancas, ovário verde, ficando vermelho após a fecundação.; Árvore, 4,5m alt.; flores brancas, ovário verde, ficando vermelho após a fecundação.; Caatinga arbustiva densa sob solo arenoso.","Hymenaea cangaceira R.B.Pinto, Mansano & A.M.G.Azevedo","",,"GBIF"
"","Universidade Federal de Sergipe, UFS","ASE","20296","Hymenaea cangaceira","","Fabaceae","Hymenaea","cangaceira","","R.B.Pinto, Mansano & A.M.G.Azevedo","Pinto, RB",2017,"","345","","Cordula, E; Melo, Y; Pinheiro, K; Amorim, BS; Sotero, D",2008,1,6,"Brazil","Pernambuco","Mirandiba","Sítio Malhada da Areia",-8.120556,-38.729167,"Árvore ca. 4-5m de altura; flores brancas; ovário verde, ficando vermelho após a fecundação.; Árvore ca. 4-5m de altura; flores brancas; ovário verde, ficando vermelho após a fecundação.; Caatinga arbustiva densa sob solo arenoso.","Hymenaea cangaceira R.B.Pinto, Mansano & A.M.G.Azevedo","",,"GBIF"
"","UEFS","HUEFS","176258","Hymenaea cangaceira","","Fabaceae","Hymenaea","cangaceira","","R.B.Pinto, Mansano & A.M.G.Azevedo","R.B.Pinto",2017,"","345","","Cordula, E.",2008,1,6,"Brazil","Pernambuco","Mirandiba","Sítio Malhada da Areia.",,,"Caatinga arbustiva densa sob solo arenoso.","Hymenaea cangaceira R.B.Pinto, Mansano & A.M.G.Azevedo","",,"GBIF"
"","IPA","IPA","82969","Hymenaea cangaceira","","Fabaceae","Hymenaea","cangaceira","","R.B.Pinto, Mansano & A.M.G.Azevedo","Pinto, R.B.",2017,"","3700","","Rita Pereira; et al.; et al.",2008,10,19,"Brazil","Pernambuco","Buíque","Vale do Catimbau, Sítio Fazenda Nova.",,,"Árvore cerca de 10m.","Hymenaea cangaceira R.B.Pinto, Mansano & A.M.G.Azevedo","",,"GBIF"
"","UNIVASF","HVASF","2681","Hymenaea cangaceira","","Fabaceae","Hymenaea","cangaceira","","R.B.Pinto, Mansano & A.M.G.Azevedo","R.B. Pinto",2017,"","59","","J. Antunes",2008,12,18,"Brazil","Paraíba","Monteiro","Sítio olhinho D água, Serrote do Peru,",-7.846833,-37.112972,"Árvore, ca. 4m alt. Caule lenticelado, esbranquiçado. Flores alvas, base do estígma dilatado, avermelhado.","Hymenaea cangaceira R.B.Pinto, Mansano & A.M.G.Azevedo","",,"GBIF"
"","UEFS","HUEFS","149634","Hymenaea cangaceira","","Fabaceae","Hymenaea","cangaceira","","R.B.Pinto, Mansano & A.M.G.Azevedo","R.B.Pinto",2017,"","59","","Antunes, J.",2008,12,18,"Brazil","Paraíba","Monteiro","Sítio Olhinho D'água, Serrote do Peru.",-7.846944,-37.113056,,"Hymenaea cangaceira R.B.Pinto, Mansano & A.M.G.Azevedo","",,"GBIF"
"","UEFS","HUEFS","131101","Hymenaea cangaceira","","Fabaceae","Hymenaea","cangaceira","","R.B.Pinto, Mansano & A.M.G.Azevedo","R.B.Pinto",2017,"","27","","Silva, F.B.L.",2007,11,10,"Brazil","Bahia","Morro do Chapéu","Lajes.",-11.493611,-41.326667,"Caatinga.","Hymenaea cangaceira R.B.Pinto, Mansano & A.M.G.Azevedo","",,"GBIF"
"","Comissão Executiva do Plano da Lavoura Cacaueira","CEPEC","138790","Hymenaea cangaceira","","Fabaceae","Hymenaea","cangaceira","","R.B.Pinto, Mansano & A.M.G.Azevedo","V. F. Mansano",,"","27","","F. B. L. Silva",2007,11,10,"Brazil","Bahia","MORRO DO CHAPÉU","Lajes.",-11.493611,-41.326667,"<ll>dwc_commonname:</ll>","Hymenaea cangaceira R.B.Pinto, Mansano & A.M.G.Azevedo","",,"GBIF"
"","Universidade Federal de Sergipe, UFS","ASE","9901","Hymenaea cangaceira","","Fabaceae","Hymenaea","cangaceira","","R.B.Pinto, Mansano & A.M.G.Azevedo","Pinto, RB",2017,"","26","","Rodrigues, LMO; Santos, E; L. V. Ribeiro",2006,2,23,"Brazil","Sergipe","Neópolis","Fazenda Cardozo",-10.32,-36.579444,"arbóreo. 20. m. folhas compostas alternas.; arbóreo. 20. m. folhas compostas alternas.; Mata Atlantica","Hymenaea cangaceira R.B.Pinto, Mansano & A.M.G.Azevedo","",,"GBIF"
"","IPA","IPA","68907","Hymenaea cangaceira","","Fabaceae","Hymenaea","cangaceira","","R.B.Pinto, Mansano & A.M.G.Azevedo","Pinto, R.B.",2017,"","1308","","Rocha, E.A.; Bezerra, E.; Bezerra, E.",2005,3,8,"Brazil","Pernambuco","Buíque","Parque Nacional do Catimbau, Sítio Serra Branca",-8.534722,-37.252778,"Árvore ca. 4 - 5m de altura, flores alvas, noturnas. Solo arenoso. Frequênte no local","Hymenaea cangaceira R.B.Pinto, Mansano & A.M.G.Azevedo","",,"GBIF"
"","UEFS","HUEFS","72860","Hymenaea cangaceira","","Fabaceae","Hymenaea","cangaceira","","R.B.Pinto, Mansano & A.M.G.Azevedo","R.B.Pinto",2017,"","171","","Oliveira, A.A.de",2003,5,22,"Brazil","Bahia","Canudos","Base I, Biodiversitas - Caminho para Gruta do Minadouro",-9.947778,-38.992222,,"Hymenaea cangaceira R.B.Pinto, Mansano & A.M.G.Azevedo","",,"GBIF"
"","UEFS","HUEFS","72591","Hymenaea cangaceira","","Fabaceae","Hymenaea","cangaceira","","R.B.Pinto, Mansano & A.M.G.Azevedo","R.B.Pinto",2017,"","7833","","Queiroz, L.P.de",2003,7,2,"Brazil","Bahia","Campo Alegre de Lourdes","Morro do Tuiuiu, ca. 10 Km NW de Campo Alegre de Lourdes na estrada para Caracol e Pitomba. Alto do morro com afloramento de rochas metamórficas com minério de ferro.",-9.483889,-43.872778,"Caatinga arbórea com solo argiloso, latosolo vermelho-amarelado.","Hymenaea cangaceira R.B.Pinto, Mansano & A.M.G.Azevedo","",,"GBIF"
"","UFPE","UFP","38991","Hymenaea cangaceira","","Fabaceae","Hymenaea","cangaceira","","R.B.Pinto, Mansano & A.M.G.Azevedo","Pinto, R.B.",2017,"","UFP38991","","Bezerra, E.L.S.; Lucena, E.",2003,12,16,"Brazil","Pernambuco","Buíque","Vale do Catimbau.Paraíso selvagem.",,,"Árvore, quiropterófila, flores alvas, odor adocicado.; Árvore, quiropterófila, flores alvas, odor adocicado.","Hymenaea cangaceira R.B.Pinto, Mansano & A.M.G.Azevedo","",,"GBIF"
"","UEFS","HUEFS","64249","Hymenaea cangaceira","","Fabaceae","Hymenaea","cangaceira","","R.B.Pinto, Mansano & A.M.G.Azevedo","R.B.Pinto",2017,"","7370","","Queiroz, L.P.de",2002,8,30,"Brazil","Bahia","Campo Alegre de Lourdes","Ca. de 7 Km W de Campo Alegre de Lourdes, na estrada para Pitomba, entrada ao lado de uma bomba d'água.",-9.485,-43.141944,"Caatinga arbórea aberta.","Hymenaea cangaceira R.B.Pinto, Mansano & A.M.G.Azevedo","",,"GBIF"
"","UEFS","HUEFS","45626","Hymenaea cangaceira","","Fabaceae","Hymenaea","cangaceira","","R.B.Pinto, Mansano & A.M.G.Azevedo","R.B.Pinto",2017,"","6244","","Queiroz, L.P.de",2000,5,21,"Brazil","Bahia","Campo Alegre de Lourdes","Morro da Carlota, ca. 7,6 km NW de Campo Alegre de Lurdes.",-9.484167,-43.0925,"Caatinga arbórea sobre solo argiloso com afloramentos rochosos ricos em minério de Ferro.","Hymenaea cangaceira R.B.Pinto, Mansano & A.M.G.Azevedo","",,"GBIF"
"","JBRJ","RB","RB00115890","Hymenaea cangaceira","","Fabaceae","Hymenaea","cangaceira","","R.B.Pinto, Mansano & A.M.G.Azevedo","R.B.Pinto , Mansano & A.M.G.Azevedo",2017,"","1841","","S.M. Faria; Cintia C.de Faria Costa, Nildo Oliveira de Souza & Adinivaldo Marques dos Santos",1999,9,29,"Brazil","Bahia","Bahia","Cocho AG Fora.",-11.199167,-40.486111,"Árvore com 5 metros de altura, com frutos, não foi observado a nodulação, colhido sementes, ocorrência de Ptorogyne nitens.","Hymenaea cangaceira R.B.Pinto, Mansano & A.M.G.Azevedo","",,"GBIF"
"","IPA","IPA","55209","Hymenaea cangaceira","","Fabaceae","Hymenaea","cangaceira","","R.B.Pinto, Mansano & A.M.G.Azevedo","Pinto, R.B.",2017,"","s.n.","","Braz, E.",1987,,,"Brazil","Paraíba","Campina Grande","Sertão do Cariri",,,,"Hymenaea cangaceira R.B.Pinto, Mansano & A.M.G.Azevedo","",,"GBIF"
"","JBRJ","RB","RB00140307","Hymenaea cangaceira","","Fabaceae","Hymenaea","cangaceira","","R.B.Pinto, Mansano & A.M.G.Azevedo","R.B.Pinto , Mansano & A.M.G.Azevedo",2017,"","16752","","R M Harley",1974,3,5,"Brazil","Bahia","Bahia","3 km NW of Lagoinha (5,5km SW of Delfino) on the side road to Minas do Mimoso. Cut over woodland, and by cultivation near river.",-10.45,-41.266667,"Tree to 10m. Leaves coriaceous, mid-green. Fruit hard, green, warted.","Hymenaea cangaceira R.B.Pinto, Mansano & A.M.G.Azevedo","",,"GBIF"
"","IPA","IPA","16111","Hymenaea cangaceira","","Fabaceae","Hymenaea","cangaceira","","R.B.Pinto, Mansano & A.M.G.Azevedo","Pinto, R.B.",2017,"","4922","","Andrade-Lima",1967,2,10,"Brazil","Pernambuco","Camocim de São Félix","Sítio Palmeira, ao pé de Lageiro gneissico",,,"Flores alvas","Hymenaea cangaceira R.B.Pinto, Mansano & A.M.G.Azevedo","",,"GBIF"
