"modified","institutionCode","collectionCode","catalogNumber","scientificName","identificationQualifier","family","genus","specificEpithet","infraspecificEpithet","scientificNameAuthorship","identifiedBy","dateIdentified","typeStatus","recordNumber","fieldNumber","recordedBy","year","month","day","country","stateProvince","municipality","locality","decimalLatitude","decimalLongitude","occurrenceRemarks","acceptedNameUsage","occurrenceID","comments","bibliographicCitation"
"","JBRJ","RB","RB01391894","Copaifera piresii","","Fabaceae","Copaifera","piresii","","Ducke","H.C. Lima",,"","2189","","Castro, W.; Oliveira, E.C.; Cunha-Neto, J.P.; Martins, J.C.; Silva, L.S.",2017,8,20,"Brazil","Rondônia","Vale do Anari","Reserva Biológica do Jaru, Unidade amostral 1 (Ponto amostral Oeste). Reserva Biológica do Jaru",-9.590555,-61.650556,"Árvore 40 m, DAP=820 mm  Placa:#422. Estéril","Copaifera piresii Ducke","",,"GBIF"
"","Universidade Federal de Mato Grosso","CNMT","5066","Copaifera piresii","","Fabaceae","Copaifera","piresii","","Ducke","Giacoppini, D.R",2015,"","380","","Santos, J.P.; França, A.L.; Giacoppini, D.R.;Silva, G.M.X.",2015,2,,"Brazil","Mato Grosso","Cotriguaçu","Fazenda São Nicolau.",-9.483,-55.819278,"Projeto Caracterização da Flora e Modelos de Restauração de Áreas de Preservação Permanete (APP'S) Degradadas no Estado do Mato Grosso.","Copaifera piresii Ducke","",,"GBIF"
"","UNEMAT","HERBAM","9401","Copaifera piresii","","Fabaceae","Copaifera","piresii","","Ducke","Silva, DR",2014,"","C107359","","Soares-Lopes, C R A; Benevides, L.C. & Freire, M.R.O.",2014,5,12,"Brazil","Mato Grosso","Alta Floresta","Área estrutural da UHE Salto Apiacás, margem direi, Afloramento Rochoso.",,,,"Copaifera piresii Ducke","",,"GBIF"
"","UNEMAT","HERBAM","9508","Copaifera piresii","","Fabaceae","Copaifera","piresii","","Ducke","Gvasconcelos",2014,"","CB 087466","","Soares-Lopes, C.R.A.; Benevides, L.C. & Freire, M.R.O.",2014,5,26,"Brazil","Mato Grosso","Alta Floresta","PCH Cabeça-de-boi, área B1, Afloramento Rochoso.",,,,"Copaifera piresii Ducke","",,"GBIF"
"","UNEMAT","HERBAM","9549","Copaifera piresii","","Fabaceae","Copaifera","piresii","","Ducke","Silva, DR",2014,"","CT 047507","","Soares-Lopes, C.R.A.; Benevides, L.C.; Freire, M.R.O. & Macedo, D.G.",2014,5,29,"Brazil","Mato Grosso","Alta Floresta","Área estrutural da PCH Cabeça-de-boi, margem esque, Área arenosa a margem do rio.",,,,"Copaifera piresii Ducke","",,"GBIF"
"","UNEMAT","HERBAM","9704","Copaifera piresii","","Fabaceae","Copaifera","piresii","","Ducke","Gvasconcelos",2014,"","CD 617662","","Soares-Lopes, C.R.A.; Macedo, D.G.",2014,6,16,"Brazil","Mato Grosso","Alta Floresta","Área de empréstimo da PCH da Fazenda, ilha da área, Floresta ombrófila.",,,,"Copaifera piresii Ducke","",,"GBIF"
"","UNEMAT","HERBAM","9966","Copaifera piresii","","Fabaceae","Copaifera","piresii","","Ducke","P. Assunção",2014,"","PA 37027924","","Soares-Lopes, C R A; Assunção, P.A.C.L.",2014,8,12,"Brazil","Mato Grosso","Alta Floresta","PCH Cabeça-de-boi, área próxima ao refeitório, mar, Mata Ciliar.",,,,"Copaifera piresii Ducke","",,"GBIF"
"","UNEMAT","HERBAM","10083","Copaifera piresii","","Fabaceae","Copaifera","piresii","","Ducke","P. Assunção",2014,"","CD 1338041","","Soares-Lopes, C.R.A.; Pereira, S.; Dos Reis, O.; Soares, D.S.; Trevisan, L.R.; Fernandes, E.; Rodrigue",2014,9,6,"Brazil","Mato Grosso","Alta Floresta","PCH Cabeça-de-boi, margem esquerda, B1, Afloramento rochoso",,,,"Copaifera piresii Ducke","",,"GBIF"
"","Universidade Federal de Mato Grosso","CNMT","4837","Copaifera piresii","","Fabaceae","Copaifera","piresii","","Ducke","Haroldo C.L.",2013,"","7738","","Haroldo, C.L.; Bonadeu, A.K.; Koch, L.E.A; Silva, S.; Maciel, L.; Lima S.R.",2013,8,23,"Brazil","Pará","Novo Progresso","Serra do Cachimbo, BR-163, Km 93.",-8.825556,-54.967778,"Frutos avermelhados e sementes com arilo amarelo. <ll>dwc_commonname:</ll> Copaiba. Doação herbário RJ - Jardim Botânico do Rio de Janeiro. RB 582934","Copaifera piresii Ducke","",,"GBIF"
"","JBRJ","RB","RB00800918","Copaifera piresii","","Fabaceae","Copaifera","piresii","","Ducke","Haroldo C. de Lima",2013,"","7738","","Haroldo C. de Lima; F. Bonadeu, A.K. Koch, L.E.A. Silva, S. Maciel, L. Lima & S.R. de Jesus",2013,8,23,"Brazil","Pará","Novo Progresso","Serra do Cachimbo, BR-163,Km 93. Campinarana.",-8.825556,-54.967778,"Árvore pequena com 7 metros de altura. Copa larga com 10 m diametro. Tronco com casca fissurada e pardacenta. Frutos avermelhados e sementes com arilo amarelo. Frequente. Material para DNA. Fotos HCL & FB.","Copaifera piresii Ducke","",,"GBIF"
"","Cenargen","CEN","73591","Copaifera piresii","","Fabaceae","Copaifera","piresii","","Ducke","M. Simon",2017,"","15121","","Glocimar Pereira-Silva",2010,3,22,"Brazil","Ro","PORTO VELHO","Cachoeira de Jirau.",-9.326944,-64.726388,"Botges florais verde ainda não abertos. Área de influência direta (lago).","Copaifera piresii Ducke","",,"GBIF"
"","Cenargen","CEN","89124","Copaifera piresii","","Fabaceae","Copaifera","piresii","","Ducke","J. B. Bringel",,"","344","","João Bernardo de Azevedo Bringel Jr.",2007,6,6,"Brazil","Pa","ALTAMIRA","Serra do Cachimbo; BR-163, trecho entre Guarantã do Norte (MT) e Castelo dos Sonhos (PA).",,,"Sementes negra.","Copaifera piresii Ducke","",,"GBIF"
"","K","Herbarium","K000834488","Copaifera piresii","","Fabaceae","Copaifera","piresii","","Ducke","Silva, R.C.V.M.",,"","8946","","Boise, J.; Nee, M.; Lopes, E.A.; Lima, R.P.; Ferreira, C.A.C.; Oliveira, J.G.; Coelho, J.A.",1987,4,29,"Brazil",,"Alvorada d´Oeste","BR-429 entre o Rio Machado e a cidade de Alvorada do Oeste a 22 km da cidade.",-11.25,-62.33,"Plantas coletadas em Rondônia","Copaifera piresii Ducke","",,"GBIF"
"","NY","NY","2062965","Copaifera piresii","","Fabaceae","Copaifera","piresii","","Ducke","J. Silva Costa",2013,"","4705","","C. A. Cid Ferreira",1984,6,22,"Brazil","Rondônia",,"BR 364, rodovia Cuiabá-Porto Velho, km 230, linha 09, ao longo da rodovia",-11.4421821022813,-61.4485147193313,,"Copaifera piresii Ducke","",,"GBIF"
"","Instituto Nacional de Pesquisas da Amazônia (INPA)","Coleção Botânica, Instituto Nacional de Pesquisas da Amazônia (INPA)","135678","Copaifera piresii","","Fabaceae","Copaifera","piresii","","Ducke","Martins-da-Silva, R.C.V.",2006,"","6300","","Mike Hopkins",1983,6,21,"Brazil","Rondônia",,"Rodovia Alvorada-Presidente Médici, linha 8, Km 15. Campinarana, solo aeenoso.",,,,"Copaifera piresii Ducke","",,"GBIF"
"","Instituto Nacional de Pesquisas da Amazônia (INPA)","Coleção Botânica, Instituto Nacional de Pesquisas da Amazônia (INPA)","79113","Copaifera piresii","","Fabaceae","Copaifera","piresii","","Ducke","Silva Costa, J. do",2013,"","2119","","Mike Hopkins",1977,6,13,"Brazil","Mato Grosso",,"Picadão que dá acesso do rio Juruena a pista do garimpo do mesmo nome.",,,,"Copaifera piresii Ducke","",,"GBIF"
"","NY","NY","2063114","Copaifera piresii","","Fabaceae","Copaifera","piresii","","Ducke","J. Silva Costa",2013,"","2119","","N. A. Rosa",1977,6,13,"Brazil","Mato Grosso",,"Picadão que da acesso do Rio Juruena a pista do garimpo do mesmo nome.",,,,"Copaifera piresii Ducke","",,"GBIF"
"","NY","NY","2063113","Copaifera piresii","","Fabaceae","Copaifera","piresii","","Ducke","J. Silva Costa",2013,"","2119","","N. A. Rosa",1977,6,13,"Brazil","Mato Grosso",,"Picadão que da acesso do Rio Juruena a pista do garimpo do mesmo nome.",,,,"Copaifera piresii Ducke","",,"GBIF"
"","Instituto Nacional de Pesquisas da Amazônia (INPA)","Coleção Botânica, Instituto Nacional de Pesquisas da Amazônia (INPA)","134826","Copaifera piresii","","Fabaceae","Copaifera","piresii","","Ducke","Martins-da-Silva, R.C.V.",2006,"","3256","","Mike Hopkins",1977,7,2,"Brazil","Mato Grosso",,"Rio Juruena, beira do rio.",,,,"Copaifera piresii Ducke","",,"GBIF"
"","Instituto Nacional de Pesquisas da Amazônia (INPA)","Coleção Botânica, Instituto Nacional de Pesquisas da Amazônia (INPA)","98632","Copaifera piresii","","Fabaceae","Copaifera","piresii","","Ducke","Martins-da-Silva, R.C.V.",2006,"","207","","Mike Hopkins",1974,9,1,"Brazil","Mato Grosso",,"Ponto 5 do Proj. RADAM, região de Juruena.  Terreno úmido. Campo cerrado. Mata Virgem.",,,,"Copaifera piresii Ducke","",,"GBIF"
"","MPEG","HERBMG","MG024232","Copaifera piresii","","Fabaceae","Copaifera","piresii","","Ducke",,,"",,"","Egler, W.A.",1960,1,28,"Brazil","Pará",,"Pará",,,,"Copaifera piresii Ducke","",,"GBIF"
"","NY","NY","2063108","Copaifera piresii","","Fabaceae","Copaifera","piresii","","Ducke","J. Silva Costa",2013,"","1185","","W. A. Egler",1960,1,28,"Brazil","Pará",,"Alto Tapajós, rio Cururú, campo arbóreo arenoso do Tabua.",,,,"Copaifera piresii Ducke","",,"GBIF"
"","NY","NY","2063109","Copaifera piresii","","Fabaceae","Copaifera","piresii","","Ducke","J. Silva Costa",2013,"","1185","","W. A. Egler",1960,1,28,"Brazil","Pará",,"Alto Tapajós, rio Cururú, campo arbóreo arenoso do Tabua.",,,,"Copaifera piresii Ducke","",,"GBIF"
"","MPEG","HERBMG","MG023688","Copaifera piresii","","Fabaceae","Copaifera","piresii","","Ducke","Pires, J.M.",,"",,"","Egler, W.A.",1958,7,13,"Brazil","Pará",,"Pará",,,,"Copaifera piresii Ducke","",,"GBIF"
"","NY","NY","2063115","Copaifera piresii","","Fabaceae","Copaifera","piresii","","Ducke","J. Silva Costa",2013,"","14445","","E. Y. Dawson",1956,4,19,"Brazil","Goiás",,"Region of the Chapada dos Veadeiros at 16 km north of Sao Joao da Aliança",-14.5,-47.5,,"Copaifera piresii Ducke","",,"GBIF"
"","Instituto Nacional de Pesquisas da Amazônia (INPA)","Coleção Botânica, Instituto Nacional de Pesquisas da Amazônia (INPA)","2571","Copaifera piresii","","Fabaceae","Copaifera","piresii","","Ducke","Silva, M.F. da",1969,"","3876","","Mike Hopkins",1952,1,8,"Brazil","Pará",,"Rio São Miguel, Posto dos Índios Caiabí",,,,"Copaifera piresii Ducke","",,"GBIF"
"","NY","NY","4276","Copaifera piresii","","Fabaceae","Copaifera","piresii","","Ducke",,,"","3876","","J. M. Pires",1952,1,8,"Brazil","Pará",,"Rio Sao Manoel, Posto dos Indios Caiabí",,,,"Copaifera piresii Ducke","",,"GBIF"
"",,"Botany","U.1606690","Copaifera piresii","","Fabaceae","Copaifera","piresii","","Ducke","Costa J",2016,"",,"","Lemos Fróes R de",1949,5,10,"Brazil","Maranhão",,"Plantas do Brasil. Estado do Maranhão. São Luiz; capoeira.",,,,"Copaifera piresii Ducke","",,"GBIF"
"","F","Botany","V0110782F","Copaifera piresii","","Fabaceae","Copaifera","piresii","","Ducke",,,"",,"",,,,,"Brazil",,,,-10.8339,-52.8731,,"Copaifera piresii Ducke","",,"GBIF"
"","F","Botany",,"Copaifera piresii","","Fabaceae","Copaifera","piresii","","Ducke","RRC ID Flag",2006,"","8946","","C. A. Cid Ferreira",,,,"Brazil","Rondônia",,,,,,"Copaifera piresii Ducke","",,"GBIF"
"",,"Botany","U.1606693","Copaifera piresii","","Fabaceae","Copaifera","piresii","","Ducke","Costa J",2016,"",,"","Rosa NA; Santos MR dos; Silva MC da",,,,"Brazil","Amazonas",,"Plantas da Amazônia. Margens da Br - 429 Pte. Médici Costa Marques a altura dos kilometros 32 e 33 entre as linhas 7 e 8, município de Pte. Medici-Rondônia. Cerrado tipo campina solo brejado.",,,,"Copaifera piresii Ducke","",,"GBIF"
"",,"Botany","U.1606691","Copaifera piresii","","Fabaceae","Copaifera","piresii","","Ducke","Costa J",2016,"",,"","Krukoff BA; Lemos Fróes R de",,,,"Brazil","Maranhão",,"Brazil: State of Maranhão: Island of São Luiz.  Sao Luiz.",,,,"Copaifera piresii Ducke","",,"GBIF"
"",,"Botany","U.1606692","Copaifera piresii","","Fabaceae","Copaifera","piresii","","Ducke","Costa J",2016,"",,"","Krukoff BA; Lemos Fróes R de",,,,"Brazil","Maranhão",,"Brazil: State of Maranhão: Island of São Luiz.",,,,"Copaifera piresii Ducke","",,"GBIF"
"",,"Botany","U.1606689","Copaifera piresii","","Fabaceae","Copaifera","piresii","","Ducke","Costa J",2016,"",,"","Krukoff BA; Lemos Fróes R de",,,,"Brazil","Maranhão",,"Brazil: State of Maranhão: Island of São Luiz.",,,,"Copaifera piresii Ducke","",,"GBIF"
