"modified","institutionCode","collectionCode","catalogNumber","scientificName","identificationQualifier","family","genus","specificEpithet","infraspecificEpithet","scientificNameAuthorship","identifiedBy","dateIdentified","typeStatus","recordNumber","fieldNumber","recordedBy","year","month","day","country","stateProvince","municipality","locality","decimalLatitude","decimalLongitude","occurrenceRemarks","acceptedNameUsage","occurrenceID","comments","bibliographicCitation"
"","UNICAMP","UEC","201441","Ormosia minor","","Fabaceae","Ormosia","minor","","Vogel","Silva, BG",2018,"","433","","Silva, BG; Bissoli, VF; Duarte, LSC",2018,4,26,"Brazil","São Paulo","Jundiaí",,-23.413194,-47.569864,,"Ormosia minor Vogel","",,"GBIF"
"","UNICAMP","UEC","189055","Ormosia minor","","Fabaceae","Ormosia","minor","","Vogel",,,"","188","","Silva, BG; Koch, I; Castello, ACD; Vidal Junior, JD",2015,1,6,"Brazil","São Paulo","São Miguel Arcanjo","Parque Estadual Carlos Botelho",-24.065278,-47.999167,"Árvore, 12 m de altura e 18,5 cm de DAP; Floresta Ombrófila Densa","Ormosia minor Vogel","",,"GBIF"
"","Cenargen","CEN","93095","Ormosia minor","","Fabaceae","Ormosia","minor","","Vogel","H. C. Lima",2017,"","14","","T. P. Pires",2013,3,25,"Brazil","Sp","JUNDIAI","Serra do Japi, marco geodésico; -23.244764 N; +46.941157 L (coordenada: medida).",,,"Projeto de Coleta de Sementes do Jardim Botânico de Jundiaí, coordenadas do material: 23K 301441, 7428101. Doação do Herbário IAC 54.138.","Ormosia minor Vogel","",,"GBIF"
"","Escola Superior de Agricultura Luiz de Queiroz, ESALQ","ESA","123617","Ormosia minor","","Fabaceae","Ormosia","minor","","Vogel",,,"","1005","","Colletta, G.D. ; Souza, V.C.",2013,4,29,"Brazil","São Paulo","Tapiraí","Reserva Particular da Votorantim (CBA). UHE da Barra.",,,"Trepadeira","Ormosia minor Vogel","",,"GBIF"
"","NY","NY","1009366","Ormosia minor","","Fabaceae","Ormosia","minor","","Vogel","B. M. Torke",2015,"","3531","","P. Fiaschi",2011,1,22,"Brazil","Espírito Santo",,"Chaves. ES-080 (estrada não-pavimentada ligando a ES-261 à cidade de Santa Leopoldina), 8 km S da ES-261, num ramal de 1 km de extensão rumo à Cachoeira do REcanto, no Rio da Prata (afluente do Rio Santa Maria).",-20.00128,-40.54603,,"Ormosia minor Vogel","",,"GBIF"
"","UNICAMP","UEC","199814","Ormosia minor","","Fabaceae","Ormosia","minor","","Vogel","Reis, TR",2012,"","14","","Reis, TR; Silva, ED; Lima, JL; Purgato, NS; Galvão, JC",2011,6,1,"Brazil","São Paulo","Jundiaí","Marco Geodésico.",,,"Árvore, 5m. Vegetativo.","Ormosia minor Vogel","",,"GBIF"
"","UNICAMP","UEC","199813","Ormosia minor","","Fabaceae","Ormosia","minor","","Vogel","Reis, TR",2012,"","16","","Reis, TR; Silva, ED; Lima, JL; Purgato, NS; Galvão, JC",2011,6,1,"Brazil","São Paulo","Jundiaí","Caminho para o Marco Geodésico.",,,"Árvore, 5m. Frutos.","Ormosia minor Vogel","",,"GBIF"
"","UNICAMP","UEC","192516","Ormosia minor","","Fabaceae","Ormosia","minor","","Vogel","Reis, TR",2012,"","8a","","Purgato, NCS; Silva, ED",2011,6,1,"Brazil","São Paulo","Jundiaí","Brasil, São Paulo, Jundiaí, Serra do Japi.",,,,"Ormosia minor Vogel","",,"GBIF"
"","UNICAMP","UEC","200157","Ormosia minor","","Fabaceae","Ormosia","minor","","Vogel",,,"","M152","","Padgurschi, MCG; Belinello, R",2009,,,"Brazil","São Paulo","São Luiz do Paraitinga","Parque Estadual da Serra do Mar",-23.4,-45.183333,"Parcela M - Projeto Biota-FAPESP. Árvore com 8 metros de altura. Frequência da espécie na parcela: n=9","Ormosia minor Vogel","",,"GBIF"
"","UNICAMP","UEC","186034","Ormosia minor","","Fabaceae","Ormosia","minor","","Vogel","Silva, E",2009,"","78","","Padgurschi, MCG; Tamashiro, JY; Belinello, R",2008,7,12,"Brazil","São Paulo","São Luiz do Paraitinga","PESM - Núcleo Santa Virgínia - Parcela K",-23.325,-45.068333,"Árvore, ca. 12m, material vegetativo. Projeto Biota Gradiente Funcional: Parcela K, indivíduo K0083; Floresta Ombrófila Densa Montana","Ormosia minor Vogel","",,"GBIF"
"","UNICAMP","UEC","172634","Ormosia minor","","Fabaceae","Ormosia","minor","","Vogel","Silva, ED",2007,"","617","","Silva, ED",2006,12,19,"Brazil","São Paulo","Ubatuba","Núcleo Santa Virgínia, Parque Estadual da Serra do Mar.",,,"Árvore 12m, frutos maduros.; Trilha do Poço do Pito, floresta ombrófila densa montana.","Ormosia minor Vogel","",,"GBIF"
"","Escola Superior de Agricultura Luiz de Queiroz, ESALQ","ESA","104255","Ormosia minor","","Fabaceae","Ormosia","minor","","Vogel","Souza, V.C.",2012,"","1149","","Aguiar, O.T.",2002,3,12,"Brazil","São Paulo","São Miguel Arcanjo",,,,,"Ormosia minor Vogel","",,"GBIF"
"","Universidade Federal de Minas Gerais","BHCB","60518","Ormosia minor","","Fabaceae","Ormosia","minor","","Vogel",,2014,"","3691","","Oliveira, AA; Stella, A; Siqueira, LP; Muniz, MRA; Souza, PCA; Vaz da Silva, PP; Souza, SC; P",2000,4,25,"Brazil","São Paulo","Salesópolis","Parque Estadual da Serra do Mar, estrada intermediária, Km 45",-23.633333,-45.683333,"Árvore, 4m altura. Frutos imaturos castanhos; Interior de mata. Floresta ombrófila densa com diferentes graus de degradação","Ormosia minor Vogel","",,"GBIF"
"","UNICAMP","UEC","115103","Ormosia minor","","Fabaceae","Ormosia","minor","","Vogel",,,"","816","","Leite, EC",1999,2,2,"Brazil","São Paulo","Jundiaí","Reserva Biológica Municipal da Serra do",-23.25,-46.25,"folha, 8,5m.","Ormosia minor Vogel","",,"GBIF"
"","JBRJ","RB","RB00843520","Ormosia minor","","Fabaceae","Ormosia","minor","","Vogel","V.C. Souza",2012,"","950","","P.L.R. Moraes; H.C. Lima; C.C. Diniz; D.S. Farias",1997,4,23,"Brazil","São Paulo","São Miguel Arcanjo","Parque Estadual de Carlos Botelho.",,,"Árvore, ca. 15m, frutos imaturos, beira de estrada, local aberto","Ormosia minor Vogel","",,"GBIF"
"","UEFS","HUEFS","177501","Ormosia minor","","Fabaceae","Ormosia","minor","","Vogel",,,"","5025","","Lima, H.C.de",1995,3,18,"Brazil","Rio de Janeiro","Casimiro de Abreu","Serra Mar, ca. 5Km, Faz. Santa Rosa, Margens do Rio Macaé.",,,,"Ormosia minor Vogel","",,"GBIF"
"","MBML","MBML-HERBARIO","42709","Ormosia minor","","Fabaceae","Ormosia","minor","","Vogel","J.E. Meireles & H.C. de Lima/VI-2011",,"","5025","","H. C. de Lima; F. Garcia & G. Laurentino",1995,3,18,"Brazil","Rio de Janeiro","Casimiro de Abreu","Serra Mar, ca 5km, Faz. Santa Rosa, margens do Rio Macaé",,,"Árvore 8m alt., tronco com casca pardacenta, levemente fissurada. Frutos jovens ferrugineo-pilosos. Ocasional","Ormosia minor Vogel","",,"GBIF"
"","NY","NY","2480384","Ormosia minor","","Fabaceae","Ormosia","minor","","Vogel",,,"","5025","","H. C. de Lima",1995,3,18,"Brazil","Rio de Janeiro",,"Area de Proteção Ambiental de Macaé de Cima. Reserva Ecológica de Macaé de Cima, estrada para Macaé de Cima, cerca de 2 km após o Hotel Garlip",,,,"Ormosia minor Vogel","",,"GBIF"
"","Escola Superior de Agricultura Luiz de Queiroz, ESALQ","ESA","116279","Ormosia minor","","Fabaceae","Ormosia","minor","","Vogel","Meireles, J.E.",2011,"","5025","","Lima, H.C.",1995,3,18,"Brazil","Rio de Janeiro","Casemiro de Abreu",,,,,"Ormosia minor Vogel","",,"GBIF"
"","UNICAMP","UEC","128391","Ormosia minor","","Fabaceae","Ormosia","minor","","Vogel","Lima, HC",2001,"","s.n.","","Pirani, JR; Mello-Silva, R; et al.",1995,7,18,"Brazil","São Paulo","Jundiaí","Trilha do Mirante",,,"Árvore 6m alt., na mata semidecídua de altitude, solo pedregoso, perto do velho observatório astronômico, a ca. 1150m altitude. Frutos imaturos.","Ormosia minor Vogel","",,"GBIF"
"","Instituto de Botânica","SP","309384","Ormosia minor","","Fabaceae","Ormosia","minor","","Vogel",,,"","3625","","Pirani, JR; Mello-Silva, R; et al.",1995,7,18,"Brazil","São Paulo","Jundiaí","Serra do Japí, trilha do Mirante",,,,"Ormosia minor Vogel","",,"GBIF"
"","Escola Superior de Agricultura Luiz de Queiroz, ESALQ","ESA","14800","Ormosia minor","","Fabaceae","Ormosia","minor","","Vogel","Souza, V.C.",2012,"","950","","Moraes, P.L.R. et al.",1994,4,23,"Brazil","São Paulo","São Miguel Arcanjo",,,,,"Ormosia minor Vogel","",,"GBIF"
"","Escola Superior de Agricultura Luiz de Queiroz, ESALQ","ESA","108687","Ormosia minor","","Fabaceae","Ormosia","minor","","Vogel","Souza, V.C.",2012,"","518","","Dias, A.C.",1994,4,6,"Brazil","São Paulo","São Miguel Arcanjo",,,,,"Ormosia minor Vogel","",,"GBIF"
"","Escola Superior de Agricultura Luiz de Queiroz, ESALQ","ESA","13238","Ormosia minor","","Fabaceae","Ormosia","minor","","Vogel",,,"","544","","Barreto, K.D. et al.",1993,5,21,"Brazil","São Paulo","Charqueada",,,,,"Ormosia minor Vogel","",,"GBIF"
"","UNICAMP","UEC","80424","Ormosia minor","","Fabaceae","Ormosia","minor","","Vogel","Lima, HC",2001,"","185","","Leite, EC; Oliveira, A",1993,9,1,"Brazil","São Paulo","São Roque","Mata da Câmara, mata mesófila semidecídual",-23.523889,-48.080556,"folha, 5m alt., nome popular: ""olho de cabra""","Ormosia minor Vogel","",,"GBIF"
"","Comissão Executiva do Plano da Lavoura Cacaueira","CEPEC","39970","Ormosia minor","","Fabaceae","Ormosia","minor","","Vogel","H. C. de Lima",,"","2640","","H. C. de Lima",1992,2,3,"Brazil","Rio de Janeiro","MACAÉ","Estr. p/ Glicerio, prox. a Represa de Macabu.",,,,"Ormosia minor Vogel","",,"GBIF"
"","UNICAMP","UEC","128390","Ormosia minor","","Fabaceae","Ormosia","minor","","Vogel","Lima, HC",2001,"","686","","Moraes, PLR",1992,5,15,"Brazil","São Paulo","São Miguel Arcanjo","Parque Estadual Carlos Botelho",-24.058333,-47.989722,"Árvore, +- 25m de altura, meio de encosta, frutos cápsula, marrom-claro.","Ormosia minor Vogel","",,"GBIF"
"","JBRJ","RB","RB00180826","Ormosia minor","","Fabaceae","Ormosia","minor","","Vogel","H. C. de Lima",,"","686","","Moraes, Pedro L. R. de",1992,5,15,"Brazil","São Paulo","São Miguel Arcanjo","Parque Estadual Carlos Botelho. Parque Estadual Carlos Botelho",,,"Árvore, ca. 25m de altura, frutos cápsula, marrom-claro.","Ormosia minor Vogel","",,"GBIF"
"","Escola Superior de Agricultura Luiz de Queiroz, ESALQ","ESA","7515","Ormosia minor","","Fabaceae","Ormosia","minor","","Vogel","Lima, H.C.",2001,"","686","","Moraes, P.L.R.",1992,5,15,"Brazil","São Paulo","São Miguel Arcanjo",,,,,"Ormosia minor Vogel","",,"GBIF"
"","UEFS","HUEFS","50467","Ormosia minor","","Fabaceae","Ormosia","minor","","Vogel",,,"",,"","Rodrigues, R.R.",1986,4,30,"Brazil","São Paulo","Jundiaí","Serra do Japi - Estrada da Ermida.",,,,"Ormosia minor Vogel","",,"GBIF"
"","MBM","MBM","251486","Ormosia minor","","Fabaceae","Ormosia","minor","","Vogel","Sartori, A",,"","s.n.","","Rodrigues, RR",1986,4,30,"Brazil","São Paulo","Jundiaí","Serra do Japi",,,,"Ormosia minor Vogel","",,"GBIF"
"","Escola Superior de Agricultura Luiz de Queiroz, ESALQ","ESA","7256","Ormosia minor","","Fabaceae","Ormosia","minor","","Vogel",,1997,"",,"","Rodrigues, R.R.",1986,4,30,"Brazil","São Paulo","Jundiaí",,,,,"Ormosia minor Vogel","",,"GBIF"
"","UNICAMP","UEC","40333","Ormosia minor","","Fabaceae","Ormosia","minor","","Vogel",,,"","16828","","Morellato-Fonzar, LPC; Rodrigues, RR",1985,1,23,"Brazil","São Paulo","Jundiaí","Serra do Japi, Mirante",,,"flor, Árvore de 3m de altura, flores cor lilás.","Ormosia minor Vogel","",,"GBIF"
"","Escola Superior de Agricultura Luiz de Queiroz, ESALQ","ESA","7245","Ormosia minor","","Fabaceae","Ormosia","minor","","Vogel","Lima, H.C.",2001,"",,"","Rodrigues, R.R. ; Morellato-Fonzar, L.P.C.",1985,2,5,"Brazil","São Paulo","Jundiaí",,,,,"Ormosia minor Vogel","",,"GBIF"
"","Instituto Nacional de Pesquisas da Amazônia (INPA)","Coleção Botânica, Instituto Nacional de Pesquisas da Amazônia (INPA)","139167","Ormosia minor","","Fabaceae","Ormosia","minor","","Vogel","""Lima, H.C. de; Fontella, J.""",1986,"","2640","","Mike Hopkins",1985,12,2,"Brazil","Rio de Janeiro",,"Estrada para Glicério, próximo a Represa de Macabú.",,,,"Ormosia minor Vogel","",,"GBIF"
"","NY","NY","607990","Ormosia minor","","Fabaceae","Ormosia","minor","","Vogel","H. C. de Lima; J. Fontella Pereira",1986,"","2640","","H. C. de Lima",1985,12,2,"Brazil","Rio de Janeiro",,"Estrada p/Glicério, próximo a Represa de Macabú",-22.3746522218962,-41.7867701287175,,"Ormosia minor Vogel","",,"GBIF"
"","K","Herbarium","K000892486","Ormosia minor","","Fabaceae","Ormosia","minor","","Vogel","Lima, H.C. de; Fontella, J.",,"","2640","","Lima, H.C.; Lima, M.P.M.",1985,12,2,"Brazil",,"Macaé","Estrada Glicério, próximo a Represa de Macabú.",,,,"Ormosia minor Vogel","",,"GBIF"
"","UNICAMP","UEC","34026","Ormosia minor","","Fabaceae","Ormosia","minor","","Vogel","Mantovani, W",1983,"","15553","","Sugiyama, M; Chiea, SC",1983,9,22,"Brazil","São Paulo","Jundiaí","Serra do Japi.",,,"fruto, Árvore de 10m de alt., com frutos.","Ormosia minor Vogel","",,"GBIF"
"","UNICAMP","UEC","8658","Ormosia minor","","Fabaceae","Ormosia","minor","","Vogel","Rodrigues, RR",,"","1608","","Leitão Filho, HF; Martins, FR; Semir, J; Shepherd, GJ; Gibbs, PE",1976,1,21,"Brazil","São Paulo","Jundiaí","Nativo em mata no alto da Serra do Japi.",,,"fruto, Árvore 5 metros, fim frutificação, sementes vermelhas.","Ormosia minor Vogel","",,"GBIF"
"","US","Botany","2676490","Ormosia minor","","Fabaceae","Ormosia","minor","","Vogel",,,"","10458","","G. T. Prance",1969,4,2,"Brazil","São Paulo",,"State of Sao Paulo, Alto da Biological Reserva, Paranapiacaba, Sao Paulo, Montane forest",,,,"Ormosia minor Vogel","",,"GBIF"
"","US","Botany","2561442","Ormosia minor","","Fabaceae","Ormosia","minor","","Vogel",,,"","10458","","G. T. Prance",1969,4,2,"Brazil","São Paulo",,"State of Sao Paulo, Alto da Biological Reserva, Paranapiacaba, Sao Paulo, Montane forest",,,,"Ormosia minor Vogel","",,"GBIF"
"","NY","NY","607991","Ormosia minor","","Fabaceae","Ormosia","minor","","Vogel","C. H. Stirton",1990,"","10458","","G. T. Prance",1969,4,2,"Brazil","São Paulo",,"Alto da Biological Reserve, Paranapiacaba",,,,"Ormosia minor Vogel","",,"GBIF"
"",,"Botany","U.1312352","Ormosia minor","","Fabaceae","Ormosia","minor","","Vogel",,,"",,"","Prance GT",1969,4,2,"Brazil",,,"State of São Paulo. Alto da Biological reserve, Paranapiacaba, São Paulo.",,,,"Ormosia minor Vogel","",,"GBIF"
"","IAC","IAC","19689","Ormosia minor","","Fabaceae","Ormosia","minor","","Vogel","H.F. Leitão Filho",1967,"","s/nº","","H.M. Souza",1967,11,5,"Brazil","São Paulo","Sorocaba",,-23.5017,-47.4581,"Observar que as folhas não muito maiores por serem de ramos novos. Duplicata n.19603","Ormosia minor Vogel","",,"GBIF"
"","US","Botany","2600285","Ormosia minor","","Fabaceae","Ormosia","minor","","Vogel",,,"","s.n.","","O. Handro",1965,2,25,"Brazil","São Paulo",,"Forest in park, Instituti de Botanica, Sao Paulo",,,,"Ormosia minor Vogel","",,"GBIF"
"","JBRJ","RB","RB00180824","Ormosia minor","","Fabaceae","Ormosia","minor","","Vogel","H. C. de Lima",1985,"","4636","","A. P. Duarte; Ed. Pereira",1959,3,24,"Brazil","Distrito Federal","Distrito Federal","entre Paulo e Virginia e Restaurante dos Esquilos.",,,"Árvore de 8-12 metros ca.. Frutífero.","Ormosia minor Vogel","",,"GBIF"
"","MO","MO","3205707","Ormosia minor","","Fabaceae","Ormosia","minor","","Vogel","C.H. Stirton",1987,"","Paulo 3715","","S. Paulo",1950,2,7,"Brazil","São Paulo",,"Capital.",,,,"Ormosia minor Vogel","",,"GBIF"
"","MO","MO","3205786","Ormosia minor","","Fabaceae","Ormosia","minor","","Vogel","C.H. Stirton.",1987,"","Paulo 3094","","S. Paulo",1950,7,17,"Brazil","São Paulo",,"Capital.",,,,"Ormosia minor Vogel","",,"GBIF"
"","JBRJ","RB","RB00180849","Ormosia minor","","Fabaceae","Ormosia","minor","","Vogel","W. Hoehne",,"","11704","","M.A. Pereira",1947,4,8,"Brazil","São Paulo","São Paulo","Parque Estadual.",,,"árvore","Ormosia minor Vogel","",,"GBIF"
"","USP","SPF","11704","Ormosia minor","","Fabaceae","Ormosia","minor","","Vogel","Hoehne, W",,"","s.n.","","Pereira, MA",1947,4,8,"Brazil","São Paulo","São Paulo","Parque do Estado",,,,"Ormosia minor Vogel","",,"GBIF"
"","IAC","IAC","6816","Ormosia minor","","Fabaceae","Ormosia","minor","","Vogel","A.L.B. Sartori",1997,"","s/nº","","P. Zink",1942,8,30,"Brazil","São Paulo","Campinas","Sousas, Três Ilhas",-22.87921,-46.96441,,"Ormosia minor Vogel","",,"GBIF"
"","F","Botany","V0372772F","Ormosia minor","","Fabaceae","Ormosia","minor","","Vogel","RRC ID Flag",1987,"","6443","","F. Lopes",1934,6,,"Brazil","São Paulo",,,-22,-49,,"Ormosia minor Vogel","",,"GBIF"
"","MO","MO","3205872","Ormosia minor","","Fabaceae","Ormosia","minor","","Vogel","A. Ducke",1938,"","Hoehne s.n.","","F.C. Hoehne",1932,1,12,"Brazil","São Paulo",,"Capital, nativa no Parque do Estado e jardim Botânico.",,,,"Ormosia minor Vogel","",,"GBIF"
"","JBRJ","RB","RB00180819","Ormosia minor","","Fabaceae","Ormosia","minor","","Vogel","A. Ducke",,"","13323","","F. C Hoehne",1932,1,12,"Brazil","São Paulo","São Paulo","Parque Estadual.",,,"Árvore, flores roxas.","Ormosia minor Vogel","",,"GBIF"
"","JBRJ","RB","RB00180842","Ormosia minor","","Fabaceae","Ormosia","minor","","Vogel","A. Ducke",1938,"",,"","Hoehne",1932,1,12,"Brazil","São Paulo","São Paulo",,,,,"Ormosia minor Vogel","",,"GBIF"
"","USP","SPF","13323","Ormosia minor","","Fabaceae","Ormosia","minor","","Vogel","Ducke, A",,"","s.n.","","Hoehne, FC",1932,1,12,"Brazil","São Paulo","São Paulo","Parque do Estado",,,,"Ormosia minor Vogel","",,"GBIF"
"","US","Botany","2678601","Ormosia minor","","Fabaceae","Ormosia","minor","","Vogel",,,"","s.n.","","F. C. Hoehne",1932,1,12,"Brazil","São Paulo",,"Proc. Brasil, Estado do Sao Paulo: Capital, nativa no Parque do Estado e Jardim Botanico",,,,"Ormosia minor Vogel","",,"GBIF"
"","US","Botany","1604297","Ormosia minor","","Fabaceae","Ormosia","minor","","Vogel",,,"","N28688","","F. C. Hoehne",1932,1,12,"Brazil","São Paulo",,"Jardim Botanico, Sao Paulo",,,,"Ormosia minor Vogel","",,"GBIF"
"","NY","NY","607992","Ormosia minor","","Fabaceae","Ormosia","minor","","Vogel","W. A. Ducke",1938,"","s/n¦","","F. C. Hoehne",1932,1,12,"Brazil","São Paulo",,"Capital, nativa no Parque do Estado e Jardim Botânico",-23.654505,-46.621883,,"Ormosia minor Vogel","",,"GBIF"
"","NY","NY","607994","Ormosia minor","","Fabaceae","Ormosia","minor","","Vogel","B. A. Krukoff",1941,"","s.n.","","F. C. Hoehne",1932,1,12,"Brazil","São Paulo",,"Jardim Botanico",-23.646109,-46.618358,,"Ormosia minor Vogel","",,"GBIF"
"","NY","NY","607993","Ormosia minor","","Fabaceae","Ormosia","minor","","Vogel","W. A. Ducke",1938,"","s/n¦","","F. C. Hoehne",1932,1,12,"Brazil","São Paulo",,"Capital, nativa no Parque do Estado e Jardim Botânico",-23.654505,-46.621883,,"Ormosia minor Vogel","",,"GBIF"
"","NY","NY","607995","Ormosia minor","","Fabaceae","Ormosia","minor","","Vogel","W. A. Ducke",1939,"","s.n.","","F. C. Hoehne",1932,1,12,"Brazil","São Paulo",,,,,"[Collection information from duplicate sheet]","Ormosia minor Vogel","",,"GBIF"
"","Instituto de Botânica","SP","28688","Ormosia minor","","Fabaceae","Ormosia","minor","","Vogel","Custodio Filho, A",,"","s.n.","","Hoehne, FC",1932,1,12,"Brazil","São Paulo","São Paulo","Parque do Estado, Jardim Botânico",,,,"Ormosia minor Vogel","",,"GBIF"
"","MNHN","P","P03101167","Ormosia minor","","Fabaceae","Ormosia","minor","","Vogel",,,"",,"","Hoehne, F.C.",1932,1,12,"Brazil","São Paulo",,,,,,"Ormosia minor Vogel","",,"GBIF"
"","K","Herbarium","K000892485","Ormosia minor","","Fabaceae","Ormosia","minor","","Vogel","Ducke, A.",,"","s.n.","","Hoene, F.C.",1932,1,12,"Brazil",,"São Paulo","Nativa no Parque do Estado e Jardim Botânico.",,,,"Ormosia minor Vogel","",,"GBIF"
"","Instituto de Botânica","SP","8480A","Ormosia minor","","Fabaceae","Ormosia","minor","","Vogel","Ducke, A",1938,"","s.n.","","Hoehne, FC",1925,2,23,"Brazil","São Paulo","Santo André","Alto da Serra, Estação Biológica",,,,"Ormosia minor Vogel","",,"GBIF"
"","Instituto de Botânica","SP","8480","Ormosia minor","","Fabaceae","Ormosia","minor","","Vogel","Ducke, A",1938,"","s.n.","","Hoehne, FC",1925,2,23,"Brazil","São Paulo","Santo André","Alto da Serra, Estação Biológica",,,,"Ormosia minor Vogel","",,"GBIF"
"","JBRJ","RB","RB00180828","Ormosia minor","","Fabaceae","Ormosia","minor","","Vogel","A. Ducke",,"",,"","J. G. Kuhlmann",1922,9,30,"Brazil","São Paulo","Santo André","Alto da Serra.",,,,"Ormosia minor Vogel","",,"GBIF"
"","Instituto de Botânica","SP","1247","Ormosia minor","","Fabaceae","Ormosia","minor","","Vogel","Sartori, A",1997,"","s.n.","","Hoehne, FC",1918,1,8,"Brazil","São Paulo","São Paulo","Butantan",,,,"Ormosia minor Vogel","",,"GBIF"
"","Instituto de Botânica","SP","743","Ormosia minor","","Fabaceae","Ormosia","minor","","Vogel","Handro, O",1952,"","s.n.","","Hoehne, FC",1917,10,20,"Brazil","São Paulo","Santo André","Alto da Serra, Estação Biológica",,,,"Ormosia minor Vogel","",,"GBIF"
"","MN","R","1557","Ormosia minor","","Fabaceae","Ormosia","minor","","Vogel","Rudd, V.E.",1959,"","s.n.","","Andrade, N.",1915,12,,"Brazil","São Paulo",,,,,,"Ormosia minor Vogel","",,"GBIF"
"","MO","MO","3205831","Ormosia minor","","Fabaceae","Ormosia","minor","","Vogel","C.H. Stirton",1987,"","Sellow 353","","F. Sellow",1814,,,"Brazil",,,,,,,"Ormosia minor Vogel","",,"GBIF"
"","MBM","MBM","91247","Ormosia minor","","Fabaceae","Ormosia","minor","","Vogel","Ducke, A",,"","s.n.","","Hoehne, FC",,,,"Brazil","São Paulo","São Paulo","Parque Estadual",,,,"Ormosia minor Vogel","",,"GBIF"
"","MBM","MBM","218375","Ormosia minor","","Fabaceae","Ormosia","minor","","Vogel",,,"","s.n.","","Hoehne, FC",,,,"Brazil","São Paulo","São Paulo","Parque Estadual",,,,"Ormosia minor Vogel","",,"GBIF"
"","B","FMNH-B-Types","1912","Ormosia minor","","Fabaceae","Ormosia","minor","","Vogel",,,"","353","","F. Sellow",,,,"Brazil",,,,,,,"Ormosia minor Vogel","",,"GBIF"
"","F","Botany","V0059621F","Ormosia minor","","Fabaceae","Ormosia","minor","","Vogel",,,"","353","","F. Sellow",,,,"Brazil",,,,-10.8339,-52.8731,,"Ormosia minor Vogel","",,"GBIF"
"","F","Botany",,"Ormosia minor","","Fabaceae","Ormosia","minor","","Vogel",,,"","2640","","de Lima & de Lima",,,,"Brazil",,,,-10.8339,-52.8731,,"Ormosia minor Vogel","",,"GBIF"
"","F","Botany",,"Ormosia minor","","Fabaceae","Ormosia","minor","","Vogel",,,"","353","","F. Sellow",,,,"Brazil",,,,-10.8339,-52.8731,,"Ormosia minor Vogel","",,"GBIF"
"","JBRJ","RB","RB00180832","Ormosia minor","","Fabaceae","Ormosia","minor","","Vogel","A. Ducke",,"",,"","Navarro de Andrade",,,,"Brazil","São Paulo","Santo André","Alto da Serra. Do Herb. Museu Nacional 1557.",,,,"Ormosia minor Vogel","",,"GBIF"
"","W","Herbarium W","0067810","Ormosia minor","","Fabaceae","Ormosia","minor","","Vogel",,,"",,"","REFLORA provisional entry",,,,"Brazil",,,,,,,"Ormosia minor Vogel","",,"GBIF"
"","W","Herbarium W","2010-0013915","Ormosia minor","","Fabaceae","Ormosia","minor","","Vogel",,,"",,"","REFLORA provisional entry",,,,"Brazil",,,,,,,"Ormosia minor Vogel","",,"GBIF"
"","Instituto de Botânica","SP","31830","Ormosia minor","","Fabaceae","Ormosia","minor","","Vogel","Ducke, A",1938,"","250","","Koscinsky, M",,,,"Brazil","São Paulo","São Paulo","Serra da Cantareira",,,,"Ormosia minor Vogel","",,"GBIF"
"","E","E","E00296832","Ormosia minor","","Fabaceae","Ormosia","minor","","Vogel",,,"",,"","Sellow, Friedrich",,,,"Brazil",,,"Brasilia",,,,"Ormosia minor Vogel","",,"GBIF"
"","K","Herbarium","K000535194","Ormosia minor","","Fabaceae","Ormosia","minor","","Vogel","Stirton, C.H.",,"","s.n.","","Sellow",,,,"Brazil",,,,,,"Herbarium Hookerianum 1867","Ormosia minor Vogel","",,"GBIF"
