"modified","institutionCode","collectionCode","catalogNumber","scientificName","identificationQualifier","family","genus","specificEpithet","infraspecificEpithet","scientificNameAuthorship","identifiedBy","dateIdentified","typeStatus","recordNumber","fieldNumber","recordedBy","year","month","day","country","stateProvince","municipality","locality","decimalLatitude","decimalLongitude","occurrenceRemarks","acceptedNameUsage","occurrenceID","comments","bibliographicCitation"
"","JBRJ","RB","RB01398558","Mimosa gardneri","","Fabaceae","Mimosa","gardneri","","Benth.","L.S.B. Jordão",2019,"","20153","","G.Martinelli; N.Pougy, T.Lima, M.Bocaiuva. H.Rocha",2018,2,26,"Brazil","Minas Gerais","Grão Mogol","localidade de Chapada do Cardoso,caminho que liga a comunidade de Taquaral a comunidade de Tingui. Cerrado arbustivo. Parque Estadual de Grão Mogol",-16.500556,-42.837222,"arbusto, 2m, heliófila, saxícola; folhas verdes, discolores; inflorescência jovem de cor verde; botões florais de cor verde-amarelados.","Mimosa gardneri Benth.","",,"GBIF"
"","Cenargen","CEN","98289","Mimosa gardneri","","Fabaceae","Mimosa","gardneri","","Benth.","L. M. Borges",2017,"","1108","","Leonardo Maurici Borges",2017,3,5,"Brazil","Go","CAVALCANTE","Reserva Natural Serra do Tombador. Estrada GO 241, Cavalcante - Minaçu; 3 km após a sede da reserva, estrada de acesso local à esquerda, cerca de 600 m da GO 241.",-13.67226,-47.820277,"Ramos com súber desenvolvido e acizentado. Indumento ferrugineo. Folhas verdes com eixos mais claros. Infrutescência excerta. Frutos coriáceos. Corola amarela. Amostra em sílica-gel (CEN e/ou RB). Doação Universidade Federal de Sã","Mimosa gardneri Benth.","",,"GBIF"
"","Cenargen","CEN","98348","Mimosa gardneri","","Fabaceae","Mimosa","gardneri","","Benth.","L. M. Borges",2017,"","1152","","Leonardo Maurici Borges",2017,3,7,"Brazil","Go","CAVALCANTE","Serra Santana. Estrada GO 241, Minaçu-Cavalcante; 56 km após a sede da reserva.",-13.54566,-47.5271,"Indumento ferrugíneo. Folhas verdes. Sinflorescência excerta ca. 80 cm. Filetes róseos passando a alvos. Amostra em sílica-gel (CEN e/ou RB). Doação Universidade Federal de São Carlos - Herbário SPSC.","Mimosa gardneri Benth.","",,"GBIF"
"","Cenargen","CEN","103256","Mimosa gardneri","","Fabaceae","Mimosa","gardneri","","Benth.","M. Simon",2017,"","6363","","Anderson Cássio Sevilha",2017,3,15,"Brazil","Mg","SANTO ANTÔNIO DO RETIRO","Sucuriu.",-15.338333,-42.7525,"Projeto Bem Diverso.","Mimosa gardneri Benth.","",,"GBIF"
"","Cenargen","CEN","103267","Mimosa gardneri","","Fabaceae","Mimosa","gardneri","","Benth.","M. Simon",2017,"","6374","","Anderson Cássio Sevilha",2017,3,15,"Brazil","Mg","SANTO ANTÔNIO DO RETIRO","Sucuriu.",-15.338333,-42.7525,"Projeto Bem Diverso.","Mimosa gardneri Benth.","",,"GBIF"
"","Cenargen","CEN","103718","Mimosa gardneri","","Fabaceae","Mimosa","gardneri","","Benth.","M. Simon, IN LIT. L. P. Queiroz",2017,"","6770","","Anderson Cássio Sevilha",2017,3,21,"Brazil","Mg","MONTEZUMA","Sítio 17. Ponto 2. Em quebra de relevo de chapada.",-15.388888,-42.412222,"Projeto Bem Diverso.","Mimosa gardneri Benth.","",,"GBIF"
"","Cenargen","CEN","104160","Mimosa gardneri","","Fabaceae","Mimosa","gardneri","","Benth.","M. Simon",2018,"","6981","","Anderson Cássio Sevilha",2017,6,21,"Brazil","Mg","RIO PARDO DE MINAS","Comunidade Brejo. Sítio 24 - Ponto 1.",-15.915555,-42.482777,"Projeto Bem Diverso.","Mimosa gardneri Benth.","",,"GBIF"
"","Cenargen","CEN","95583","Mimosa gardneri","","Fabaceae","Mimosa","gardneri","","Benth.","L. M. Borges",2017,"","2978","","Marcelo Fragomeni Simon",2016,4,15,"Brazil","To","ARRAIAS","Ao longo da TO - 050, 1 km ao sul de Arraias.",-12.9725,-46.901666,"Arbusto pouco ramificado com até 10 cm de diâmetro na base. Eixo da inflorescência longo, 50 cm, bem acima da folhagem, podendo apresentar até 3 ramificaçges. Filetes rosa. Comum no local.","Mimosa gardneri Benth.","",,"GBIF"
"","Cenargen","CEN","101154","Mimosa gardneri","","Fabaceae","Mimosa","gardneri","","Benth.","M. Simon",2016,"","2989","","Marcelo Fragomeni Simon",2016,9,20,"Brazil","Go","CRISTALINA","Ao longo da BR - 050, 7 km ao sul do entroncamento com a BR - 040. Fragmento próximo à rodovia.",-16.804444,-47.655,"Subarbusto crescendo de xilopódio com caule rasteiro, 30 cm. Filetes róseos. Ocasional.","Mimosa gardneri Benth.","",,"GBIF"
"","Cenargen","CEN","103234","Mimosa gardneri","","Fabaceae","Mimosa","gardneri","","Benth.","M. Simon",2018,"","6341","","Anderson Cássio Sevilha",2016,12,8,"Brazil","Mg","SANTO ANTÔNIO DO RETIRO","Sítio 10. Ponto 3.",-15.333611,-42.7525,"Botão floral. Projeto Bem Diverso.","Mimosa gardneri Benth.","",,"GBIF"
"","JBRJ","RB","RB01098228","Mimosa gardneri","","Fabaceae","Mimosa","gardneri","","Benth.","L.M. Borges",2012,"",,"","L.M. Boges; P. C. Baleeiro; M.T.C. Watanabe",2012,3,19,"Brazil","Goiás","Cristalina","Serra  dos  Cristais.  Estrada  de  terra  para  a  Reserva  Particular  do  Patrimônio  Natural  Linda  Serra  dos  Topázios,  a  partir  da  rodovia  BR-050,  a  ca.  de  3  km  S  de  Cristalina.  Ramal  secundário  da  estrada.  Campo  arenoso  úmido  com  áreas  alagáveis  .",-16.777222,-47.6525,"Substrato com xilopódio reptante. Ramos apressos ao solo com folhas dispostas horizontalmente. Ramos e raques levemente albos. Foliólulos verdes. Sinflorescência assurgentes. Perianto alvo. População abundante. Amostra em sílica.Prensado em álcool.","Mimosa gardneri Benth.","",,"GBIF"
"","JBRJ","RB","RB00738727","Mimosa gardneri","","Fabaceae","Mimosa","gardneri","","Benth.","L.M. Borges",2012,"","522","","L.M. Borges; P.C. Baleeiro, M.T.C. Watanabe",2012,3,19,"Brazil","Goiás","Cristalina","Serra  dos  Cristais.  Estrada  de  terra  para  a  Reserva  Particular  do  Patrimônio  Natural  Linda  Serra  dos  Topázios,  a  partir  da  rodovia  BR-050,  a  ca.  de  3Km  S  de  Cristalina.  .",-16.777222,-47.650833,"Subarbusto com xilopódio reptante. Ramos apressos, ao solo com folhas dispostas horizontalmente. Ramos e raques levemente albos. Foliólulos alvo. filetes róseos. Frutos imaturos verde claro. População abundante","Mimosa gardneri Benth.","",,"GBIF"
"","USP","SPF","217715","Mimosa gardneri","","Fabaceae","Mimosa","gardneri","","Benth.","Borges, LM",2012,"","522","","Borges, LM",2012,3,19,"Brazil","Goiás","Cristalina","Serra dos Cristais, Estrada de terra para a Reserva Particular do Patrimônio Natural Linda Serra dos Topázios, a partir da rodovia BR-050, a ca. de 3 km S de Cristalina. Ramal secundário da estrada.",-16.777306,-47.651083,"Subarbusto com xilopódio reptante. Ramos apressos ao solo com flohas dispostas horizontalmente. Ramos e raques levemente albos. Foliólulos verdes. Sinflorescências assurgentes. Perianto alvo. Filetes róseos. Frutos imaturos verde cla","Mimosa gardneri Benth.","",,"GBIF"
"","USP","SPF","217719","Mimosa gardneri","","Fabaceae","Mimosa","gardneri","","Benth.","Borges, LM",2012,"","521","","Borges, LM",2012,3,19,"Brazil","Goiás","Cristalina","Serra dos Cristais, Estrada de terra para a Reserva Particular do Patrimônio Natural Linda Serra dos Topázios, a partir da rodovia BR-050, a ca. de 3 km S de Cristalina. Ramal secundário da estrada.",-16.777306,-47.651083,"Subarbusto com xilopódio reptante. Ramos apressos ao solo com flohas dispostas horizontalmente. Ramos e raques levemente albos. Foliólulos verdes. Sinflorescências assurgentes. Glomérulos maiores que os observados no restante da popu","Mimosa gardneri Benth.","",,"GBIF"
"","UNICAMP","UEC","204996","Mimosa gardneri","","Fabaceae","Mimosa","gardneri","","Benth.","Simon, MF",2013,"","1138","","Silva, JS",2012,5,10,"Brazil","Tocantins","Ponte Alta do Tocantins","Ponte Alta do Tocantins-TO.Serra das Araras.",,,"Subarbusto com 1,8 m de altura.Filetes róseos, anteras amarelos.","Mimosa gardneri Benth.","",,"GBIF"
"","USP","SPF","212300","Mimosa gardneri","","Fabaceae","Mimosa","gardneri","","Benth.","Borges, LM",2014,"","15114","","Queiroz, LP",2010,10,30,"Brazil","Goiás","Cristalina",,-16.843333,-47.675833,,"Mimosa gardneri Benth.","",,"GBIF"
"","UEFS","HUEFS","165494","Mimosa gardneri","","Fabaceae","Mimosa","gardneri","","Benth.","L.M.Borges",2012,"","15114","","Queiroz, L.P.de",2010,10,30,"Brazil","Goiás","Cristalina","BR 050, ca. 5Km de Cristalina.",-16.843333,-47.675833,"Cerrado degradado ao lado de plantação de eucalipto.","Mimosa gardneri Benth.","",,"GBIF"
"","Cenargen","CEN","76918","Mimosa gardneri","","Fabaceae","Mimosa","gardneri","","Benth.","L. M. Borges",2012,"","15114","","Luciano Paganucci de Queiroz",2010,10,30,"Brazil","Go","CRISTALINA","Brasil - Goiás - Cristalina , RB -050, ca. 5 km de Cristalina , cerrado degradado ao lado de plantação de eucalipto.",-16.843333,-47.675833,"Arbusto ramificado na base, formando touceira ca. alt. Folíolos cartáceos, flores com cálice e corola verde-claro e estames rosa claro, frutos imaturos verdes DNA. Doação do Herbário da Universidade Estadual de Feira de Santana -","Mimosa gardneri Benth.","",,"GBIF"
"","USP","SPF","229959","Mimosa gardneri","","Fabaceae","Mimosa","gardneri","","Benth.","Borges, LM",2015,"","6829","","Silva, JM",2008,5,29,"Brazil","Tocantins","Ponte Alta do Tocantins","Jalapão",-10.891389,-47.460833,,"Mimosa gardneri Benth.","",,"GBIF"
"","Cenargen","CEN","91972","Mimosa gardneri","","Fabaceae","Mimosa","gardneri","","Benth.","L. M. Borges & M. F. Simon",2017,"","2000","","Cristopher William Fagg",2008,11,19,"Brazil","To","PONTE ALTA DO TOCANTINS","Bacia do Tocantins.",-10.83,-47.5,"Árvore, tronco com casca escamosa. Folhas membranáceas. Frutos velhos cor marrom. Doação Herbário IBGE. Plantas do Brasil. Tocantins.","Mimosa gardneri Benth.","",,"GBIF"
"","UnB","UB","113018","Mimosa gardneri","","Fabaceae","Mimosa","gardneri","","Benth.","Borges, LM",2014,"","10241","","Delprete, PG; et al.",2007,8,18,"Brazil","Goiás","Cocalzinho de Goiás","Serra dos Pireneus. Fazenda Capitão do MAto. Estrada da casinha da fazenda em direção do Morro do Cabeludo.",-15.806667,-48.801944,"Estames rosados.; Erva prostrada; estames rosados.; Formação rupestre com rochas aflorantes.","Mimosa gardneri Benth.","",,"GBIF"
"","JBRJ","RB","RB00593862","Mimosa gardneri","","Fabaceae","Mimosa","gardneri","","Benth.","L.M. Borges",2012,"","10241","","P.G. Delprete; A. Francener, T.M. Guimarães & R. Vieira",2007,8,18,"Brazil","Goiás","Cocalzinho de Goiás","Serra dos Pireneus. Fazenda Capitão do Mato. Estrada da casinha da fazenda em direção do Morro do Cabeludo.",-15.806667,-48.801944,"Erva prostada. Estames.","Mimosa gardneri Benth.","",,"GBIF"
"","UEFS","HUEFS","123649","Mimosa gardneri","","Fabaceae","Mimosa","gardneri","","Benth.","L.M.Borges",2012,"","4321","","Souza, J.P.de",2005,1,21,"Brazil","Goiás","Cristalina","Estrada para Unaí. Ca 600 m da BR 040. Crrado degradado com campo rupestre adjacente.",-16.745278,-47.604722,,"Mimosa gardneri Benth.","",,"GBIF"
"","K","Herbarium","K000850650","Mimosa gardneri","","Fabaceae","Mimosa","gardneri","","Benth.","Borges, L.M.",,"","4321","","Rando, J.G.; Ferrucci, M.S.; Paula-Souza, J.; Duarte, A.R.; Tsuji, R.",2005,1,21,"Brazil",,"Cristalina","Estrada para Unaí. Ca. 600m da BR040. .",-16.75,-47.6,"Projeto Coletas Botânicas com ênfase em Elaeocarpaceae, Ericaceae, Gesneriaceae, Leguminosae-Mimosoideae, Sapindaceae, Scrophulariaceae; Tilaceae e Violaceae. (Esalq/USP e Instituto de Botanica del Nordesde) Fianciado pela Myndel Botanica Foundation.","Mimosa gardneri Benth.","",,"GBIF"
"","UnB","UB","102066","Mimosa gardneri","","Fabaceae","Mimosa","gardneri","","Benth.","Borges, LM",2014,"","677","","Simon, MF",2005,9,,"Brazil","Goiás","Pirenópolis","Pirenópolis",-15.783333,-48.883333,,"Mimosa gardneri Benth.","",,"GBIF"
"","UFU","HUFU","37988","Mimosa gardneri","","Fabaceae","Mimosa","gardneri","","Benth.","Casaratti, S.N.",2004,"","3816","","Nakajima, J.N.; Romero, R.; Andrade, T.; Cesarotti, S.N.; Machado, A.B. & Rocha, F.A.",2004,9,14,"Brazil","Minas Gerais","Delfinópolis","Trilha da Escada de Pedras",,,"Subarbusto, ca. 2 m. Filetes rosas.; Campo rupestre.","Mimosa gardneri Benth.","",,"GBIF"
"","Cenargen","CEN","78116","Mimosa gardneri","","Fabaceae","Mimosa","gardneri","","Benth.","M. Simon",2003,"","460","","Marcelo Fragomeni Simon",2003,3,3,"Brazil","Go","CAVALCANTE","Estrada 60 Km ao norte de Cavalcante em direção a cachoeira do Prata, rio do Prata.",-13.416666,-47.65,"Inflorescência em longo eixo de 30 cm. Filetes rosa, frutos da estação anterior castanhos. Doação Daubeny Herbarium (FHO) - Flora do Brasil.","Mimosa gardneri Benth.","",,"GBIF"
"","USP","SPF","213892","Mimosa gardneri","","Fabaceae","Mimosa","gardneri","","Benth.","Borges, LM",2015,"","3360","","Cavalcanti, TB",2003,9,29,"Brazil","Tocantins","Dianópolis",,-11.6025,-46.517222,,"Mimosa gardneri Benth.","",,"GBIF"
"","Cenargen","CEN","42697","Mimosa gardneri","","Fabaceae","Mimosa","gardneri","","Benth.","L. M. Borges",2017,"","426","","Marcelo Fragomeni Simon",2001,5,11,"Brazil","To","PONTE ALTA DO TOCANTINS","Ponte Alta. Estrada de Ponte Alta para Natividade. NORTE.",-10.983333,-47.5,"Filetes rosa. Doação do Sistema Herbário UB 9340-8. Brasil - Tocantins.","Mimosa gardneri Benth.","",,"GBIF"
"","Escola Superior de Agricultura Luiz de Queiroz, ESALQ","ESA","66622","Mimosa gardneri","","Fabaceae","Mimosa","gardneri","","Benth.","Borges, L.M.",2015,"","24080","","Souza, V.C. et al.",2000,7,17,"Brazil","Tocantins","Natividade",,,,,"Mimosa gardneri Benth.","",,"GBIF"
"","USP","SPF","229889","Mimosa gardneri","","Fabaceae","Mimosa","gardneri","","Benth.","Borges, LM",2012,"","s.n.","","Pareja, EK",1999,8,23,"Brazil","Tocantins","Palmas","Reserva do Lageado.",,,,"Mimosa gardneri Benth.","",,"GBIF"
"","UnB","UB","8510","Mimosa gardneri","","Fabaceae","Mimosa","gardneri","","Benth.","Borges, LM",2015,"","291","","Simon, MF; Amaral, MF",1999,9,15,"Brazil","Goiás","Cocalzinho de Goiás","5km ao longo da estrada de Cocalzinho a Corumbá de Goiás",,,"Estames rosa, caule subterrâneo lenhoso espesso. Formigas associadas.; Semi-Arbusto 0,2m. Flor rosa; Campo rupestre. Solo: Solo arenoso, afloramento de rochas de quartzito.","Mimosa gardneri Benth.","",,"GBIF"
"","E","E","E00202959","Mimosa gardneri","","Fabaceae","Mimosa","gardneri","","Benth.",,,"","291","","Simon, M.F.; Amaral, M.F.",1999,9,15,"Brazil",,,,,,,"Mimosa gardneri Benth.","",,"GBIF"
"","NY","NY","00932797","Mimosa gardneri","","Fabaceae","Mimosa","gardneri","","Benth.","R. C. Barneby",1998,"","1802","","M. L. Fonseca",1998,5,7,"Brazil","Goiás",,"CNT, ca. 1 km abaixo da mina de níquel. Folha Uruaçú SD 22-Z-B",-14.3581,-48.3864,,"Mimosa gardneri Benth.","",,"GBIF"
"","Universidade Federal de Santa Catarina","FLOR","28498","Mimosa gardneri","","Fabaceae","Mimosa","gardneri","","Benth.","Barneby, R.C.",1997,"","66199","","Hatschbach, G.; Hatschbach, M. & Barbosa, E.",1997,3,14,"Brazil","Minas Gerais","Joaquim Felício","Serra do Cabral.",,,"arbusto, flor rosada, 1m altura","Mimosa gardneri Benth.","",,"GBIF"
"","IF","SPSF","11063","Mimosa gardneri","","Fabaceae","Mimosa","gardneri","","Benth.",,,"","66199","","G. Hatschbach",1997,3,14,"Brazil","Mg","Joaquim Felício","Serra do Cabral",,,"COLETA: XLS: SPSFAntigo; GEOGRAFIA: campo rupestre&nf;;","Mimosa gardneri Benth.","",,"GBIF"
"","Comissão Executiva do Plano da Lavoura Cacaueira","CEPEC","75387","Mimosa gardneri","","Fabaceae","Mimosa","gardneri","","Benth.","R. C. Barneby",,"","66199","","G. Hatschbach",1997,3,14,"Brazil","Minas Gerais","Joaquim Felício","Serra do Cabral.",,,,"Mimosa gardneri Benth.","",,"GBIF"
"","NY","NY","00932772","Mimosa gardneri","","Fabaceae","Mimosa","gardneri","","Benth.","R. C. Barneby",1997,"","66199","","G. G. Hatschbach",1997,3,14,"Brazil","Minas Gerais",,"Serra do Cabral",-17.7612670946765,-44.172127456015,,"Mimosa gardneri Benth.","",,"GBIF"
"","UEFS","HUEFS","28234","Mimosa gardneri","","Fabaceae","Mimosa","gardneri","","Benth.","L.M.Borges",2015,"","1669","","Cavalcanti, T.B.",1995,7,25,"Brazil","Goiás","Niquelândia","Estrada paralela ao rio Tocantins, entre o rio Tocantins e Serra Negra.",-13.983333,-41.35,"Solo areno-pedregoso.","Mimosa gardneri Benth.","",,"GBIF"
"","MPEG","HERBMG","MG147549","Mimosa gardneri","","Fabaceae","Mimosa","gardneri","","Benth.","Lobato, L.C.B.",,"",,"","Munhoz, C.; Silva, A.S.L. da",1994,5,21,"Brazil","Goiás",,"Alto Paraíso de Goiás",-13.766667,-47.5,,"Mimosa gardneri Benth.","",,"GBIF"
"","USP","SPF","199785","Mimosa gardneri","","Fabaceae","Mimosa","gardneri","","Benth.","Dutra, VF",2008,"","22047","","Brandão, M",1993,3,2,"Brazil","Minas Gerais","Itacambira","Serra de Itacambira",,,,"Mimosa gardneri Benth.","",,"GBIF"
"","JBRJ","RB","RB00171940","Mimosa gardneri","","Fabaceae","Mimosa","gardneri","","Benth.","L.M. Borges",2012,"","1113","","T. B. Cavalcanti; B. M. T. Walter, D. M. S. da Rocha (CENARGEN), H. G. P. dos Santos, S. P. C. Santos & N. P. V. Batista (FURNAS)",1992,3,10,"Brazil","Goiás","Minaçu","A 7 km da entrada norte do canteiro de obras.",-13.466667,-48.383333,"Arvoreta 1,80-2,0m de alt. Filetes lilás, anteras cremes. Flor lilás. Frequente.","Mimosa gardneri Benth.","",,"GBIF"
"","NY","NY","00933245","Mimosa gardneri","","Fabaceae","Mimosa","gardneri","","Benth.","L. M. Borges",2012,"","58268","","G. G. Hatschbach",1992,11,29,"Brazil","Goiás",,"Rod. BR-050, próximo ao Rio Imburuçu",,,,"Mimosa gardneri Benth.","",,"GBIF"
"","Comissão Executiva do Plano da Lavoura Cacaueira","CEPEC","54508","Mimosa gardneri","","Fabaceae","Mimosa","gardneri","","Benth.","R. C. Barneby",,"","53954","","G. Hatschbach",1990,2,14,"Brazil","Goiás","TEREZINA DE GOIÁS","Rod. GO-118, 10-20Km ao S cidade.",,,,"Mimosa gardneri Benth.","",,"GBIF"
"","Comissão Executiva do Plano da Lavoura Cacaueira","CEPEC","56248","Mimosa gardneri","","Fabaceae","Mimosa","gardneri","","Benth.","R. C. Barneby",,"","53750","","G. Hatschbach",1990,2,10,"Brazil","Goiás","CRISTALINA","Estr. p/ o Salto do Arrojado.",,,,"Mimosa gardneri Benth.","",,"GBIF"
"","US","Botany","3232868","Mimosa gardneri","","Fabaceae","Mimosa","gardneri","","Benth.",,,"","53750","","G. Hatschbach, M. M. Hatschbach & V. Nicolack",1990,2,10,"Brazil","Goiás",,"Estrada para o Salto do Arrojado (Mun. Cristalina)",,,,"Mimosa gardneri Benth.","",,"GBIF"
"","US","Botany","3231909","Mimosa gardneri","","Fabaceae","Mimosa","gardneri","","Benth.",,,"","53954","","G. Hatschbach, M. M. Hatschbach & V. Nicolack",1990,2,14,"Brazil","Goiás",,"Rod. GO-118, 10-20 km S de Teresina de Goias",,,,"Mimosa gardneri Benth.","",,"GBIF"
"","NY","NY","00933254","Mimosa gardneri","","Fabaceae","Mimosa","gardneri","","Benth.","R. C. Barneby",1990,"","53954","","G. G. Hatschbach",1990,2,14,"Brazil","Goiás",,"Rod. GO-118, 10-20 km S de Teresina de Goiás",-13.7803789246898,-47.2648250589424,,"Mimosa gardneri Benth.","",,"GBIF"
"","NY","NY","00932831","Mimosa gardneri","","Fabaceae","Mimosa","gardneri","","Benth.","R. C. Barneby",1990,"","53750","","G. G. Hatschbach",1990,2,10,"Brazil","Goiás",,"Estr. para Salto do Arrojado",-16.7723416525899,-47.6137541731285,,"Mimosa gardneri Benth.","",,"GBIF"
"","K","Herbarium","K000851942","Mimosa gardneri","","Fabaceae","Mimosa","gardneri","","Benth.","Barneby, R.C.",,"","53750","","Hatschbach, G.G.; Hatschbach, M.; Nicolack, V.",1990,2,10,"Brazil",,"Cristalina","Estrada para Salto do Arrojado.",,,,"Mimosa gardneri Benth.","",,"GBIF"
"","MO","MO","2918168","Mimosa gardneri","","Fabaceae","Mimosa","gardneri","","Benth.","R. Barneby",1990,"","Hatschbach 53750","","Gert G. Hatschbach|Maria M. Hatschbach|V. Nicolack",1990,11,10,"Brazil","Goiás",,"Estrada para o Salto do Arrojado (mun. Cristalina)",,,,"Mimosa gardneri Benth.","",,"GBIF"
"","UFV","VIC","19917","Mimosa gardneri","","Fabaceae","Mimosa","gardneri","","Benth.","Dutra, V.F.",2008,"","2232","","Pirani, J.R.; et al.",1988,2,14,"Brazil","Minas Gerais","Itacambira","Serra de Itacambira - 45 Km de Juramento, Campo rupestre.",-17.066667,-43.333333,"Arbusto, c.a. de 70 cm de altura; heliófilo em solo arenoso, densamente ramoso. Cálice e corola róseas, estames alvos na base gradualmente rosa bem claro para o ápce.","Mimosa gardneri Benth.","",,"GBIF"
"","US","Botany","3331137","Mimosa gardneri","","Fabaceae","Mimosa","gardneri","","Benth.",,,"","2232","","J. R. Pirani, W. W. Thomas, R. Mello-Silva & J. Fernandes",1988,2,14,"Brazil","Minas Gerais",,"Itacambita: Serra de Itacambira, a 45 km de Juramento",-17.07,-43.33,,"Mimosa gardneri Benth.","",,"GBIF"
"","USP","SPF","49092","Mimosa gardneri","","Fabaceae","Mimosa","gardneri","","Benth.","Borges, LM",2018,"","1801","","Pirani, JR",1987,2,8,"Brazil","Goiás",,"Chapada dos Veadeiros",,,,"Mimosa gardneri Benth.","",,"GBIF"
"","NY","NY","00932832","Mimosa gardneri","","Fabaceae","Mimosa","gardneri","","Benth.","R. C. Barneby",,"","1555","","J. R. Pirani",1987,2,4,"Brazil","Goiás",,"Ca. 5 km da cidade, estrada para Paracatu",-16.77,-47.62,,"Mimosa gardneri Benth.","",,"GBIF"
"","K","Herbarium","K000851945","Mimosa gardneri","","Fabaceae","Mimosa","gardneri","","Benth.","Barneby, R.C.",,"","1555","","Stannard, B.L.; Pirani, J.R.; Furlan, A.; Kameyama, C.; Harley, R.M.",1987,2,4,"Brazil",,"Cristalina","Ca. 5Km da cidade, estrada para Paracatu.",-16.77,-47.62,,"Mimosa gardneri Benth.","",,"GBIF"
"","UFV","VIC","19924","Mimosa gardneri","","Fabaceae","Mimosa","gardneri","","Benth.","Dutra, V.F.",2008,"","9079","","Meguro, M.; et al.",1986,1,9,"Brazil","Minas Gerais","Itacambira","Estrada para Montes Claros, Campo arenoso.",,,"Arbusto, c.a. de 1,2 metros de altura. Flores rosas claras, frutos secos.","Mimosa gardneri Benth.","",,"GBIF"
"","NY","NY","00932839","Mimosa gardneri","","Fabaceae","Mimosa","gardneri","","Benth.","L. M. Borges",2012,"","7474","","W. R. Anderson",1973,3,19,"Brazil","Goiás",,"Chapada dos Veadeiros, 9 km by road S of Terezina.",-13.8614307362088,-47.2651252254628,,"Mimosa gardneri Benth.","",,"GBIF"
"","MN","R","170816","Mimosa gardneri","","Fabaceae","Mimosa","gardneri","","Benth.",,,"","8131","","Anderson, W.R.",1973,4,4,"Brazil","Goiás","Cristalina",,,,,"Mimosa gardneri Benth.","",,"GBIF"
"","UnB","UB","39038","Mimosa gardneri","","Fabaceae","Mimosa","gardneri","","Benth.","Borges, LM",2015,"","8131","","Anderson, WR",1973,4,4,"Brazil","Goiás",,,,,,"Mimosa gardneri Benth.","",,"GBIF"
"","MO","MO","2915799","Mimosa gardneri","","Fabaceae","Mimosa","gardneri","","Benth.","R. Barneby",1984,"","Anderson 8131","","William R. Anderson|Paul A. Fryxell|Steven R. Hill|R. Reis dos Santos|R. Souza",1973,4,4,"Brazil","Goiás",,"Serra dos Cristals. Grassy hillside campo on souther edge of Cristalina; sandy soil; sandy soil.",,,,"Mimosa gardneri Benth.","",,"GBIF"
"","US","Botany","3095134","Mimosa gardneri","","Fabaceae","Mimosa","gardneri","","Benth.",,,"","8131","","W. R. Anderson, P. A. Fryxell, S. R. Hill, R. Reis dos Santos & R. Souza",1973,4,4,"Brazil","Goiás",,"Serra dos Cristais, Grassy hillside campo on southern edge of Cristalina",,,,"Mimosa gardneri Benth.","",,"GBIF"
"","NY","NY","00932807","Mimosa gardneri","","Fabaceae","Mimosa","gardneri","","Benth.","R. C. Barneby",,"","8131","","W. R. Anderson",1973,4,4,"Brazil","Goiás",,"Southern edge of Cristalina. Serra dos Cristais.",-16.7837419101089,-47.6004533219042,,"Mimosa gardneri Benth.","",,"GBIF"
"","UnB","UB","382","Mimosa gardneri","","Fabaceae","Mimosa","gardneri","","Benth.","Borges, LM",2015,"","34001","","Irwin, HS; Anderson, WR; et al.",1972,1,13,"Brazil","Goiás","Pirenópolis","21 Km E de Pirenópolis",,,"Ramos com 1mX5cm.; Arbusto prostrado. Fruto verde.; Grandes touceiras de ciperáceaes. Topologia: Inclinado.","Mimosa gardneri Benth.","",,"GBIF"
"","MO","MO","2918105","Mimosa gardneri","","Fabaceae","Mimosa","gardneri","","Benth.","R. Barneby",1984,"","Irwin 34001","","Howard S. Irwin",1972,1,13,"Brazil","Goiás",,"Serra dos Pierenus. Slopes of Serra dos Pirineus, ca. 21 km E. of Pirenópolis.",,,,"Mimosa gardneri Benth.","",,"GBIF"
"","US","Botany","3255332","Mimosa gardneri","","Fabaceae","Mimosa","gardneri","","Benth.",,,"","34001","","H. S. Irwin, W. Anderson, M. Stieber & E. Lee",1972,1,13,"Brazil","Goiás",,"Serra dos Pireneus, slopes of Serra dos Pirineus, ca. 21 km E. of Pirenopolis",,,,"Mimosa gardneri Benth.","",,"GBIF"
"","NY","NY","00932801","Mimosa gardneri","","Fabaceae","Mimosa","gardneri","","Benth.","R. C. Barneby",,"","34001","","H. S. Irwin",1972,1,13,"Brazil","Goiás",,"Serra dos Pirineus, ca. 21 km E. of Pirenópolis.",-15.85,-48.75395,,"Mimosa gardneri Benth.","",,"GBIF"
"","UnB","UB","19031","Mimosa gardneri","","Fabaceae","Mimosa","gardneri","","Benth.","Barneby, R",1988,"","25812","","Irwin, HS; Onishi, E; Fonsêca, SF; Souza, R; Santos, RR; Ramos, J",1970,1,31,"Brazil","Minas Gerais",,"Ca. 60km N.E. of Patrocínio",,,"Sessile subshrub, the inflorescence to 20cm tall.; Upper slopes. Steep pastured slopes.","Mimosa gardneri Benth.","",,"GBIF"
"","US","Botany","3022670","Mimosa gardneri","","Fabaceae","Mimosa","gardneri","","Benth.",,,"","25812","","H. S. Irwin, E. Onishi, S. F. Fonsêca, R. Souza & et al.",1970,1,31,"Brazil","Minas Gerais",,"Serra dos Oculos, ca. 60 km N.E. of Patrocinio",,,,"Mimosa gardneri Benth.","",,"GBIF"
"","NY","NY","00932773","Mimosa gardneri","","Fabaceae","Mimosa","gardneri","","Benth.","R. C. Barneby",,"","25812","","H. S. Irwin",1970,1,31,"Brazil","Minas Gerais",,"Serra dos Óculos, ca. 60 km N.E. of Patrocínio",-18.66669,-46.8,,"Mimosa gardneri Benth.","",,"GBIF"
"","UnB","UB","19030","Mimosa gardneri","","Fabaceae","Mimosa","gardneri","","Benth.","Barneby, R",,"","25825","","Irwin, HS; Onishi, E; Fonsêca, SF; Souza, R; Santos, RR; Ramos, J",1970,2,1,"Brazil","Minas Gerais",,"Ca. 60km N.E. of Patrocínio",,,"Subacaulescent subshrub. Inflorescences to ca. 50cm tall. Heads lavender-magenta.; Campo.","Mimosa gardneri Benth.","",,"GBIF"
