"modified","institutionCode","collectionCode","catalogNumber","scientificName","identificationQualifier","family","genus","specificEpithet","infraspecificEpithet","scientificNameAuthorship","identifiedBy","dateIdentified","typeStatus","recordNumber","fieldNumber","recordedBy","year","month","day","country","stateProvince","municipality","locality","decimalLatitude","decimalLongitude","occurrenceRemarks","acceptedNameUsage","occurrenceID","comments","bibliographicCitation"
"","JBRJ","RB","RB01420708","Daphnopsis schwackeana","","Thymelaeaceae","Daphnopsis","schwackeana","","Taub.","L. Rossi",,"","115","","D. Nunes; T. Lorenzetti, F.R.M. Fraga & C.D.M. Ferreira",2019,10,3,"Brazil","Rio de Janeiro","Rio de Janeiro","Floresta da Tijuca, Setor A, na trilha do Estudante, após a bifurcação para a trilha Transcarioca. PARNA da Tijuca",,,"Folhas verdes, discolores, cartáceas. Raque da inflorescência e pedicelo verde-claro; sépalas, filete, estilete e estigma brancos; anteras amarelas","Daphnopsis schwackeana Taub.","",,"GBIF"
"","JBRJ","RB","RB01404485","Daphnopsis schwackeana","","Thymelaeaceae","Daphnopsis","schwackeana","","Taub.","G.M. Antar",,"","1718","","G.M. Antar; V.B. Caetano",2017,7,14,"Brazil","São Paulo","Embu-Guaçu","Estrada de Santa Rita, Km 60. Próximo a cava mineração",-23.920278,-46.873333,"Árvore cerc ade 3 metros de altura. Folhas discolores com a face abaxial mais clara. Perianto alvo, estames amarelos","Daphnopsis schwackeana Taub.","",,"GBIF"
"","JBRJ","RB","RB01372620","Daphnopsis schwackeana","","Thymelaeaceae","Daphnopsis","schwackeana","","Taub.","G.M. Antar",,"","1124","","G.M. Antar; V.B. Caetano",2016,7,13,"Brazil","São Paulo","Embu-Guaçu","Estrada de Santa Rita, km 60 . Próximo a cava de mineração.",-23.926944,-46.879167,,"Daphnopsis schwackeana Taub.","",,"GBIF"
"","Cenargen","CEN","99606","Daphnopsis schwackeana","","Thymelaeaceae","Daphnopsis","schwackeana","","Taub.","G. M. Antar",,"","1124","","Guilherme de M. Antar",2016,7,13,"Brazil","Sp","EMBU-GUACU","Estrada de Santa Rita, km 60. Próximo a cava de mineração.",-23.926944,-46.879166,"Mata Atlântica. Em estágio médio de recuperação. Doação Universidade de São Pauo - Herbário SPF.","Daphnopsis schwackeana Taub.","",,"GBIF"
"","USP","SPF","227846","Daphnopsis schwackeana","","Thymelaeaceae","Daphnopsis","schwackeana","","Taub.","Antar, GM",2016,"","1124","","Antar, GM",2016,7,13,"Brazil","São Paulo","Embu-Guaçu","Estrada de Santa Rita, km 60. Próximo a cava de mineração.",-23.927056,-46.879389,"Árvore cauliflora ca. 4 m alt. Flores verdes.; Mata Atlântica. Floresta Ombrófila Densa em estágio médio de recuperação. Solo organo-argiloso.","Daphnopsis schwackeana Taub.","",,"GBIF"
"","JBRJ","RB","RB01045441","Daphnopsis schwackeana","","Thymelaeaceae","Daphnopsis","schwackeana","","Taub.","J. Külkamp",2019,"","149","","Carlos D.M. Ferreira; M. Grefe & P. Feliz",2015,8,23,"Brazil","Rio de Janeiro","Rio de Janeiro","Jacarepaguá. Crescendo próximo a casa amarela.",,,"Arvoreta, 1,5 metros de altura. Presença de caulifloria. Flores e botões de coloração ferrugínea. Frutos de cor verde.","Daphnopsis schwackeana Taub.","",,"GBIF"
"","IAC","IAC","56742","Daphnopsis schwackeana","","Thymelaeaceae","Daphnopsis","schwackeana","","Taub.","A.C.O. Souza",,"","210","","A.C.O. Souza & L.C. Bernacci",2015,8,12,"Brazil","São Paulo","Cunha","Parque Estadual da Serra do Mar #?# Núcleo Cunha",-23.0744,-44.9597,"Parcela NUC 01 - regeneração após corte raso, seguido de fogo e pastagem, Ind. 0438","Daphnopsis schwackeana Taub.","",,"GBIF"
"","Escola Superior de Agricultura Luiz de Queiroz, ESALQ","ESA","123716","Daphnopsis schwackeana","","Thymelaeaceae","Daphnopsis","schwackeana","","Taub.","Colletta, G.D.",2013,"","1104","","Colletta, G.D. ; Ferreira, M.A.P.",2013,5,1,"Brazil","São Paulo","Tapiraí","Reserva Particular da Votorantim (CBA), UHE Fumaça, trilha do Chagas.",,,"Árvore, 3m","Daphnopsis schwackeana Taub.","",,"GBIF"
"","Universidade Regional de Blumenau, FURB","FURB","42612","Daphnopsis schwackeana","","Thymelaeaceae","Daphnopsis","schwackeana","","Taub.",,,"","485","","Uhlmann, A.; et al.",2012,5,6,"Brazil","Rio de Janeiro","Nova Friburgo","antena SBT.",-22.359167,-42.564167,,"Daphnopsis schwackeana Taub.","",,"GBIF"
"","MBM","MBM","387990","Daphnopsis schwackeana","","Thymelaeaceae","Daphnopsis","schwackeana","","Taub.","Uhlmann, A",,"","485","","Uhlmann, A",2012,5,6,"Brazil","Rio de Janeiro","Nova Friburgo","Antena SBT",-22.359192,-42.564078,"Árvore de aproximadamente 6m de altura; flores em botões.; Em borda de Floresta Ombrófila Densa Montana.","Daphnopsis schwackeana Taub.","",,"GBIF"
"","JBRJ","RB","RB00863280","Daphnopsis schwackeana","","Thymelaeaceae","Daphnopsis","schwackeana","","Taub.",,,"","485","","A. Uhlmann; et al",2012,5,6,"Brazil","Rio de Janeiro","Nova Friburgo","Antena SBT.",-22.359167,-42.563889,"Árvore de aproximadamente 6m de altura; flores em botões","Daphnopsis schwackeana Taub.","",,"GBIF"
"","UNISANTA","HUSC","11848","Daphnopsis schwackeana","","Thymelaeaceae","Daphnopsis","schwackeana","","Taub.",,,"","821","","P.S.P Sampaio",2012,8,22,"Brazil","São Paulo","Guarujá","Serra do Guararu, condomínio Iporanga.",,,"Flores creme-amareladas.; Floresta ombrofila densa.","Daphnopsis schwackeana Taub.","",,"GBIF"
"","UNISANTA","HUSC","11850","Daphnopsis schwackeana","","Thymelaeaceae","Daphnopsis","schwackeana","","Taub.","P.S.P Sampaio",2012,"","130","","D. Costa; R. Guandalini, G Martins",2012,8,17,"Brazil","São Paulo","Guarujá","Serra do Guararu, condomínio Iporanga, área B.",-23.898083,-46.166417,"Árvore com ca. de 4 metros de altura, na borda da mata, com flores caulinares cremes com estames amarelos (8 estames).; Floresta ombrofila densa.","Daphnopsis schwackeana Taub.","",,"GBIF"
"","UNISANTA","HUSC","11849","Daphnopsis schwackeana","","Thymelaeaceae","Daphnopsis","schwackeana","","Taub.","M.Magenta; P.S.P Sampaio",2014,"","31","","A. Carminatto; M.Magenta",2012,8,9,"Brazil","São Paulo","Guarujá","Serra do Guararu, condomínio Iporanga, área C, parcela 19, indivíduo 1091.",,,"Árvore medindo 9m e com inflorescência (botão) verde clara.; Floresta ombrofila densa.","Daphnopsis schwackeana Taub.","",,"GBIF"
"","IAC","IAC","54075","Daphnopsis schwackeana","","Thymelaeaceae","Daphnopsis","schwackeana","","Taub.","A.C.O. Souza et al.",2012,"","20","","A.C.O. Souza; L.C. Bernacci & R. Belinelo",2012,,,"Brazil","São Paulo","Ubatuba","Parque Estadual da Serra do Mar, Núcleos Santa Virgínia/Picinguaba, trilha da Pipoca",-23.360372,-45.109914,,"Daphnopsis schwackeana Taub.","",,"GBIF"
"","IF","SPSF","45701","Daphnopsis schwackeana","","Thymelaeaceae","Daphnopsis","schwackeana","","Taub.","N.M.Ivanauskas",2012,"","6404","","N.M.Ivanauskas & E.Rocha & D.Souza & F.M.Souza & S.Alves",2011,9,2,"Brazil","Sp","Bananal","Estação Ecológica de Bananal",-22.790556,-44.356944,"COLETA: Arvoreta 2,5m altura, flores.;","Daphnopsis schwackeana Taub.","",,"GBIF"
"","UNICAMP","UEC","200104","Daphnopsis schwackeana","","Thymelaeaceae","Daphnopsis","schwackeana","","Taub.",,,"","M1457","","Padgurschi, MCG; Belinello, R",2009,,,"Brazil","São Paulo","São Luiz do Paraitinga","Parque Estadual da Serra do Mar",-23.4,-45.183333,"Parcela M - Projeto Biota-FAPESP. Árvore com 6.5 metros de altura. Frequência da espécie na parcela: n=6","Daphnopsis schwackeana Taub.","",,"GBIF"
"","JBRJ","RB","RB00519960","Daphnopsis schwackeana","","Thymelaeaceae","Daphnopsis","schwackeana","","Taub.","Lucia Rossi",,"","605","","M.C.Souza; M.M.Saavedra, R.F.Monteiro, C.N.Fraga",2008,1,16,"Brazil","Espírito Santo","Águia Branca","Rochedo. Propriedade do Sr. Ailton Corteletti . Mata entre os afloramentos.",-18.954444,-40.801944,"Arbusto de 2 metros de altura com flores brancas.","Daphnopsis schwackeana Taub.","",,"GBIF"
"","MBML","MBML-HERBARIO","53817","Daphnopsis schwackeana","","Thymelaeaceae","Daphnopsis","schwackeana","","Taub.","L. Rossi/2019",,"","805","","M. C. Souza; M. M. Saavedra, R. F. Monteiro, C. N. Fraga",2008,4,16,"Brazil","Espírito Santo","Águia Branca","Rochedo. Propriedade do Sr. Ailton Corteletti. Mata entre os afloramentos",-18.954444,-40.801944,"Arbusto de 2 metros de altura com flores brancas. Habitat: Mata Atlântica. Hábito/Forma de vida: arbustivo","Daphnopsis schwackeana Taub.","",,"GBIF"
"","IF","SPSF","41191","Daphnopsis schwackeana","","Thymelaeaceae","Daphnopsis","schwackeana","","Taub.","G.A.D.C. Franco",2008,"","1114","","F.M.Souza & N.M.Ivanauskas & M.J.Robim & R.P.Sanches & H.Gallo & J.M. de Faria",2008,8,12,"Brazil","Sp","São Luis do Paraitinga","Estação Ecológica de Santa Virginia",-23.339167,-45.154722,,"Daphnopsis schwackeana Taub.","",,"GBIF"
"","IF","SPSF","41190","Daphnopsis schwackeana","","Thymelaeaceae","Daphnopsis","schwackeana","","Taub.","G.A.D.C. Franco",2008,"","1113","","F.M.Souza & N.M.Ivanauskas & M.J.Robim & R.P.Sanches",2008,8,12,"Brazil","Sp","São Luis do Paraitinga","Estação Ecológica de Santa Virginia",-23.339167,-45.154722,,"Daphnopsis schwackeana Taub.","",,"GBIF"
"","Universidade Estadual de Londrina, UEL","FUEL","45023","Daphnopsis schwackeana","","Thymelaeaceae","Daphnopsis","schwackeana","","Taub.","Franco, GADC",2008,"","1113","","Souza, FM; Ivanauskas, NM; Robim, MJ; Sanches, RP; Gallo, H; J.M. de Faria",2008,8,12,"Brazil","São Paulo","Ubatuba","Estação Ecológica de Santa Virgínia",,,"Lat. 23°20'21""S Long. 45°9'17""W.","Daphnopsis schwackeana Taub.","",,"GBIF"
"","Universidade Estadual de Londrina, UEL","FUEL","48887","Daphnopsis schwackeana","","Thymelaeaceae","Daphnopsis","schwackeana","","Taub.","Franco, GADC",2008,"","1114","","Souza, FM; Ivanauskas, NM; Robim, MJ; Sanches, RP; Gallo, H; J.M. de Faria",2008,8,12,"Brazil","São Paulo","Ubatuba","Estação Ecológica de Santa Virgínia",,,"Lat. 23°20'21""S Long. 45°91'70""W","Daphnopsis schwackeana Taub.","",,"GBIF"
"","UFRB","HURB","3791","Daphnopsis schwackeana","","Thymelaeaceae","Daphnopsis","schwackeana","","Taub.","G.A.D. Franco",2008,"","1114","","Souza, F.M.; et al.",2008,8,12,"Brazil","São Paulo","Ubatuba","Estação Ecológica de Santa Virginia;",-23.339167,-45.154722,,"Daphnopsis schwackeana Taub.","",,"GBIF"
"","Instituto de Botânica","SP","426354","Daphnopsis schwackeana","","Thymelaeaceae","Daphnopsis","schwackeana","","Taub.","Rossi, L",2011,"","1669","","Shirasuna, RT",2008,8,18,"Brazil","São Paulo","São Paulo","Lote 4, Parelheiros Rodoanel Mário Covas, Trecho Sul",,,,"Daphnopsis schwackeana Taub.","",,"GBIF"
"","IF","SPSF","44182","Daphnopsis schwackeana","","Thymelaeaceae","Daphnopsis","schwackeana","","Taub.",,,"","845","","R.A.F.Lima & A.G.Aguirre",2008,10,23,"Brazil","Sp","Ibiúna","Parque Estadual de Jurupará, Base Fumaça",,,"COLETA: Floresta Ombrófila Densa Montana Secundária.; GEOGRAFIA: Trilha do Tamanduá;","Daphnopsis schwackeana Taub.","",,"GBIF"
"","UNICAMP","UEC","166705","Daphnopsis schwackeana","","Thymelaeaceae","Daphnopsis","schwackeana","","Taub.","Tamashiro, JY",2009,"","1630","","Padgurschi, MCG; Tamashiro, JY; Belinello, R",2008,,,"Brazil","São Paulo","São Luiz do Paraitinga","PESM- Núcleo Santa Virgínia - Parcela K.",-23.325556,-45.067778,"K1771 Árvore, ca. 6 m, sem flores ou frutos. Abundância: 5 ind ha(-1).; Floresta Ombrófila Densa Montana.","Daphnopsis schwackeana Taub.","",,"GBIF"
"","UNICAMP","UEC","166704","Daphnopsis schwackeana","","Thymelaeaceae","Daphnopsis","schwackeana","","Taub.","Tamashiro, JY",2009,"","1637","","Padgurschi, MCG; Tamashiro, JY; Belinello, R",2008,,,"Brazil","São Paulo","São Luiz do Paraitinga","PESM- Núcleo Santa Virgínia - Parcela K.",-23.325556,-45.067778,"K1778 Árvore, ca. 9 m, sem flores ou frutos. Abundância: 5 ind ha(-1).; Floresta Ombrófila Densa Montana.","Daphnopsis schwackeana Taub.","",,"GBIF"
"","UNICAMP","UEC","148830","Daphnopsis schwackeana","","Thymelaeaceae","Daphnopsis","schwackeana","","Taub.","Aranha, BA",2008,"","470","","Aranha, BA",2007,1,15,"Brazil","São Paulo","Ubatuba","Fazenda Capricórnio, Parcela J",-23.366389,-45.084167,,"Daphnopsis schwackeana Taub.","",,"GBIF"
"","Jardim Botânico Plantarum","HPL","11059","Daphnopsis schwackeana","","Thymelaeaceae","Daphnopsis","schwackeana","","Taub.","G.A.D.C. Franco",2008,"","442","","R.T. Polisel",2007,9,15,"Brazil","Sp","Juquitiba","Coletado na estrada dos Carmos, rumo à represa do França, km 3,9, na beira da estrada, sub-bosque da mata (S 23° 58' 0""; W 47"" 6' 0"", 700m).",,,,"Daphnopsis schwackeana Taub.","",,"GBIF"
"","IAC","IAC","50209","Daphnopsis schwackeana","","Thymelaeaceae","Daphnopsis","schwackeana","","Taub.","E. Ramos et al.",2007,"","599","","E. Ramos; H.R. Gonçalves & S. Santos",2007,10,1,"Brazil","São Paulo","Ubatuba","Fazenda Capricórnio, Núcleo Picinguaba/PESM, Parcela H",-23.372954,-45.082268,"Subparcela 99, Indivíduo H1585","Daphnopsis schwackeana Taub.","",,"GBIF"
"","Instituto de Botânica","SP","429359","Daphnopsis schwackeana","","Thymelaeaceae","Daphnopsis","schwackeana","","Taub.","Rossi, L",2009,"","5003","","Almeida Scabbia, RJ; Santos, MA",2007,10,10,"Brazil","São Paulo","Santo André","Subprefeitura de Paranapiacaba e Parque andreense, em frente ao restaurante da Subprefeitura",-23.757017,-46.455158,,"Daphnopsis schwackeana Taub.","",,"GBIF"
"","MNHN","P","P06233625","Daphnopsis schwackeana","","Thymelaeaceae","Daphnopsis","schwackeana","","Taub.",,,"",,"","Scabbia, R.J.A.|Santos, M.A.",2007,10,10,"Brazil","São Paulo",,,-23.75,-46.45,,"Daphnopsis schwackeana Taub.","",,"GBIF"
"","UNICAMP","UEC","200452","Daphnopsis schwackeana","","Thymelaeaceae","Daphnopsis","schwackeana","","Taub.",,2008,"","N1425","","Pereira, LS; Belinello, R; Gomes, JAMA",2007,12,,"Brazil","São Paulo","São Luiz do Paraitinga","Parque Estadual da Serra do Mar",-23.4,-45.183333,"Parcela N - Projeto Biota-FAPESP. Árvore com 3.5 metros de altura. Frequência da espécie na parcela: n=6; Mata Atlântica","Daphnopsis schwackeana Taub.","",,"GBIF"
"","IAC","IAC","49014","Daphnopsis schwackeana","","Thymelaeaceae","Daphnopsis","schwackeana","","Taub.","J.A.M.A. Gomes et al.",2006,"","369","","J.A.M.A. Gomes; L.C. Bernacci; O.A. Santos; S. Santos & F.J. Benedetti",2006,11,1,"Brazil","São Paulo","Ubatuba","Fazenda Capricórnio, Parcela G (Parque Estadual da Serra do Mar, Núcleo Picinguaba)",-23.373498,-45.080223,"subparcela 86, indivíduo G 1388","Daphnopsis schwackeana Taub.","",,"GBIF"
"","IAC","IAC","50544","Daphnopsis schwackeana","","Thymelaeaceae","Daphnopsis","schwackeana","","Taub.","J.A.M.A. Gomes & C.B. Virillo",2006,"","615","","J.A.M.A. Gomes & C.B. Virillo",2006,11,9,"Brazil","São Paulo","Ubatuba","Fazenda Capricórnio, Parcela G (Parque Estadual da Serra do Mar, Núcleo Picinguaba)",-23.373498,-45.080223,"indivíduo G 0241","Daphnopsis schwackeana Taub.","",,"GBIF"
"","UNICAMP","UEC","132850","Daphnopsis schwackeana","","Thymelaeaceae","Daphnopsis","schwackeana","","Taub.","Tamashiro, JY",,"","18","","Urbanetz, C; Mariuza; Lelo; Domingos",2003,5,1,"Brazil","São Paulo","Cananéia","Fazenda Folha Larga.",-24.883333,-47.916667,"Frutos carnosos verdes.","Daphnopsis schwackeana Taub.","",,"GBIF"
"","IF","SPSF","31583","Daphnopsis schwackeana","","Thymelaeaceae","Daphnopsis","schwackeana","","Taub.",,,"","532","","P.Affonso & R.Lopes Neto",2001,7,16,"Brazil","Sp","São Paulo","Parque Estadual da Serra do Mar, Núcleo Curucutú",,,"COLETA: XLS: SPSFAntigo;","Daphnopsis schwackeana Taub.","",,"GBIF"
"","IF","SPSF","31609","Daphnopsis schwackeana","","Thymelaeaceae","Daphnopsis","schwackeana","","Taub.",,,"","533","","P.Affonso & R.L.Neto",2001,7,16,"Brazil","Sp","São Paulo","P.E.Serra do Mar, Núcleo Curucutu",,,"COLETA: XLS: SPSFAntigo;","Daphnopsis schwackeana Taub.","",,"GBIF"
"","USP","SPF","165397","Daphnopsis schwackeana","","Thymelaeaceae","Daphnopsis","schwackeana","","Taub.","Garcia, RJF",2001,"","532","","Affonso, P",2001,7,16,"Brazil","São Paulo","São Paulo","Parque Estadual da Serra do Mar",-23.985278,-46.743056,,"Daphnopsis schwackeana Taub.","",,"GBIF"
"","USP","SPF","165398","Daphnopsis schwackeana","","Thymelaeaceae","Daphnopsis","schwackeana","","Taub.","Rossi, L",2001,"","533","","Affonso, P",2001,7,16,"Brazil","São Paulo","São Paulo","Parque Estadual da Serra do Mar",-23.985278,-46.743056,,"Daphnopsis schwackeana Taub.","",,"GBIF"
"","IF","SPSF","29975","Daphnopsis schwackeana","","Thymelaeaceae","Daphnopsis","schwackeana","","Taub.","N.M.Ivanaukas",2008,"","48","","Turma Disciplina Taxonomia Vegetal",2001,11,21,"Brazil","Sp","São Luis do Paraitinga","Núcleo Santa Virginia",,,"COLETA: XLS: SPSFAntigo; GEOGRAFIA: floresta ombrofila&nf;;","Daphnopsis schwackeana Taub.","",,"GBIF"
"","IF","SPSF","28705","Daphnopsis schwackeana","","Thymelaeaceae","Daphnopsis","schwackeana","","Taub.",,,"","108","","F.O. Souza",2000,7,20,"Brazil","Sp","Caraguatatuba","P.E.Serra do Mar, Núcleo Caraguatatuba",,,"COLETA: XLS: SPSFAntigo; GEOGRAFIA: mata ombrofila densa&nf;;","Daphnopsis schwackeana Taub.","",,"GBIF"
"","USP","SPF","150507","Daphnopsis schwackeana","","Thymelaeaceae","Daphnopsis","schwackeana","","Taub.","Rossi, L",2000,"","108","","Souza, FO",2000,7,20,"Brazil","São Paulo","Caraguatatuba","Parque Estadual da Serra do Mar",,,,"Daphnopsis schwackeana Taub.","",,"GBIF"
"","Universidade Federal de Minas Gerais","BHCB","57234","Daphnopsis schwackeana","","Thymelaeaceae","Daphnopsis","schwackeana","","Taub.",,,"","662","","Oliveira, PP",2000,8,9,"Brazil","Rio de Janeiro","Rio das Ostras","Reserva Biológica União",,,"Mata atlântica, morro","Daphnopsis schwackeana Taub.","",,"GBIF"
"","UEFS","HUEFS","84639","Daphnopsis schwackeana","","Thymelaeaceae","Daphnopsis","schwackeana","","Taub.",,,"","662","","Oliveira, P.P.",2000,8,9,"Brazil","Rio de Janeiro","Rio das Ostras","Reserva Biológica União.",-22.516667,-41.933333,"Mata Atlântica, morro.","Daphnopsis schwackeana Taub.","",,"GBIF"
"","UNICAMP","UEC","115673","Daphnopsis schwackeana","","Thymelaeaceae","Daphnopsis","schwackeana","","Taub.","Tamashiro, JY",,"","131","","Hanazaki, N; Peroni, N; Teixeira, B",1999,6,22,"Brazil","São Paulo","Ilha Comprida","Pedrinhas",-24.895,-47.705,"Arbusto. &nf;Uso local: artesanato/ construção. &nf;Status: Nativa; Floresta Ombrófila Densa das Terras Baixas. Capoeira, beira de rio.","Daphnopsis schwackeana Taub.","",,"GBIF"
"","UNISANTA","HUSC","2021","Daphnopsis schwackeana","","Thymelaeaceae","Daphnopsis","schwackeana","","Taub.","Rossi, L.",1999,"","328","","Sampaio, P.S.P.; Magenta, M.A.G.",1999,8,19,"Brazil","São Paulo","Bertioga","Guaratuba, Fazenda Três Marias, estrada da captação.",,,"Arvoreta, 6m de altura. Flores creme.; Transição restinga-encosta.","Daphnopsis schwackeana Taub.","",,"GBIF"
"","UNICAMP","UEC","115162","Daphnopsis schwackeana","","Thymelaeaceae","Daphnopsis","schwackeana","","Taub.","Rossi, L",2009,"","778","","Cardoso-Leite, E",1998,6,9,"Brazil","São Paulo","Jundiaí","Reserva Biológica Municipal da Serra do Japi",-23.25,-46.25,"4,5m.","Daphnopsis schwackeana Taub.","",,"GBIF"
"","IF","SPSF","19226","Daphnopsis schwackeana","","Thymelaeaceae","Daphnopsis","schwackeana","","Taub.",,,"","611","","J.A.Pastore & J.B.Baitello",1995,7,21,"Brazil","Sp","Ibiúna","Parque Estadual de Jurupará, Fazenda Tucano",,,"COLETA: XLS: SPSFAntigo; GEOGRAFIA: mata ciliar&nf;;","Daphnopsis schwackeana Taub.","",,"GBIF"
"","MO","MO","100303271","Daphnopsis schwackeana","","Thymelaeaceae","Daphnopsis","schwackeana","","Taub.","L. Rossi (SP)",1997,"","Pastore 611","","J.A. Pastore|J.B. Baitello",1995,7,2,"Brazil","São Paulo",,"Parque Estadual de Jurapara, fazenda Tucano, na mata ciliar",,,,"Daphnopsis schwackeana Taub.","",,"GBIF"
"","IF","SPSF","17721","Daphnopsis schwackeana","","Thymelaeaceae","Daphnopsis","schwackeana","","Taub.",,,"","599","","M.L.Kawazaki & G.A.D.C. Franco",1994,8,18,"Brazil","Sp","Cunha","P.E.Serra do Mar - Núcleo Cunha",,,"COLETA: XLS: SPSFAntigo;","Daphnopsis schwackeana Taub.","",,"GBIF"
"","UNICAMP","UEC","073127","Daphnopsis schwackeana","","Thymelaeaceae","Daphnopsis","schwackeana","","Taub.","Rossi, L",2009,"","342","","Assis, MA; Furlan, A; Carneiro, CE; Farinaccio, MA; Scudeller, VV; Cavalcanti, DC",1994,8,28,"Brazil","São Paulo","Ubatuba","Estrada de Itamambuca, Km 45 da Rodovia Rio-Santos.",,,"Árvore até 7m dentro da mata. Flores masculinas brancas.; Mata Atlântica.","Daphnopsis schwackeana Taub.","",,"GBIF"
"","UNICAMP","UEC","073123","Daphnopsis schwackeana","","Thymelaeaceae","Daphnopsis","schwackeana","","Taub.","Rossi, L",2009,"","344","","Assis, MA; Furlan, A; Carneiro, CE; Farinaccio, MA; Scudeller, VV; Cavalcanti, DC",1994,8,28,"Brazil","São Paulo","Ubatuba","Estrada de Itamambuca, Km 45 da Rodovia Rio-Santos.",,,"Árvore até 4m dentro da mata. Flores masculinas brancas.; Mata Atlântica.","Daphnopsis schwackeana Taub.","",,"GBIF"
"","UNICAMP","UEC","073129","Daphnopsis schwackeana","","Thymelaeaceae","Daphnopsis","schwackeana","","Taub.","Rossi, L",2009,"","364","","Assis, MA; Furlan, A; Carneiro, CE; Farinaccio, MA; Scudeller, VV; Cavalcanti, DC",1994,8,28,"Brazil","São Paulo","Ubatuba","Trilha da Fazenda Capricórnio",-23.4,-45.083333,"Árvore até 5m dentro da mata. Flores femininas brancas.; Em plantação de cacau.","Daphnopsis schwackeana Taub.","",,"GBIF"
"","UNICAMP","UEC","85922","Daphnopsis schwackeana","","Thymelaeaceae","Daphnopsis","schwackeana","","Taub.","Rossi, L",2009,"","599","","Kawasaki, ML; Franco, GAD",1994,8,18,"Brazil","São Paulo","Cunha","Parque estadual da Serra do Mar, Estrada do Rio Paraibuna.",,,"Arvoreta 4m alt.; flores brancas.","Daphnopsis schwackeana Taub.","",,"GBIF"
"","MO","MO","100303261","Daphnopsis schwackeana","","Thymelaeaceae","Daphnopsis","schwackeana","","Taub.","L. Rossi (SP)",1997,"","Kawasaki 599","","Maria L. Kawasaki|G.A. Franco",1994,8,18,"Brazil","São Paulo",,"Parque Estadual da Serra do Mar, estrada do rio Paraibuna",,,,"Daphnopsis schwackeana Taub.","",,"GBIF"
"","MO","MO","100305151","Daphnopsis schwackeana","","Thymelaeaceae","Daphnopsis","schwackeana","","Taub.","L. Rossi (SP)",1997,"","Stehmann 1475","","J.R. Stehmann|Marcos Sobral",1994,8,17,"Brazil","São Paulo",,"Jureia., trilha Grajauna-Guilherme",,,,"Daphnopsis schwackeana Taub.","",,"GBIF"
"","MO","MO","100305201","Daphnopsis schwackeana","","Thymelaeaceae","Daphnopsis","schwackeana","","Taub.","L. Rossi (SP)",1997,"","Assis 344","","Marco A. de Assis|et al.",1994,8,28,"Brazil","São Paulo",,"Estrada de itamambuca, km 35 da rodovia Rio/Santos",,,,"Daphnopsis schwackeana Taub.","",,"GBIF"
"","MO","MO","100305153","Daphnopsis schwackeana","","Thymelaeaceae","Daphnopsis","schwackeana","","Taub.","L. Rossi (SP)",1997,"","Stehmann 1479","","J.R. Stehmann|Marcos Sobral",1994,8,17,"Brazil","São Paulo",,"Jureia., trilha Grajauna-Guilherme",,,,"Daphnopsis schwackeana Taub.","",,"GBIF"
"","MO","MO","100305199","Daphnopsis schwackeana","","Thymelaeaceae","Daphnopsis","schwackeana","","Taub.","L. Rossi (SP)",1997,"","Assis 342","","Marco A. de Assis|et al.",1994,8,28,"Brazil","São Paulo",,"Estrada de itamambuca, km 35 da rodovia Rio/Santos",,,,"Daphnopsis schwackeana Taub.","",,"GBIF"
"","MO","MO","100305203","Daphnopsis schwackeana","","Thymelaeaceae","Daphnopsis","schwackeana","","Taub.","L. Rossi (SP)",1997,"","Assis 364","","Marco A. de Assis|et al.",1994,8,28,"Brazil","São Paulo",,"Trilha da Fazenda Capricornio em plantacao de cacau",-23.4,-45.083333,,"Daphnopsis schwackeana Taub.","",,"GBIF"
"","Escola Superior de Agricultura Luiz de Queiroz, ESALQ","ESA","17903","Daphnopsis schwackeana","","Thymelaeaceae","Daphnopsis","schwackeana","","Taub.","Rossi, L.",2005,"","364","","Assis, M.A. et al.",1994,8,28,"Brazil","São Paulo","Ubatuba",,,,,"Daphnopsis schwackeana Taub.","",,"GBIF"
"","USP","SPF","96112","Daphnopsis schwackeana","","Thymelaeaceae","Daphnopsis","schwackeana","","Taub.","Rossi, L",1997,"","1655","","Rossi, L",1994,9,5,"Brazil","São Paulo","Salesópolis","Estação Biológica de Boracéia",,,,"Daphnopsis schwackeana Taub.","",,"GBIF"
"","MO","MO","100303253","Daphnopsis schwackeana","","Thymelaeaceae","Daphnopsis","schwackeana","","Taub.","L. Rossi (SP)",1997,"","Esteves 2658","","G.L. Esteves|et al.",1994,9,29,"Brazil","São Paulo",,"Serra da Bocaina, alto vale do rio Paca (Bracui)",,,,"Daphnopsis schwackeana Taub.","",,"GBIF"
"","MO","MO","100303246","Daphnopsis schwackeana","","Thymelaeaceae","Daphnopsis","schwackeana","","Taub.","L. Rossi (SP)",1997,"","Catharino 2049","","E.L.M. Catharino|et al.",1994,9,29,"Brazil","São Paulo",,"Serra da Bocaina, alto vale do rio Paca (Bracui)",,,,"Daphnopsis schwackeana Taub.","",,"GBIF"
"","MO","MO","100303249","Daphnopsis schwackeana","","Thymelaeaceae","Daphnopsis","schwackeana","","Taub.","L. Rossi (SP)",1997,"","Catharino 2051","","E.L.M. Catharino|et al.",1994,9,29,"Brazil","São Paulo",,"Serra da Bocaina, alto vale do rio Paca (Bracui)",,,,"Daphnopsis schwackeana Taub.","",,"GBIF"
"","MO","MO","100305175","Daphnopsis schwackeana","","Thymelaeaceae","Daphnopsis","schwackeana","","Taub.","L. Rossi (SP)",1997,"","Rossi 1653","","Lucia Rossi|et al.",1994,9,5,"Brazil","São Paulo",,"Estacao Biologica de Boraceia, ""mata proxima ao alojamento""",,,,"Daphnopsis schwackeana Taub.","",,"GBIF"
"","MO","MO","100305169","Daphnopsis schwackeana","","Thymelaeaceae","Daphnopsis","schwackeana","","Taub.","L. Rossi (SP)",1997,"","Rossi 1637","","Lucia Rossi|et al.",1994,9,7,"Brazil","São Paulo",,"Estacao Biologica de Boraceia",,,,"Daphnopsis schwackeana Taub.","",,"GBIF"
"","MO","MO","100305167","Daphnopsis schwackeana","","Thymelaeaceae","Daphnopsis","schwackeana","","Taub.","L. Rossi (SP)",1997,"","Rossi 1636","","Lucia Rossi|et al.",1994,9,7,"Brazil","São Paulo",,"Estacao Biologica de Boraceia",,,,"Daphnopsis schwackeana Taub.","",,"GBIF"
