"modified","institutionCode","collectionCode","catalogNumber","scientificName","identificationQualifier","family","genus","specificEpithet","infraspecificEpithet","scientificNameAuthorship","identifiedBy","dateIdentified","typeStatus","recordNumber","fieldNumber","recordedBy","year","month","day","country","stateProvince","municipality","locality","decimalLatitude","decimalLongitude","occurrenceRemarks","acceptedNameUsage","occurrenceID","comments","bibliographicCitation"
"","JBRJ","RB","RB01378322","Coccoloba oblonga","","Polygonaceae","Coccoloba","oblonga","","Lindau","A.M. Miranda",,"","6838","","A.M. Miranda; K. Martins & A. Figueiredo",2017,10,19,"Brazil","Bahia","Saubara","Distrito de Cabuçu, Fazenda Cabuçu",,,"Arbusto com cerca de 3 metros de altura; caule acinzentado, folhas coriáceas; frutos imaturos verdes. Ocasional","Coccoloba oblonga Lindau","",,"GBIF"
"","UEFS","HUEFS","238605","Coccoloba oblonga","","Polygonaceae","Coccoloba","oblonga","","Lindau","A.M.Miranda",2017,"","6838","","Miranda, A.M.",2017,10,19,"Brazil","Bahia","Saubara","Cabuçu. Fazenda Cabuçu.",,,,"Coccoloba oblonga Lindau","",,"GBIF"
"","Universidade Federal da Bahia","ALCB","131610","Coccoloba oblonga","","Polygonaceae","Coccoloba","oblonga","","Lindau","Miranda, AM",2017,"","6838","","Miranda, AM; Martins, K",2017,10,19,"Brazil","Bahia","Saubara","Distrito de cabuçu, fazenda Cabuçu.",,,"ca 3m de altura, caule acinzentado, folhas coriáceas, frutos imaturos verdes. Ocasional.","Coccoloba oblonga Lindau","",,"GBIF"
"","Universidade Federal Rural de Pernambuco","HST","22034","Coccoloba oblonga","","Polygonaceae","Coccoloba","oblonga","","Lindau","A.M.Miranda",2017,"","6838","","A.M.Miranda; K.Martins, A.Figueredo",2017,10,19,"Brazil","Bahia","Saubara","distrito de Cabuçu, fazenda Cabuçu",,,"Arbusto ca. 3 m alt.; caule acinzentado; folhas coriáceas; frutos imaturos verdes. Ocasional.","Coccoloba oblonga Lindau","",,"GBIF"
"","UEFS","HUEFS","224858","Coccoloba oblonga","","Polygonaceae","Coccoloba","oblonga","","Lindau",,,"","13232","","Melo, E.",2016,6,18,"Brazil","Bahia","Santa Terezinha","Serra da Jibóia, ápice da serra.",-12.253611,-39.475833,"Mata Altântica.","Coccoloba oblonga Lindau","",,"GBIF"
"","UEFS","HUEFS","215672","Coccoloba oblonga","","Polygonaceae","Coccoloba","oblonga","","Lindau","E.Melo",2017,"","1257","","Costa, G.",2015,3,28,"Brazil","Bahia","Jiquiriçá","Cachoeira dos Amores. Fragmento de Mata, próximo a rio e pasto.",-13.2825,-39.570278,,"Coccoloba oblonga Lindau","",,"GBIF"
"","Comissão Executiva do Plano da Lavoura Cacaueira","CEPEC","142425","Coccoloba oblonga","","Polygonaceae","Coccoloba","oblonga","","Lindau","Sem Informação",,"","307","","Nogueira, M.G.C.",2014,8,30,"Brazil","Bahia","NILO PEÇANHA","Conglomerado BA_1067-1-1-33",-13.679722,-39.060278,"Duplicatas: NAO","Coccoloba oblonga Lindau","",,"GBIF"
"","Comissão Executiva do Plano da Lavoura Cacaueira","CEPEC","142427","Coccoloba oblonga","","Polygonaceae","Coccoloba","oblonga","","Lindau","Sem Informação",,"","319","","Nogueira, M.G.C.",2014,8,30,"Brazil","Bahia","NILO PEÇANHA","Conglomerado BA_1067-1-6-45",-13.679722,-39.060278,"Duplicatas: NAO","Coccoloba oblonga Lindau","",,"GBIF"
"","UEFS","HUEFS","175422","Coccoloba oblonga","","Polygonaceae","Coccoloba","oblonga","","Lindau",,,"","836","","Popovkin, A.V.",2011,2,9,"Brazil","Bahia","Entre Rios","Imbé.",-12.05,-38,"Atlantic Forest.","Coccoloba oblonga Lindau","",,"GBIF"
"","UEFS","HUEFS","172165","Coccoloba oblonga","","Polygonaceae","Coccoloba","oblonga","","Lindau","E.Melo",2016,"","1012","","Saavedra, M.M.",2009,7,27,"Brazil","Bahia","Porto Seguro","BR - 367, ca. 12 Km de Porto Seguro em direção a Santa Cruz de Cabrália.",-16.357778,-39.013056,"Restinga Arbórea.","Coccoloba oblonga Lindau","",,"GBIF"
"","Universidade Federal de Sergipe, UFS","ASE","9283","Coccoloba oblonga","","Polygonaceae","Coccoloba","oblonga","","Lindau","Melo, E",2016,"","109","","Ribeiro, LV; Santos; E.V.Brunos",2006,6,12,"Brazil","Sergipe","São Cristóvão","Fragmento de Mata próxima á rodovia Jõao Bebe Água",-10.0053,-37.1223,"Arbusto. Com frutos.; Arbusto. Com frutos.; Borda da Mata","Coccoloba oblonga Lindau","",,"GBIF"
"","Universidade Federal da Bahia","ALCB","73493","Coccoloba oblonga","","Polygonaceae","Coccoloba","oblonga","","Lindau","Santos, JS",2006,"","126","","Santos, JS; Guedes, ML; Valadão, RM; Carvalho, G",2006,7,24,"Brazil","Bahia","Cachoeira","Recôncavo Sul, RPPN-Peninha-Mata do Mato Preto",-12.616667,-38.95,"ca de 3m altura, com ramos lenticelados. Folhas cartáceas, discolores. Frutos imaturos verdes.","Coccoloba oblonga Lindau","",,"GBIF"
"","UEFS","HUEFS","126809","Coccoloba oblonga","","Polygonaceae","Coccoloba","oblonga","","Lindau","E.Melo",2017,"","1073","","Paixão, J.L.",2006,8,18,"Brazil","Bahia","Potiraguá","Rod. que liga a BR 101 com Itapetinga, ca. 15 Km de Itaibé, Faz. Idependência. Área com ação antropica, proviniente da extração da madeira.",-15.203333,-39.575,"Mata higrófila sul bahiana.","Coccoloba oblonga Lindau","",,"GBIF"
"","UEFS","HUEFS","127275","Coccoloba oblonga","","Polygonaceae","Coccoloba","oblonga","","Lindau","E.Melo",2016,"","6181","","Amorim, A.",2006,9,2,"Brazil","Bahia","Saubara","Rod. Cachoeira de São Félix a Santo Amaro. Entrocamento ca. 10 km de Santo Amaro em direção a Saubara. Estrada vicinal em direção ao assentamento.",-12.78,-38.79,"Interior de mata próximo ao córrego.","Coccoloba oblonga Lindau","",,"GBIF"
"","UESB","HUESB","4095","Coccoloba oblonga","","Polygonaceae","Coccoloba","oblonga","","Lindau","E.Melo",2005,"","3978","","Melo, E.; B.M.Silva.; B.M.Silva.",2005,7,22,"Brazil","Bahia","Santa Teresinha","Serra da Jibóia.",-12.854722,-39.475,"Amostra p/ DNA. Troca de material.; Arbusto ca. 3 m alt. Folhas coriáceas discolores. Frutos imaturos verdes.; Ápice da serra.","Coccoloba oblonga Lindau","",,"GBIF"
"","UEFS","HUEFS","98823","Coccoloba oblonga","","Polygonaceae","Coccoloba","oblonga","","Lindau",,,"","3978","","Melo, E.",2005,7,22,"Brazil","Bahia","Santa Terezinha","Serra da Jibóia.",-12.854722,-39.475,"Ápice da serra.","Coccoloba oblonga Lindau","",,"GBIF"
"","UESC","UESC","13679","Coccoloba oblonga","","Polygonaceae","Coccoloba","oblonga","","Lindau",,,"","1395","","Nunes, T.S.",2005,12,27,"Brazil","Bahia","Santo Antônio",,-16.163611,-38.968889,"Árvore ca. 6m altura.","Coccoloba oblonga Lindau","",,"GBIF"
"","UEFS","HUEFS","104148","Coccoloba oblonga","","Polygonaceae","Coccoloba","oblonga","","Lindau","E.Melo",2016,"","1378","","Nunes, T.S.",2005,12,27,"Brazil","Bahia","Santo Antônio","Estrada para Belmonte.",-16.163611,-38.968889,,"Coccoloba oblonga Lindau","",,"GBIF"
"","UEFS","HUEFS","104165","Coccoloba oblonga","","Polygonaceae","Coccoloba","oblonga","","Lindau",,,"","1395","","Nunes, T.S.",2005,12,27,"Brazil","Bahia","Santo Antônio","Estrada para Belmonte.",-16.163611,-38.968889,,"Coccoloba oblonga Lindau","",,"GBIF"
"","NY","NY","1019275","Coccoloba oblonga","","Polygonaceae","Coccoloba","oblonga","","Lindau","E. de Melo",2006,"","1395","","T. S. Nunes",2005,12,27,"Brazil","Bahia",,"Estrada para Belmonte.",-16.1636,-38.9689,,"Coccoloba oblonga Lindau","",,"GBIF"
"","UEFS","HUEFS","83485","Coccoloba oblonga","","Polygonaceae","Coccoloba","oblonga","","Lindau",,,"","4933","","França, F.",2004,2,24,"Brazil","Bahia","Entre Rios","Estrada Entre-Rios-Linha Verde.",-11.980278,-37.935,"Tabuleiro arenoso.","Coccoloba oblonga Lindau","",,"GBIF"
"","UEFS","HUEFS","102177","Coccoloba oblonga","","Polygonaceae","Coccoloba","oblonga","","Lindau",,,"","496","","Macedo, G.E.L.",2004,2,28,"Brazil","Bahia","Jequié",,-13.944722,-40.109444,"Floresta estacional(Mata de cipó) zona de transição. Solo areno argiloso-pedregoso.","Coccoloba oblonga Lindau","",,"GBIF"
"","UEFS","HUEFS","102176","Coccoloba oblonga","","Polygonaceae","Coccoloba","oblonga","","Lindau",,,"","596","","Macedo, G.E.L.",2004,3,8,"Brazil","Bahia","Jequié",,-13.944722,-40.109444,"Floresta estacional(Mata de cipó) zona de transição. Solo areno argiloso-pedregoso.","Coccoloba oblonga Lindau","",,"GBIF"
"","UEFS","HUEFS","102175","Coccoloba oblonga","","Polygonaceae","Coccoloba","oblonga","","Lindau",,,"","1209","","Macedo, G.E.L.",2004,8,18,"Brazil","Bahia","Jequié",,-13.951111,-40.109722,"Floresta estacional(Mata de cipó) zona de transição. Solo areno argiloso-pedregoso.","Coccoloba oblonga Lindau","",,"GBIF"
"","UEFS","HUEFS","102174","Coccoloba oblonga","","Polygonaceae","Coccoloba","oblonga","","Lindau",,,"","1274","","Macedo, G.E.L.",2004,9,2,"Brazil","Bahia","Jequié",,-13.944722,-40.109444,"Floresta estacional(Mata de cipó) zona de transição. Solo areno argiloso-pedregoso.","Coccoloba oblonga Lindau","",,"GBIF"
"","UEFS","HUEFS","102173","Coccoloba oblonga","","Polygonaceae","Coccoloba","oblonga","","Lindau",,,"","1351","","Macedo, G.E.L.",2004,12,6,"Brazil","Bahia","Jequié",,-13.944722,-40.109444,"Floresta estacional(Mata de cipó) zona de transição. Solo areno argiloso-pedregoso.","Coccoloba oblonga Lindau","",,"GBIF"
"","Universidade Federal da Bahia","ALCB","61799","Coccoloba oblonga","","Polygonaceae","Coccoloba","oblonga","","Lindau","Melo, E",2003,"","10252","","Guedes, ML; Rigueira, D",2003,4,12,"Brazil","Bahia","Cairu","Baixo Sul, Garapuá, Caminho para a Mata do Abreu",-13.483333,-39.033333,"escandente. Folhas semi-crassas, discolores, com a face adaxial verde escura. Inflorescência axilar. Fruto imaturo verde.","Coccoloba oblonga Lindau","",,"GBIF"
"","Comissão Executiva do Plano da Lavoura Cacaueira","CEPEC","101535","Coccoloba oblonga","","Polygonaceae","Coccoloba","oblonga","","Lindau","E. de Melo",,"","10252","","M. L. Guedes",2003,4,12,"Brazil","Bahia","CAIRÚ","Litoral Sul. Garapuá. Caminho para a Mata do Abreu.",-13.483333,-39.033333,,"Coccoloba oblonga Lindau","",,"GBIF"
"","USP","SPF","159931","Coccoloba oblonga","","Polygonaceae","Coccoloba","oblonga","","Lindau","Melo, E",2003,"","10252","","Guedes, ML",2003,4,12,"Brazil","Bahia","Cairu","Guarapuá, caminho para a Mata do Abreu.",-13.483333,-39.033333,,"Coccoloba oblonga Lindau","",,"GBIF"
"","UEFS","HUEFS","57653","Coccoloba oblonga","","Polygonaceae","Coccoloba","oblonga","","Lindau","E.Melo",2016,"","824","","Nunes, T.S.",2002,1,9,"Brazil","Bahia","Santa Cruz Cabrália","Estrada Arraial dÁjuda para Trancoso, BR 367, 37 Km do entroncamento para Porto Seguro, entrada a esquerda no sentido Trancoso, ca. 3 Km do asfalto.",-16.555278,-39.124722,"Restinga arbórea aberta.","Coccoloba oblonga Lindau","",,"GBIF"
"","UEFS","HUEFS","81110","Coccoloba oblonga","","Polygonaceae","Coccoloba","oblonga","","Lindau","E.Melo",2016,"","4605","","Mattos-Silva, L.A.",2002,7,14,"Brazil","Bahia","Una","Fazenda Bolandeira.",-15.315278,-39.005556,"Restinga arbórea. Solo arenoso. Coletadas numa extensa faixa da mata, no sentido Norte-Sul, paralela aos cordões litorâneos e próximos a uma área que apresenta uma vegetação semelhante à do Cerrado.","Coccoloba oblonga Lindau","",,"GBIF"
"","UEFS","HUEFS","52667","Coccoloba oblonga","","Polygonaceae","Coccoloba","oblonga","","Lindau",,,"","3284","","Melo, E.",2001,3,30,"Brazil","Bahia","Coração de Maria","Fazenda Belmonte.",-12.25,-38.8,"Mata.","Coccoloba oblonga Lindau","",,"GBIF"
"","Comissão Executiva do Plano da Lavoura Cacaueira","CEPEC","54056","Coccoloba oblonga","","Polygonaceae","Coccoloba","oblonga","","Lindau","E. de Melo",,"","8573","","W. W. Thomas",2001,7,1,"Brazil","Bahia","URUÇUCA","7.3Km ao N de Serrra Grande Rod. P/ Itacaré, Faz. Lagoa. Parcela 41. Árvore 2020.",-14.416667,-39.016667,,"Coccoloba oblonga Lindau","",,"GBIF"
"","Universidade Federal da Bahia","ALCB","62101","Coccoloba oblonga","","Polygonaceae","Coccoloba","oblonga","","Lindau",,,"","3481","","E, Melo; França, F; Cavalcanti, V",2001,11,2,"Brazil","Bahia","Santa Teresinha","Recôncavo Sul, Serra da Jibóia. Ápice da Serra",-12.85,-39.466667,"Esgalhado. Folhas discolores. Frutos imaturos verdes e maduros vináceos.","Coccoloba oblonga Lindau","",,"GBIF"
"","UEFS","HUEFS","57015","Coccoloba oblonga","","Polygonaceae","Coccoloba","oblonga","","Lindau",,,"","3481","","Melo, E.",2001,11,2,"Brazil","Bahia","Santa Terezinha","Serra da Jibóia. Ápice da Serra.",-12.85,-39.466667,,"Coccoloba oblonga Lindau","",,"GBIF"
"","USP","SPF","158779","Coccoloba oblonga","","Polygonaceae","Coccoloba","oblonga","","Lindau","Melo, E",,"","3481","","Melo, E",2001,11,2,"Brazil","Bahia","Santa Teresinha","Serra da Jibóia",-12.85,-39.466667,,"Coccoloba oblonga Lindau","",,"GBIF"
"","Universidade Federal da Bahia","ALCB","59114","Coccoloba oblonga","","Polygonaceae","Coccoloba","oblonga","","Lindau","Melo, E",2012,"","2899","","Jardim, JG; Aguiar, C; Sant'Ana, SC de; Juchum, F; Paixão, JL da",2000,2,24,"Brazil","Bahia","São Miguel das Matas","Recôncavo Sul, Faz. Engenho da Lama (Proprietário Genival Lucas), ca. 4,5 km ao sul da cidade",-13.425,-39.432222,"Escandente. Ca. de 1m. Folhas verdes na face superior e a face inferior mais clara. Frutos imaturos verdes.","Coccoloba oblonga Lindau","",,"GBIF"
"","UEFS","HUEFS","62842","Coccoloba oblonga","","Polygonaceae","Coccoloba","oblonga","","Lindau","E.Melo",2005,"","2899","","Jardim, J.G.",2000,2,24,"Brazil","Bahia","São Miguel das Matas","Faz. Engenho da Lama (Proprietário Genival Lucas), ca. 4,5 km ao S da cidade.",-13.046944,-39.432222,"Mata Higrófila.","Coccoloba oblonga Lindau","",,"GBIF"
"","NY","NY","02796046","Coccoloba oblonga","","Polygonaceae","Coccoloba","oblonga","","Lindau",,,"","2899","","J. G. Jardim",2000,2,24,"Brazil","Bahia",,"Recôncavo Sul, Faz. Engenho da Lama (Proprietário Genival Lucas), ca. 4,5 km ao sul da cidade",-13.0469,-39.4322,,"Coccoloba oblonga Lindau","",,"GBIF"
"","UEFS","HUEFS","50281","Coccoloba oblonga","","Polygonaceae","Coccoloba","oblonga","","Lindau","E.Melo",2000,"","1138","","Jesus, N.G.",2000,3,23,"Brazil","Bahia","Entre Rios","RPPN Fazenda Lontra/Saudade.",-12.915278,-40.215556,,"Coccoloba oblonga Lindau","",,"GBIF"
"","UEFS","HUEFS","135093","Coccoloba oblonga","","Polygonaceae","Coccoloba","oblonga","","Lindau","E.Melo",2017,"","1138","","Jesus, N.G.",2000,3,23,"Brazil","Bahia","Entre Rios","RPPN Fazenda Lontra/ Saudade.",-12.915278,-40.215556,,"Coccoloba oblonga Lindau","",,"GBIF"
"","UFPR","UPCB","47036","Coccoloba oblonga","","Polygonaceae","Coccoloba","oblonga","","Lindau","Melo, E. de",2000,"","54","","Silva, B.M.da",2000,4,15,"Brazil","Bahia","Santa Teresinha","Serra da Jibóia",,,"Arbusto ca. 2,5m, folhas cartácea levemente discolor, inflorescência passada..","Coccoloba oblonga Lindau","",,"GBIF"
"","UEFS","HUEFS","44544","Coccoloba oblonga","","Polygonaceae","Coccoloba","oblonga","","Lindau",,,"","394","","Miranda, E.B.",2000,4,16,"Brazil","Bahia","Entre Rios","Estrada para Imbé, ca. 1 km da Linha Verde.",-12.281389,-37.895,"Mata Atlântica.","Coccoloba oblonga Lindau","",,"GBIF"
"","UEFS","HUEFS","44773","Coccoloba oblonga","","Polygonaceae","Coccoloba","oblonga","","Lindau",,,"","54","","Silva, B.M.",2000,4,15,"Brazil","Bahia","Santa Terezinha","Serra da Jibóia.",-12.854722,-41.814722,,"Coccoloba oblonga Lindau","",,"GBIF"
"","IPA","IPA","63726","Coccoloba oblonga","","Polygonaceae","Coccoloba","oblonga","","Lindau","Melo, E. de",2000,"","394","","Miranda, E.B.; França, F.; Melo, E.; Silva, E.; França, F.; Melo, E.; Silva, E.",2000,4,16,"Brazil","Bahia","Entre Rios","estrada para Imbé, ca. 1km da linha verde.",-12.281389,-37.895,"Arbusto escandente ca. 3m de altura. Folha crassa discolor, face abaxial verde-claro. Frutos imaturos verdes.; Mata Atlântica.","Coccoloba oblonga Lindau","",,"GBIF"
"","Cenargen","CEN","42267","Coccoloba oblonga","","Polygonaceae","Coccoloba","oblonga","","Lindau","E. Melo",,"","394","","Elaine Barbosa Miranda-Silva",2000,4,16,"Brazil","Ba","ENTRE RIOS","Estrada para Imbé, ca. de 1 km da Linha Verde.",-12.28139,-37.895,"Folhas crassa discolor, face abaxial verde-claro, Doação do Herbário da Universidade Estadual de Feira de Santana - HUEFS (44544). Feira de Santana - Bahia.","Coccoloba oblonga Lindau","",,"GBIF"
"","Escola Superior de Agricultura Luiz de Queiroz, ESALQ","ESA","84081","Coccoloba oblonga","","Polygonaceae","Coccoloba","oblonga","","Lindau","Melo, E.",,"","54","","Silva, B.M.",2000,4,15,"Brazil","Bahia","Santa Terezinha",,,,,"Coccoloba oblonga Lindau","",,"GBIF"
"","Instituto Nacional de Pesquisas da Amazônia (INPA)","Coleção Botânica, Instituto Nacional de Pesquisas da Amazônia (INPA)","220470","Coccoloba oblonga","","Polygonaceae","Coccoloba","oblonga","","Lindau","Melo, E. de",2005,"","1390","","Mike Hopkins",2000,5,11,"Brazil","Bahia",,"Fazenda Rio Fundo. Mata ombrófilo densa, em estádio avançado de regeneração. Substrato areno-argiloso.",-11.595,-37.73,,"Coccoloba oblonga Lindau","",,"GBIF"
"","Universidade Federal da Bahia","ALCB","48732","Coccoloba oblonga","","Polygonaceae","Coccoloba","oblonga","","Lindau","Melo, E",2012,"","1390","","Fonseca, MR; Jesus, NG de; Guedes, ML",2000,5,11,"Brazil","Bahia","Jandaíra","Litoral Norte, Faz. Rio Fundo",-11.595,-37.731111,"Escandente. Folhas coriáceas, discolores, face adaxial brilhante. Frutos imaturos verdes.; Em estádio avançado de regeneração. Substrato areno-argiloso.","Coccoloba oblonga Lindau","",,"GBIF"
"","Universidade Estadual de Londrina, UEL","FUEL","35381","Coccoloba oblonga","","Polygonaceae","Coccoloba","oblonga","","Lindau","E. de Melo",2000,"","388","","M.M.da Silva; et al.",2000,5,6,"Brazil","Bahia","Ilhéus","Una, entrada p. povoado Pedras, entrada p. povoado Pedras",,,"Liana; folhas coriáceas, discolores, face adaxial verde escura, face abaxial verde clara; frutos imaturos verdes.","Coccoloba oblonga Lindau","",,"GBIF"
"","UFPB","JPB","32862","Coccoloba oblonga","","Polygonaceae","Coccoloba","oblonga","","Lindau","Melo, E de",2000,"","388","","Silva, MM da; Oliveira, RP; França, F; Santos, MA",2000,5,6,"Brazil","Bahia","Ilhéus","Una - entrada para povoado Pedras depois da entrada da reserva. Entrada a esquerda a 16 Km da estrada da reserva.",-15.269444,-39.533333,"; DESC: Liana. Folhas coriáceas, discolores, face adaxial verde escura, face abaxial verde clara. Frutos imaturos verdes.","Coccoloba oblonga Lindau","",,"GBIF"
"","UEFS","HUEFS","45358","Coccoloba oblonga","","Polygonaceae","Coccoloba","oblonga","","Lindau",,,"","388","","Silva, M.M.da",2000,5,6,"Brazil","Bahia","Ilhéus","Una - entrada para povoado Pedras depois da entrada da reserva. Entrada a esquerda a 16 km da estrada da reserva.",-15.269444,-39.050556,,"Coccoloba oblonga Lindau","",,"GBIF"
"","UEFS","HUEFS","50726","Coccoloba oblonga","","Polygonaceae","Coccoloba","oblonga","","Lindau","E.Melo",2005,"","1390","","Fonseca, M.R.",2000,5,11,"Brazil","Bahia","Jandaíra","Fazenda Rio Fundo.",-11.595,-37.731111,"Mata ombrófila densa, em estádio avançado de regeneração.","Coccoloba oblonga Lindau","",,"GBIF"
"","JBRJ","RB","RB00320951","Coccoloba oblonga","","Polygonaceae","Coccoloba","oblonga","","Lindau",,,"","388","","M.M. Silva; et al.",2000,5,6,"Brazil","Bahia","Ilhéus","Una - Entrada para povoado Pedras depois da entrada da reserva. Entrada a esquerda a 16Km da estrada da reserva.",-15.269445,-39.050556,"Liana. Folhas coriáceas, discolores, face adaxial verde escura, face abaxial verde clara. frutos imaturos verdes.","Coccoloba oblonga Lindau","",,"GBIF"
"","Comissão Executiva do Plano da Lavoura Cacaueira","CEPEC","25953","Coccoloba oblonga","","Polygonaceae","Coccoloba","oblonga","","Lindau","E. de Melo",,"","3694","","T. S. dos Santos",1999,6,22,"Brazil","Bahia","ILHÉUS","Quadra D do CEPEC.",,,,"Coccoloba oblonga Lindau","",,"GBIF"
"","Universidade Estadual de Londrina, UEL","FUEL","35223","Coccoloba oblonga","","Polygonaceae","Coccoloba","oblonga","","Lindau","E. de Melo",1999,"","3194","","França, F; et al.",1999,7,8,"Brazil","Bahia","Santa Terezinha","Serra da Jibóia",,,"Arbusto; escandente; folha coriáea discolor; fruto imaturo verde.","Coccoloba oblonga Lindau","",,"GBIF"
"","UEFS","HUEFS","38689","Coccoloba oblonga","","Polygonaceae","Coccoloba","oblonga","","Lindau","E.Melo",2002,"","3194","","França, F.",1999,7,8,"Brazil","Bahia","Santa Terezinha","Serra da Jibóia.",-12.85,-39.466667,"Vegetação Arbustivo-Arbórea antropizada densa.","Coccoloba oblonga Lindau","",,"GBIF"
"","UEFS","HUEFS","38691","Coccoloba oblonga","","Polygonaceae","Coccoloba","oblonga","","Lindau","E.Melo",2002,"","3196","","França, F.",1999,7,8,"Brazil","Bahia","Santa Terezinha","Serra da Jibóia.",-12.85,-39.466667,"Vegetação Arbustivo-Arbórea antropizada densa.","Coccoloba oblonga Lindau","",,"GBIF"
"","UnB","UB","157199","Coccoloba oblonga","","Polygonaceae","Coccoloba","oblonga","","Lindau","Melo, E",1999,"","3196","","França, F; Cordeiro, I; Carneiro, D; Silva, BM",1999,7,8,"Brazil","Bahia","Santa Teresinha","Serra da Jiboia",-12.852778,-39.466667,"Vegetação Arbustivo-arbórea antropizada densa","Coccoloba oblonga Lindau","",,"GBIF"
"","Cenargen","CEN","47067","Coccoloba oblonga","","Polygonaceae","Coccoloba","oblonga","","Lindau","E. Melo",,"","3194","","Flávio França",1999,7,8,"Brazil","Ba","SANTA TERESINHA","Serra da Jibóia",-12.85,-39.466666,"Folha coriaceas, Doação do Herbário da Universidade Estadual de Feira de Santana - HUEFS (38689). Feira de Santana - Bahia.","Coccoloba oblonga Lindau","",,"GBIF"
"","UEFS","HUEFS","51067","Coccoloba oblonga","","Polygonaceae","Coccoloba","oblonga","","Lindau","E.Melo",2005,"","7373","","Guedes, M.L.S.",1999,12,4,"Brazil","Bahia","Entre Rios","Litoral Norte.",,,,"Coccoloba oblonga Lindau","",,"GBIF"
"","UEFS","HUEFS","73069","Coccoloba oblonga","","Polygonaceae","Coccoloba","oblonga","","Lindau","E.Melo",2003,"","1489","","Jardim, J.G.",1998,2,3,"Brazil","Bahia","Jussari","Rod. Jussari/Palmira. Entrada ca. 7,5 km percorrendo mais 1,7 km até a sede da Faz. Teimoso. RPPN Serra do Teimoso",-15.166667,-39.583333,,"Coccoloba oblonga Lindau","",,"GBIF"
"","USP","SPF","171564","Coccoloba oblonga","","Polygonaceae","Coccoloba","oblonga","","Lindau","Melo, E",2003,"","1489","","Jardim, JG",1998,2,3,"Brazil","Bahia","Jussari","RPPN Serra do Teimoso",-15.166667,-39.583333,,"Coccoloba oblonga Lindau","",,"GBIF"
"","Instituto Nacional de Pesquisas da Amazônia (INPA)","Coleção Botânica, Instituto Nacional de Pesquisas da Amazônia (INPA)","205396","Coccoloba oblonga","","Polygonaceae","Coccoloba","oblonga","","Lindau",,,"","347","","Mike Hopkins",1998,3,29,"Brazil","Bahia",,"Litoral Norte, Entre Rios, RPPN Fazenda Lontra/ Saudade.",,,,"Coccoloba oblonga Lindau","",,"GBIF"
"","UEFS","HUEFS","54428","Coccoloba oblonga","","Polygonaceae","Coccoloba","oblonga","","Lindau","E.Melo",2001,"","347","","Jesus, N.G.",1998,3,29,"Brazil","Bahia","Entre Rios","RPPN Fazenda Lontra/Saudade.",-12.915278,-40.215556,"Floresta subperenifolia.","Coccoloba oblonga Lindau","",,"GBIF"
"","Comissão Executiva do Plano da Lavoura Cacaueira","CEPEC","26571","Coccoloba oblonga","","Polygonaceae","Coccoloba","oblonga","","Lindau","E. de Melo",,"","14121","","S. A. Mori",1996,3,31,"Brazil","Bahia","ITANAGRA","8Kma W da Rod. Itanagra/Subauma.",,,,"Coccoloba oblonga Lindau","",,"GBIF"
"","Comissão Executiva do Plano da Lavoura Cacaueira","CEPEC","24707","Coccoloba oblonga","","Polygonaceae","Coccoloba","oblonga","","Lindau","E. de Melo",,"","551","","A. Eupunino",1996,11,5,"Brazil","Bahia","PORTO SEGURO","Km 18 da BR-367 liga Porto Seguro/Cabralia.",,,,"Coccoloba oblonga Lindau","",,"GBIF"
"","Instituto Nacional de Pesquisas da Amazônia (INPA)","Coleção Botânica, Instituto Nacional de Pesquisas da Amazônia (INPA)","213573","Coccoloba oblonga","","Polygonaceae","Coccoloba","oblonga","","Lindau","Melo, E. de",1999,"","370","","Mike Hopkins",1995,4,6,"Brazil","Bahia",,"Fazenda do Bu. Mata do Bu. Floresta Ombrófila Aberta.",-12.035278,-37.73,,"Coccoloba oblonga Lindau","",,"GBIF"
"","Comissão Executiva do Plano da Lavoura Cacaueira","CEPEC","64015","Coccoloba oblonga","","Polygonaceae","Coccoloba","oblonga","","Lindau","E. de Melo",,"","6014","","A. M. de Carvalho",1995,4,5,"Brazil","Bahia","UNA","3Km na estrada Una/Ilheus, entrada p/ Pedras.",,,,"Coccoloba oblonga Lindau","",,"GBIF"
"","UEFS","HUEFS","31716","Coccoloba oblonga","","Polygonaceae","Coccoloba","oblonga","","Lindau","R.Howard",1995,"","6014","","Carvalho, A.M.de",1995,4,5,"Brazil","Bahia","Una","3km na estrada Una/Ilhéus. Entrada para o destrito de Pedras.",,,"Mata Higrófila Sul Baiana, mata de restinga perturbada.","Coccoloba oblonga Lindau","",,"GBIF"
"","UEFS","HUEFS","34318","Coccoloba oblonga","","Polygonaceae","Coccoloba","oblonga","","Lindau","E.Melo",1999,"","370","","Lima, M.P.M.",1995,4,6,"Brazil","Bahia","Conde","Fazenda do Bu, Mata da Maré.",-12.035278,-37.728611,"Floresta Ombrófila Arberta.","Coccoloba oblonga Lindau","",,"GBIF"
"","IPA","IPA","64538","Coccoloba oblonga","","Polygonaceae","Coccoloba","oblonga","","Lindau","Melo, E. de",1999,"","370","","Lima, M.P.M. de; et al.; et al.",1995,4,6,"Brazil","Bahia","Conde","Fazenda do Bu, mata da Maré.",-12.035278,-37.728611,"Árvore ca. 1,5m de altura; folhas com ócrea castanha, caduca. Inflorescência e flores verdes com pedicelo rosado quando da queda das flores, estames brancos.; Floresta Ombrófila Aberta.","Coccoloba oblonga Lindau","",,"GBIF"
"","MPEG","HERBMG","MG173172","Coccoloba oblonga","","Polygonaceae","Coccoloba","oblonga","","Lindau","Melo , E.",,"",,"","Lima, M.P.M. de",1995,4,6,"Brazil","Bahia",,"Conde",-12.035278,-37.728611,,"Coccoloba oblonga Lindau","",,"GBIF"
"","UEFS","HUEFS","34321","Coccoloba oblonga","","Polygonaceae","Coccoloba","oblonga","","Lindau","E.Melo",1999,"","723","","Ferreira, M.C.",1995,6,1,"Brazil","Bahia","Conde","Fazenda do Bu, trilha para Mata do Fundão, divisão com Pinus.",-12.025833,-37.703889,"Floresta Ombrófila Arberta.","Coccoloba oblonga Lindau","",,"GBIF"
