"modified","institutionCode","collectionCode","catalogNumber","scientificName","identificationQualifier","family","genus","specificEpithet","infraspecificEpithet","scientificNameAuthorship","identifiedBy","dateIdentified","typeStatus","recordNumber","fieldNumber","recordedBy","year","month","day","country","stateProvince","municipality","locality","decimalLatitude","decimalLongitude","occurrenceRemarks","acceptedNameUsage","occurrenceID","comments","bibliographicCitation"
"","IMA","MAC","32797","Eugenia umbrosa","","Myrtaceae","Eugenia","umbrosa","","O.Berg","E.C.O.Chagas",2009,"","108","","W.S.Ferreira-Junior; J.Y.A.Galdino",2008,4,5,"Brazil","Alagoas","Maceió","Usina Cachoeira, Fazenda Boa Vista",-9.416667,-35.7,"Árvore ca. 3 m de altura. Frutos marrons; Mata Atlântica","Eugenia umbrosa O.Berg","",,"GBIF"
"","UFPE","UFP","59767","Eugenia umbrosa","","Myrtaceae","Eugenia","umbrosa","","O.Berg",,,"","38","","Silva, M.A.M.; Mendes, P.G.A. & Guerra, T.N.F.",2008,8,30,"Brazil","Pernambuco","Igarassu","Usina São José, Mata de Zambana, Usina São José, Borda. Mata Atlântica.",,,"7º47'14,22""S / 34º56'39,81""W.","Eugenia umbrosa O.Berg","",,"GBIF"
"","IMA","MAC","34525","Eugenia umbrosa","","Myrtaceae","Eugenia","umbrosa","","O.Berg","E.C.O.Chagas",2008,"","1541","","Chagas-Mota; D.S.Correia; P.B.Alves",2008,11,13,"Brazil","Alagoas","Maceió","Serra da Saudinha.",-10.118611,-36.201944,"Árvore ca. 5 m de altura. Flores verdes. Planta com cera ou pêlos nas folhas.; Mata Pluvial Atlântica.","Eugenia umbrosa O.Berg","",,"GBIF"
"","IPA","IPA","78570","Eugenia umbrosa","","Myrtaceae","Eugenia","umbrosa","","O.Berg","Souza, M.C.",2008,"","262","","Marques, J.S.; Albuquerque, N.A.; Albuquerque, N.A.",2007,10,30,"Brazil","Pernambuco","Igarassu","Mata de Vespas, Usina São José. Interior ripário.",-7.751361,-34.981083,"Árvore ca. 7 metros. Flores brancas.Frequência média.","Eugenia umbrosa O.Berg","",,"GBIF"
"","IMA","MAC","31520","Eugenia umbrosa","","Myrtaceae","Eugenia","umbrosa","","O.Berg","E.C.O.Chagas",2009,"","86","","W.S.Ferreira-Junior; -",2007,12,22,"Brazil","Alagoas","Maceió",,-10.118611,-36.201944,"Árvore ca. de 4m de altura. Botões florais cremes.; Mata Atlântica.","Eugenia umbrosa O.Berg","",,"GBIF"
"","Universidade Federal de Minas Gerais","BHCB","125344","Eugenia umbrosa","","Myrtaceae","Eugenia","umbrosa","","O.Berg",,2008,"","2552","","Queiroz, EP; Filho, WRL",2007,12,3,"Brazil","Pernambuco","Recife","Engenho São João, Mata.",-8.064444,-34.9725,"Arvoreta, 5m de altura. Folhas subcoriáceas. Flores esverdeadas, passadas.","Eugenia umbrosa O.Berg","",,"GBIF"
"","JBRJ","RB","RB00514908","Eugenia umbrosa","","Myrtaceae","Eugenia","umbrosa","","O.Berg","M.C. Souza",2009,"","328","","M.C. Souza",2006,1,7,"Brazil","Rio de Janeiro","Teresópolis","Parque Navional da Serra dos Orgãos. Na borda do Rio Paqueque.",,,"Árvore com 6  metros de altura, com flores.","Eugenia umbrosa O.Berg","",,"GBIF"
"","UnB","UB","144767","Eugenia umbrosa","","Myrtaceae","Eugenia","umbrosa","","O.Berg",,,"","1085","","Mazine-Capelo, FF; et al.;",2006,11,24,"Brazil","Minas Gerais","Faria Lemos","Fazenda Santa Rita, trilha principal.",,,"Árvore c. de 30 m de altura, botões branco asverdeado, frutos amarelo-alaranjados.; Floresta ombrófila densa.","Eugenia umbrosa O.Berg","",,"GBIF"
"","UnB","UB","168885","Eugenia umbrosa","","Myrtaceae","Eugenia","umbrosa","","O.Berg","Sol. M.",2009,"","1085","","Mazine-Capelo, FF; Lucas, EJ; Leoni, L; Brummitt, NA; Campos, OR",2006,11,24,"Brazil","Minas Gerais","Faria Lemos","Fazenda Santa Rita, trilha principal.",-20.760278,-42.544444,"Árvore de ca. 30m de altura, botões branco-esverdeado, fruto amarelo-alaranjado.; Floresta ombrófila densa.","Eugenia umbrosa O.Berg","",,"GBIF"
"","K","Herbarium","K001021882","Eugenia umbrosa","","Myrtaceae","Eugenia","umbrosa","","O.Berg","Sobral, M.",,"","1085","","Jennings, L.V.S.; Flores, T.B.; Campos, O.R.; Sampaio, D.; Leoni, L.; Lucas, E.J.; Brummitt, N.A.; Mazine, F.F.",2006,11,24,"Brazil",,"Faria Lemos","Fazenda Santa Rita, trilha principal.",-20.76,-42.06,"Sheet 2/2; See wood and carpological collection","Eugenia umbrosa O.Berg","",,"GBIF"
"","K","Herbarium","K001021881","Eugenia umbrosa","","Myrtaceae","Eugenia","umbrosa","","O.Berg","Sobral, M.",,"","1085","","Jennings, L.V.S.; Flores, T.B.; Campos, O.R.; Sampaio, D.; Leoni, L.; Lucas, E.J.; Brummitt, N.A.; Mazine, F.F.",2006,11,24,"Brazil",,"Faria Lemos","Fazenda Santa Rita, trilha principal.",-20.76,-42.06,"Sheet 1/2. Material coletado em sílica. Foto. Material prensado em álcool. Molecular (DNA); Organ: Leaf (from silica); DNA Bank number: 35651; Taken by: Mazine; Dept.: Herbarium/Jodrell; Date: 2009. See carpological and wood collection","Eugenia umbrosa O.Berg","",,"GBIF"
"","UDESC","LUSC","7199","Eugenia umbrosa","","Myrtaceae","Eugenia","umbrosa","","O.Berg","SOBRAL, M.",,"","1085","","E.J. Lucas; et al.",2006,12,6,"Brazil","Bahia","Una","entrada para a estrada de Rio das Pedras.",,,,"Eugenia umbrosa O.Berg","",,"GBIF"
"","Universidade Federal da Bahia","ALCB","83617","Eugenia umbrosa","","Myrtaceae","Eugenia","umbrosa","","O.Berg","Sobral, M",2014,"","87","","Araújo, GB; Cavalcante, F",2005,5,16,"Brazil","Alagoas","Matriz de Camaragibe",,,,"ca. 3,5 cm alt. botões florais marrons.; secundária.","Eugenia umbrosa O.Berg","",,"GBIF"
"","IMA","MAC","22641","Eugenia umbrosa","","Myrtaceae","Eugenia","umbrosa","","O.Berg","E.C.O.Chagas",2009,"","87","","G.B.Araujo; Cavalcante, F",2005,5,16,"Brazil","Alagoas","Matriz do Camaragibe",,-9.254722,-35.8925,"Árvore ca. de 3,5m de altura. Botões florais marrons.; Mata Atlântica secundária.","Eugenia umbrosa O.Berg","",,"GBIF"
"","Universidade Federal de Minas Gerais","BHCB","96352","Eugenia umbrosa","","Myrtaceae","Eugenia","umbrosa","","O.Berg",,,"","392","","equipe acaraú",2005,7,4,"Brazil","Santa Catarina",,"faz. Acaraú",,,"Árvore, frutos imaturos marrom (ferrugem).","Eugenia umbrosa O.Berg","",,"GBIF"
"","IMA","MAC","28965","Eugenia umbrosa","","Myrtaceae","Eugenia","umbrosa","","O.Berg","E.C.O.Chagas",2009,"","246","","N.T. Mendonça",2005,11,9,"Brazil","Alagoas","Murici",,-9.535278,-36.559167,"Árvore ca. de 3,5m de altura. Flores amarelas. Frutos imaturos.; Mata Atlântica.","Eugenia umbrosa O.Berg","",,"GBIF"
"","JBRJ","RB","RB00421990","Eugenia umbrosa","","Myrtaceae","Eugenia","umbrosa","","O.Berg","M. Sobral",,"","113","","D. Sattler; C.H. Reif da Paula, M. Adamek & A. Kaczmarczyk",2004,2,3,"Brazil","Rio de Janeiro","Teresópolis","Vale do Rio Frade. Parque Nacional da Serra dos Órgãos",-22.447222,-43.006389,"Árvore, DAP 54 centímetros, altura cerca de 154 metros. Flores com cheiro adocicado","Eugenia umbrosa O.Berg","",,"GBIF"
"","Universidade Federal de Minas Gerais","BHCB","96417","Eugenia umbrosa","","Myrtaceae","Eugenia","umbrosa","","O.Berg",,,"","116","","equipe acaraú",2004,9,7,"Brazil","Santa Catarina",,"faz. Acaraú",,,"Árvore, fruto maduro amarelo (cítrico).","Eugenia umbrosa O.Berg","",,"GBIF"
"","UnB","UB","167964","Eugenia umbrosa","","Myrtaceae","Eugenia","umbrosa","","O.Berg","Faria, JEQ",2012,"","2589","","Fiaschi, P; Amorim, AM; Jardim, JG; Paixão, JL",2004,10,30,"Brazil","Bahia","Valença","Estrada de Valença para Guaibim. Ca de 2 km entrada a esq. 8 km rumo à sede da reserva.",-13.328889,-39.840278,"Árvore ca 10m alt. Folhas discolores. Frutos verdes, com cálice um pouco mais claro.","Eugenia umbrosa O.Berg","",,"GBIF"
"","IMA","MAC","20667","Eugenia umbrosa","","Myrtaceae","Eugenia","umbrosa","","O.Berg","E.C.O.Chagas",2009,"","1321","","M.Oliveira; A.A.Grillo",2003,3,12,"Brazil","Alagoas","Ibateguara","Coimbra, Cerrado da Burra. Área de Topo.",-9.6425,-36.451944,"Árvore ca. de 5 m de altura. Frutos imaturos verdes.; Mata Atlântica","Eugenia umbrosa O.Berg","",,"GBIF"
"","IMA","MAC","21252","Eugenia umbrosa","","Myrtaceae","Eugenia","umbrosa","","O.Berg","E.C.O.Chagas",2009,"","1321","","M.Oliveira; A.A.Grillo",2003,3,12,"Brazil","Alagoas","Ibateguara","Coimbra. Cerrado da Burra. Área de Topo.",-9.6425,-36.451944,"Árvore com ca. de 5m de altura. Frutos imaturos verdes. Frequente.","Eugenia umbrosa O.Berg","",,"GBIF"
"","UFPB","JPB","33930","Eugenia umbrosa","","Myrtaceae","Eugenia","umbrosa","","O.Berg","Figueira, M",2017,"","1321","","Oliveira, CAM de; Grillo, AA",2003,3,12,"Brazil","Alagoas","Ibateguara","Usina Serra Grande, Cerrado da Burra. Área de topo.",,,"; DESC: Arvore ca. 5 m de alt.; frutos imaturos verdes. Frequente.","Eugenia umbrosa O.Berg","",,"GBIF"
"","UFRPE","PEUFR","46039","Eugenia umbrosa","","Myrtaceae","Eugenia","umbrosa","","O.Berg","B.S.Amorim",2010,"","177","","G.J. Bezerra; A.Melquíades",2003,3,28,"Brazil","Pernambuco","Igarassu","Usina São José",,,"Árvore ca. 5m, flores brancas e botões","Eugenia umbrosa O.Berg","",,"GBIF"
"","MNHN","P","P04682377","Eugenia umbrosa","","Myrtaceae","Eugenia","umbrosa","","O.Berg","Giaretta",,"",,"","Thomas, W.W.|Amorim, A.M.|Querino, R.N.|Paixão, J.L.|Sant´Ana, S.",2003,3,15,"Brazil","Bahia",,,-15.09556,-39.5425,,"Eugenia umbrosa O.Berg","",,"GBIF"
"","IMA","MAC","20002","Eugenia umbrosa","","Myrtaceae","Eugenia","umbrosa","","O.Berg","E.C.O.Chagas",2009,"","8067","","R.P.Lyra-Lemos; et al.",2003,10,18,"Brazil","Alagoas","Matriz do Camaragibe","Santuário Ecológico da Serra D'água.",-10.061667,-35.567222,"Árvore, ca. de 4m de altura. Frutos ferrugíneos.; Mata Atlântica em serra.","Eugenia umbrosa O.Berg","",,"GBIF"
"","Universidade Federal de Minas Gerais","BHCB","128677","Eugenia umbrosa","","Myrtaceae","Eugenia","umbrosa","","O.Berg",,2009,"","38","","Freire, SG; Silva, HCH; Fernandes, HMC",2002,1,31,"Brazil","Pernambuco","Igarassu","Usina São José, Engenho D'água. Mata de Piedade. Trilha na área ripária.",-7.848611,-34.358056,"Árvore, 3m de altura, folhas verdes discolores, frutos marrons com sépalas persistentes.","Eugenia umbrosa O.Berg","",,"GBIF"
"","IMA","MAC","15368","Eugenia umbrosa","","Myrtaceae","Eugenia","umbrosa","","O.Berg","E.C.O.Chagas",2009,"","6328","","R.P.Lyra-Lemos; W.Thomas; Barbosa; Rodal; et al.",2002,3,17,"Brazil","Alagoas","Branquinha","Fazenda Riachão.",-9.250556,-35.935,"Árvore com ca. de 3,5m de altura. Frutos maduros marrons.; Mata Atlântica em Serra.","Eugenia umbrosa O.Berg","",,"GBIF"
"","UFPE","UFP","32203","Eugenia umbrosa","","Myrtaceae","Eugenia","umbrosa","","O.Berg","Sobral, M.",2006,"","954","","Lucena, M.F.A.; Araújo, A. & Araújo, J.E.",2002,3,2,"Brazil","Pernambuco","Paulista","Loteamento alto do Morumbi, Interior da mata.",,,"Arbusto ca. 3m alt., folhas cartáceas; frutos imaturos de cor marrom; enrugados, com excrescências., cálice persistente verde.; Vegetação Árborea densa. Solo areno-argiloso rico em serrapilheira.","Eugenia umbrosa O.Berg","",,"GBIF"
"","UEFS","HUEFS","82622","Eugenia umbrosa","","Myrtaceae","Eugenia","umbrosa","","O.Berg","M.Sobral",2013,"","6328","","Lyra-Lemos, R.P.",2002,3,17,"Brazil","Alagoas","Branquinha","Fazenda Riachão.",-9.250556,-35.935,"Mata Atlântica em serra.","Eugenia umbrosa O.Berg","",,"GBIF"
"","JBRJ","RB","RB00309178","Eugenia umbrosa","","Myrtaceae","Eugenia","umbrosa","","O.Berg",,,"","09","","Alexandre Quinet",2001,2,16,"Brazil","Rio de Janeiro","Nova Friburgo","Lumiar, Sítio dos Lírios Brancos.",-22.352222,-42.3825,"Árvore, 6m de altura, 35 cm de DAP, folha discolor verde, fruto imaturo verde de cálice persistente.","Eugenia umbrosa O.Berg","",,"GBIF"
"","USP","SPF","162079","Eugenia umbrosa","","Myrtaceae","Eugenia","umbrosa","","O.Berg","Sobral, M",2005,"","573","","Lobão, AQ",2001,4,12,"Brazil","Rio de Janeiro","Teresópolis","Parque Nacional da Serra dos Órgãos",,,,"Eugenia umbrosa O.Berg","",,"GBIF"
"","UFSCar","SORO","6668","Eugenia umbrosa","","Myrtaceae","Eugenia","umbrosa","","O.Berg","M. Sobral",2005,"","573","","Lobão, A.Q.; Vieira, S. & Fiaschi, P.",2001,4,12,"Brazil","Rio de Janeiro","Teresópolis","Parque Nacional da Serra dos Órgãos. Trilha para a pedra do Sino. Mata Atlântica.",,,"Árvore, ca. De 6m de altura. Folhas discolores verdes. Frutos marrons.","Eugenia umbrosa O.Berg","",,"GBIF"
"","JBRJ","RB","RB00309172","Eugenia umbrosa","","Myrtaceae","Eugenia","umbrosa","","O.Berg","J.M.A.Braga",,"","11","","E.Erbesdobler",2001,5,7,"Brazil","Rio de Janeiro","Rio das Ostras","Reserva Biológica União. Reserva Biológica União",,,"Árvores. Frutos.","Eugenia umbrosa O.Berg","",,"GBIF"
"","JBRJ","RB","RB00309157","Eugenia umbrosa","","Myrtaceae","Eugenia","umbrosa","","O.Berg","J.M.A.Braga",,"","23","","E.Erbesdobler",2001,8,1,"Brazil","Rio de Janeiro","Rio das Ostras","Reserva Biológica União. Reserva Biológica União",,,"árvore, frutos","Eugenia umbrosa O.Berg","",,"GBIF"
"","Escola Superior de Agricultura Luiz de Queiroz, ESALQ","ESA","93427","Eugenia umbrosa","","Myrtaceae","Eugenia","umbrosa","","O.Berg","Giaretta, A.",2015,"","4503","","Ivanauskas, N.M. et al.",2001,8,17,"Brazil","São Paulo","São Sebastião",,,,,"Eugenia umbrosa O.Berg","",,"GBIF"
"","JBRJ","RB","RB00309193","Eugenia umbrosa","","Myrtaceae","Eugenia","umbrosa","","O.Berg","G.M.Barroso",,"","5865","","Haroldo C. de Lima; et al",2001,9,12,"Brazil","Rio de Janeiro","Nova Iguaçu","Rebio, Tinguá, Pedra 90, picada para o Pico do Tinguá. . Tinguá",-22.588055,-43.468333,"Arbusto com 2 m de altura. Frutis castanho-amarelados. Ocasional no suib-bosque.","Eugenia umbrosa O.Berg","",,"GBIF"
"","JBRJ","RB","RB00348197","Eugenia umbrosa","","Myrtaceae","Eugenia","umbrosa","","O.Berg",,,"","5865","","H. C. de Lima; S. J. Silva Neto, L. Sylvestre & W. da Silva",2001,9,12,"Brazil","Rio de Janeiro","Nova Iguaçu","Pedra 90, picada para o Pico do Tinguá. REBIO do Tinguá",,,"Arbusto com 2m de altura. Frutos castanho-amarelados. Ocasional no sub-bosque.    Det.: G. M. Barroso     XI/ 2001","Eugenia umbrosa O.Berg","",,"GBIF"
"","JBRJ","RB","RB00309187","Eugenia umbrosa","","Myrtaceae","Eugenia","umbrosa","","O.Berg",,,"","1550","","S.J.Silva Neto; M.V.Pereira-Moura & W. da Silva",2001,12,11,"Brazil","Rio de Janeiro","Nova Iguaçu","Estrada para Itacolomi, trilha da Lagoa.",,,"Árvore ciófila caída sobre o leito do rio, ca. 8,0 m de altura; folhas discolores cartáceas; botões alvo-esbranquiçados; flores com cálice verde e corola branca.","Eugenia umbrosa O.Berg","",,"GBIF"
"","MBM","MBM","410010","Eugenia umbrosa","","Myrtaceae","Eugenia","umbrosa","","O.Berg",,,"","1550","","Silva Neto, SJ",2001,12,11,"Brazil","Rio de Janeiro","Nova Iguaçu","Estrada para Itacolomi, trilha da lagoa.",,,"Árvore ciófila caída sobre o leito do rio, ca. 8,0 m de altura; folhas discolores cartáceas; botões alvo-esbranquiçados; flores com cálice verde e corola branca.","Eugenia umbrosa O.Berg","",,"GBIF"
"","UFRPE","PEUFR","31528","Eugenia umbrosa","","Myrtaceae","Eugenia","umbrosa","","O.Berg","M. Sobral",2007,"","820","","M.F.A. Lucena",2000,1,14,"Brazil","Pernambuco","Tamandaré","Mata de Pau Amarelo",,,"Arvoreta com 5 m de altura; cálice persistente verde; folhas coráceas","Eugenia umbrosa O.Berg","",,"GBIF"
"","JBRJ","RB","RB00307542","Eugenia umbrosa","","Myrtaceae","Eugenia","umbrosa","","O.Berg","M.Sobral",2006,"","4335","","L.S.Leoni",2000,1,5,"Brazil","Minas Gerais","Carangola","Fazenda Santa Rita.",,,"Arvore ereta, com 15-17m de altura, tronco liso de cor clara, ramos patentes, corola alvacenta, flores com odor forte","Eugenia umbrosa O.Berg","",,"GBIF"
"","UFRPE","PEUFR","37263","Eugenia umbrosa","","Myrtaceae","Eugenia","umbrosa","","O.Berg","M. Sobral",2007,"","47","","K. Almeida",2000,5,28,"Brazil","Pernambuco","São Lourenço da Mata","Estação Ecológica do Tapacurá",-8.012778,-34.950278,"Árvore com cerca de 7 m; fruto passado marrom com sépalas persistentes verdes","Eugenia umbrosa O.Berg","",,"GBIF"
"","JBRJ","RB","RB00366791","Eugenia umbrosa","","Myrtaceae","Eugenia","umbrosa","","O.Berg","M.C.SOUZA",2016,"","4424","","L.S.Leani",2000,5,9,"Brazil","Minas Gerais","Carangola","Fazenda Santa Rita.",,,"Árvore ereta com 15m de altura; corola alvacenta; frutos imaturos de cor verde-amarelada.","Eugenia umbrosa O.Berg","",,"GBIF"
"","Instituto de Botânica","SP","351081","Eugenia umbrosa","","Myrtaceae","Eugenia","umbrosa","","O.Berg","Sobral, M",2007,"","47","","Almeida, K",2000,5,28,"Brazil","Pernambuco","São Lourenço da Mata","Estação Ecológica do Tapacurá. Solo areno-argiloso.",-8.012778,-34.950278,"Árvore ca. 7m alt., fruto passado marrom com sépalas persistentes verdes.","Eugenia umbrosa O.Berg","",,"GBIF"
"","IF","SPSF","28883","Eugenia umbrosa","","Myrtaceae","Eugenia","umbrosa","","O.Berg","F.F.Mazine",2011,"","2158","","L.Rossi & M.L.Kawasaki & L.Bopp",2000,9,20,"Brazil","Sp","Caraguatatuba","Parque Estadual da Serra do Mar",,,"COLETA: XLS: SPSFAntigo&nf;Mata Ombrofila Densa de Encosta&nf;Árvore 4m altura; frutos verde-acinzentados.; GEOGRAFIA: Trilha dos Tropeiros;","Eugenia umbrosa O.Berg","",,"GBIF"
"","Instituto de Botânica","SP","350685","Eugenia umbrosa","","Myrtaceae","Eugenia","umbrosa","","O.Berg",,,"","2158","","Rossi, L; Kawasaki, ML; Bopp, L",2000,9,20,"Brazil","São Paulo","Caraguatatuba","Parque Estadual da Serra do Mar, Núcleo Caraguatatuba. Trilha dos Tropeiros",,,,"Eugenia umbrosa O.Berg","",,"GBIF"
"","IPA","IPA","84431","Eugenia umbrosa","","Myrtaceae","Eugenia","umbrosa","","O.Berg","Amorim, B.S.",2010,"","26","","Silva, T.M.C.; Almeida, K.; Almeida, K.",2000,10,10,"Brazil","Pernambuco","São Lourenço da Mata","Estação Ecológica do Tapacurá",-8.012778,-34.950278,"Árvore ca. 5m de altura. Caule marron. Flores com quatro pétalas alvas, sépalas verdes e os estames alvos.; Solo areno-argiloso.","Eugenia umbrosa O.Berg","",,"GBIF"
"","UFPB","JPB","29143","Eugenia umbrosa","","Myrtaceae","Eugenia","umbrosa","","O.Berg","Souza, MC",2008,"","26","","Silva, TMC da; Almeida, K",2000,10,10,"Brazil","Pernambuco","São Lourenço da Mata","Estação Ecológica do Tapacurá",-8.012778,-34.950278,"; DESC: Árvore com cerca de 5m. Caule marrom. Flores com quatro pétalas alvas, sépalas verdes e os estames alvos. Solo areno-agiloso.","Eugenia umbrosa O.Berg","",,"GBIF"
"","UFRPE","PEUFR","37262","Eugenia umbrosa","","Myrtaceae","Eugenia","umbrosa","","O.Berg","M. Sobral",2007,"","26","","T.M.C. da Silva",2000,10,10,"Brazil","Pernambuco","São Lourenço da Mata","Estação Ecológica do Tapacurá",-8.012778,-34.950278,"Árvore com cerca de 5 m de altura; flores com quatro pétalas alvas; sépalas verdes e estames alvos","Eugenia umbrosa O.Berg","",,"GBIF"
"","UFRPE","PEUFR","37261","Eugenia umbrosa","","Myrtaceae","Eugenia","umbrosa","","O.Berg","M. Sobral",2007,"","29","","E.S. da Silva; Antônio",2000,10,30,"Brazil","Pernambuco","São Lourenço da Mata","Estação Ecológica do Tapacurá",-8.012778,-34.950278,"Árvore com cerca de 6 m; flores em botões marrons","Eugenia umbrosa O.Berg","",,"GBIF"
"","Instituto de Botânica","SP","351065","Eugenia umbrosa","","Myrtaceae","Eugenia","umbrosa","","O.Berg","Sobral, M",2007,"","26","","Silva, TMC; Almeida, K",2000,10,10,"Brazil","Pernambuco","São Lourenço da Mata","Estação Ecológica do Tapacurá. Solo areno-argiloso.",-8.012778,-34.950278,"Árvore ca. 5m alt., caule marrom, flores com quatro pétalas alvas, sépalas verdes e os estames alvos.","Eugenia umbrosa O.Berg","",,"GBIF"
"","JBRJ","RB","RB00266029","Eugenia umbrosa","","Myrtaceae","Eugenia","umbrosa","","O.Berg","Marcos Eduardo Guerra Sobral",2014,"","16/58","","Alexandre Quinet",2000,12,16,"Brazil","Rio de Janeiro","Magé","Piabetá. Estrada do Matão nº 100. Cachoeira Grande.",-22.568333,-43.1225,"Árvore, 2,5 metros de altura, 10 cm de DAP, folha discolor verde, fruto verde, comum no local.","Eugenia umbrosa O.Berg","",,"GBIF"
"","UNISANTA","HUSC","1717","Eugenia umbrosa","","Myrtaceae","Eugenia","umbrosa","","O.Berg","Kawasaki, M.L.",1999,"","217","","Sampaio, P.S.P.; Lima, E.S.; Martins, S.E.",1999,3,25,"Brazil","São Paulo","Bertioga","São Lourenço, Rod SP-55, Km 211,5. Fazenda da Família Pinto",,,"Árvore, 8m alt., flores passadas, sépalas creme.; Transição Restinga-encosta","Eugenia umbrosa O.Berg","",,"GBIF"
"","Instituto de Botânica","SP","333978","Eugenia umbrosa","","Myrtaceae","Eugenia","umbrosa","","O.Berg",,,"","218","","Sampaio, PSP; Lima, ES; Martins, SE",1999,3,25,"Brazil","São Paulo","Bertioga","São Lourenço, Rod. SP-55, Km 211,5. Fazenda da Família Pinto",,,,"Eugenia umbrosa O.Berg","",,"GBIF"
"","UNISANTA","HUSC","1832","Eugenia umbrosa","","Myrtaceae","Eugenia","umbrosa","","O.Berg","Kawasaki, M.L.",1999,"","460","","Martins, S.E.; Magenta, M.A.G.; Sampaio, P.S.P.; Góes, C.P.; Monteiro, A.C.",1999,4,29,"Brazil","São Paulo","São Sebastião","Juqueí, próximo à estrada Rio-Santos.",,,"Árvore, 8m alt., frutos jovens imaturos castanhos.; Beira da estrada, Floresta de restinga alta.","Eugenia umbrosa O.Berg","",,"GBIF"
"","Instituto de Botânica","SP","335815","Eugenia umbrosa","","Myrtaceae","Eugenia","umbrosa","","O.Berg",,,"","460","","Martins, SE; Magenta, MAG; Sampaio, PSP; Góes, CP; Monteiro, AC",1999,4,29,"Brazil","São Paulo","São Sebastião","Juqueí, próximo à estrada Rio-Santos",,,,"Eugenia umbrosa O.Berg","",,"GBIF"
"","IPA","IPA","67504","Eugenia umbrosa","","Myrtaceae","Eugenia","umbrosa","","O.Berg","Sobral, M.",2007,"","67504","","Eugênio, C.; Ferreira, C.; Ferreira, C.",1999,7,26,"Brazil","Pernambuco","Recife","Curado, campus do Comando Militar do Nordeste.",,,,"Eugenia umbrosa O.Berg","",,"GBIF"
"","UNISANTA","HUSC","2092","Eugenia umbrosa","","Myrtaceae","Eugenia","umbrosa","","O.Berg","Kawasaki, M.L.",1999,"","549","","Martins, S.E.; Sampaio, P.S.P.",1999,9,2,"Brazil","São Paulo","Bertioga","São Lourenço, Rod. SP-55, km 211,5. Fazenda da Família Pinto.",,,"Árvore, 6m de altura. Frutos marrons imaturos.; Floresta de restinga paludosa sobre solo turfoso.","Eugenia umbrosa O.Berg","",,"GBIF"
"","Instituto de Botânica","SP","337849","Eugenia umbrosa","","Myrtaceae","Eugenia","umbrosa","","O.Berg",,,"","549","","Martins, SE; Sampaio, PSP",1999,9,2,"Brazil","São Paulo","Bertioga","São Lourenço, Rod. SP-55, Km 211,5. Fazenda da Família Pinto",,,,"Eugenia umbrosa O.Berg","",,"GBIF"
"","Instituto de Botânica","SP","340826","Eugenia umbrosa","","Myrtaceae","Eugenia","umbrosa","","O.Berg","Souza, MC",2005,"","951A","","Oliveira, PP",1998,1,20,"Brazil","Rio de Janeiro","Rio das Ostras","Reserva Biológica União. Baixada. Trilha 10.",,,"Fruto verde.","Eugenia umbrosa O.Berg","",,"GBIF"
"","JBRJ","RB","RB00309923","Eugenia umbrosa","","Myrtaceae","Eugenia","umbrosa","","O.Berg","M.Sobral",,"","445","","E. M. Ferraz; J. Urbano e A. Bispo",1998,9,16,"Brazil","Pernambuco","São Vicente Ferrer",,-7.583333,-35.5,"árvore ca. de 7m de alt.; Frutos verde-amarelados.","Eugenia umbrosa O.Berg","",,"GBIF"
"","IMA","MAC","9718","Eugenia umbrosa","","Myrtaceae","Eugenia","umbrosa","","O.Berg","E.C.O.Chagas",2009,"","3949","","R.P.Lyra-Lemos; M.N.Rodrigues",1998,10,15,"Brazil","Alagoas","Barra de Santo Antônio","Fazenda São Brás.",-9.666667,-35.833333,"Arvoreta com ca. de 4m de alt. Flores esverdeadas. Frutos maduros marrons.; Mata Atlântica em vale de tabuleiro.","Eugenia umbrosa O.Berg","",,"GBIF"
"","IMA","MAC","9811","Eugenia umbrosa","","Myrtaceae","Eugenia","umbrosa","","O.Berg","E.C.O.Chagas",2009,"","1324","","M.N.Rodrigues; R.P.Lyra-Lemos; S.Costa; S.Rocha",1998,10,29,"Brazil","Alagoas","Satuba","APA do Catolé e Fernão Velho.",-9.9425,-36.378889,"Árvore com ca. de 3m de altura. Florc/ pétalas brancas, estames brancos, botões verdes.; Mata Atlântica.","Eugenia umbrosa O.Berg","",,"GBIF"
"","UEFS","HUEFS","81877","Eugenia umbrosa","","Myrtaceae","Eugenia","umbrosa","","O.Berg","M.Sobral",2012,"","1324","","Rodrigues, M.N.",1998,10,29,"Brazil","Alagoas","Satuba","APA do Catolé e Fernão Velho.",,,"Mata Atlântica.","Eugenia umbrosa O.Berg","",,"GBIF"
"","UFPB","JPB","62659","Eugenia umbrosa","","Myrtaceae","Eugenia","umbrosa","","O.Berg","Amorim, GS",2019,"","1324","","Rodrigues, MN; Lyra Lemos, RP de; Costa, S; Rocha, S",1998,10,29,"Brazil","Alagoas",,,,,"; DESC: Árvore c/ ca. de 3m de alt.; flor c/ pétalas brancas, estames brancos, botões verdes.","Eugenia umbrosa O.Berg","",,"GBIF"
"","UFPB","JPB","62656","Eugenia umbrosa","","Myrtaceae","Eugenia","umbrosa","","O.Berg","Figueira, M",2017,"","3949","","Lyra-Lemos, RP; Rodrigues, MN",1998,10,15,"Brazil","Alagoas","Barra de Santo Antônio","Fazenda São Brás",,,,"Eugenia umbrosa O.Berg","",,"GBIF"
"","UNISANTA","HUSC","1469","Eugenia umbrosa","","Myrtaceae","Eugenia","umbrosa","","O.Berg","Kawasaki, M.L.",1999,"","333","","Martins, S.E.; et al.",1998,11,17,"Brazil","São Paulo","Bertioga","Fazenda da Família Pinto.",,,"Árvore, 8m alt., frutos alaranjados.; Floresta de restinga úmida","Eugenia umbrosa O.Berg","",,"GBIF"
"","Instituto de Botânica","SP","333576","Eugenia umbrosa","","Myrtaceae","Eugenia","umbrosa","","O.Berg",,,"","333","","Martins, SE; Rossi, L; et al.",1998,11,17,"Brazil","São Paulo","Bertioga","Fazenda da Família Pinto",,,,"Eugenia umbrosa O.Berg","",,"GBIF"
"","JBRJ","RB","RB00727278","Eugenia umbrosa","","Myrtaceae","Eugenia","umbrosa","","O.Berg","A. Quinet",,"","1005","","S. J. Silva Neto; et al.",1997,8,28,"Brazil","Rio de Janeiro","Duque de Caxias","Reservatório de Saracuruna(REDUC), Rio Pedra BRanca. Reserva da Petrobras",-22.516667,-42.5,"Árvore ciófila, ca. 6,0 m de altura; folhas discolores cartáceas; frutos imaturos verdes.","Eugenia umbrosa O.Berg","",,"GBIF"
"","NY","NY","02173099","Eugenia umbrosa","","Myrtaceae","Eugenia","umbrosa","","O.Berg",,,"","1005","","S. J. da Silva Neto",1997,8,28,"Brazil","Rio de Janeiro",,"Reservatório de Saracuruna(REDUC), Rio Pedra BRanca. Reserva da Petrobras",-22.516667,-42.5,,"Eugenia umbrosa O.Berg","",,"GBIF"
